countryname,countrycode,region,date,policytype,policyvalue,flag,new_level,prev_level,notes
Australia,AUS,East_Asia_Pacific,20200928,C1: School closing,2,0,2T,3T,Victoria - Proposed changes for Monday include a staged return to school for some students and an allowance for outdoor gatherings of five people from two households.  https://web.archive.org/web/20200928121411/https://www.theguardian.com/world/2020/sep/26/victoria-records-one-death-and-12-new-cases-as-covid-19-numbers-continue-to-drop
Australia,AUS,East_Asia_Pacific,20200928,C2: Workplace closing,2,0,2T,3T,"Earlier, Prime Minister Scott Morrison on Sunday said Victoria should do more “in the weeks ahead to safely ease more restrictions,” after state authorities promised an accelerated timetable for returning to normal.  The southeastern state said 127,000 workers would be allowed to go back to work on Monday, 30,000 more than in its previous plan.  https://web.archive.org/web/20200928121457/https://www.aljazeera.com/news/2020/9/28/covid-19-cases-in-australias-victoria-fall-as-lockdown-eases"
Australia,AUS,East_Asia_Pacific,20200928,C4: Restrictions on gatherings,4,0,4T,4T,Victoria - Proposed changes for Monday include a staged return to school for some students and an allowance for outdoor gatherings of five people from two households.  https://web.archive.org/web/20200928121411/https://www.theguardian.com/world/2020/sep/26/victoria-records-one-death-and-12-new-cases-as-covid-19-numbers-continue-to-drop
Australia,AUS,East_Asia_Pacific,20201009,E1: Income support,1,1,1A,1A,"Tax cuts for 11 million Australians will flow in the coming weeks after the Morrison Government secured the passage of the legislation through the Federal Parliament today.    The tax relief package, for both individuals and business, is part of our COVID-19 Economic Recovery Plan for Australia to create jobs, rebuild our economy and secure Australia’s future.    The Australian Taxation Office (ATO) will update its schedules next week, with software payroll companies to update over the coming weeks, to get more money into the pockets of hard-working Australians as quickly as possible.    Getting money into the pockets of Australians will give them more to spend at their local shops helping to create more jobs.    Our business tax relief measures will also help to keep businesses to stay afloat, to grow and to hire more people.    It is estimated our tax relief package to reduce the personal income tax burden and encourage business investment will create around 100,000 jobs by the end of 2021-22 and boost GDP by around $6 billion in 2020-21 and $19 billion in 2021-22.    http://archive.today/2020.10.19-200109/https://www.pm.gov.au/media/tax-relief-back-hard-working-australians-and-create-more-jobs-passes-parliament"
Australia,AUS,East_Asia_Pacific,20201016,C8: International travel controls,3,.,3.,4.,"""Passengers from New Zealand will be able to travel to Australia, quarantine-free, from Friday, 16 October, provided they have not been in an area designated as a COVID-19 hotspot in New Zealand in the preceding 14 days.""    Link:  http://archive.today/2020.10.19-181332/https://www.pm.gov.au/media/safe-travel-zone-new-zealand    The opening of the border to passengers from New Zealand indicates that the borders are not closed to all regions, hence change of code to ""3"".  "
Australia,AUS,East_Asia_Pacific,20201019,C1: School closing,2,0,2T,2T,"The UNESCO school closure tracker (https://en.unesco.org/covid19/educationresponse) continues to represent the status of schools in Australia as ""Partially open"" for period 5th-18th October 2020.    In link below Victoria Government outlines the plan for phased return to full time onsite education.  It notes that remote and flexible learning will continue for some years (Yrs 8-10) until 26th October.  However, this appears to apply only in Metropolitan Melbourne whereas for Rural and Regional Victoria, ""All students will return to on-site learning"" between 12-16 October.  Indicator is left at 2T, following the coding guideline of focusing on strictest measures, but it appears to highly limited to specific year groups within a specific geographical area and is likely to change shortly for Victoria.      http://archive.today/2020.10.19-170001/https://www.coronavirus.vic.gov.au/returning-to-onsite-learning"
Australia,AUS,East_Asia_Pacific,20201019,C2: Workplace closing,2,0,2T,2T,"There appears to be a policy operating in Victoria which is called the ""Permitted worker scheme"".  In the link below, its refers to the following under the section ""Key Points"":    ""Workplaces in metropolitan Melbourne must be closed unless:  the workplace is part of a permitted activity, or  all employees are working from home.  Employers that require their staff to attend a worksite must issue a worker permit to their employees. Issuing the workers permit is the employer’s responsibility. The dates on existing permits can be edited and added to by employers as required.""    http://archive.today/2020.10.19-190315/https://www.dhhs.vic.gov.au/permitted-worker-scheme-coronavirus-covid-19    "
Australia,AUS,East_Asia_Pacific,20201019,C4: Restrictions on gatherings,4,0,4T,4T,"Victoria appears to be running two sets of policies, one which is more restrictive but focused on the area of Metropolitan Melbourne (""second step restrictions"") and one for regional Victoria (""third step restrictions"").  This dual policy appears to be still in operation as the page which contains information on restrictions (https://www.dhhs.vic.gov.au/victorias-restriction-levels-covid-19) was last updated on the 19th October 2020.    The more restrictive measures on gathering which date back to September appear to be remain current and suggest that 4T is the appropriate code.    ""You can meet in a group of up to ten people from a maximum of two households outdoors in a public place to socialise (children under 12 months of age not included in the limit). An outdoor public place means areas accessible to everyone, including local parks and beaches. This replaces the limit of five people from a maximum of two households.""    http://archive.today/2020.10.19-183040/https://www.dhhs.vic.gov.au/second-step-restrictions-metropolitan-melbourne-covid-19"
Australia,AUS,East_Asia_Pacific,20201019,C5: Close public transport,1,0,1T,1T,"The link below from DHHS Victoria suggests that public transport continues to operate.  There are no references to it being reduced.  However, given the previous comment on 28 August, continuing travel restrictions and stay at home requirements it was decided to leave the code unchanged at ""1T"".  This may need reviewing    ""Will public transport continue to operate?  Yes. Public transport will continue to operate. When catching public transport, you must wear a face mask and keep at least 1.5 metres between yourself and others. Wash your hands before you leave home and when you return.""    http://archive.today/2020.10.19-191944/https://www.dhhs.vic.gov.au/travel-metropolitan-melbourne-second-step-covid-19%23will-public-transport-continue-to-operate"
Australia,AUS,East_Asia_Pacific,20201019,C6: Stay at home requirements,2,0,2T,2T,"The code ""2T"" was based on policy for Metropolitan Melbourne and following the coding guidance of focusing on the strictest measures.    ""You can leave home for four reasons, with limits:  shopping for food or other essential items   socialising or exercise (applies to outdoor exercise, and with your household or up to nine other people outdoors, from a maximum of two households). This needs to be in a public outdoor place (for example a local park)  permitted work, primary and secondary education (when your school and year level are permitted)  caregiving, for compassionate reasons, or to seek medical treatment, also remain permitted reasons to leave home.""    http://archive.today/2020.10.19-183040/https://www.dhhs.vic.gov.au/second-step-restrictions-metropolitan-melbourne-covid-19    "
Australia,AUS,East_Asia_Pacific,20201019,C7: Restrictions on internal movement,2,0,2T,2T,"Restrictions on travel continue to be in place for Metropolitan Victoria.      ""I live in metropolitan Melbourne. Can I travel?  No. If you live in metropolitan Melbourne, you cannot travel for a holiday. You must stay at home, unless it is for one of the four reasons or one of the other permitted reasons.""    http://archive.today/2020.10.19-191944/https://www.dhhs.vic.gov.au/travel-metropolitan-melbourne-second-step-covid-19%23will-public-transport-continue-to-operate"
Australia,AUS,East_Asia_Pacific,20201019,H6: Facial Coverings,4,0,4T,4T,"Current guidance on use of face masks in Victoria:      ""From 11 October all Victorians must wear a fitted face mask when they leave home, no matter where they live.   All Victorians must wear a fitted face mask when they leave home, no matter where they live. As restrictions ease and movement increases, the effectiveness of a face mask is even more important.   You must wear a fitted face mask that covers the nose and mouth. This means that face shields, bandanas, or scarves or loose snoods, loose Buffs® or loose neck gaiters on their own will no longer be considered a sufficient face covering.    There are a number of lawful excuses for not wearing a face mask.  A face mask with three layers is the option recommended by the Chief Health Officer, as it provides the best protection for you and others. ""    http://archive.today/2020.10.19-173951/https://www.dhhs.vic.gov.au/face-masks-vic-covid-19"
Brunei,BRN,East_Asia_Pacific,20200929,C1: School closing,1,1,1G,1G,"All schools have been open across the country but with updated guidelines, snippet below  ""Schools and educational institutions are emphasized to use the guidelines and measures to maintain safety, hygiene and prevention that have been provided in ensuring the well-being of students and residents as well as educational institutions are guaranteed. Implementation of Standard Operating Procedures (SOP) School Restoration / De-Escalation Plan IPTA and IBTE such as conducting daily body temperature checks for students, teachers, instructors""  https://web.archive.org/web/20201018101339/http://www.moe.gov.bn/SitePages/NewsArticle.aspx?AID=686  (The content is in Malay language, please open link in Chrome->right click->Translate to English)"
Brunei,BRN,East_Asia_Pacific,20200929,C3: Cancel public events,1,1,1G,1G,Public Events are allowed to take place however with condition that not more than 350 people are allowed.  Reference:  https://web.archive.org/web/20201018125029/https://thescoop.co/2020/09/25/coronavirus-one-new-imported-case-found-as-govt-relaxes-more-restrictions/
Brunei,BRN,East_Asia_Pacific,20200929,C4: Restrictions on gatherings,2,1,2G,2G,Any public events or mass gatherings such as weddings will remain capped at 350 people.    Reference:  https://web.archive.org/web/20201018125029/https://thescoop.co/2020/09/25/coronavirus-one-new-imported-case-found-as-govt-relaxes-more-restrictions/
Brunei,BRN,East_Asia_Pacific,20200929,C7: Restrictions on internal movement,0,.,0,0,"Internal movements are open however from September 7 it has become compulsory to use BruHealth (app) to scan in and out of public places, and violators can be fined up to 10,000 for breaking the law.  Refer to:  https://web.archive.org/web/20201018125029/https://thescoop.co/2020/09/25/coronavirus-one-new-imported-case-found-as-govt-relaxes-more-restrictions/"
Brunei,BRN,East_Asia_Pacific,20200929,C8: International travel controls,2,.,2.,2.,"International travelers are allowed for following purpose:  • Essential business travel (including official travel)  • Students  • Individual primarily here for the purpose of medical treatment  • Compassionate and other special circumstances, such as parents, spouse, or other  immediate family members of Brunei Citizens or Residents.  Upon arrival, travelers will be required to undergo self-isolation at hotel accommodation for a  period of between 2 to 14 days depending on the self-isolation notice that is given upon  arrival as determined by the Ministry of Health’s risk assessment.     For detailed guidelines refer to:   https://web.archive.org/web/20201018135612/http://www.pmo.gov.bn/SiteCollectionDocuments/covid19/Entry-Travel-Pass-Application-Guidelines.pdf"
Brunei,BRN,East_Asia_Pacific,20200929,E1: Income support,0,.,0,1F,"No Income support provided as of now, it was provided until June 2020  Refer to:  https://web.archive.org/web/20200425202332/https://thescoop.co/2020/03/13/covid-19-live-updates/"
Brunei,BRN,East_Asia_Pacific,20200929,E2: Debt/contract relief,0,.,0,,"No relief such as stopping loan payment provided by government however government have provide relief such as deferring loan repayments    Refer to section ""Banks to defer loan repayments for all businesses in private sector"":  https://web.archive.org/web/20200425202332/https://thescoop.co/2020/03/13/covid-19-live-updates/"
Brunei,BRN,East_Asia_Pacific,20201019,C1: School closing,1,1,1G,1G,"Per updated coding for C1 - 1G remains in as the code, schools open with precautions   All schools have been open across the country but with updated guidelines, snippet below  ""Schools and educational institutions are emphasized to use the guidelines and measures to maintain safety, hygiene and prevention that have been provided in ensuring the well-being of students and residents as well as educational institutions are guaranteed. Implementation of Standard Operating Procedures (SOP) School Restoration / De-Escalation Plan IPTA and IBTE such as conducting daily body temperature checks for students, teachers, instructors""  https://web.archive.org/web/20201018101339/http://www.moe.gov.bn/SitePages/NewsArticle.aspx?AID=686  (The content is in Malay language, please open link in Chrome->right click->Translate to English)"
Brunei,BRN,East_Asia_Pacific,20201019,C2: Workplace closing,1,1,1G,1G,Article notes the relaxing of restrictions back in May - unable to find any other recent sources: https://web.archive.org/web/20201025200552/https://thescoop.co/2020/10/23/coronavirus-one-new-imported-case-but-no-local-transmission-for-169-days/
Brunei,BRN,East_Asia_Pacific,20201019,C3: Cancel public events,1,1,1G,1G,No changes noted in restrictions since easing in Sept - https://web.archive.org/web/20201018125029/https://thescoop.co/2020/09/25/coronavirus-one-new-imported-case-found-as-govt-relaxes-more-restrictions/
Brunei,BRN,East_Asia_Pacific,20201019,C4: Restrictions on gatherings,2,1,2G,2G,No changes noted in restrictions since easing in Sept - https://web.archive.org/web/20201018125029/https://thescoop.co/2020/09/25/coronavirus-one-new-imported-case-found-as-govt-relaxes-more-restrictions/
Brunei,BRN,East_Asia_Pacific,20201019,C5: Close public transport,0,.,0,0,Article notes the beginning of relaxed restrictions started in May - unable to find any other recent sources: https://web.archive.org/web/20201025200552/https://thescoop.co/2020/10/23/coronavirus-one-new-imported-case-but-no-local-transmission-for-169-days/
Brunei,BRN,East_Asia_Pacific,20201019,C6: Stay at home requirements,0,.,0,,Article notes the beginning of relaxed restrictions started in May - unable to find any other recent sources: https://web.archive.org/web/20201025200552/https://thescoop.co/2020/10/23/coronavirus-one-new-imported-case-but-no-local-transmission-for-169-days/
Brunei,BRN,East_Asia_Pacific,20201019,C7: Restrictions on internal movement,0,.,0,0,Article notes the beginning of relaxed restrictions started in May - unable to find any other recent sources: https://web.archive.org/web/20201025200552/https://thescoop.co/2020/10/23/coronavirus-one-new-imported-case-but-no-local-transmission-for-169-days/
Brunei,BRN,East_Asia_Pacific,20201019,C8: International travel controls,2,.,2.,2.,Quaratine time for foreign arrivals required: Article notes the beginning of relaxed restrictions started in May - unable to find any other recent sources: https://web.archive.org/web/20201025200552/https://thescoop.co/2020/10/23/coronavirus-one-new-imported-case-but-no-local-transmission-for-169-days/
Brunei,BRN,East_Asia_Pacific,20201019,E1: Income support,0,.,0,0,Unable to locate any information to advise income support - not likely needed as no local transmission in 169 days  https://web.archive.org/web/20201025200552/https://thescoop.co/2020/10/23/coronavirus-one-new-imported-case-but-no-local-transmission-for-169-days/
Brunei,BRN,East_Asia_Pacific,20201019,E2: Debt/contract relief,0,.,0,0,Unable to locate any information re: debt relief - not likely needed as no local transmission in 169 days  https://web.archive.org/web/20201025200552/https://thescoop.co/2020/10/23/coronavirus-one-new-imported-case-but-no-local-transmission-for-169-days/
Brunei,BRN,East_Asia_Pacific,20201019,H1: Public information campaigns,2,1,2G,2G,no new cases of local transmission in 169 days - https://web.archive.org/web/20201025200552/https://thescoop.co/2020/10/23/coronavirus-one-new-imported-case-but-no-local-transmission-for-169-days/
Brunei,BRN,East_Asia_Pacific,20201019,H2: Testing policy,1,.,1.,2.,"no new cases of local transmission in 169 days - article notes ""According to the most recent statistics, 14.3% of the country’s population has been tested for COVID-19.""  https://web.archive.org/web/20201025200552/https://thescoop.co/2020/10/23/coronavirus-one-new-imported-case-but-no-local-transmission-for-169-days/"
Brunei,BRN,East_Asia_Pacific,20201019,H3: Contact tracing,2,.,2.,1.,It is also a legal requirement for all visitors and residents in Brunei to use the contact-tracing app BruHealth every time they enter/exit a public place. https://web.archive.org/web/20201025200552/https://thescoop.co/2020/10/23/coronavirus-one-new-imported-case-but-no-local-transmission-for-169-days/
Brunei,BRN,East_Asia_Pacific,20201019,H6: Facial Coverings,2,1,2G,2G,"""The minister reminded the public to practise personal hygiene, proper cough and sneezing etiquette and wear face masks in crowded public places. If feeling unwell, not to go to public places and attend social gatherings.""  https://web.archive.org/web/20201025203329/https://borneobulletin.com.bn/2020/10/brunei-records-one-new-covid-19-case-6/"
China,CHN,East_Asia_Pacific,20200926,C6: Stay at home requirements,0,.,0,3T,The last two communities in Ruili are now allowed to leave their homes as long as the nucleic acid testing results are negative.    http://web.archive.org/web/20200928213240/https://www.jiemian.com/article/5018819.html
China,CHN,East_Asia_Pacific,20201004,C2: Workplace closing,2,0,2T,2T,Ruili lifts lock-down from 22:00 on 21 Sep.   Entertainment venues are suspended from reopening. Other business can reopen. Source:  http://web.archive.org/web/20200928213240/https://www.jiemian.com/article/5018819.html
China,CHN,East_Asia_Pacific,20201004,C3: Cancel public events,2,0,2T,2T,Ruili lifts lock-down from 22:00 on 21 Sep.   Entertainment venues are suspended from reopening. Other business can reopen. Source:  http://web.archive.org/web/20200928213240/https://www.jiemian.com/article/5018819.html
China,CHN,East_Asia_Pacific,20201004,C4: Restrictions on gatherings,3,0,3T,3T,"Ruili ends its lock-down, entertainment venues are closed to avoid mass gathering. No specific provision is made regarding what size of a private gathering is allowed. But in a news report, it does mention that people started to gather immediately, and there were even fireworks. So it is reasonable to presume a small-scale private gathering is allowed.   http://web.archive.org/web/20200928213240/https://www.jiemian.com/article/5018819.html"
China,CHN,East_Asia_Pacific,20201004,E1: Income support,1,0,1F,1F,"Benefits for insured formal sector workers continue. There are three main categories of benefits:   1. Unemployed insurance benefits(no more than 24 months);  2. Unemployed assistance (available between March to December 2020, not to be claimed in joint with ""1"");  3. Price inflation subsidy (available between March to June 2020).    http://web.archive.org/web/20201004232953/http://www.sznews.com/news/content/2020-09/21/content_23574588.htm"
China,CHN,East_Asia_Pacific,20201004,E2: Debt/contract relief,1,.,1.,1.,"The regulation issued on 31 January 2020 stay effective. It allows patients, quarantined individuals, workers participating in the prevention and control of COVID-19, COVID-induced unemployed workers to have more favourable loan policy, adjust mortgage repayment and defer other loan repayments up to one year.    http://web.archive.org/web/20200924071933/http://www.gov.cn/zhengce/zhengceku/2020-02/01/content_5473639.htm  "
China,CHN,East_Asia_Pacific,20201004,H1: Public information campaigns,2,1,2G,2G,Continuous coordinated public information campaigns. 
China,CHN,East_Asia_Pacific,20201004,H2: Testing policy,3,.,3.,3.,No change.
China,CHN,East_Asia_Pacific,20201004,H3: Contact tracing,2,.,2.,2.,No change.
China,CHN,East_Asia_Pacific,20201004,H6: Facial Coverings,2,1,2G,2G,No change.
China,CHN,East_Asia_Pacific,20201010,C1: School closing,1,1,1G,2T,"The ministry of education also confirms that 90% of all the students (including primary, middle schools and tertiary institutions) are back to school, apart from very few schools and universities choose to reopen after the national day holiday (reopen on 9 Oct).  http://web.archive.org/web/20200928203750/http://www.bjnews.com.cn/edu/2020/09/22/771370.html    The social distancing and other public health precautions imposed in schools and universities would make the school life significantly different from the old normal.  https://archive.vn/V6Vvv    The UNESCO school closure map has also marked all schools in China reopened from 10 Oct.  https://archive.vn/KF92t"
China,CHN,East_Asia_Pacific,20201010,C7: Restrictions on internal movement,2,0,2T,2T,"From 0:00 on 10 October, any Chinese citizen can leave Ruili without the need to present a valid negative nucleic acid test result. However, foreigners and people entering the Chinese border through Ruili cannot leave except for very limited reason. Ruili still has exit checking points in place.     http://web.archive.org/web/20201010122507/http://www.chinanews.com/sh/2020/10-09/9308805.shtml"
China,CHN,East_Asia_Pacific,20201012,C6: Stay at home requirements,3,0,3T,0,The residential building of the three asymptomatic cases was put under the total lockdown.   https://archive.vn/5pYP6  
China,CHN,East_Asia_Pacific,20201013,C2: Workplace closing,2,0,2T,2T,"After the spreading event happened in the Qingdao Municipality Thoracic Surgery Hospital, the hospital itself, restaurants and supermarkets where the confirmed cases had visited were closed for deep cleaning.    http://web.archive.org/web/20201022212211/http://www.xinhuanet.com/politics/2020-10/13/c_1126598010.htm"
China,CHN,East_Asia_Pacific,20201013,C3: Cancel public events,2,0,2T,2T,"Due to the newly confirmed cases, many large events are either postponed or cancelled. All collective activities (apart from teaching) are suspended in schools.    https://web.archive.org/web/20201022212532/https://www.thepaper.cn/newsDetail_forward_9528572    https://archive.vn/vkCoz"
China,CHN,East_Asia_Pacific,20201013,C4: Restrictions on gatherings,3,0,3T,3T,The deputy director of the Qingdao Health Commission ask citizens to avoid unnecessary gathering such as meeting and eating out together.    https://archive.vn/AuovQ
China,CHN,East_Asia_Pacific,20201013,C5: Close public transport,0,.,0,0,"In Qingdao, all the 4,200 buses are thoroughly cleaned. Public transport riders are required to show healthy green QR code. PPE and social distance are required. But public transport is neither closed nor reduced.     http://web.archive.org/web/20201015060246/http://sd.sina.com.cn/news/2020-10-12/detail-iivhvpwz1603871.shtml"
China,CHN,East_Asia_Pacific,20201016,C7: Restrictions on internal movement,2,0,2T,2T,Many local governments have advised against travelling to Qingdao. Some places even hinted protective measures such as quarantine for travellers returning from Qingdao.    http://web.archive.org/web/20201022215607/http://www.fjsyxww.com/2020-10/16/content_1038806.htm
Fiji,FJI,East_Asia_Pacific,20201002,C8: International travel controls,3,.,3.,4.,"The change of code to a 3 reflects the immigration rule concerning yachts in the ""Blue Lanes"" scheme.  As yachts are allowed entry if they satisfy various requirements of the Fiji authorities, the conclusion is that - although limited in scale - the borders are open to some who are not citizens of Fiji.  As such, a code of ""4"" referring to banning arrival from all regions or total border closure would not reflect the situation.  ""Fiji has established a safe “blue lanes”, open to those yachts and pleasure craft sailing to Fiji. Any boat coming to Fiji will be carefully considered on a case-by-case basis. The only port of entry will be Port Denarau Marina. If this pilot project and if successful, extending blue lanes to other ports and marinas will be considered.""  Link: http://archive.today/2020.10.12-080639/http://www.immigration.gov.fj/"
Fiji,FJI,East_Asia_Pacific,20201008,C8: International travel controls,3,.,3.,3.,"""Fiji wants to open its borders to New Zealand as soon as possible, says Prime Minister Voreqe Bainimarama.""  ' “Given that Fiji is COVID-contained, given we have gone over 170 days without a new case of the virus, given the exemplary job we have done at managing our border, and given the economic urgency of resuming flows of two-way trade and tourism, we are keen to see those discussions advance past the exploratory phase and on to practical progress as soon as possible.” '  http://archive.today/2020.10.12-115640/https://www.fijitimes.com/pm-wants-nz-travel-soon/"
