"","CountryName","CountryCode","Date","region","PolicyType","PolicyCode","previous_PolicyCode","Notes"
"1","Bermuda","BMU",2021-01-05,"North_America","C1: School closing","2G","2G","Private school pupils will go back to their classrooms for the start of the new term, 5th of January. However, public school students will be learning at home from 5th until January 12.   http://web.archive.org/web/20210119003904/https://www.royalgazette.com/education/news/article/20210105/private-schools-to-go-back-to-the-classroom/   http://web.archive.org/web/20210119004441/https://www.gov.bm/articles/ministry-education-remote-learning-reminder"
"2","Bermuda","BMU",2021-01-13,"North_America","C1: School closing","1G","2G","Public Schools reopened in-person learning on the 13th of January.     https://www.gov.bm/articles/eemc-public-schools-reopen-january-13th     http://web.archive.org/web/20210110213759/https://www.gov.bm/articles/eemc-public-schools-reopen-january-13th     Latest Covid-19 Guidelines for School Settings - http://web.archive.org/web/20210119005407/https://www.gov.bm/sites/default/files/11436-Coronavirus-2020-School-Guidance%20%286%29.pdf     Latest guidance for Minibuses and Public Buses for dedicated school runs - http://web.archive.org/web/20210119005526/https://www.gov.bm/sites/default/files/11645_School%20Buses%20Phase%204%20200903.pdf"
"3","Bermuda","BMU",2021-01-05,"North_America","C2: Workplace closing","2G","2G","Indoor facilities at bars and nightclubs are still closed.  http://web.archive.org/web/20210112065919/https://www.gov.bm/nightclubs-and-bars-guidance"
"4","Bermuda","BMU",2021-01-07,"North_America","C2: Workplace closing","2G","2G","Indoor bars and nightclubs will remain closed.  http://web.archive.org/web/20210112071512/https://www.gov.bm/articles/new-restrictions-effect-7-january-2021"
"5","Bermuda","BMU",2021-01-18,"North_America","C2: Workplace closing","2G","2G","Indoor bars and Night clubs are still closed.   http://web.archive.org/web/20210119020050/https://www.gov.bm/coronavirus-phase4-guidance"
"6","Bermuda","BMU",2021-01-21,"North_America","C2: Workplace closing","1G","2G","Bars and nightclubs can re-open but will only be permitted to operate as table service only, with a maximum of 6 at a table. No bar service will be permitted.  Effective 21st January 2021.  http://web.archive.org/web/20210201232618/https://www.gov.bm/nightclubs-and-bars-guidance"
"7","Bermuda","BMU",2020-12-30,"North_America","C3: Cancel public events","2G","2G","Public events like Gombey Troupe performances are still occurring, but with increased rules and regulations. However, other than the Gombey performances, no large events have been approved for the holiday weekend. Group gatherings are still limited to a maximum of 10 people per group.  https://web.archive.org/web/20210109094644/https://www.gov.bm/articles/covid-19-update-minister-national-security-remarks-30-december-2020"
"8","Bermuda","BMU",2021-01-05,"North_America","C3: Cancel public events","2G","2G","No Policy change.   http://web.archive.org/web/20210112065919/https://www.gov.bm/nightclubs-and-bars-guidance"
"9","Bermuda","BMU",2021-01-18,"North_America","C3: Cancel public events","2G","2G","Persons must not gather in groups of 10 or more in public or private. Persons wishing to gather in groups of more than 10, must apply to the Minister of National Security  http://web.archive.org/web/20210119020050/https://www.gov.bm/coronavirus-phase4-guidance"
"10","Bermuda","BMU",2021-01-21,"North_America","C3: Cancel public events","2G","2G","In order to hold an event or gathering larger than the permitted 25 person maximum, an exemption from the Minister of National Security is required.  http://web.archive.org/web/20210201234602/https://www.gov.bm/covid-19-guidance-events-and-gatherings"
"11","Bermuda","BMU",2021-01-07,"North_America","C4: Restrictions on gatherings","4G","4G","Gatherings remain restricted to no more than ten people.  http://web.archive.org/web/20210112071512/https://www.gov.bm/articles/new-restrictions-effect-7-january-2021"
"12","Bermuda","BMU",2021-01-18,"North_America","C4: Restrictions on gatherings","4G","4G","Persons must not gather in groups of 10 or more in public or private.   http://web.archive.org/web/20210119020050/https://www.gov.bm/coronavirus-phase4-guidance"
"13","Bermuda","BMU",2021-01-21,"North_America","C4: Restrictions on gatherings","3G","4G","Persons must not gather in groups of more than 25 persons, whether in public or private.    http://web.archive.org/web/20210201231644/http://www.bermudalaws.bm/laws/Annual%20Laws/2021/Statutory%20Instruments/Public%20Health%20%28COVID-19%20Emergency%20Powers%29%20%28No.%203%29%20Amendment%20%28No.%202%29%20Regulations%202021.pdf     http://web.archive.org/web/20210201231802/https://www.gov.bm/coronavirus-phase4-guidance"
"14","Bermuda","BMU",2021-01-11,"North_America","C5: Close public transport","0","0","Department of Public Transportation (DPT) provides update on Public and Schools Bus Service. http://web.archive.org/web/20210119022953/https://www.gov.bm/articles/dpt-provides-update-public-and-schools-bus-service-11-january-2021"
"15","Bermuda","BMU",2021-01-18,"North_America","C5: Close public transport","0","0","Full public transport is in operation. http://web.archive.org/web/20210119023604/https://www.gov.uk/foreign-travel-advice/bermuda/coronavirus"
"16","Bermuda","BMU",2021-01-05,"North_America","C6: Stay at home requirements","2G","2G","According to a Cabinet Office spokesperson the following restrictions will come into effect on Thursday, 7 January, 2021 at 6am  - The hours of curfew will be from midnight until 5am;  - Businesses will be required to close at 11pm, whereas they're currently now required to close at 10pm.    http://web.archive.org/web/20210112071512/https://www.gov.bm/articles/new-restrictions-effect-7-january-2021"
"17","Bermuda","BMU",2021-01-21,"North_America","C6: Stay at home requirements","2G","2G","Curfew is still ongoing from Midnight to 5am http://web.archive.org/web/20210201231802/https://www.gov.bm/coronavirus-phase4-guidance"
"18","Bermuda","BMU",2021-01-18,"North_America","C7: Restrictions on internal movement","0","0","No restriction found"
"19","Bermuda","BMU",2021-01-05,"North_America","C8: International travel controls","2","2","By applying for a Travel Authorisation, visitors and residents agree to comply with Bermuda's quarantine and public health laws instructions at all times, including wearing a Traveller Wristband. If you test positive at any time you shall self-isolate for 14 days at your accommodation, at your cost. If you are a close contact of a positive person, you will self-quarantine for 14 days, at your cost. By purchasing a Travel Authorisation you agree to comply with Bermuda's laws designed to protect residents and visitors from COVID-19 spread.    http://web.archive.org/web/20210112072935/https://www.gov.bm/coronavirus-travellers"
"20","Bermuda","BMU",2021-01-18,"North_America","C8: International travel controls","2","2","Test and Quarantine still required.  http://web.archive.org/web/20210119030050/https://www.gov.bm/coronavirus-travellers     http://web.archive.org/web/20201103132042/https://www.gov.uk/foreign-travel-advice/bermuda/entry-requirements"
"21","Bermuda","BMU",2021-02-01,"North_America","C8: International travel controls","2","2","Test and Quarantine still required.   http://web.archive.org/web/20210201230809/https://www.gov.bm/coronavirus-travellers"
"22","Bermuda","BMU",2021-01-05,"North_America","E1: Income support","1T","1T","The SUB would be paid once a month and the programme will run until 31st March 2021.  http://web.archive.org/web/20210112074101/https://www.gov.bm/articles/minister-finance-press-conference-remarks-30-november-2020"
"23","Bermuda","BMU",2021-02-01,"North_America","E1: Income support","1T","1T","The SUB would be paid once a month and the programme will run until 31st March 2021.  http://web.archive.org/web/20210112074101/https://www.gov.bm/articles/minister-finance-press-conference-remarks-30-november-2020"
"24","Bermuda","BMU",2021-01-05,"North_America","H1: Public information campaigns","2G","2G","Dedicated covid-19 website for updates.  http://web.archive.org/web/20201215011545/https://www.gov.bm/coronavirus"
"25","Bermuda","BMU",2021-01-18,"North_America","H1: Public information campaigns","2G","2G","Dedicated website for Covid-19 Updates.  http://web.archive.org/web/20210117161146/https://www.gov.bm/coronavirus"
"26","Bermuda","BMU",2021-02-01,"North_America","H1: Public information campaigns","2G","2G","Coordinated public campaign  https://archive.st/archive/2021/2/www.gov.bm/3ibb/www.gov.bm/index.html"
"27","Bermuda","BMU",2021-01-05,"North_America","H2: Testing policy","3","3","The Ministry of Health has partnered with MarketPlace Stores across the Island to offer free COVID-19 testing.  https://archive.vn/NSD4V"
"28","Bermuda","BMU",2021-01-05,"North_America","H3: Contact tracing","2","2","Each WeHealth Bermuda COVID-19 exposure notification will show the date someone was potentially exposed to COVID-19 and what steps they should take next, according to The Ministry of Health’s recommendations. Because the app does not collect any personal information, all exposure notifications remain anonymous.  https://archive.vn/WdWat"
"29","Bermuda","BMU",2021-01-05,"North_America","H6: Facial Coverings","2G","2G","No Policy Change.  https://archive.vn/oXt8O"
"30","Bermuda","BMU",2021-01-18,"North_America","H6: Facial Coverings","2G","2G","Mask Guidance - http://web.archive.org/web/20210109094305/https://www.gov.bm/mask-guidance"
"31","Bermuda","BMU",2021-02-01,"North_America","H6: Facial Coverings","2G","2G","Mask Guidance - http://web.archive.org/web/20210202003601/https://www.gov.bm/mask-guidance"
"32","Bermuda","BMU",2021-01-08,"North_America","H7: Vaccination policy","0","0","On the 8th of January, the first shipment for 9,750 doses of the COVID-19 vaccine arrived, on the British Airways flight. The UK has provided these 9,750 doses of the COVID-19 vaccine and equipment free of charge in order to support Bermuda’s public health and economic objectives. https://archive.vn/VKXPo     For more information on the COVID-19 vaccination programme.    See link - https://archive.vn/AihsO"
"33","Bermuda","BMU",2021-01-11,"North_America","H7: Vaccination policy","0","0","The very first COVID-19 vaccines provided on 11th January. http://web.archive.org/web/20210119033435/https://www.caribbeannationalweekly.com/caribbean-breaking-news-featured/bermudas-premier-and-opposition-leader-among-first-to-take-covid-19-vaccine/     First phase, Phase 1A, is the staff and residents of our long term care facilities such as residence of the Extended Care Unit of the Hospital. Vaccination Plan - http://web.archive.org/web/20210119031249/https://www.gov.bm/vaccines     Vaccine administered was Pfizer-BioNTech."
"34","Bermuda","BMU",2021-01-26,"North_America","H7: Vaccination policy","0","0","Following the announcement that the UK Government would make available to Bermuda a further 29,250 doses of the Pfizer-BioNTech vaccine and ancillary equipment  http://web.archive.org/web/20210202001116/https://www.gov.bm/articles/government-house-advisory-pfizer-biontech%C2%A0vaccine"
"35","Bermuda","BMU",2021-02-01,"North_America","H7: Vaccination policy","0","0","Bermuda’s National COVID-19 vaccination strategy has as its primary priority for the COVID-19 vaccination programme the prevention of COVID-19 mortality and the protection of health care workers, essential workers and social care staff and systems.  Secondary priorities include vaccination of those at increased risk of hospitalisation, at increased risk of exposure, and to maintain resilience in public services.    http://web.archive.org/web/20210202002109/https://www.gov.bm/vaccines"
"36","Canada","CAN",2021-01-11,"North_America","C1: School closing","3T","2T","Effective 11 January, the first day of winter term class at most province of Ontario universities and colleges, post-secondary institutions move all classes online (with limited exceptions for small medical school applied sessions, etc.) in anticipation of the the provincial government’s signalled-well-in-advance decision to raise Ontario’s covid-19 alert status to the emergency level effective 14 January. Elementary and secondary schools had moved online when classes resumed on 4 January. With all education levels now online in Ontario, Canada’s most populous province, national code for Canada moved to 3T. See government of Ontario website archived:  https://web.archive.org/web/20210114204552/https://www.ontario.ca/page/covid-19-provincewide-shutdown  ***Note edited to reflect that the closing of this univeristy is at the discretion of the university rather than due to government policy. Therefore, it is not reflected in the coding; however, useful to understand the context for Canadian school closures. https://web.archive.org/web/20210109022315/https://www.uwo.ca/coronavirus/presidents-updates/"
"37","Canada","CAN",2021-01-25,"North_America","C1: School closing","3T","3T","On 25 January 2021, elementary and secondary students in some regions of the province of Ontario returned to school. However, schools in the Cities of Toronto and Hamilton as well as the regions of Windsor-Essex (bordering Detroit), Peel and York (suburban Toronto) continue to conduct classes online until at least 10 February 2021. Universities and colleges in Ontario’s urban areas are also holding online classes. See Government of Ontario and cp24 tv news websites,  https://web.archive.org/web/20210122104517if_/https://news.ontario.ca/en/statement/60033/over-100000-ontario-students-return-to-class-beginning-next-week   https://web.archive.org/web/20210125204416/https://www.cp24.com/news/students-return-to-in-class-instruction-in-seven-regions-of-province-today-1.5280563"
"38","Canada","CAN",2021-01-29,"North_America","C1: School closing","3T","3T","C1 = 3T  In the 29 January 2021 print edition of the Globe and Mail newspaper, there was a report on the province of Ontario’s decision to return elementary and secondary students in some regions (Ottawa, southeastern Ontario including Kingston, southwestern Ontario including London) to in-class learning at school from online classes at home. However, schools in the Cities of Toronto and Hamilton as well as the regions of Windsor-Essex (bordering Detroit), Peel and York (suburban Toronto) continue to conduct classes online until at least 10 February 2021. Universities and colleges in Ontario’s urban areas are also holding online classes. See Globe and Mail newspaper website, archived:  https://web.archive.org/web/20210129181047/https://www.theglobeandmail.com/canada/article-ontario-modelling-projects-continued-drop-in-cases-if-restrictions/"
"39","Canada","CAN",2021-01-25,"North_America","C2: Workplace closing","3T","3T","On 25 January 2021, the government of Quebec published an updated list of businesses required to close and essential businesses allowed to operate under restricted rules. Quebec may have the most restrictive provincial policy in place now. Ontario has also closed and/or restricted business operations. Ontario and Quebec are the two most populous provinces See Government of Quebec website, archived:  https://web.archive.org/web/20210125205800/https://www.quebec.ca/en/health/health-issues/a-z/2019-coronavirus/list-commercial-enterprises/"
"40","Canada","CAN",2021-01-29,"North_America","C2: Workplace closing","3T","3T","In the 29 January 2021 print editions of English-language Canadian newspapers, a Canadian Press report quoted Quebec Premier Francois Legault’s warning that “the majority of measures will remain … such as closing non-essential businesses”. Quebec continues to enforce the most restrictive policy among Canada’s provinces and territories. See Globe and Mail newspaper website, archived:  https://web.archive.org/web/20210129153654/https://www.theglobeandmail.com/canada/article-number-of-deaths-in-quebec-jumped-10-per-cent-in-2020-due-to-covid-19/"
"41","Canada","CAN",2021-01-25,"North_America","C3: Cancel public events","2T","2T","On 25 January 2021, the City of Toronto (most populous in Canada) continues to conform with the “Province-wide (Ontario) declaration of emergency …(by) extending the cancellation of City-led and City-permitted outdoor special events through March 31”. Similar policies are in place in Quebec and other provinces. See City of Toronto website, archived: https://web.archive.org/web/20210125211052/https://www.toronto.ca/home/covid-19/covid-19-latest-city-of-toronto-news/affected-city-services/?accordion=events  ***Updated to also include Quebec - ""Activities organized in a public place Prohibited, except for places of worship (maximum of 10 people in attendance) and funerals (a maximum of 25 people excluding the staff of the funeral establishment and volunteers inside or outside the building. Keeping an attendance register is mandatory). Moreover, no food or alcohol can be served.""  http://web.archive.org/web/20210129173941/https://www.quebec.ca/en/health/health-issues/a-z/2019-coronavirus/confinement-in-quebec/"
"42","Canada","CAN",2021-01-29,"North_America","C3: Cancel public events","2T","2T","C3 = 3T  On 29 January 2021, the Province of Ontario’s Regulation 82/20 continues in force: “Indoor organized events … are not permitted...Meeting and event spaces are closed...Concert venues, theatres and cinemas are not permitted to open for any purpose.” The Province of Quebec and other provinces have imposed similar rules. See City of Toronto website, archived:  https://web.archive.org/web/20201202172433/https://www.toronto.ca/home/covid-19/covid-19-reopening-recovery-rebuild/covid-19-reopening-guidelines-for-businesses-organizations/covid-19-guidance-indoor-outdoor-events/"
"43","Canada","CAN",2021-01-05,"North_America","C4: Restrictions on gatherings","4T","4T","On 5 January, Leger, a well-known Canadian public opinion research and polling firm, released a survey showing that 48% of respondents in a sample designed to be representative of Canada’s population ignored public health advice to stay home over the holidays and participated in at least one gathering with participants from outside the household. See Leger website, archived:  https://web.archive.org/web/20210106200207/https://leger360.com/surveys/legers-north-american-tracker-january-5-2021/"
"44","Canada","CAN",2021-01-25,"North_America","C4: Restrictions on gatherings","4T","4T","On 25 January 2021, the government of Quebec clarified that its rule limiting regular religious observance gatherings to 10 persons applies to the entire building, not each room. Other than religious settings: “Indoor or outdoor private gatherings (p)rohibited.” Quebec may have the most restrictive provincial policy in place now. Other provinces have also restricted indoor and outdoor gatherings to a maximum of 10 persons. See Government of Quebec and Montreal Gazette newspaper websites, archived:  https://web.archive.org/web/20210125212921/https://www.quebec.ca/en/health/health-issues/a-z/2019-coronavirus/confinement-in-quebec/  https://web.archive.org/web/20210125213115/https://montrealgazette.com/news/local-news/quebec-flip-flops-on-gatherings-in-places-of-worship-for-third-time-in-48-hours"
"45","Canada","CAN",2021-01-29,"North_America","C4: Restrictions on gatherings","4T","4T","On 29 January 2021, the Province of Ontario’s Regulation 82/20 continues in force:  "" (1) Subject to sections 2 to 4, no person shall attend, (a)  an organized public event that is held indoors; (b)  a social gathering that is held indoors, including a social gathering associated with a gathering described in clause (d); (c)  an organized public event or social gathering of more than 5 people that is held outdoors, including a social gathering associated with a gathering described in clause (d); or (d)  a gathering of more than 10 people for the purposes of a wedding, a funeral or a religious service, rite or ceremony""  Link not archiving: https://www.ontario.ca/laws/regulation/200082/v34  ***Note updated to include bylaw link and full text on gatherings; link to Toronto website deleted as it was from November and allowed up to 10 people at outdoor events, compared to Ontario bylaw 82/20 which now only allows for 5"
"46","Canada","CAN",2021-01-06,"North_America","C5: Close public transport","1T","0","Effective 6 January, the Office of Premier Blaine Higgs announced that “the entire province of New Brunswick will move to the Orange level... Public Health recommended the move due to the doubling of cases in less than six days … as well as reports of situations where some individuals were not complying with public health measures.” To comply with orange alert rules requiring 1m distancing on public transit, city transit services reduced bus seating capacity to 50% or 15-20 passengers on each bus.     See New Brunswick government websites, archived:  https://web.archive.org/web/20210110192430/https://www2.gnb.ca/content/gnb/en/news/news_release.2021.01.0007.html  https://web.archive.org/web/20210110200130/https://www2.gnb.ca/content/gnb/en/corporate/promo/covid-19/recovery.html  https://web.archive.org/web/20210110200130/https://www2.gnb.ca/content/gnb/en/corporate/promo/covid-19/recovery.html  https://web.archive.org/web/20210110205043/https://www.saintjohn.ca/news-and-service-updates/saint-john-transit-seating-capacity-reduced-by-covid-19-orange-phase  https://web.archive.org/web/20210110203956/https://www.fredericton.ca/en/transit"
"47","Canada","CAN",2021-01-19,"North_America","C5: Close public transport","1T","1T","New Brunswick reduces bus capacity 9 passangers per bus.  https://web.archive.org/web/20210129204857/https://twitter.com/ThinkTransitSJ/status/1351617181642072065"
"48","Canada","CAN",2021-01-25,"North_America","C5: Close public transport","1T","1T","Municipal public transit in the province of New Brunswick reduced to 50% seating capacity. See CAN-NB. ***edited to add link  http://web.archive.org/web/20210129205247/https://twitter.com/ThinkTransitSJ/"
"49","Canada","CAN",2021-01-29,"North_America","C5: Close public transport","1T","1T","On 29 January 2021, the Province of New Brunswick continues to restrict bus transit to 50% seating capacity. See Saint John Transit twitter, archived:  https://web.archive.org/web/20210129192512/https://twitter.com/ThinkTransitSJ/"
"50","Canada","CAN",2021-01-09,"North_America","C6: Stay at home requirements","2T","1G","Effective 9 January, the government of Quebec imposed a province-wide curfew in place between 8pm and 5am. Being out during those hours is prohibited without a specifically exempted reason -- e.g., travelling to and from essential work, owners walking a dog within a 1 km radius of home. Curfew rules will be in place until 8 Feburary at least. See government of Quebec website, archived:   https://web.archive.org/web/20210112081748/https://www.quebec.ca/premier-ministre/actualites/detail/le-premier-ministre-francois-legault-annonce-de-nouvelles-mesures-sanitaires-pour-controler-la-deuxi/"
"51","Canada","CAN",2021-01-25,"North_America","C6: Stay at home requirements","2T","2T","As of 25 January 2021, the government of Quebec continues to impose a curfew between 8 p.m. and 5 a.m except for travel to and from an essential workplace and walking a dog. No other province has a curfew. See government of Quebec website, archived:  https://web.archive.org/web/20210125212921/https://www.quebec.ca/en/health/health-issues/a-z/2019-coronavirus/confinement-in-quebec/"
"52","Canada","CAN",2021-01-29,"North_America","C6: Stay at home requirements","2T","2T","In the 29 January 2021 print editions of English-language Canadian newspapers, a Canadian Press report quoted Quebec Premier Francois Legault’s warning that “the majority of measures will remain … Legault singled out the province’s 8 p.m. to 5 a.m. curfew as a measure that is “working well,” suggesting that it was likely to be among the rules that is extended..” Quebec continues to be the only province or territory in Canada with a curfew. See Globe and Mail newspaper website, archived:  https://web.archive.org/web/20210129153654/https://www.theglobeandmail.com/canada/article-number-of-deaths-in-quebec-jumped-10-per-cent-in-2020-due-to-covid-19/"
"53","Canada","CAN",2021-01-25,"North_America","C7: Restrictions on internal movement","2T","2T","As of January 25 2021, the 4 Atlantic provinces continue to require 14-day quarantine requirements on Canadians entering from another province (including other Atlantic provinces; Atlantic bubble suspended) as well as restrictions on ""non-essential"" travel into these provinces by non-residents. For examples, see CAN-NB and CAN_NL.   See New Brunswick website: http://web.archive.org/web/20210130111953/https://www2.gnb.ca/content/gnb/en/corporate/promo/covid-19/travel.html  ***note updated to include New Brunswick website link"
"54","Canada","CAN",2021-01-29,"North_America","C7: Restrictions on internal movement","2T","2T","29 January was the first full day of effect in 2021 for the province of Manitoba’s requirement: “Individuals who travelled internationally or inter-provincially must go into mandatory self-isolation (quarantine) for 14 days from the date of arrival to Manitoba.” Manitoba imposed a similar rule during 2020 and then relaxed the requirements gradually. The 4 Atlantic provinces impose similar rules, that now apply to inter-provincial travel within the Atlantic region. The Atlantic bubble exception no longer applies. See Province of Manitoba website, archived:  https://web.archive.org/web/20210129195407/https://www.gov.mb.ca/covid19/restartmb/prs/orders/index.html"
