"","CountryName","CountryCode","Date","region","PolicyType","PolicyCode","previous_PolicyCode","Notes"
"1","Aruba","ABW",2021-11-23,"Latin_America_Caribbean","C1: School closing","1G","1G","Schools will open on the 1st of September 2021, with the exception of school that can open online and daycares.    https://web.archive.org/web/20211122145337/https://www.arubacovid19.org/ddg-eng"
"2","Aruba","ABW",2021-11-23,"Latin_America_Caribbean","C2: Workplace closing","0","0","No measures applicable to workplaces and commerce    https://web.archive.org/web/20211122145337/https://www.arubacovid19.org/ddg-eng"
"3","Aruba","ABW",2021-11-23,"Latin_America_Caribbean","C3: Cancel public events","1G","1G","On 2nd September 2021 Government of Aruba banned dancing in restaurants and nightlife establishments. Seating at restaurants is at a maximum of eight per table (excluding children under the age of 12), both indoors and outdoors. Tables must be at least 1.5 m apart. All bars, rum shops, nightclubs, and restaurants can serve at tables only. There are “restricted zones” that are off-limits between the hours of 7:00 pm and 5:00 am. Restricted zones include all beaches and public parking lots. Source Aruba.com travel page. Archived: https://archive.vn/9nIJZ"
"4","Aruba","ABW",2021-11-23,"Latin_America_Caribbean","C4: Restrictions on gatherings","4G","4G","Gathering Ban  Max. 6 people.    https://web.archive.org/web/20211122145337/https://www.arubacovid19.org/ddg-eng"
"5","Aruba","ABW",2021-11-23,"Latin_America_Caribbean","C5: Close public transport","0","0","No measures found    https://web.archive.org/web/20211122145337/https://www.arubacovid19.org/ddg-eng"
"6","Aruba","ABW",2021-11-23,"Latin_America_Caribbean","C6: Stay at home requirements","2G","2G","Area ban from 1900-0500H    https://web.archive.org/web/20211122145337/https://www.arubacovid19.org/ddg-eng"
"7","Aruba","ABW",2021-11-23,"Latin_America_Caribbean","C7: Restrictions on internal movement","0","0","No measures found    https://web.archive.org/web/20211122145337/https://www.arubacovid19.org/ddg-eng"
"8","Aruba","ABW",2021-11-23,"Latin_America_Caribbean","C8: International travel controls","1","1","All visitors are required to have a negative test prior to boarding or test on landing and quarantine until the results are available.    https://web.archive.org/web/20211122150511/https://www.aruba.com/uk/traveler-health-requirements"
"9","Aruba","ABW",2021-11-23,"Latin_America_Caribbean","E1: Income support","1T","1T","Since the beginning of the pandemic in March, the government put into effect a fiscal emergency plan for April, May, and June 2020. Besides, the government has provided financial support to the commercial sector in the form of salary subsidies and financial support from AWG. 4000,- per quarter paid to small and medium enterprises to keep the economy running. Effective Nov 1st, 2021 Fiscal Emergency Plan was effected by the Government of Aruba. Having completed the first part a second part valid for 3 years  Archived: http://web.archive.org/web/20211026004343/https://www.government.aw/news/news_47033/item/tax-relief-plan-part-2-to-support-economic-recovery_54981.html"
"10","Aruba","ABW",2021-11-23,"Latin_America_Caribbean","E2: Debt/contract relief","0","0","Source:   https://web.archive.org/web/20210907020245/https://www.imf.org/en/Topics/imf-and-covid19/Policy-Responses-to-COVID-19"
"11","Aruba","ABW",2021-11-23,"Latin_America_Caribbean","H1: Public information campaigns","2G","2G","Coordinated public campaign on national website and national tourism board.    https://web.archive.org/web/20211122145337/https://www.arubacovid19.org/ddg-eng  https://web.archive.org/web/20211122150511/https://www.aruba.com/uk/traveler-health-requirements"
"12","Aruba","ABW",2021-11-23,"Latin_America_Caribbean","H2: Testing policy","1","1","This system is only allowed for AZV patients who are symptomatic (according to the case definition). You will not be able to test for Covid-19 if you are not symptomatic and/or traveling outside of the country.    https://web.archive.org/web/20211103124323/https://covid19test.healthapp.aw/"
"13","Aruba","ABW",2021-11-23,"Latin_America_Caribbean","H3: Contact tracing","2","2","Comprehensive contact tracing in effect.  https://web.archive.org/web/20211001103154/https://www.government.aw/news/news_47033/item/the-contact-tracing-team-of-the-department-of-public-health-urges-to-enter-correct-data-in-the-aruba-health-app_57995.html"
"14","Aruba","ABW",2021-11-23,"Latin_America_Caribbean","H6: Facial Coverings","2G","2G","Masks are obligatory indoors    https://web.archive.org/web/20211122145337/https://www.arubacovid19.org/ddg-eng"
"15","Aruba","ABW",2021-11-23,"Latin_America_Caribbean","H7: Vaccination policy","5G","5G","All age groups over 18 are able to be vaccinated    https://web.archive.org/web/20211101053655/https://8f39937c-2835-4a9d-b0e9-4a8971f34620.filesusr.com/ugd/1a09f9_dc0437f5973e422eb5fbed71931d5af7.pdf"
"16","Aruba","ABW",2021-11-23,"Latin_America_Caribbean","H8: Protection of elderly people","0","0","No measures or restrictions for elderly citizens found    https://web.archive.org/web/20211122145337/https://www.arubacovid19.org/ddg-eng"
"17","Aruba","ABW",2021-11-25,"Latin_America_Caribbean","V2: Vaccine Availability","12633","12635","Vaccinations are available to all citizens over 18 years of age    https://web.archive.org/web/20211101053655/https://8f39937c-2835-4a9d-b0e9-4a8971f34620.filesusr.com/ugd/1a09f9_dc0437f5973e422eb5fbed71931d5af7.pdf"
"18","Aruba","ABW",2021-11-25,"Latin_America_Caribbean","V3: Vaccine Financial Support","12633","12635","Free to citizens"
"19","Argentina","ARG",2021-11-15,"Latin_America_Caribbean","C1: School closing","1G","1G","Schools are open with restrictions in place    People must:    to. keep a minimum distance of 2 meters between them .  b. use face masks in closed and open shared spaces. Its use will not be mandatory only when circulating outdoors more than 2 meters away from other people.  c. ventilate the rooms adequately and constantly.    https://web.archive.org/web/20211203081936/https://www.argentina.gob.ar/salud/coronavirus/medidas-prevencion/generales/conducta"
"20","Argentina","ARG",2021-11-15,"Latin_America_Caribbean","C2: Workplace closing","1G","1G","Schools are open with restrictions in place    People must:    to. keep a minimum distance of 2 meters between them .  b. use face masks in closed and open shared spaces. Its use will not be mandatory only when circulating outdoors more than 2 meters away from other people.  c. ventilate the rooms adequately and constantly.    https://web.archive.org/web/20211203081936/https://www.argentina.gob.ar/salud/coronavirus/medidas-prevencion/generales/conducta"
"21","Argentina","ARG",2021-11-15,"Latin_America_Caribbean","C3: Cancel public events","1G","1G","Considering the epidemiological and sanitary situation and the progress of the vaccination campaign in the country, the government has established new general prevention measures since October 1st, which will be valid until December 31st. In this sense, the general rules of conduct are maintained, and special emphasis is placed on the capacity and protocols of the activities of greatest risk.   https://web.archive.org/web/20211026093246/https://www.boletinoficial.gob.ar/detalleAviso/primera/250368/20211001    GENERAL PREVENTION MEASURES Decree 678/2021  ARTICLE 3.- ACTIVITIES OF GREATER EPIDEMIOLOGICAL AND SANITARY RISK: The following activities, which involve a greater epidemiological and sanitary risk, must comply, in addition to the protocols, recommendations and instructions of the national, provincial and Autonomous City of Buenos Aires, the following conditions for its realization:    Massive events of more than THOUSAND (1000) people:  i. Those carried out in closed spaces may use a maximum of FIFTY PERCENT (50%) of the authorized capacity and must require the people who attend to have a complete vaccination scheme that occurred at least FOURTEEN (14) days before. of the event, or at least one dose of vaccine plus a negative diagnostic test carried out no more than FORTY-EIGHT (48) hours in advance.  ii: Those that are carried out in outdoor spaces may use, at most, FIFTY PERCENT (50%) of the authorized capacity and must require concurrent people over EIGHTEEN (18) years of age to have, at least, a dose of vaccine applied, at least, fourteen (14) days before the event.    https://web.archive.org/web/20211026093246/https://www.boletinoficial.gob.ar/detalleAviso/primera/250368/20211001  https://web.archive.org/web/20211206120724/https://www.argentina.gob.ar/salud/coronavirus-COVID-19/medidas-preventivas-generales/actividades-de-mayor-riesgo"
"22","Argentina","ARG",2021-11-15,"Latin_America_Caribbean","C4: Restrictions on gatherings","1G","1G","Considering the epidemiological and sanitary situation and the progress of the vaccination campaign in the country, the government has established new general prevention measures since October 1st, which will be valid until December 31st. In this sense, the general rules of conduct are maintained, and special emphasis is placed on the capacity and protocols of the activities of greatest risk.   https://web.archive.org/web/20211026093246/https://www.boletinoficial.gob.ar/detalleAviso/primera/250368/20211001    GENERAL PREVENTION MEASURES Decree 678/2021  ARTICLE 3.- ACTIVITIES OF GREATER EPIDEMIOLOGICAL AND SANITARY RISK: The following activities, which involve a greater epidemiological and sanitary risk, must comply, in addition to the protocols, recommendations and instructions of the national, provincial and Autonomous City of Buenos Aires, the following conditions for its realization:    Massive events of more than THOUSAND (1000) people:  i. Those carried out in closed spaces may use a maximum of FIFTY PERCENT (50%) of the authorized capacity and must require the people who attend to have a complete vaccination scheme that occurred at least FOURTEEN (14) days before. of the event, or at least one dose of vaccine plus a negative diagnostic test carried out no more than FORTY-EIGHT (48) hours in advance.  ii: Those that are carried out in outdoor spaces may use, at most, FIFTY PERCENT (50%) of the authorized capacity and must require concurrent people over EIGHTEEN (18) years of age to have, at least, a dose of vaccine applied, at least, fourteen (14) days before the event.    https://web.archive.org/web/20211026093246/https://www.boletinoficial.gob.ar/detalleAviso/primera/250368/20211001  https://web.archive.org/web/20211206120724/https://www.argentina.gob.ar/salud/coronavirus-COVID-19/medidas-preventivas-generales/actividades-de-mayor-riesgo"
"23","Argentina","ARG",2021-11-15,"Latin_America_Caribbean","C5: Close public transport","1G","1G","Considering the epidemiological and sanitary situation and the progress of the vaccination campaign in the country, the government has established new general prevention measures since October 1st, which will be valid until December 31st. In this sense, the general rules of conduct are maintained, and special emphasis is placed on the capacity and protocols of the activities of greatest risk.     https://web.archive.org/web/20211026093246/https://www.boletinoficial.gob.ar/detalleAviso/primera/250368/20211001"
"24","Argentina","ARG",2021-11-15,"Latin_America_Caribbean","C6: Stay at home requirements","1T","1T","Considering the epidemiological and sanitary situation and the progress of the vaccination campaign in the country, the government has established new general prevention measures since October 1st, which will be valid until December 31st. In this sense, the general rules of conduct are maintained, and special emphasis is placed on the capacity and protocols of the activities of greatest risk.     ARTICLE 2:   F. In no case may persons who have the status of ""confirmed case"", ""suspected case"" or ""close contact"" of COVID-19 circulate, in accordance with the definitions established by the national health authority, nor those who must comply with isolation under the terms of the Decree No. 260/20, extended under the terms of Decree No. 167/21, its amendments and complementary regulations.    https://web.archive.org/web/20211026093246/https://www.boletinoficial.gob.ar/detalleAviso/primera/250368/20211001      Is a curfew in place? No. Anyone residing or travelling in Argentina should consult with local authorities for the most up-to-date information regarding the status of each city or department as they may move between mandatory quarantine and social distancing measures depending on the current conditions.     https://web.archive.org/web/20211018004313/https://ar.usembassy.gov/covid-19/"
"25","Argentina","ARG",2021-11-15,"Latin_America_Caribbean","C7: Restrictions on internal movement","1T","1T","Considering the epidemiological and sanitary situation and the progress of the vaccination campaign in the country, the government has established new general prevention measures since October 1st, which will be valid until December 31st. In this sense, the general rules of conduct are maintained, and special emphasis is placed on the capacity and protocols of the activities of greatest risk.     https://web.archive.org/web/20211026093246/https://www.boletinoficial.gob.ar/detalleAviso/primera/250368/20211001      Movement Restrictions:  Are there restrictions on intercity or interstate travel? No  Additional information about interprovincial travel can be found?here? (In Spanish). Individual provinces may require additional local permits to enter or transit.  https://web.archive.org/web/20211203153720/https://ar.usembassy.gov/covid-19/"
"26","Argentina","ARG",2021-11-15,"Latin_America_Caribbean","C8: International travel controls","2","2","As of November 1, 2021, the entry into the national territory of non-resident foreigners is restored, as long as they comply with the immigration and health requirements in force or that are established in the future.     Starting from 29/11/2021, according to Administrative Decision 1163/2021, any person who comes from or has been in the African continent or in the affected areas defined by the national health authority in the last 14 days prior to entering the country, will be subject to compliance with the current immigration requirements.   These requirements include a 14 days mandatory quarantine.    https://web.archive.org/web/20211206132706/https://www.argentina.gob.ar/salud/coronavirus-COVID-19/medidas-preventivas-generales/fronteras-e-ingreso-al-territorio-nacional"
"27","Argentina","ARG",2021-11-15,"Latin_America_Caribbean","E1: Income support","0","0","No changes found."
"28","Argentina","ARG",2021-11-15,"Latin_America_Caribbean","E2: Debt/contract relief","0","1","No new data was found.    *International Monetary Fund Policy Tracker includes the following information last updated on July 2, 2021: ""Measures have been aimed at encouraging bank lending through (i) lower reserve requirements on bank lending to households and SMEs; (ii) regulations that limit banks’ holdings of central bank paper to provide space for SME lending; (iii) temporary easing of bank provisioning needs and of bank loan classification rules (i.e. extra 60 days to be classified as non-performing); and (iv) a stay on both bank account closures due to bounced checks and credit denial to companies with payroll tax arrears.""    https://web.archive.org/web/20211014094735/https://www.imf.org/en/Topics/imf-and-covid19/Policy-Responses-to-COVID-19"
"29","Argentina","ARG",2021-11-15,"Latin_America_Caribbean","H1: Public information campaigns","2G","2G","Public campaign across social media and official web pages.    https://web.archive.org/web/20211206185713/https://www.argentina.gob.ar/salud/coronavirus/cuidarnos"
"30","Argentina","ARG",2021-11-15,"Latin_America_Caribbean","H2: Testing policy","2","2","Testing is performed for anyone showing COVID-19 symptoms and for all contacts of confirmed cases*.    *If a suspected case is confirmed:   A house-to-house search is conducted for close contacts of confirmed cases and of all people with symptoms consistent with COVID-19.  People are accompanied to the testing site in the neighborhood to take the sample. The test that is carried out is the PCR, with a special circuit to have the result as soon as possible and thus be able to confirm or rule out.    https://web.archive.org/web/20210615013646/https://www.argentina.gob.ar/coronavirus/detectar"
"31","Argentina","ARG",2021-11-15,"Latin_America_Caribbean","H3: Contact tracing","2","2","If a suspected case is confirmed:   A house-to-house search is conducted for close contacts of confirmed cases and of all people with symptoms consistent with COVID-19.  People are accompanied to the testing site in the neighbourhood to take the sample. The test that is carried out is the PCR, with a special circuit to have the result as soon as possible and thus be able to confirm or rule out.    https://web.archive.org/web/20210615013646/https://www.argentina.gob.ar/coronavirus/detectar"
"32","Argentina","ARG",2021-11-15,"Latin_America_Caribbean","H6: Facial Coverings","3G","3G","People must:  b. use face masks in closed and open shared spaces. Its use will not be mandatory only when circulating outdoors more than 2 meters away from other people.    https://web.archive.org/web/20211203081936/https://www.argentina.gob.ar/salud/coronavirus/medidas-prevencion/generales/conducta"
"33","Argentina","ARG",2021-11-15,"Latin_America_Caribbean","H7: Vaccination policy","5G","4G","The COVID-19 vaccine is available for all adults older than 18 years old.   Children 12-17 and 3-11 years old are already receiving the COVID-19 vaccine.     https://web.archive.org/web/20211117185752/https://www.argentina.gob.ar/noticias/el-60-por-ciento-de-la-poblacion-del-pais-ya-completo-su-esquema-de-vacunacion-contra-covid"
"34","Argentina","ARG",2021-11-15,"Latin_America_Caribbean","H8: Protection of elderly people","1G","1G","No changes found."
"35","Argentina","ARG",2021-11-29,"Latin_America_Caribbean","V1: Vaccine Prioritisation","9595","9594","Using Argentina's Ministry of Health COVID Site the links below give the current Priority List and also has the information about what vaccines are currently available.    --------  https://web.archive.org/web/20211211234623/https://www.argentina.gob.ar/coronavirus/vacuna/preguntas-frecuentes  https://web.archive.org/web/20211203023315/https://www.argentina.gob.ar/coronavirus/vacuna/cuales"
"36","Argentina","ARG",2021-11-29,"Latin_America_Caribbean","V2: Vaccine Availability","13155","13154","Currently the vaccine is fully funded by the government for all defined at risk portions of the population as well as strategic for essential function.  -------  https://web.archive.org/web/20211211234623/https://www.argentina.gob.ar/coronavirus/vacuna/preguntas-frecuentes  https://web.archive.org/web/20211203023315/https://www.argentina.gob.ar/coronavirus/vacuna/cuales"
"37","Argentina","ARG",2021-11-29,"Latin_America_Caribbean","V3: Vaccine Financial Support","13155","13154","Currently the vaccine is fully funded by the government for all defined at risk portions of the population as well as strategic for essential function.  -------  https://web.archive.org/web/20211211234623/https://www.argentina.gob.ar/coronavirus/vacuna/preguntas-frecuentes  https://web.archive.org/web/20211203023315/https://www.argentina.gob.ar/coronavirus/vacuna/cuales"
"38","Bahamas","BHS",2021-11-23,"Latin_America_Caribbean","C1: School closing","1G","1G","No change from previous period. Guidance on schools reopening document still in effect.    Web link: https://web.archive.org/web/20211213195227/https://76e8ca5c-b0d6-41c1-a80e-fa1785909945.filesusr.com/ugd/e822df_e08881f3e35f4297ad405c8e010afb90.pdf    Note for future coders - The Ministry of Education published an announcement regarding the availability of the hybrid model into January 2022. Please see the announcement here: https://web.archive.org/web/20211213193100/https://www.ministryofeducationbahamas.com/"
"39","Bahamas","BHS",2021-11-23,"Latin_America_Caribbean","C2: Workplace closing","1G","2T","Businesses may be open with restrictions and it is recommended to stay at home where possible.    https://web.archive.org/web/20211213203356/https://opm.gov.bs/covid19/"
"40","Bahamas","BHS",2021-11-23,"Latin_America_Caribbean","C3: Cancel public events","1G","1T","Public events may proceed with restrictions on capacity and/or social distancing measures.     https://web.archive.org/web/20211213203356/https://opm.gov.bs/covid19/    https://web.archive.org/web/20211213203356/https://opm.gov.bs/covid19/"
"41","Bahamas","BHS",2021-11-23,"Latin_America_Caribbean","C4: Restrictions on gatherings","3G","3T","Across the Bahamas there are restrictions on a range of social gatherings, including: weddings and funerals (maximum 33% of venue capacity), social gatherings indoors (maximum 20 people), outdoors (must be vaccinated or have a negative covid test).    Web link: https://web.archive.org/web/20211213203356/https://opm.gov.bs/covid19/"
"42","Bahamas","BHS",2021-11-23,"Latin_America_Caribbean","C5: Close public transport","0","0","No new changes in effect. Taxis, private bus and public bus services are all operating at 50% reduced seating capacity.    Archive: https://web.archive.org/web/20211213203356/https://opm.gov.bs/covid19/"
"43","Bahamas","BHS",2021-11-23,"Latin_America_Caribbean","C6: Stay at home requirements","1G","1G","The curfew is still lifted, but recommendations to stay at home remain in place.    https://web.archive.org/web/20211213203356/https://opm.gov.bs/covid19/"
"44","Bahamas","BHS",2021-11-23,"Latin_America_Caribbean","C7: Restrictions on internal movement","1T","1T","Some restrictions on travel between islands are in place. The guidance notes that:  - ""Unvaccinated Travelers departing from New Providence, Grand Bahama, Bimini, Exuma, Abaco, North and South Eleuthera (including Harbour Island) to any other island; are required to upload a Negative RT-PCR Test result during The Bahamas Travel Health Visa trip application process. Traveling from any other island does not require a RT-PCR test for travel.  - ""Fully Vaccinated Travelers departing from New Providence, Grand Bahama, Bimini, Exuma, Abaco, North and South Eleuthera (including Harbour Island) to any other island; will be required to upload their Vaccination Card and either a negative RT-PCR Test result or a Rapid Antigen Test result during The Bahamas Travel Health Visa trip application process. Traveling from any other island does not require a vaccination card and COVID-19 test result for travel.""    Details can be found here: https://web.archive.org/web/20211213210527/https://travel.gov.bs/file/travelProtocols"
"45","Bahamas","BHS",2021-11-23,"Latin_America_Caribbean","C8: International travel controls","1","1","No changes to the policy (same link from previous note applies)."
"46","Bahamas","BHS",2021-11-29,"Latin_America_Caribbean","C8: International travel controls","3","1","The Bahamas imposed a travel ban for anyone coming from: Botswana, Eswatini (formerly Swaziland), Lesotho, Malawi, Mozambique, Namibia, Zimbabwe, and South Africa due to concerns about the Omicron variant.     Initial press release can be found here: https://web.archive.org/web/20211213212151/https://www.bahamas.gov.bs/wps/portal/public/news%20and%20press%20release/travel%20restrications%20as%20a%20result%20of%20omicron%20-%20a%20covid-19%20variant/%21ut/p/b1/vZLZkqIwFIafZR7AJmwhXIIgaxBZgnBjsQiCoNgook8_dk3XTM1UtT0XM51cper7851zEiqh1lRySMe6Ss_18ZC2b-cEblhtiVdzDmEEOREYdOAYiuqyGks_gPgBgA-WBH7kgYYl6ZHXeACBEbq25Ao6s7QYKqLWeszLyhFXqhqN1yFuK89UiqJtoBUnMVml2mrCsIxss3fR6Jab-OwPyb5A6AS7YNiCsQW1dzGXOz5N9vOZWLC9fY40ZCGzVEN5e5BbW_X27s6wCr66kgali5xVJIPo2TkbQ5GZe6Rf1LnSeXvMQGIs1w29CG-SZpBy7HYSENtXxQt8nnNiNjrSXGRvLjtHMPSaNdSVdIi0RaOJUTeQtc6NLufQ_QDfZ_Ok-b-a7c_8kgnegDkNrZAHSOE-y0dU8nT8HHgHnj3f7zf8WQP8DOAoRz92Wyp-YMKHmAyogFoDbuM3t9647-9eI6yAD_a0r_YWCKIJK7rvhHvgixEdqBOmQwDw3bQC28T4nt-w6LoF8UJZkk7B5aA9F_o2_FohkumvFgr_XWgx7ENos7aD5rSvsV8sRP_-05hUUmfdyzXvXsALEllG5AWAOETzNKAp0sezKavwNDeScopHvRaZiclsVkr5xBoEXfTvyTTYanBGMxOfYoMYrelWG9W9ccyaHY2RHMeSNI3q5KherM4jTEPmEBGYkdkuVHlrVouxZsXygi133jrPXLrL0tIU8ll6Sef5sBXEbBOSbaKfZvJRHvqT1Tmvu0bdOQ7oFZkJYB3nEqj3xwNOC9Yz4666t5pTWV3ia6dGL8pXzpEBV_U9L3Cd7MNBGFo4TJJpIoaYmHjVDTOFhapHs5bX0WJWlMvNa5rNiuwoLy_t8ip9-0b1XThaNvTUUlnff23pO9g9gjE%21/dl4/d5/L2dBISEvZ0FBIS9nQSEh/"
