"","CountryName","CountryCode","Date","region","PolicyType","PolicyCode","previous_PolicyCode","Notes"
"122","Chile","CHL",2022-05-01,"Latin_America_Caribbean","H7: Vaccination policy","5G","5G","There are not changes. Recently, all people can apply vaccines, so it could be changed to Universal. There is not specific indications related to the exact date but It could be from November.     Available at: https://archive.vn/WpCCI"
"123","Chile","CHL",2022-05-11,"Latin_America_Caribbean","H7: Vaccination policy","5G","5G","There are not changes. Recently, all people can apply vaccines, so it could be changed to Universal. There is not specific indications related to the exact date but It could be from November.     Available at: https://archive.vn/2aNSD"
"124","Chile","CHL",2022-05-16,"Latin_America_Caribbean","H7: Vaccination policy","5G","5G","There are not changes. Recently, all people can apply vaccines, so it could be changed to Universal. There is not specific indications related to the exact date but It could be from November.     Available at: https://archive.vn/dUteO"
"125","Chile","CHL",2022-05-01,"Latin_America_Caribbean","H8: Protection of elderly people","1G","1G","On 1 October 2021, National government took new measures about ""Plan Paso a Paso"". The curfew between 10:00 pm to 5 am has been dropped, and there are no mobility restrictions for elderly people. It depends on commune situation. Before this, it was not clear if elderly people could go outside. For this reason and because of more flexibilities, I apply this change from 1 October 2021.    Available at: https://archive.vn/QZ3bY"
"126","Chile","CHL",2022-05-11,"Latin_America_Caribbean","H8: Protection of elderly people","1G","1G","On 1 October 2021, National government took new measures about ""Plan Paso a Paso"". The curfew between 10:00 pm to 5 am has been dropped, and there are no mobility restrictions for elderly people. It depends on commune situation. Before this, it was not clear if elderly people could go outside. For this reason and because of more flexibilities, I apply this change from 1 October 2021.    Available at: https://archive.vn/VK1IO"
"127","Chile","CHL",2022-05-16,"Latin_America_Caribbean","H8: Protection of elderly people","1G","1G","On 1 October 2021, National government took new measures about ""Plan Paso a Paso"". The curfew between 10:00 pm to 5 am has been dropped, and there are no mobility restrictions for elderly people. It depends on commune situation. Before this, it was not clear if elderly people could go outside. For this reason and because of more flexibilities, I apply this change from 1 October 2021.    Available at: https://archive.vn/KaZDv"
"128","Colombia","COL",2022-05-15,"Latin_America_Caribbean","C1: School closing","1G","1G","Face-to-face class has resumed. Students are expected to wear mask in closed school spaces.    http://web.archive.org/web/20220514140607/https://www.mineducacion.gov.co/portal/salaprensa/Noticias/409395:Con-encuentros-en-los-territorios-y-entrega-de-infraestructura-educativa-en-el-Valle-el-Ministerio-de-Educacion-acompana-el-retorno-a-las-aulas-que-esta-semana-ya-llega-al-100-en-las-secretarias-de-Educacion-del-pais    http://web.archive.org/web/20220516110039/https://www.minsalud.gov.co/Paginas/Uso-de-tapabocas-en-espacios-cerrados-se-levanta-pero-con-excepciones.aspx"
"129","Colombia","COL",2022-05-16,"Latin_America_Caribbean","C1: School closing","1T","1G","From May 16, schools in territories with at least 70% of the people vaccinated and 40% received the booster shot will be able to remove masks.    http://web.archive.org/web/20220529215302/https://www.mineducacion.gov.co/portal/salaprensa/Noticias/410678:Desde-el-lunes-colegios-que-cumplan-con-criterios-podran-retirar-tapabocas"
"130","Colombia","COL",2022-05-01,"Latin_America_Caribbean","C2: Workplace closing","1T","2G","From 1 May, masks in closed spaces is lifted for municipalities with vaccination coverage > 70%. However, mask is still required in health service spaces, nursing homes, closed school spaces and in transport (not only in public transport).    http://web.archive.org/web/20220516110039/https://www.minsalud.gov.co/Paginas/Uso-de-tapabocas-en-espacios-cerrados-se-levanta-pero-con-excepciones.aspx"
"131","Colombia","COL",2022-05-15,"Latin_America_Caribbean","C2: Workplace closing","1T","1T","Facemasks: Resolution 692 requires the use of facemasks on public transportation, which includes air travel and at airport and marine terminals. Facemasks are required in metropolitan areas with a fully vaccinated rate of lower than 70% and a booster shot rate of lower than 40%. If the fully vaccinated rate is 70% or higher and over 40% of the population has also received a booster shot, facemasks are only required on public transportation and in public transportation stations, health facilities, and nursing homes.       http://web.archive.org/web/20220529215531/https://co.usembassy.gov/covid-19-information/  http://web.archive.org/web/20220529220118/https://www.minsalud.gov.co/Normatividad_Nuevo/Resoluci%C3%B3n%20692%20de%202022.pdf"
"132","Colombia","COL",2022-05-01,"Latin_America_Caribbean","C3: Cancel public events","2T","2G","From March 1, the use of the face mask in open spaces will not be mandatory in municipalities with >70% complete vaccination scheme. However, its permanent use is recommended in people with comorbidities, respiratory symptoms and who are not vaccinated.  Subsequently, from May 1, masks in closed spaces is lifted for municipalities with vaccination coverage > 70%. However, mask is still required in health service spaces, nursing homes, closed school spaces and in transport (not only in public transport). In addition, the presentation of vaccination card is eliminated nationwide. It will not be a requirement to enter public events and closed spaces such as restaurants, bars, gastropubs, cinemas, libraries and museums.    https://archive.ph/XQQQC#selection-2069.0-2069.120  https://web.archive.org/web/20220516161825/https://consultorsalud.com/colombia-elimina-uso-del-tapabocas-esp-cerr/  http://web.archive.org/web/20220516110039/https://www.minsalud.gov.co/Paginas/Uso-de-tapabocas-en-espacios-cerrados-se-levanta-pero-con-excepciones.aspx"
"133","Colombia","COL",2022-05-15,"Latin_America_Caribbean","C3: Cancel public events","2T","2T","From March 1, the use of the face mask in open spaces will not be mandatory in municipalities with >70% complete vaccination scheme. However, its permanent use is recommended in people with comorbidities, respiratory symptoms and who are not vaccinated. Mask is still required in health service spaces, nursing homes, closed school spaces and in transport (not only in public transport). In addition, the presentation of vaccination card is eliminated nationwide. It will not be a requirement to enter public events and closed spaces such as restaurants, bars, gastropubs, cinemas, libraries and museums.  There is no change in policies except for schools. Studies in municipalities with >70% complete vaccination scheme no longer have to wear face masks from May 16.    https://archive.ph/XQQQC#selection-2069.0-2069.120  https://web.archive.org/web/20220516161825/https://consultorsalud.com/colombia-elimina-uso-del-tapabocas-esp-cerr/  http://web.archive.org/web/20220516110039/https://www.minsalud.gov.co/Paginas/Uso-de-tapabocas-en-espacios-cerrados-se-levanta-pero-con-excepciones.aspx    There is no change in policies except for schools. Studies in municipalities with >70% complete vaccination scheme no longer have to wear face masks from May 16.    http://web.archive.org/web/20220529215302/https://www.mineducacion.gov.co/portal/salaprensa/Noticias/410678:Desde-el-lunes-colegios-que-cumplan-con-criterios-podran-retirar-tapabocas"
"134","Colombia","COL",2022-05-01,"Latin_America_Caribbean","C4: Restrictions on gatherings","0","2G","Subsequently, from May 1, masks in closed spaces is lifted for municipalities with vaccination coverage > 70%. However, mask is still required in health service spaces, nursing homes, closed school spaces and in transport (not only in public transport). In addition, the presentation of vaccination card is eliminated nationwide. It will not be a requirement to enter public events and closed spaces such as restaurants, bars, gastropubs, cinemas, libraries and museums.    https://web.archive.org/web/20220516161825/https://consultorsalud.com/colombia-elimina-uso-del-tapabocas-esp-cerr/  http://web.archive.org/web/20220516110039/https://www.minsalud.gov.co/Paginas/Uso-de-tapabocas-en-espacios-cerrados-se-levanta-pero-con-excepciones.aspx"
"135","Colombia","COL",2022-05-15,"Latin_America_Caribbean","C4: Restrictions on gatherings","0","0","From March 1, the use of the face mask in open spaces will not be mandatory in municipalities with >70% complete vaccination scheme. However, its permanent use is recommended in people with comorbidities, respiratory symptoms and who are not vaccinated. Mask is still required in health service spaces, nursing homes, closed school spaces and in transport (not only in public transport). In addition, the presentation of vaccination card is eliminated nationwide. It will not be a requirement to enter public events and closed spaces such as restaurants, bars, gastropubs, cinemas, libraries and museums.  There is no change in policies except for schools. Studies in municipalities with >70% complete vaccination scheme no longer have to wear face masks from May 16.    https://archive.ph/XQQQC#selection-2069.0-2069.120  https://web.archive.org/web/20220516161825/https://consultorsalud.com/colombia-elimina-uso-del-tapabocas-esp-cerr/  http://web.archive.org/web/20220516110039/https://www.minsalud.gov.co/Paginas/Uso-de-tapabocas-en-espacios-cerrados-se-levanta-pero-con-excepciones.aspx    There is no change in policies except for schools. Studies in municipalities with >70% complete vaccination scheme no longer have to wear face masks from May 16.    http://web.archive.org/web/20220529215302/https://www.mineducacion.gov.co/portal/salaprensa/Noticias/410678:Desde-el-lunes-colegios-que-cumplan-con-criterios-podran-retirar-tapabocas"
"136","Colombia","COL",2022-05-15,"Latin_America_Caribbean","C5: Close public transport","0","0","Facemasks: Resolution 692 requires the use of facemasks on public transportation, which includes air travel and at airport and marine terminals. Facemasks are required in metropolitan areas with a fully vaccinated rate of lower than 70% and a booster shot rate of lower than 40%. If the fully vaccinated rate is 70% or higher and over 40% of the population has also received a booster shot, facemasks are only required on public transportation and in public transportation stations, health facilities, and nursing homes.       http://web.archive.org/web/20220529215531/https://co.usembassy.gov/covid-19-information/  http://web.archive.org/web/20220529220118/https://www.minsalud.gov.co/Normatividad_Nuevo/Resoluci%C3%B3n%20692%20de%202022.pdf"
"137","Colombia","COL",2022-05-15,"Latin_America_Caribbean","C6: Stay at home requirements","0","0","There is currently no curfew in place.     http://web.archive.org/web/20220529215531/https://co.usembassy.gov/covid-19-information/"
"138","Colombia","COL",2022-05-15,"Latin_America_Caribbean","C7: Restrictions on internal movement","0","0","There are no curfew in place, no restrictions on intercity or interstate travel. All inbound international passengers no longer have to self-quarantine for 14 days.    http://web.archive.org/web/20220529215531/https://co.usembassy.gov/covid-19-information/"
"139","Colombia","COL",2022-05-01,"Latin_America_Caribbean","C8: International travel controls","1","4","As of May 1, 2022, visitors to Colombia ages 18 or older will need to provide proof of complete vaccination for entry or a negative COVID test (48 hours in advance of travel for an antigen test or 72 hours in advance of travel for a PCR test). Travelers should be prepared to show their original, physical vaccination card or digital certificate both at airline check-in and when passing through Colombian Immigration. The vaccination document must include the individual’s full name, date of vaccination, name of the vaccine administered, and the number of doses administered. A photo of one’s vaccination card may not be accepted. If you completed your vaccination scheme within 14 days before entry to Colombia you will also need to have an antigen test 48 hours prior to arrival or a PCR test 72 hours prior to arrival in Colombia.      https://web.archive.org/web/20220513151749/https://co.usembassy.gov/covid-19-information/"
"140","Colombia","COL",2022-05-14,"Latin_America_Caribbean","C8: International travel controls","1","1","As of May 1, 2022, visitors to Colombia ages 18 or older will need to provide proof of complete vaccination for entry or a negative COVID test (48 hours in advance of travel for an antigen test or 72 hours in advance of travel for a PCR test). Travelers should be prepared to show their original, physical vaccination card or digital certificate both at airline check-in and when passing through Colombian Immigration. The vaccination document must include the individual’s full name, date of vaccination, name of the vaccine administered, and the number of doses administered. A photo of one’s vaccination card may not be accepted. If you completed your vaccination scheme within 14 days before entry to Colombia you will also need to have an antigen test 48 hours prior to arrival or a PCR test 72 hours prior to arrival in Colombia.      https://web.archive.org/web/20220513151749/https://co.usembassy.gov/covid-19-information/"
"141","Colombia","COL",2022-05-15,"Latin_America_Caribbean","E1: Income support","1T","1T","State support grants beneficiaries an incentive as follows:  For additional workers who are young people between 18 and 28 years old, the equivalent of 25% of a current legal monthly minimum wage is delivered.  If it links women over 28 years of age who earn and contribute up to three minimum wages, a contribution of 15% of a minimum wage is granted.   In the case of integrating men over 28 years of age into their payroll, the employer is recognized with an aid of up to 10% of a minimum wage    http://web.archive.org/web/20220529225119/https://www.mintrabajo.gov.co/web/guest/prensa/comunicados/2022/mayo/%C2%A1atencion-empleadores-que-amplien-sus-nominas-seran-beneficiados-con-incentivos"
"142","Colombia","COL",2022-05-15,"Latin_America_Caribbean","E2: Debt/contract relief","0","0","No data found"
"143","Colombia","COL",2022-05-15,"Latin_America_Caribbean","H1: Public information campaigns","2G","2G","The Colombian government coordinates public health information campaigns on the Ministry of Health website and social media sites such as twitter.    http://web.archive.org/web/20220529231031/https://www.minsalud.gov.co/Paginas/Seguimos-en-zona-segura-pero-se-debe-mantener-la-vigilancia.aspx  http://web.archive.org/web/20220529231247/https://www.minsalud.gov.co/Portada2021/index.html"
"144","Colombia","COL",2022-05-15,"Latin_America_Caribbean","H2: Testing policy","3","3","PCR testing is available. The city of Bogota does offer no-cost COVID-19 testing occasionally too.    http://web.archive.org/web/20220529231630/https://bogota.gov.co/mi-ciudad/salud/bogota-donde-hacerse-la-prueba-gratis-de-covid-19-este-28-de-mayo  http://web.archive.org/web/20220529215531/https://co.usembassy.gov/covid-19-information/"
"145","Colombia","COL",2022-05-15,"Latin_America_Caribbean","H3: Contact tracing","2","2","No changes. Colombian government uses a system called ""PRASS"" to trace contacts of those with confirmed infection. Entities in charge must start tracking contacts of the case since the case is suspected or probable, according to the guidelines of the PRASS program.    https://web.archive.org/web/20220425185832/https://minsalud.gov.co/salud/publica/PET/Paginas/Pruebas-Rastreo-y-Aislamiento-Selectivo-Sostenible.aspx"
"146","Colombia","COL",2022-05-15,"Latin_America_Caribbean","H6: Facial Coverings","3T","3T","Resolution 692 requires the use of facemasks on public transportation, which includes air travel and at airport and marine terminals. Facemasks are required in metropolitan areas with a fully vaccinated rate of lower than 70% and a booster shot rate of lower than 40%. If the fully vaccinated rate is 70% or higher and over 40% of the population has also received a booster shot, facemasks are only required on public transportation and in public transportation stations, health facilities, and nursing homes.       http://web.archive.org/web/20220529215531/https://co.usembassy.gov/covid-19-information/  http://web.archive.org/web/20220529220118/https://www.minsalud.gov.co/Normatividad_Nuevo/Resoluci%C3%B3n%20692%20de%202022.pdf"
"147","Colombia","COL",2022-05-15,"Latin_America_Caribbean","H7: Vaccination policy","5G","5G","540 municipalities in Colombia already have 70% of their complete schemes, which indicates that 48.1% of all municipalities in the country can already free themselves from the mask in open spaces. Likewise, 329 municipalities have already completed 40 percent of the reinforcements of that 70 percent, which indicates that they can already eliminate the mask in closed spaces.     https://archive.ph/h4VSx"
"148","Colombia","COL",2022-05-15,"Latin_America_Caribbean","H8: Protection of elderly people","0","0","The elderly are recommended to get vaccinated:  Vaccination is to de-escalate the mandatory use of face masks should lead us to keep our guard up with vaccination against covid-19, especially in older adults, who are the most vulnerable to the virus, and in children, which is where we still have the greatest lag compared to other population groups.    https://archive.ph/h4VSx"
"149","Colombia","COL",2022-05-15,"Latin_America_Caribbean","V2: Vaccine Availability","34394","10456","Ministry of health is urging those between 3 and 11 years of age to increase in vaccination as there is a lag. In addition, the fourth dose for age over 50 is approved.    https://web.archive.org/web/20220530155932/https://www.minsalud.gov.co/Paginas/Minsalud-hizo-llamado-a-aumentar-vacunacion-en-ninos-y-ninas.aspx  https://web.archive.org/web/20220530160047/https://www.minsalud.gov.co/Paginas/Colombia-recibio-730.300-dosis-de-vacunas-contra-el-covid-19-del-mecanismo-COVAX.aspx"
"150","Colombia","COL",2022-05-15,"Latin_America_Caribbean","V3: Vaccine Financial Support","34394","10456","Ministry of health is urging those between 3 and 11 years of age to increase in vaccination as there is a lag. In addition, the fourth dose for age over 50 is approved.    https://web.archive.org/web/20220530155932/https://www.minsalud.gov.co/Paginas/Minsalud-hizo-llamado-a-aumentar-vacunacion-en-ninos-y-ninas.aspx  https://web.archive.org/web/20220530160047/https://www.minsalud.gov.co/Paginas/Colombia-recibio-730.300-dosis-de-vacunas-contra-el-covid-19-del-mecanismo-COVAX.aspx"
"151","Colombia","COL",2022-05-15,"Latin_America_Caribbean","V4: Mandatory Vaccination","34394","28786","Free"
"152","Cuba","CUB",2022-04-29,"Latin_America_Caribbean","C1: School closing","1G","1G","A number of COVID-19 measures continue in Cuba including social distancing, wearing a face mask in public and limited operations of businesses and public spaces. You should comply with restrictions at all times and follow the advice of local authorities. Mobility within and between provinces will also vary depending on the evolution of the pandemic, and may result in disruption to local and inter-province transport options, as well as curfews.    https://web.archive.org/web/20220513193400/https://www.dfa.ie/travel/travel-advice/a-z-list-of-countries/cuba/    Wearing a face mask in public is compulsory, as is social distancing of a minimum of 1.5 metres.    Anyone who does not follow local rules can be fined or even prosecuted.    https://web.archive.org/web/20220513193434/https://www.gov.uk/foreign-travel-advice/cuba/coronavirus"
"153","Cuba","CUB",2022-05-14,"Latin_America_Caribbean","C1: School closing","1G","1G","A number of COVID-19 measures continue in Cuba including social distancing, wearing a face mask in public and limited operations of businesses and public spaces. You should comply with restrictions at all times and follow the advice of local authorities. Mobility within and between provinces will also vary depending on the evolution of the pandemic, and may result in disruption to local and inter-province transport options, as well as curfews.    https://web.archive.org/web/20220527191628/https://www.dfa.ie/travel/travel-advice/a-z-list-of-countries/cuba/    Wearing a face mask in public is compulsory, as is social distancing of a minimum of 1.5 metres.    Anyone who does not follow local rules can be fined or even prosecuted.    https://web.archive.org/web/20220527191701/https://www.gov.uk/foreign-travel-advice/cuba/coronavirus"
"154","Cuba","CUB",2022-04-29,"Latin_America_Caribbean","C2: Workplace closing","1G","1G","A number of COVID-19 measures continue in Cuba including social distancing, wearing a face mask in public and limited operations of businesses and public spaces. You should comply with restrictions at all times and follow the advice of local authorities. Mobility within and between provinces will also vary depending on the evolution of the pandemic, and may result in disruption to local and inter-province transport options, as well as curfews.    https://web.archive.org/web/20220513193400/https://www.dfa.ie/travel/travel-advice/a-z-list-of-countries/cuba/    Wearing a face mask in public is compulsory, as is social distancing of a minimum of 1.5 metres.    Anyone who does not follow local rules can be fined or even prosecuted.    https://web.archive.org/web/20220513193434/https://www.gov.uk/foreign-travel-advice/cuba/coronavirus"
"155","Cuba","CUB",2022-05-14,"Latin_America_Caribbean","C2: Workplace closing","1G","1G","A number of COVID-19 measures continue in Cuba including social distancing, wearing a face mask in public and limited operations of businesses and public spaces. You should comply with restrictions at all times and follow the advice of local authorities. Mobility within and between provinces will also vary depending on the evolution of the pandemic, and may result in disruption to local and inter-province transport options, as well as curfews.    https://web.archive.org/web/20220527191628/https://www.dfa.ie/travel/travel-advice/a-z-list-of-countries/cuba/    Wearing a face mask in public is compulsory, as is social distancing of a minimum of 1.5 metres.    Anyone who does not follow local rules can be fined or even prosecuted.    https://web.archive.org/web/20220527191701/https://www.gov.uk/foreign-travel-advice/cuba/coronavirus"
"156","Cuba","CUB",2022-04-29,"Latin_America_Caribbean","C3: Cancel public events","0","0","A number of COVID-19 measures continue in Cuba including social distancing, wearing a face mask in public and limited operations of businesses and public spaces. You should comply with restrictions at all times and follow the advice of local authorities. Mobility within and between provinces will also vary depending on the evolution of the pandemic, and may result in disruption to local and inter-province transport options, as well as curfews.    https://web.archive.org/web/20220513193400/https://www.dfa.ie/travel/travel-advice/a-z-list-of-countries/cuba/    Wearing a face mask in public is compulsory, as is social distancing of a minimum of 1.5 metres.    Anyone who does not follow local rules can be fined or even prosecuted.    https://web.archive.org/web/20220513193434/https://www.gov.uk/foreign-travel-advice/cuba/coronavirus"
"157","Cuba","CUB",2022-05-14,"Latin_America_Caribbean","C3: Cancel public events","0","0","A number of COVID-19 measures continue in Cuba including social distancing, wearing a face mask in public and limited operations of businesses and public spaces. You should comply with restrictions at all times and follow the advice of local authorities. Mobility within and between provinces will also vary depending on the evolution of the pandemic, and may result in disruption to local and inter-province transport options, as well as curfews.    https://web.archive.org/web/20220527191628/https://www.dfa.ie/travel/travel-advice/a-z-list-of-countries/cuba/    Wearing a face mask in public is compulsory, as is social distancing of a minimum of 1.5 metres.    Anyone who does not follow local rules can be fined or even prosecuted.    https://web.archive.org/web/20220527191701/https://www.gov.uk/foreign-travel-advice/cuba/coronavirus"
"158","Cuba","CUB",2022-04-29,"Latin_America_Caribbean","C4: Restrictions on gatherings","0","0","A number of COVID-19 measures continue in Cuba including social distancing, wearing a face mask in public and limited operations of businesses and public spaces. You should comply with restrictions at all times and follow the advice of local authorities. Mobility within and between provinces will also vary depending on the evolution of the pandemic, and may result in disruption to local and inter-province transport options, as well as curfews.    https://web.archive.org/web/20220513193400/https://www.dfa.ie/travel/travel-advice/a-z-list-of-countries/cuba/    Wearing a face mask in public is compulsory, as is social distancing of a minimum of 1.5 metres.    Anyone who does not follow local rules can be fined or even prosecuted.    https://web.archive.org/web/20220513193434/https://www.gov.uk/foreign-travel-advice/cuba/coronavirus"
