"","CountryName","CountryCode","Date","region","PolicyType","PolicyCode","previous_PolicyCode","Notes"
"1","United Arab Emirates","ARE",2021-01-26,"Middle_East_North_Africa","C1: School closing","3T","0","In the emirate of Abu Dhabi: ""Students of all academic levels in the UAE Capital will continue distance learning for three more weeks from January 17, the Abu Dhabi Emergency, Crisis and Disasters Committee has announced.""     https://web.archive.org/web/20210208152237/https://www.khaleejtimes.com/news/coronavirus-in-uae-distance-learning-extended-for-all-abu-dhabi-schools"
"2","United Arab Emirates","ARE",2021-02-14,"Middle_East_North_Africa","C1: School closing","2T","3T","In the emirate of Abu Dhabi, students are allowed to return to school to school from the 14th of February with the option of remote learning for parents who do not want to sent their children to school.     https://web.archive.org/web/20210214192825/https://www.arabianbusiness.com/education/458187-abu-dhabi-to-reopen-schools-on-february-14-after-approving-preventative-protocol"
"3","United Arab Emirates","ARE",2021-02-16,"Middle_East_North_Africa","C1: School closing","2T","2T","no change in policy  http://archive.today/5FSZe"
"4","United Arab Emirates","ARE",2021-01-26,"Middle_East_North_Africa","C2: Workplace closing","2T","1G","Dubai has banned live entertainment ""as of Thursday, January 21, 2021, until further notice."" ""Dubai’s Department of Tourism and Commerce Marketing (DTCM) on Thursday issued a circular that put all entertainment activities — like live DJ, live band, live dancing and quiz nights — on hold until further notice.""  https://web.archive.org/web/20210208155208/https://www.khaleejtimes.com/coronavirus-pandemic/covid-19-dubai-entertainment-ban-may-affect-business-but-its-the-right-moversquo"
"5","United Arab Emirates","ARE",2021-02-02,"Middle_East_North_Africa","C2: Workplace closing","2T","2T","February 8, 2021- Pubs and bars in Dubai have closed. Shopping malls, cinemas, hotels, restaurants, cafes, seated indoor venues, including cinemas as well as entertainment and sports venues will be operating under reduced capacity. https://web.archive.org/web/20210208132439if_/https://www.khaleejtimes.com/coronavirus-pandemic/dubai-pubs-bars-closed-full-list-of-new-covid-rules-capacity-limits"
"6","United Arab Emirates","ARE",2021-02-07,"Middle_East_North_Africa","C2: Workplace closing","2T","2T","Pubs and bars in Dubai continue to be closed. In addition, Abu Dhabi has announced that effective February 7, ""reduced attendance at the workplace in Abu Dhabi government and semi-government entities to 30%. Remote working for all jobs that could be delivered fully outside the workplace, employees with chronic diseases and weak immunity, employees older than 60, and people of determination."" PCR tests are compulsory every week for all employees.   https://web.archive.org/web/20210208134748if_/https://www.mediaoffice.abudhabi/government-affairs/dgs-applies-30-percent-attendance-in-workplace-in-government-and-semi-government-agencies/"
"7","United Arab Emirates","ARE",2021-02-09,"Middle_East_North_Africa","C2: Workplace closing","2T","2T","Workplaces continue to operate at a reduced capacity with closure of some entertainment facilities.     https://web.archive.org/web/20210214195422/https://www.thenationalnews.com/uae/government/abu-dhabi-government-to-cut-workplace-attendance-to-30-per-cent-1.1160679"
"8","United Arab Emirates","ARE",2021-02-16,"Middle_East_North_Africa","C2: Workplace closing","2T","2T","No change in policy   https://web.archive.org/web/20210214195422/https://www.thenationalnews.com/uae/government/abu-dhabi-government-to-cut-workplace-attendance-to-30-per-cent-1.1160679"
"9","United Arab Emirates","ARE",2021-02-02,"Middle_East_North_Africa","C3: Cancel public events","2T","2G","Beginning on February 2, ""The Dubai Tourism has suspended all the entertainment permits issued in the emirate. This came after the authority detected more than 200 violations of safety guidelines and closed down around 20 establishments in three weeks.""     https://web.archive.org/web/20210208140628/https://www.khaleejtimes.com/coronavirus-pandemic/dubai-covid-19-full-list-of-new-rules-for-travel-malls-hospitals"
"10","United Arab Emirates","ARE",2021-02-09,"Middle_East_North_Africa","C3: Cancel public events","2T","2T","Entertainment spots including DJs, live bands and performers, at hotels, restaurants and beach clubs continue to be suspended.     https://web.archive.org/web/20210214201553/https://www.reuters.com/article/health-coronavirus-emirates-int-idUSKBN29P2LW"
"11","United Arab Emirates","ARE",2021-02-16,"Middle_East_North_Africa","C3: Cancel public events","2T","2T","no change in policy,   http://archive.today/OdWWy"
"12","United Arab Emirates","ARE",2021-02-02,"Middle_East_North_Africa","C4: Restrictions on gatherings","4T","4G","February 8, 2021- In the emirate of Dubai, authorities ""have issued multiple measures to boost Covid-19 safety in the emirate. The new rules range from closing down pubs and bars...; cracking down on private parties and events.."" ""Only first-degree relatives can attend weddings, social events and private parties. The maximum number of guests allowed has been capped at 10. The directive is applicable for events at homes and hotels. Tables at restaurants and cafes in Dubai will be set up three metres apart — up from the previous two metres. Additionally, the number of people allowed to sit on one table has been capped at seven at restaurants; and four at cafes. Fitness centres and gyms in Dubai will need to increase the physical distancing between the sports equipment and trainees from 2 to 3 metres.  Hotel establishments will be required to operate at 70% of total capacity; new bookings should comply with the new capacity limit. Shopping malls will operate at a reduced capacity of 70%. Audience capacity of seated indoor venues, including cinemas as well as entertainment and sports venues, to be reduced to 50%. Hotel establishments will be required to operate at 70% of total capacity; new bookings should comply with the new capacity limit. Restaurants and cafes will be required to close by 1am. They will also not be allowed to organise any entertainment activities in their premises.""  https://web.archive.org/web/20210208131256/https://www.khaleejtimes.com/coronavirus-pandemic/dubai-covid-19-full-list-of-new-rules-for-travel-malls-hospitals"
"13","United Arab Emirates","ARE",2021-02-07,"Middle_East_North_Africa","C4: Restrictions on gatherings","4T","4T","February 8, 2021- No change in Dubai's policies. They ""will be in place from February 2 to 28.""  https://web.archive.org/web/20210208132439/https://www.khaleejtimes.com/coronavirus-pandemic/dubai-pubs-bars-closed-full-list-of-new-covid-rules-capacity-limits      In the emirate of Sharjah, authorities ""have tightened restrictions on social gatherings including wedding receptions and parties. Under new rules issued to combat Covid-19, the maximum number of guests allowed for such events has been cut from 30 to 20. Only one person is allowed for every four square metres of available floor space. Tables must be placed four metres apart from one another and venues may admit no more than 50 per cent of their capacity. The duration of domestic celebrations must not exceed four hours and live music performances are prohibited. Guests must wear masks at all times and avoid nose-to-nose greetings, kissing, hugging and shaking hands.""https://web.archive.org/web/20210208130334/https://www.thenationalnews.com/uae/health/sharjah-tightens-restrictions-on-parties-and-weddings-at-homes-1.1161473       The emirate of Abu Dhabi has also restricted the number of people gathering, allowing up to 10 people for marriage ceremonies and family gatherings, and 20 people for funerals and mourning services. Abu Dhabi has also capped the operating capacity of commercial, economic, and tourism activities; shopping malls up to 40%, restaurants and coffee shops up to 60%, gyms up to 50%, hotels 60%, private beaches and swimming pools 50%, public beaches and parks up to 60%, taxis up to 45% capacity, and buses up to 75% capacity. Movie theaters in Abu Dhabi have closed.   https://web.archive.org/web/20210208131023if_/https://www.mediaoffice.abudhabi/health/capping-operating-capacity-of-commercial-economic-tourism-activities-in-abu-dhabi/ "
"14","United Arab Emirates","ARE",2021-02-09,"Middle_East_North_Africa","C4: Restrictions on gatherings","4G","4T","On 7th of Feb, imposed restriction on gatherings:"" Gatherings and parties will be strictly prohibited in the capital city, and movie theaters will be closed. A maximum of 10 people will be allowed to attend marriage ceremonies and family gatherings, the circular said""    https://web.archive.org/web/20210214202717/https://english.alarabiya.net/coronavirus/2021/02/07/Abu-Dhabi-bans-gatherings-limits-capacity-in-malls-beaches-restaurants"
"15","United Arab Emirates","ARE",2021-02-16,"Middle_East_North_Africa","C4: Restrictions on gatherings","4G","4G","No change in policy  http://archive.today/OdWWy"
"16","United Arab Emirates","ARE",2021-02-16,"Middle_East_North_Africa","C5: Close public transport","0","0","no change in policy"
"17","United Arab Emirates","ARE",2021-02-16,"Middle_East_North_Africa","C6: Stay at home requirements","0","0","no change in policy"
"18","United Arab Emirates","ARE",2021-02-01,"Middle_East_North_Africa","C7: Restrictions on internal movement","2T","2T","February 1, 2021- Abu Dhabi continues to restrict entry into the emirate, requiring PCR or DPI tests. The emirate has updated entry procedures based on test type. Those entering the emirate with a PCR test and staying for 4 days or more must take another PCR test on day 4 of entry. Those staying for 8 days or more must take a PCR test on day 9 of entry. People entering with a DPI test must take a PCR test on day 3 of entry if staying in Abu Dhabi for 48 hours or more. Those staying for 7 days or more are required to take a PCR test on day 7 of entry.     https://web.archive.org/web/20210208121658/https://u.ae/en/information-and-services/justice-safety-and-the-law/handling-the-covid-19-outbreak/entry-requirements-to-abu-dhabi-as-of-1-february-2021"
"19","United Arab Emirates","ARE",2021-02-09,"Middle_East_North_Africa","C7: Restrictions on internal movement","2T","2T","No change in policy"
"20","United Arab Emirates","ARE",2021-02-16,"Middle_East_North_Africa","C7: Restrictions on internal movement","2T","2T","no change in policy   https://web.archive.org/web/20210208121658/https://u.ae/en/information-and-services/justice-safety-and-the-law/handling-the-covid-19-outbreak/entry-requirements-to-abu-dhabi-as-of-1-february-2021"
"21","United Arab Emirates","ARE",2021-01-26,"Middle_East_North_Africa","C8: International travel controls","2","2","No change in policy-     https://web.archive.org/web/20210208120621/https://u.ae/en/information-and-services/justice-safety-and-the-law/handling-the-covid-19-outbreak/travelling-amid-covid-19/travelling-to-the-uae"
"22","United Arab Emirates","ARE",2021-02-09,"Middle_East_North_Africa","C8: International travel controls","1","2","No change in policy.    https://web.archive.org/web/20210215194017/https://u.ae/en/information-and-services/justice-safety-and-the-law/handling-the-covid-19-outbreak/travelling-amid-covid-19/travelling-to-the-uae"
"23","United Arab Emirates","ARE",2021-02-16,"Middle_East_North_Africa","C8: International travel controls","2","1","No change in policy, arrivals into Abu Dhabi must still quarantine   http://archive.today/pwdFv"
"24","United Arab Emirates","ARE",2021-02-09,"Middle_East_North_Africa","E1: Income support","0","0","No policy information available"
"25","United Arab Emirates","ARE",2021-02-16,"Middle_East_North_Africa","E1: Income support","0","0","policy info not found"
"26","United Arab Emirates","ARE",2021-02-09,"Middle_East_North_Africa","H1: Public information campaigns","2G","2G","No change in policy.    https://web.archive.org/web/20210215195632/https://u.ae/en/information-and-services/justice-safety-and-the-law/handling-the-covid-19-outbreak/online-platforms-for-covid-19"
"27","United Arab Emirates","ARE",2021-02-08,"Middle_East_North_Africa","H2: Testing policy","3","3","February 8, 2021- Testing continues to be available nationwide. ""The new cases were detected through 148,587 additional tests.""     https://web.archive.org/web/20210208113931if_/https://www.khaleejtimes.com/coronavirus-pandemic/coronavirus-uae-reports-2798-new-covid-19-cases-3933-recoveries-9-deaths"
"28","United Arab Emirates","ARE",2021-02-09,"Middle_East_North_Africa","H2: Testing policy","3","3","No change in policy. Testing is available at several sites including drive through sites for citizens and residents.     https://web.archive.org/web/20210215195822/https://u.ae/en/information-and-services/justice-safety-and-the-law/handling-the-covid-19-outbreak/types-of-tests-for-detecting-covid-19-and-testing-for-covid19"
"29","United Arab Emirates","ARE",2021-02-16,"Middle_East_North_Africa","H2: Testing policy","3","3","No change in policy  https://web.archive.org/web/20210215195822/https://u.ae/en/information-and-services/justice-safety-and-the-law/handling-the-covid-19-outbreak/types-of-tests-for-detecting-covid-19-and-testing-for-covid19"
"30","United Arab Emirates","ARE",2021-02-16,"Middle_East_North_Africa","H3: Contact tracing","2","2","No change in policy   http://archive.today/p5Uk7"
"31","United Arab Emirates","ARE",2021-02-09,"Middle_East_North_Africa","H6: Facial Coverings","3G","3G","No change in policy.  Masks are required whenever one is outdoors or interacting with people outside one's bubble.     https://web.archive.org/web/20210215200847/https://www.khaleejtimes.com/coronavirus-pandemic/uae-covid-rules-will-you-be-fined-for-not-wearing-a-mask-in-a-car"
"32","United Arab Emirates","ARE",2021-02-16,"Middle_East_North_Africa","H6: Facial Coverings","3G","3G","No change in policy   http://archive.today/OdWWy"
"33","United Arab Emirates","ARE",2021-02-07,"Middle_East_North_Africa","H7: Vaccination policy","3G","4G","Starting February 7, a nationwide decision by the Ministry of Health, which said all vaccine centres were now dedicated ""only to the elderly and people with chronic diseases, in the light of the spike in infections over the past weeks...But people who have not yet had their first dose are expected to wait until next month. Walk-in services will end and younger people will be seen by appointment only.""   ""Four vaccines are available in the UAE. The Sinopharm and Sputnik V drugs are available across the UAE, although the latter is only for emergency use.  Pfizer-BioNTech and Oxford-AstraZeneca vaccines are available in Dubai. Currently, specific priority groups are being vaccinated in Dubai, with plans for a wider programme later in the year.""  https://web.archive.org/web/20210207152420/https://www.thenationalnews.com/uae/health/abu-dhabi-limits-vaccines-to-elderly-and-disabled-for-next-six-weeks-1.1161411"
"34","United Arab Emirates","ARE",2021-02-09,"Middle_East_North_Africa","H7: Vaccination policy","3G","3G","Starting 7 Feb for six weeks all Covid-19 vaccination centers in Abu Dhabi and other emirates to serve priority in Vaccination for target groups.     https://web.archive.org/web/20210215201440/https://doh.gov.ae/en/covid-19/national-vaccination    There are four vaccines in the UAE for use on eligible individuals against the COVID-19 infection: one by Sinopharm, the other by Pfizer-BioNTech, the third by Sputnik V and the latest by Oxford-AstraZeneca. The UAE is offering these vaccines to its citizens and residents free of charge and on optional basis after ensuring that the person has no condition or symptom that make it inadvisable.     https://web.archive.org/web/20210215201840/https://u.ae/en/information-and-services/justice-safety-and-the-law/handling-the-covid-19-outbreak/vaccines-against-covid-19-in-the-uae"
"35","United Arab Emirates","ARE",2021-02-16,"Middle_East_North_Africa","H7: Vaccination policy","3G","3G","No change in policy  https://web.archive.org/web/20210215201440/https://doh.gov.ae/en/covid-19/national-vaccination"
"36","Bahrain","BHR",2021-01-31,"Middle_East_North_Africa","C1: School closing","3G","1G","Beginning January 31, all in-person attendance at public and private schools and kindergartens will be suspended for at least three weeks out of precaution due to a new Covid-19 variant in Bahrain:  https://web.archive.org/web/20210209224841/https://bh.usembassy.gov/covid-19-information/"
"37","Bahrain","BHR",2021-02-16,"Middle_East_North_Africa","C1: School closing","3G","3G","All in-person attendance at public and private schools and kindergartens remains suspended until at least March 14.   https://web.archive.org/web/20210216062152/https://bh.usembassy.gov/covid-19-information/    Additional decisions introduced to support national mitigation efforts have been extended for an additional 3 weeks, to be implemented from 21 February to Saturday 14 March:  Temporary suspension of in person learning across all nurseries, public and private schools as well as higher education institutes and universities. Temporary suspension of in person activities at nurseries and private training institutes licensed by the Ministry of Labour and Social Development. -- https://web.archive.org/web/20210222164846/https://healthalert.gov.bh/en/article/the-national-medical-taskforce-for-combatting-the-coronavirus-covid-19-18-feb-2021"
"38","Bahrain","BHR",2021-01-31,"Middle_East_North_Africa","C2: Workplace closing","2G","2G","Beginning January 31, all indoor dining will be suspended.  Food and beverage outlets will remain available for takeout and delivery services, all grocery stores and commercial outlets remain open:  https://web.archive.org/web/20210209224841/https://bh.usembassy.gov/covid-19-information/"
"39","Bahrain","BHR",2021-02-16,"Middle_East_North_Africa","C2: Workplace closing","2G","2G","All indoor dining remains suspended until at least March 14.  Food and beverage outlets will remain available for takeout and delivery services, and limited outdoor dining. All grocery stores and commercial outlets remain open. As of February 11, in-person religious services will be suspended for at least two weeks.   https://web.archive.org/web/20210216062152/https://bh.usembassy.gov/covid-19-information/    Additional decisions introduced to support national mitigation efforts have been extended for an additional 3 weeks, to be implemented from 21 February to Saturday 14 March:  Also, All government entities and institutions to allow a maximum of 70% of employees to work from home  https://web.archive.org/web/20210222164846/https://healthalert.gov.bh/en/article/the-national-medical-taskforce-for-combatting-the-coronavirus-covid-19-18-feb-2021"
"40","Bahrain","BHR",2021-01-26,"Middle_East_North_Africa","C3: Cancel public events","2G","2G","Limited religious services have resumed in Bahrain:  https://web.archive.org/web/20210209224841/https://bh.usembassy.gov/covid-19-information/"
"41","Bahrain","BHR",2021-02-11,"Middle_East_North_Africa","C3: Cancel public events","2G","2G","As of February 11, in-person religious services are suspended for at least two weeks.    https://web.archive.org/web/20210216062152/https://bh.usembassy.gov/covid-19-information/"
"42","Bahrain","BHR",2021-02-16,"Middle_East_North_Africa","C3: Cancel public events","2G","2G","As of February 11, in-person religious services will be suspended for at least two weeks.   https://web.archive.org/web/20210216062152/https://bh.usembassy.gov/covid-19-information/"
"43","Bahrain","BHR",2021-01-26,"Middle_East_North_Africa","C4: Restrictions on gatherings","4G","4G","Gatherings of over 5 people have been banned:  https://web.archive.org/web/20210209225447/https://www.gov.uk/foreign-travel-advice/bahrain/coronavirus#:~:text=Gatherings%20of%20over%205%20people,January%20to%2020%20February%202021."
"44","Bahrain","BHR",2021-02-16,"Middle_East_North_Africa","C4: Restrictions on gatherings","3G","4G","Additional decisions introduced to support national mitigation efforts have been extended for an additional 3 weeks, to be implemented from 21 February to Saturday 14 March:  Temporary closure of indoor gyms, sports halls and swimming pools, including all indoor exercise classes.  Outdoor exercise as part of gyms and sports halls, including exercise classes, may continue with a maximum of 30 participants. Any social event or gathering in a private residence or other private space with more than 30 participants is strictly prohibited.  These restrictions exclude schools and institutions catering for individuals with special needs, for medical students, as well as teachers, principals, and all other educational administrative staff.  https://web.archive.org/web/20210222164846/https://healthalert.gov.bh/en/article/the-national-medical-taskforce-for-combatting-the-coronavirus-covid-19-18-feb-2021"
"45","Bahrain","BHR",2021-01-26,"Middle_East_North_Africa","C5: Close public transport","0","0","It is mandatory to wear face masks in public, including on all public transport and while travelling in taxis, with fines of 20 Bahraini Dinars for failure to do so. Rules are strictly enforced by the authorities and non-compliance can result in immediate fines and/or arrest:  https://web.archive.org/web/20210209225447/https://www.gov.uk/foreign-travel-advice/bahrain/coronavirus#:~:text=Gatherings%20of%20over%205%20people,January%20to%2020%20February%202021."
"46","Bahrain","BHR",2021-02-16,"Middle_East_North_Africa","C5: Close public transport","0","0","Unable to locate any notice regarding public transport"
"47","Bahrain","BHR",2021-01-26,"Middle_East_North_Africa","C6: Stay at home requirements","1G","2G","No curfew or stay at home order in place:  https://web.archive.org/web/20210209225447/https://www.gov.uk/foreign-travel-advice/bahrain/coronavirus#:~:text=Gatherings%20of%20over%205%20people,January%20to%2020%20February%202021."
"48","Bahrain","BHR",2021-02-16,"Middle_East_North_Africa","C6: Stay at home requirements","1G","1G","It is assumed to be recommended, closures and limiting of activities increased during the period being reported:    In response to recommendations made by the National Medical Task Force for combatting the Coronavirus (COVID-19), the following rules shall apply from Sunday 07 February 2021 to Saturday 20 February 2021:  • All government entities and institutions to allow a maximum of 70% of employees to work from home  • Temporary closure of in-door gyms, sports halls and swimming pools, including all indoor exercise classes   https://web.archive.org/web/20210222170925/https://healthalert.gov.bh/en/article/the-national-medical-taskforce-for-combatting-the-coronavirus-covid-19-05-02-2021    Additional decisions introduced to support national mitigation efforts have been extended for an additional 3 weeks, to be implemented from 21 February to Saturday 14 March:  All government entities and institutions to allow a maximum of 70% of employees to work from home.  Temporary suspension of in person learning across all nurseries, public and private schools as well as higher education institutes and universities.  Temporary suspension of in person activities at government rehabilitation centres affiliated with the Ministry of Labour and Social Development.  Temporary suspension of in person activities at nurseries and private training institutes licensed by the Ministry of Labour and Social Development.  Temporary closure of indoor gyms, sports halls and swimming pools, including all indoor exercise classes.  Outdoor exercise as part of gyms and sports halls, including exercise classes, may continue with a maximum of 30 participants.  Temporarily limit dining services to outdoors.  Any social event or gathering in a private residence or other private space with more than 30 participants is strictly prohibited.  These restrictions exclude schools and institutions catering for individuals with special needs, for medical students, as well as teachers, principals, and all other educational administrative staff.  https://web.archive.org/web/20210222164846/https://healthalert.gov.bh/en/article/the-national-medical-taskforce-for-combatting-the-coronavirus-covid-19-18-feb-2021"
"49","Bahrain","BHR",2021-01-26,"Middle_East_North_Africa","C7: Restrictions on internal movement","0","0","No restrictions on internal movement:  https://web.archive.org/web/20210209225447/https://www.gov.uk/foreign-travel-advice/bahrain/coronavirus#:~:text=Gatherings%20of%20over%205%20people,January%20to%2020%20February%202021."
"50","Bahrain","BHR",2021-02-16,"Middle_East_North_Africa","C7: Restrictions on internal movement","0","0","Movement Restrictions   Is a curfew in place? No   Are there restrictions on intercity or interstate travel? No   https://web.archive.org/web/20210216062152/https://bh.usembassy.gov/covid-19-information/"
"51","Bahrain","BHR",2021-01-26,"Middle_East_North_Africa","C8: International travel controls","1","1","Bahrain International Airport remains open, including for transit and transfer passengers. All arrivals, except for those transferring within the airport, will be required to undergo and pay for the enhanced arrivals testing procedure for COVID-19 and need to self-quarantine until test results have been received. Any person staying in Bahrain for 10 days or more must repeat the testing procedure on the 10th day following their arrival in the Kingdom:  https://web.archive.org/web/20210209225447/https://www.gov.uk/foreign-travel-advice/bahrain/coronavirus#:~:text=Gatherings%20of%20over%205%20people,January%20to%2020%20February%202021."
