"","CountryName","CountryCode","Date","region","PolicyType","PolicyCode","previous_PolicyCode","Notes"
"577","Papua New Guinea","PNG",2021-02-16,"East_Asia_Pacific","H2: Testing policy","2","2","As per the media statement on 17th February, The Controller of the PNG COVID-19 National Pandemic Response said PNG - specificially in the National Capital District - is ramping up testing using rapid antigen tests, but are re-confirming positive tests with GeneXpert (a form of RT-PCR test initially used for tuberculosis).    See the PNG National Department of Health's Facebook post/media release, archived at https://archive.vn/bfZLR    ""He announced that there are four urban clinics in the NCD that are now doing swabbing for COVID-19 tests for those with symptoms of COVID-19 where members of the public can also get their test results within a short time for free. These are Badili, Tokarara, Morata and Gordons clinics. These sites are part of the nine clinics that have been selected to participate in the Antigen (Ag) Rapid Diagnosis (RDT) validation in NCD. The public will be informed when the rest of the nine clinics begin swabbing too.  Other sites that are also providing routine swabbing for symptomatic clients are Pari clinic in Moresby South, and the Port Moresby General Hospital. The general public are encouraged to utilize any of these services to check for COVID-19 infection.  Mr Manning said that this Antigen test is easy and results will be given within 20 to 30 minutes. Further GeneXpert testing is then performed on positive samples to confirm if the patient has the coronavirus disease or not. The turnaround time is about an hour which is more convenient for isolation and contact tracing.  He also confirmed that Rita Flynn is no longer swabbing but only tests the positive samples it receives from the urban sites to confirm, using GeneXpert. All negative samples from the Ag test are sent to CPHL for confirmation."""
"578","Papua New Guinea","PNG",2021-02-02,"East_Asia_Pacific","H3: Contact tracing","2","2","National Public of Health: http://web.archive.org/web/20210103050544/https://www.health.gov.pg/subindex.php?news=1"
"579","Papua New Guinea","PNG",2021-02-16,"East_Asia_Pacific","H3: Contact tracing","2","2","Contact tracing is still ongoing in PNG. See the reports on the PNG National Department of Health, where cases in Madang province (https://archive.vn/ttYLP) and West Sepik province (https://archive.vn/kPXBV) were largely found through contact tracing."
"580","Papua New Guinea","PNG",2021-02-02,"East_Asia_Pacific","H6: Facial Coverings","3G","3G","Residents in the National Capital District (NCD) must wear facemasks in indoor public areas and on public transport. Companies must comply with government mandates to prevent the spread of COVID-19..  http://web.archive.org/web/20201222174642/https://www.garda.com/crisis24/news-alerts/419956/papua-new-guinea-papua-new-guinea-requiring-inbound-travelers-to-pay-for-quarantine-as-of-dec-1-update-23"
"581","Papua New Guinea","PNG",2021-02-16,"East_Asia_Pacific","H6: Facial Coverings","2G","3G","Measure No. 10 of the National Pandemic Act 2020 (last revised 20th January 2021) is still in force, where face masks are required in enclosed spaces; public transport; aircrafts; workers in markets, establishments and public transport; business and government departments.    The first clause states :-  ""No person shall be permitted entry to, or otherwise remain within, any enclosed space within an establishment unless the person is wearing a mask or face covering, in a manner which covers their mouth, nose and chin"".    Available at https://covid19.info.gov.pg/files/National%20Pandemic%20Measures/New%20Measures%202021/Measure%2020012020/Measure%2010%20Jan%2020.pdf  Saved to Google Drive at https://drive.google.com/file/d/1_kYSesbKcrAn-5rMKLlhVprp8fmSW1VR/view?usp=sharing    Also saved to Dropbox, archived at https://www.dropbox.com/s/5hu80yipe74lz2a/PNGMeasure10-20210120.pdf"
"582","Papua New Guinea","PNG",2021-02-02,"East_Asia_Pacific","H7: Vaccination policy","0","0","COVID-19 Vaccine Information:    Has the government of Papua New Guinea approved a COVID-19 vaccine for use? No  The United States Government does not plan to provide COVID-19 vaccinations to private U.S. citizens overseas. Please follow host country developments and guidelines for COVID-19 vaccination.  http://web.archive.org/save/https://pg.usembassy.gov/covid-19-information/"
"583","Papua New Guinea","PNG",2021-02-16,"East_Asia_Pacific","H7: Vaccination policy","0","0","No change.    As per the US Embassy in PNG's website (archived at https://archive.vn/B1hBc),    ""Has the government of Papua New Guinea approved a COVID-19 vaccine for use? No"""
"584","Singapore","SGP",2021-01-26,"East_Asia_Pacific","C1: School closing","1G","1G","There has been no significant policy change.   This is the current policy: ""All MOE Kindergartens (MKs), primary and secondary schools will start the school year on Monday, 4 January 2021 while Junior Colleges (JCs) and Millennia Institute (MI) will start on Monday, 11 January 2021. In line with the current national posture, schools will reopen fully with most Co-Curricular Activities (CCA) and school activities allowed, and higher-risk activities suspended or limited to a smaller group cap.""    Source: /web/20210129154111/https://www.moe.gov.sg/news/press-releases/20201218-arrangements-for-school-reopening-in-2021"
"585","Singapore","SGP",2021-01-30,"East_Asia_Pacific","C1: School closing","1G","1G","No update.   See:  https://web.archive.org/web/20210201224305/https://www.moe.gov.sg/news/press-releases/20201218-arrangements-for-school-reopening-in-2021"
"586","Singapore","SGP",2021-02-12,"East_Asia_Pacific","C1: School closing","1G","1G","The code of 1G continues to be valid and signifies that the educational arrangements are significantly different to the situation prior to the Covid-19 pandemic.  The ""safe management measures"" from the Ministry of Education FAQ page are detailed below:    ""With school reopening in 2021, what are the safe management measures put in place in schools?""    ""Safe management measures in schools will continue to include the following:    Screening    Twice-daily temperature-taking and visual screening for all students and staff.  Students and staff who are unwell, or who have household members on Home Quarantine Order/Stay Home Notice or have adult household members with flu-like symptoms such as fever and cough, are required to stay away from school.  It is not mandatory for students to have their TraceTogether tokens when school reopens. The tokens will only be required in schools after nationwide distribution is completed.    Hygiene    Frequent cleaning of high-touch surfaces and disinfection of the premises to be done daily.  Students will continue to practise frequent hand-washing throughout the school day and wipe down of tables and shared equipment after use.    Safe Distancing    Fixed group seating of up to eight from the same class will be allowed.  CCAs and external learning journeys of up to 50 people conducted in a fixed group with exclusive use of venues (if possible) are allowed.  Curricular, co-curricular and enrichment activities with fixed intermingling across schools are allowed.  Staggered arrival, dismissal and recess timings to reduce congestion.""    From SG Ministry of Education FAQs.  (Cannot be archived as the page consists of drop down items.  The page link is here:  https://www.moe.gov.sg/faqs-covid-19-infection)."
"587","Singapore","SGP",2021-02-22,"East_Asia_Pacific","C1: School closing","1G","1G","The code of 1G continues to be valid and signifies that the educational arrangements are significantly different to the situation prior to the Covid-19 pandemic.  The ""safe management measures"" from the Ministry of Education FAQ page are detailed below:    ""With school reopening in 2021, what are the safe management measures put in place in schools?""    ""Safe management measures in schools will continue to include the following:    Screening    Twice-daily temperature-taking and visual screening for all students and staff.  Students and staff who are unwell, or who have household members on Home Quarantine Order/Stay Home Notice or have adult household members with flu-like symptoms such as fever and cough, are required to stay away from school.  It is not mandatory for students to have their TraceTogether tokens when school reopens. The tokens will only be required in schools after nationwide distribution is completed.    Hygiene    Frequent cleaning of high-touch surfaces and disinfection of the premises to be done daily.  Students will continue to practise frequent hand-washing throughout the school day and wipe down of tables and shared equipment after use.    Safe Distancing    Fixed group seating of up to eight from the same class will be allowed.  CCAs and external learning journeys of up to 50 people conducted in a fixed group with exclusive use of venues (if possible) are allowed.  Curricular, co-curricular and enrichment activities with fixed intermingling across schools are allowed.  Staggered arrival, dismissal and recess timings to reduce congestion.""        Will all CCAs and school activities be resumed? [UPDATED, 18 Feb, 6:45pm]  Most CCAs and school activities are allowed to resume while activities that involve the following will remain suspended:    Trips to view external performances due to higher risk of intermingling with other schools and the public;  Activities with high level of body contact such as Taekwondo sparring, Rugby scrum and tackle;  Overnight camps.  Schools will continue to safeguard our students' well-being during CCAs and school activities, by implementing the necessary safe management measures (SMMs). This includes minimising prolonged inter-mingling between students and members of the public for activities held at external venues, such as Learning Journeys.    From SG Ministry of Education FAQs.  (Cannot be archived as the page consists of drop down items.  The page link is here:  https://www.moe.gov.sg/faqs-covid-19-infection)."
"588","Singapore","SGP",2021-01-26,"East_Asia_Pacific","C2: Workplace closing","2G","2G","Current policy is to remain in Phase 3 of Safe Management Measures which recommends ""work from home.""  Source: /web/20210129162508/https://www.mom.gov.sg/newsroom/press-releases/2021/0122-workplace-safe-management-measures-to-stay-put-for-now    The pilot for certain nightclubs and karaoke outlets to open was suspended.  Source:  /web/20210129163200/https://www.gov.sg/article/safe-management-measures-and-chinese-new-year"
"589","Singapore","SGP",2021-01-30,"East_Asia_Pacific","C2: Workplace closing","2G","2G","No update."
"590","Singapore","SGP",2021-02-05,"East_Asia_Pacific","C2: Workplace closing","2G","2G","The move to open nightclubs and karaoke bars has been put on hold, but 3 bars which were previously opened as part of the pilot scheme have been allowed to stay open.      http://archive.today/2021.02.12-202027/https://www.straitstimes.com/singapore/pilot-for-bars-and-pubs-to-reopen-extended-by-2-months-but-will-not-include-more-outlets"
"591","Singapore","SGP",2021-02-12,"East_Asia_Pacific","C2: Workplace closing","2G","2G","The code 2G is given to reflect that nightclubs and karaoke bars remain closed (with 3 exceptions (see note on 5th February)).  As noted in previous entry on 19th January, a plan to pilot the re-opening of nightclubs and karaoke bars was postponed till further notice in response to a rise in numbers of Covid19 cases.  As noted on 5th February, this remains the case, although 3 bars which were opened during the pilot phase (at Orchard Plaza, Cuppage Plaza and Boat Quay) have been allowed to stay open.    (Link to earlier article from Straits Times:  http://archive.today/2021.02.12-145755/https://www.straitstimes.com/singapore/pilot-plans-to-reopen-nightclubs-and-karaoke-joints-put-on-hold-mti-mha)"
"592","Singapore","SGP",2021-02-22,"East_Asia_Pacific","C2: Workplace closing","2G","2G","No further updates found.  Previous entry on 12th February as follows:    The code 2G is given to reflect that nightclubs and karaoke bars remain closed (with 3 exceptions (see note on 5th February)).  As noted in previous entry on 19th January, a plan to pilot the re-opening of nightclubs and karaoke bars was postponed till further notice in response to a rise in numbers of Covid19 cases.  As noted on 5th February, this remains the case, although 3 bars which were opened during the pilot phase (at Orchard Plaza, Cuppage Plaza and Boat Quay) have been allowed to stay open.    (Link to earlier article from Straits Times:  http://archive.today/2021.02.12-145755/https://www.straitstimes.com/singapore/pilot-plans-to-reopen-nightclubs-and-karaoke-joints-put-on-hold-mti-mha)"
"593","Singapore","SGP",2021-02-02,"East_Asia_Pacific","C3: Cancel public events","1G","1G","***recoded from 2G to 1G; while C4 is coded at 4G to reflect private gathering limits in homes, large events - including worship services, indoor and outdoor musical ceremonies - are still allowed, making 1G a better fit since all public events are clearly not banned.     Previous coding note:     The coding notes advise using a code of ""2"" in situations where private gatherings are limited to below 10 people (which is the situation in Singapore).  However, in previous official advice on public gatherings, a strategy of piloting some events is discussed with up to 5 zones of 50 people (see below).  In addition, as the previous notes on 26th January and 28th December comment, some public events appear to be allowed including religious services and live indoor performances although there are restrictions with segregation between groups of people at the venue, social distancing and limits on the size of the events.    The code for C3 appears to be intermediate between 1G and 2G - some events can go ahead (within safe management guidelines), some cannot (particularly the larger ones).  For the moment, the code has been left as ""2"" with the flag ""G"" to reflect the general geographic scope.    Link:  http://archive.today/2021.02.12-190710/https://www.stb.gov.sg/content/stb/en/home-pages/advisory-for-MICE.html"
"594","Singapore","SGP",2021-02-22,"East_Asia_Pacific","C3: Cancel public events","1G","1G","The move to Phase 3 policy restrictions at the end of 2020 in Singapore appears to be accompanied by progressive relaxing of restrictions relating to public events.  Prior to this examples of public events which were allowed included Cinema and indoor live performances.  Straits Times notes ""Live performances for the arts resumed cautiously with small scale trials for audience groups of 50 in September. Audience capacity was expanded to 100, in two groups of 50, on Nov 1."" These were allowed with strict safe management measures such as social distancing and limits on the size of events.    In December, Straits Times reported that the easing of restrictions in Phase 3 included allowing indoor live performances and the piloting of outdoor live performances for up to 250 people.  Distancing rules included the separation of the audience into groups of 50 with a 3m gap between groups and a 1m gap between individuals within the groups. Similar rules have also applied to MICE events which have a business rather than recreational/leisure function.    The article in Straits Times also refers to an ""indoor concert at the Sands Theatre at Marina Bay Sands on Dec 18 and 19, with mandatory pre-event testing, that had 400 in the audience"".  Also, ""The Singapore Symphony Orchestra conducted a similar pilot, with mandatory testing for an audience of 400 at the Esplanade Concert Hall for its Christmas fundraising concert on Dec 16.""      http://archive.today/2021.02.13-160106/https://www.straitstimes.com/life/arts/phase-3-re-opening-outdoor-performance-pilots-for-audiences-of-250-indoor-audience-limit"
"595","Singapore","SGP",2021-01-30,"East_Asia_Pacific","C4: Restrictions on gatherings","4G","4G","No update."
"596","Singapore","SGP",2021-01-26,"East_Asia_Pacific","C5: Close public transport","0","0","No policy update.   Current policy: ""All forms of public transportation require that travelers wear masks, including taxis and ride-hailing services.""    Source: /web/20210129200807/https://sg.usembassy.gov/u-s-citizen-services/covid-19-information/?_ga=2.233373725.2067602834.1611949383-1605621240.1611949383"
"597","Singapore","SGP",2021-01-30,"East_Asia_Pacific","C5: Close public transport","0","0","No update.  See:  https://web.archive.org/web/20210201224914/https://sg.usembassy.gov/u-s-citizen-services/covid-19-information/?_ga=2.233373725.2067602834.1611949383-1605621240.1611949383"
"598","Singapore","SGP",2021-01-26,"East_Asia_Pacific","C6: Stay at home requirements","1G","1G","General public guidance encourages people to stay at home with limited visitors."
"599","Singapore","SGP",2021-01-30,"East_Asia_Pacific","C6: Stay at home requirements","1G","1G","No update."
"600","Singapore","SGP",2021-01-26,"East_Asia_Pacific","C7: Restrictions on internal movement","0","0","No update in policy. Current policy: ""While there are no movement restrictions in place, there are still certain rules that must be followed. All persons in Singapore must?wear a mask whenever outside of their residence?in public places including public transport, supermarkets, wet markets, convenience stores, pharmacies, and shopping malls. Current phase 3 social distancing rules limit gatherings to eight persons, such as groups in restaurants and homes.""  http://web.archive.org/web/20210130220457/https://sg.usembassy.gov/u-s-citizen-services/covid-19-information/?_ga=2.233373725.2067602834.1611949383-1605621240.1611949383"
"601","Singapore","SGP",2021-01-30,"East_Asia_Pacific","C7: Restrictions on internal movement","0","0","No update.   See:   https://web.archive.org/web/20210201224914/https://sg.usembassy.gov/u-s-citizen-services/covid-19-information/?_ga=2.233373725.2067602834.1611949383-1605621240.1611949383"
"602","Singapore","SGP",2021-01-26,"East_Asia_Pacific","C8: International travel controls","3","3","There has been no major update to public health policy.     It is notable that there a select few countries from which non-Singapore citizens/residents are able to arrive from; they are listed in the following source.  Source: /web/20210129204802/https://safetravel.ica.gov.sg/arriving/overview    Additionally, ""from 1 January 2021, all incoming travellers will also be required to pay for their stay at dedicated SHN facilities, and will be responsible for their inpatient medical bills if they have onset of symptoms of COVID-19 within 14 days of their entry to Singapore.""  Source: /web/20210129205210/https://www.moh.gov.sg/news-highlights/details/updates-to-stay-home-notice-and-charging-policy-for-travellers"
"603","Singapore","SGP",2021-01-30,"East_Asia_Pacific","C8: International travel controls","3","3","No update.  See:   https://web.archive.org/web/20210201225214/https://www.moh.gov.sg/news-highlights/details/updates-to-stay-home-notice-and-charging-policy-for-travellers"
"604","Singapore","SGP",2021-02-09,"East_Asia_Pacific","C8: International travel controls","3","3","Straits Times Article: refers to easing of travel restrictions in relation to Australia NSW and a tightening of restrictions in relation to Vietnam including a ban for short term visitors from Feb 13th.    ""Visitors from Vietnam will face tighter restrictions when entering Singapore from Saturday (Feb 13) due to an increase in Covid-19 cases in the country, in the latest border measures announced on Tuesday by the Ministry of Health (MOH) to safeguard public health and curb potential transmission to the community.    Short-term travellers holding an air travel pass (ATP) who had visited Vietnam within the last 14 days will not be allowed into Singapore, said MOH.""    http://archive.today/2021.02.12-153446/https://www.straitstimes.com/singapore/tighter-border-measures-for-travellers-from-vietnam-and-business-travel-pass-holders"
"605","Singapore","SGP",2021-02-12,"East_Asia_Pacific","C8: International travel controls","3","3","The SG government approach to border controls is summarised in the link below.      In broad terms,  the guidelines separate arrivals into specific groups: citizens, permanent residents, families of citizens and permanent residents, long term pass holders, short term visitors and work pass holders.      Short term visitors are allowed to enter Singapore for ""any purpose of travel"" under the Air Travel Pass Scheme if they are travelling from Australia, Brunei Darussalam,  Mainland China, New Zealand and Taiwan.  As noted on 9th February, this arrangement has been suspended for Vietnam.    Short term visitors are also permitted to enter Singapore under the Green Lanes Scheme if the purpose of the visit is ""Business and Official Travel"" AND if they are travelling from Brunei Darussalam, Germany, Indonesia, Japan, Mainland China, Malaysia and the Republic of Korea.    By implication, this means that short term visitors are not allowed into Singapore for ""Any Purpose of Travel"" if their departure point is not listed.  Thus the code for C8 continues to be a ""3"" - ban arrivals from some regions.    http://archive.today/2021.02.13-150455/https://safetravel.ica.gov.sg/arriving/overview"
"606","Singapore","SGP",2021-02-22,"East_Asia_Pacific","C8: International travel controls","3","3","The SG government approach to border controls is summarised in the link below.      In broad terms,  the guidelines separate arrivals into specific groups: citizens, permanent residents, families of citizens and permanent residents, long term pass holders, short term visitors and work pass holders.      Short term visitors are allowed to enter Singapore for ""any purpose of travel"" under the Air Travel Pass Scheme if they are travelling from Australia, Brunei Darussalam,  Mainland China, New Zealand and Taiwan.  As noted on 9th February, this arrangement has been suspended for Vietnam.    Short term visitors are also permitted to enter Singapore under the Green Lanes Scheme if the purpose of the visit is ""Business and Official Travel"" AND if they are travelling from Brunei Darussalam, Germany, Indonesia, Japan, Mainland China, Malaysia and the Republic of Korea.    By implication, this means that short term visitors are not allowed into Singapore for ""Any Purpose of Travel"" if their departure point is not listed.  Thus the code for C8 continues to be a ""3"" - ban arrivals from some regions.    http://archive.today/2021.02.22-140139/https://safetravel.ica.gov.sg/arriving/overview"
"607","Singapore","SGP",2021-01-26,"East_Asia_Pacific","E1: Income support","2G","2G","***Recoded from 1G to 2G. No explanation was given for change from 2G to 1G and income support continues to be in place.     There is currently a ""COVID-19 Recovery Grant"" for those lost at least 50% of their salary for 3 months. This grant is applicable those who are under contract or self-employed.   https://web.archive.org/web/20201221213411/https://www.msf.gov.sg/media-room/Pages/COVID-19-Recovery-Grant-for-Lower--to-Middle-Income-Workers.aspx"
"608","Singapore","SGP",2021-01-30,"East_Asia_Pacific","E1: Income support","2G","2G","No updates."
"609","Singapore","SGP",2021-01-30,"East_Asia_Pacific","E2: Debt/contract relief","2","2","No update"
"610","Singapore","SGP",2021-01-26,"East_Asia_Pacific","H1: Public information campaigns","2G","2G","Strong campaign effort that is also very culturally sensitive to upcoming celebrations. Source:  http://web.archive.org/web/20210130221801/https://www.gov.sg/article/safe-management-measures-and-chinese-new-year  ***updated to properly archive link"
"611","Singapore","SGP",2021-01-30,"East_Asia_Pacific","H1: Public information campaigns","2G","2G","No update"
"612","Singapore","SGP",2021-01-26,"East_Asia_Pacific","H2: Testing policy","3","3","No policy change.  Current policy: ""We strongly encourage all individuals in the identified community groups to come forward for testing. The costs of these tests will be fully borne by the Government.""   Notably, there is a culturally sensitive approach to testing: ""As community interactions are likely to increase in the leadup to Chinese New Year, we will carry out surveillance testing for stallholders, shop owners, persons in the food and beverage industry, as well as food delivery persons operating in and around Chinatown. While there has been no evidence that these community groups are at higher risk of infection, the Ministry of Health (MOH) will be offering tests to them as they are expected to interact more frequently with other members of the public during this time. The testing will take place from 8 February to 9 February 2021. MOH, together with other government agencies, will be progressively reaching out to these identified community groups with further details.""    Source: /web/20210130001917/https://www.moh.gov.sg/news-highlights/details/tightening-safe-management-measures-and-update-on-vaccination-plans"
"613","Singapore","SGP",2021-01-30,"East_Asia_Pacific","H2: Testing policy","3","3","No update.  See:   https://web.archive.org/web/20210201230423/https://www.moh.gov.sg/news-highlights/details/tightening-safe-management-measures-and-update-on-vaccination-plans"
