"","CountryName","CountryCode","Date","region","PolicyType","PolicyCode","previous_PolicyCode","Notes"
"384","Greenland","GRL",2022-04-13,"Europe_Central_Asia","H1: Public information campaigns","2G","2G","Greenland Government website provides information on prevention (cross setting), covid symptoms, vaccination and testing. Primary link https://corona.nun.gl/en/prevention/ Last updated Wednesday 9. february   Archived link http://web.archive.org/web/20220502093420/https://corona.nun.gl/en/prevention/"
"385","Greenland","GRL",2022-04-13,"Europe_Central_Asia","H2: Testing policy","3","3","COVID-19 testing is available in Greenland per region either by booking or drop in.  https://web.archive.org/web/20220412000040/https://corona.nun.gl/en/testing-for-covid-19/"
"386","Greenland","GRL",2022-04-13,"Europe_Central_Asia","H3: Contact tracing","1","1","If you test positive:  Test result  -If your test result is positive, it means you are infected with the coronavirus.  -If your result from a PCR-test is positive, you will receive your test result via SMS. You are responsible for contacting your close contacts. Read more about the definition of a close contact.  -If you have taken an antigen test (home test) which shows a positive result, you should consider yourself infected with COVID-19. You must follow the same guidelines, but you will not be contacted by the health department / corona secretariat.  Last updated Wednesday 9. february  https://web.archive.org/web/20220412000409/https://corona.nun.gl/en/infection-and-symptoms/if-you-test-positive/"
"387","Greenland","GRL",2022-04-13,"Europe_Central_Asia","H6: Facial Coverings","1G","1G","From February 10, 2022, restrictions on wearing a mask/visor in public places have been lifted, but it is still a recommendation. Primary link https://visitgreenland.com/corona-faq/#transit    Archived link http://web.archive.org/web/20220502091653/https://visitgreenland.com/corona-faq/"
"388","Greenland","GRL",2022-04-13,"Europe_Central_Asia","H7: Vaccination policy","5G","5G","The Greenland Government website states that covid vaccines are universally available to all registered residents aged 5 years and older as well as pregnant and breastfeeding women. The vaccine is free and voluntary. It was not possible to date the policies for eligibility for aged 5-11 years. Primary link https://corona.nun.gl/en/vaccination-against-covid-19/covid-19-vaccination-programme/      Last updated Friday 4. february    Archived link http://web.archive.org/web/20220502094514/https://corona.nun.gl/en/vaccination-against-covid-19/covid-19-vaccination-programme/"
"389","Greenland","GRL",2022-04-13,"Europe_Central_Asia","H8: Protection of elderly people","1G","1G","The Greenland Government website recommends vulnerable groups, including the elderly, take additional precautions including avoiding large events and gatherings where social distancing can't be maintained, and using a face mask. Primary link https://corona.nun.gl/en/information-about-covid-19/  Last updated Friday 4. february. Archived link http://web.archive.org/web/20220502094755/https://corona.nun.gl/en/information-about-covid-19/"
"390","Croatia","HRV",2022-04-04,"Europe_Central_Asia","C1: School closing","1G","1G","No policy change.  Physical distance, hygiene, and other preventative measures in place.    https://web.archive.org/web/20220403223541/https://www.koronavirus.hr/uploads/Upute_za_sprjecavanje_i_suzbijanje_epidemije_bolesti_COVID_19_vezano_uz_rad_predskolskih_ustanova_osnovnih_i_srednjih_skola_u_skolskoj_godini_2021_2022_3_75c63541db.pdf"
"391","Croatia","HRV",2022-04-04,"Europe_Central_Asia","C2: Workplace closing","1G","1G","No policy change.  In order to adapt as much as possible to the new conditions, employers are advised to organize, wherever possible, work from home or work in shifts, in order to avoid interfering with workers. For the protection of one's own, but also the health of others, it is recommended that all business trips be postponed and that meetings be held online. Jobs related to the health care system also have specially prescribed measures that employees must adhere to so that the system itself is not overloaded.    https://web.archive.org/web/20220403224542/https://koronavirus.hr/o-poslu/46"
"392","Croatia","HRV",2022-04-04,"Europe_Central_Asia","C3: Cancel public events","1G","1G","Professional artistic performances, cultural programs and events attended only by persons (visitors, performers and staff) holding an EU digital COVID certificate of vaccination, testing and / or recovery from COVID-19 are exempt from all restrictions of this recommendation - including the obligation to wear masks, physical distances, number of persons present, etc. Also, if all contractors have an EU digital COVID certificate, they are exempt from all anti-epidemic measures.    It is mandatory to use a face mask indoors and when it is not possible to maintain a physical distance of at least 1.5 m outdoors. The obligation to use the mask does not apply to visitors during the consumption of food and beverages, nor to contractors during the performance.    It is obligatory to adhere to the measure of physical distancing which avoids close personal contact at a distance of at least 1.5 meters outdoors and 2 meters indoors. It is not necessary for people living in a joint household to maintain the prescribed distance. The distance between the visitor and the performer on stage must be at least 4 meters.     The physical distance between visitors during the program, the organizer must provide seats 1.5 meters apart  Exceptionally, when holding performances, cultural programs and low-risk events, the physical distance between visitors from 1 seat is allowed, with the obligatory wearing of masks during the program. The restriction does not apply to visitors living in the same household. Low-risk programs are programs with exclusively seating places that do not involve interaction with the audience and active engagement of the audience such as singing.    https://web.archive.org/web/20220403225317/https://www.koronavirus.hr/sto-moram-znati/o-svakodnevnom-zivotu/preporuke-za-sprjecavanje-zaraze-covid-19-tijekom-odrzavanja-profesionalnih-umjetnickih-izvedbi-kulturnih-programa-i-manifestacija/740"
"393","Croatia","HRV",2022-04-04,"Europe_Central_Asia","C4: Restrictions on gatherings","0","2G","No policy change.  Are commercial flights operating? Yes  Is public transportation operating? Yes  Wearing protective masks is mandatory?throughout?the country?in public transportation.    https://web.archive.org/web/20220403071447/https://hr.usembassy.gov/covid-19-information/"
"394","Croatia","HRV",2022-04-04,"Europe_Central_Asia","C5: Close public transport","0","0","No stay at home requirements."
"395","Croatia","HRV",2022-04-04,"Europe_Central_Asia","C6: Stay at home requirements","0","0","No stay at home requirements."
"396","Croatia","HRV",2022-04-04,"Europe_Central_Asia","C7: Restrictions on internal movement","0","0","No restrictions on movements.    Is a curfew in place? No  Are there restrictions on intercity or interstate travel? No    https://web.archive.org/web/20220403071447/https://hr.usembassy.gov/covid-19-information/"
"397","Croatia","HRV",2022-04-04,"Europe_Central_Asia","C8: International travel controls","2","2","No policy change.  A negative viral test result: PCR not older than 72 hours or rapid antigen test (list of acceptable antigen tests) not older than 48 hours (counting from the time of taking the test to arriving at the border crossing point).  A certificate showing they have received two doses of vaccine used in the EU Member States or vaccines approved by the World Health Organization for emergency use not older than 270 days, provided that 14 days have passed since receiving the second dose of the vaccine, or a certificate showing they have received a single doze of the vaccine if the vaccine is administered in a single doze not older than 270 days, provided that 14 days have passed since the single doze, or a certificate that they have received the booster doze of the vaccine.  A certificate showing that they have recovered from COVID-19 and have received one dose of vaccine used in EU Member States or a vaccine approved by the World Health Organization for emergency use, provided that 14 days have passed since they received the single dose within eight months from contracting the disease, provided that the vaccine was administered less than 270 days from their arrival at the border crossing point.  A positive PCR test result or rapid antigen test result, confirming that the holder recovered from the SARS-CoV-2 virus infection, which was performed in the previous 180 days, and which is older than 11 days from the date of arrival at the border crossing point, or a medical certificate of recovery.  Perform PCR testing or rapid antigen testing immediately upon arrival to Croatia (at the traveler’s own expense), with the obligation to stay in self-isolation until receiving a negative test result. If testing cannot be performed, travelers must self-isolate for a period of 10 days.  Travelers can facilitate faster processing at the Croatian border by completing the Enter Croatia web form and uploading their information and attachments ahead of their arrival.  Tourists are also required to show the proof of booked or paid accommodation or ownership of a home or a vessel when entering Croatia.    https://web.archive.org/web/20220403071447/https://hr.usembassy.gov/covid-19-information/"
"398","Croatia","HRV",2022-04-04,"Europe_Central_Asia","E1: Income support","0","0","No evidence of income support."
"399","Croatia","HRV",2022-04-04,"Europe_Central_Asia","E2: Debt/contract relief","0","0","No evidence of debt/contract relief."
"400","Croatia","HRV",2022-04-04,"Europe_Central_Asia","H1: Public information campaigns","2G","2G","Updates and recommendations consistently posted online.    https://web.archive.org/web/20220403232111/https://www.koronavirus.hr/"
"401","Croatia","HRV",2022-04-04,"Europe_Central_Asia","H2: Testing policy","3","3","Are PCR and/or antigen tests available for U.S. citizens in Croatia? Yes  If so, are test results reliably available within one calendar day? Yes  A test can be arranged at the following locations:?COVID-19 Testing Locations in Croatia.  The cost of a local test (rapid antigen test or a PCR test) ranges from $40 to $150 or more, depending upon the location, and the result can be expected between 1-48 hours depending upon the type of the test.    https://web.archive.org/web/20220403071447/https://hr.usembassy.gov/covid-19-information/"
"402","Croatia","HRV",2022-04-04,"Europe_Central_Asia","H3: Contact tracing","0","0","Mobile app is available for contact tracing but no evidence of 'on-the-ground' contact tracing. I believe previous coding has relied on the mobile app availability as evidence of contact tracing."
"403","Croatia","HRV",2022-04-04,"Europe_Central_Asia","H6: Facial Coverings","2G","2G","Wearing protective masks is mandatory?in all closed spaces throughout?the country. Masks are also mandatory in open spaces where a physical distance of at least 1.5 meters cannot be maintained.    https://web.archive.org/web/20220403071447/https://hr.usembassy.gov/covid-19-information/"
"404","Croatia","HRV",2022-04-04,"Europe_Central_Asia","H7: Vaccination policy","5G","5G","Has the government of Croatia approved a COVID-19 vaccine for use? Yes  Are vaccines available in Croatia for U.S. citizens to receive? Yes  Which vaccines are available in Croatia? Pfizer–BioNTech, Moderna, AstraZeneca and Johnson & Johnson.  According to the Croatian Institute for Public Health, foreigners with temporary or permanent residency in Croatia can register for the COVID-19 vaccine through their local healthcare provider.  If you have an OIB (Croatian Personal Identification Number) and a local health insurance plan, you may visit https://cijepise.zdravlje.hr/ to register to get vaccinated.  If you do not have a local health insurance plan, you may visit the following Croatian Institute of Public Health website for the contact details of the county public health institutes to register by phone.    https://web.archive.org/web/20220403071447/https://hr.usembassy.gov/covid-19-information/"
"405","Croatia","HRV",2022-04-04,"Europe_Central_Asia","H8: Protection of elderly people","1G","1G","Updated March 17: New measures have been announced to address the elderly population, which is also the most vulnerable. Follow these pages, we will publish them as soon as they are official.    The most effective general prevention measures:  frequent hand hygiene with products containing 70% alcohol: rub your hands if your hands are invisibly dirty or wash with soap and water if your hands are dirty for about 20 seconds  avoid touching eyes, nose and mouth  maintain air hygiene by coughing or sneezing into a bent elbow or tissue and then immediately throw the tissue in the trash can with a lid  wearing a medical mask is mandatory if you have respiratory symptoms  after removing the mask from the face it is mandatory to carry out hand hygiene  maintaining a distance in social contact between persons of at least 1 meter if the person has any of the respiratory symptoms  maintain the hygiene of your living space by periodically wiping surfaces that are frequently touched with your hands with a surface disinfectant     https://web.archive.org/web/20220403232847/https://www.koronavirus.hr/sto-moram-znati/o-prevenciji/vazne-upute-za-starije-osobe-i-kronicne-bolesnike/51"
"406","Hungary","HUN",2022-04-12,"Europe_Central_Asia","C1: School closing","0","0","No restrictions. Everything seems to remain fully open.  https://archive.ph/3EH5o  https://archive.ph/8GlWT"
"407","Hungary","HUN",2022-04-12,"Europe_Central_Asia","C2: Workplace closing","0","0","No measures since March 7th, 2022. Even the vaccination requirements for employees have been abolished.  https://archive.ph/3EH5o"
"408","Hungary","HUN",2022-04-12,"Europe_Central_Asia","C3: Cancel public events","0","0","No restrictions on mass events.  https://archive.ph/3EH5o"
"409","Hungary","HUN",2022-04-12,"Europe_Central_Asia","C4: Restrictions on gatherings","0","0","No restrictions.  https://archive.ph/3EH5o"
"410","Hungary","HUN",2022-04-12,"Europe_Central_Asia","C5: Close public transport","0","0","Public transport is not affected.  https://archive.ph/3EH5o  https://archive.ph/Ja9Nj"
"411","Hungary","HUN",2022-04-12,"Europe_Central_Asia","C6: Stay at home requirements","0","0","Only staying home after testing positive, no other restrictions.  https://archive.ph/XxdOR  https://archive.ph/3EH5o"
"412","Hungary","HUN",2022-04-12,"Europe_Central_Asia","C7: Restrictions on internal movement","0","0","No restrictions.  https://archive.ph/3EH5o"
"413","Hungary","HUN",2022-04-12,"Europe_Central_Asia","C8: International travel controls","0","0","No restrictions, free to travel for any reason and no epidemiologically related checks.  https://archive.ph/8GlWT  https://archive.ph/1TSBs"
"414","Hungary","HUN",2022-04-12,"Europe_Central_Asia","E1: Income support","2T","2T","Support continues. Tax refunds for families, young people are exempted from paying income tax.   https://archive.ph/XxdOR"
"415","Hungary","HUN",2022-04-12,"Europe_Central_Asia","E2: Debt/contract relief","2","2","The credit moratorium was extended until June 30, 2022.   https://archive.ph/XxdOR"
"416","Hungary","HUN",2022-04-12,"Europe_Central_Asia","H1: Public information campaigns","2G","2G","A strong push mostly for vaccination through multiple communicated channels (social media, newspapers, etc.)  https://archive.ph/XxdOR  https://archive.ph/VFF0o"
"417","Hungary","HUN",2022-04-12,"Europe_Central_Asia","H2: Testing policy","2","2","Anyone can get PCR tested for price and need to travel to a test location. Free tests are only for those referred due to contact or symptoms. So recorded as anyone symptomatic, but for a price it is universal.  https://archive.ph/XxdOR"
"418","Hungary","HUN",2022-04-12,"Europe_Central_Asia","H3: Contact tracing","1","1","No mention of contact tracing in the most updated government policy, there have been previous efforts, little evidence about their current impact.  https://archive.ph/XxdOR  https://archive.ph/Ja9Nj"
"419","Hungary","HUN",2022-04-12,"Europe_Central_Asia","H6: Facial Coverings","2G","0","From 7 March it is not compulsory to wear a face mask in indoor public spaces or on public transport. Some institutions frequented by the vulnerable populations still require it (ex. hospitals) or can recommend the use of facial covering.  https://archive.ph/3EH5o  https://archive.ph/1TSBs"
"420","Hungary","HUN",2022-04-12,"Europe_Central_Asia","H7: Vaccination policy","5G","5G","No change. Vaccines are generally available, with Pfizer, Moderna, Astra Zeneca, Sinopharm, and Sputnik V all being used. Vaccination is now allowed for children over 5 years of age, the fourth dose already being administered for specific groups.  https://archive.ph/XxdOR"
"421","Hungary","HUN",2022-04-12,"Europe_Central_Asia","H8: Protection of elderly people","0","0","No measures, all lifted.  https://archive.ph/3EH5o"
"422","Ireland","IRL",2022-05-02,"Europe_Central_Asia","C8: International travel controls","0","0","2nd May 2022, The EU Digital Covid-19 cert is being extended until June 2023 - leaving Irish travellers liable to be up to date with vaccinations depending on what country they are travelling to.  It no longer required for travel to Ireland and several other EU countries however it is still demanded for some Irish holiday favourite destinations such as Portugal.    https://web.archive.org/web/20220502182019/https://www.independent.ie/news/eu-digital-covid-19-cert-extended-until-june-2023-41606956.html"
"423","Ireland","IRL",2022-04-01,"Europe_Central_Asia","H2: Testing policy","1","2","From 1st April 2022, If you have symptoms of COVID-19 you should self-isolate until 48 hours after your symptoms end. You no longer need a COVID-19 test if you have symptoms, unless you:    - Are 55 or older and have not received a booster  - Have a high-risk medical condition  - Are immunocompromised  - Live in the same household or provide care and support to someone who is immunocompromised  - Are pregnant  - Are a healthcare worker    If you are a close contact with no symptoms, you no longer need a test unless you are a healthcare worker who is a household close contact.    https://web.archive.org/web/20220419100921/https://www.citizensinformation.ie/en/covid19/living_with_covid19_plan.html"
"424","Ireland","IRL",2022-04-11,"Europe_Central_Asia","H7: Vaccination policy","5G","5G","11th April 2022, Getting a booster dose    To get your first booster dose, you must be aged 12 or older.    12 to 15 year olds must attend their booster appointment with a parent or legal guardian. A parent or legal guardian will need to give consent for their child's vaccination.    Do not book an appointment for a second booster dose yet. These will be available soon for:    people over 65  people over 12 with a weak immune system  How long to wait before getting your first booster    After your first round of COVID-19 vaccination, you need to wait:    3 months (at least 90 days) if you are 16 or older  6 months (at least 182 days) if you are aged 12 to 15  You will not get your booster dose if the minimum interval has not passed on the day of your appointment.    If you had COVID-19 since you were vaccinated, you should get your booster dose at least:    3 months after your positive test result or when symptoms started if you are 16 or older  6 months after your positive test result or when symptoms started if you are aged 12 to 15  If you had an additional dose because you have a weak immune system, you can get your booster at least 3 months after your additional dose if you are 12 or older.    Vaccines:    Pfizer/BioNTech COVID-19 vaccine  Moderna/Spikevax COVID-19 vaccine  Novavax COVID-19 vaccine  Janssen COVID-19 vaccine  AstraZeneca COVID-19 vaccine (not currently available)    https://web.archive.org/web/20220412001307/https://covid19booster.healthservice.ie/hse-self-referral/?flow=booster"
"425","Iceland","ISL",2022-04-12,"Europe_Central_Asia","C1: School closing","0","0","23/04/22    No changes to policy  https://web.archive.org/web/20220327200017/https://www.covid.is/sub-categories/effective-restrictions"
"426","Iceland","ISL",2022-04-24,"Europe_Central_Asia","C1: School closing","0","0","29/04/22    No changes found  https://web.archive.org/web/20220327200017/https://www.covid.is/sub-categories/effective-restrictions"
"427","Iceland","ISL",2022-04-12,"Europe_Central_Asia","C2: Workplace closing","0","0","23/04/22    No changes to policy  https://web.archive.org/web/20220327200017/https://www.covid.is/sub-categories/effective-restrictions"
"428","Iceland","ISL",2022-04-24,"Europe_Central_Asia","C2: Workplace closing","0","0","29/04/22    No changes found  https://web.archive.org/web/20220327200017/https://www.covid.is/sub-categories/effective-restrictions"
"429","Iceland","ISL",2022-04-12,"Europe_Central_Asia","C3: Cancel public events","0","0","23/04/22    No changes to policy  https://web.archive.org/web/20220327200017/https://www.covid.is/sub-categories/effective-restrictions"
"430","Iceland","ISL",2022-04-24,"Europe_Central_Asia","C3: Cancel public events","0","0","29/04/22    No changes found  https://web.archive.org/web/20220327200017/https://www.covid.is/sub-categories/effective-restrictions"
"431","Iceland","ISL",2022-04-12,"Europe_Central_Asia","C4: Restrictions on gatherings","0","0","23/04/22    No changes to policy  https://web.archive.org/web/20220327200017/https://www.covid.is/sub-categories/effective-restrictions"
"432","Iceland","ISL",2022-04-24,"Europe_Central_Asia","C4: Restrictions on gatherings","0","0","29/04/22    No changes found  https://web.archive.org/web/20220327200017/https://www.covid.is/sub-categories/effective-restrictions"
"433","Iceland","ISL",2022-04-12,"Europe_Central_Asia","C5: Close public transport","0","0","23/04/22    No changes to policy  https://web.archive.org/web/20220327200017/https://www.covid.is/sub-categories/effective-restrictions"
"434","Iceland","ISL",2022-04-24,"Europe_Central_Asia","C5: Close public transport","0","0","29/04/22    No changes found  https://web.archive.org/web/20220327200017/https://www.covid.is/sub-categories/effective-restrictions"
"435","Iceland","ISL",2022-04-12,"Europe_Central_Asia","C6: Stay at home requirements","0","0","23/04/22    No changes to policy  https://web.archive.org/web/20220327200017/https://www.covid.is/sub-categories/effective-restrictions"
"436","Iceland","ISL",2022-04-24,"Europe_Central_Asia","C6: Stay at home requirements","0","0","29/04/22    No changes found  https://web.archive.org/web/20220327200017/https://www.covid.is/sub-categories/effective-restrictions"
"437","Iceland","ISL",2022-04-12,"Europe_Central_Asia","C7: Restrictions on internal movement","0","0","23/04/22    No changes to policy  https://web.archive.org/web/20220327200017/https://www.covid.is/sub-categories/effective-restrictions"
"438","Iceland","ISL",2022-04-24,"Europe_Central_Asia","C7: Restrictions on internal movement","0","0","29/04/22    No changes found  https://web.archive.org/web/20220327200017/https://www.covid.is/sub-categories/effective-restrictions"
"439","Iceland","ISL",2022-04-12,"Europe_Central_Asia","C8: International travel controls","0","0","23/04/22    No changes to policy  https://web.archive.org/web/20220327200017/https://www.covid.is/sub-categories/effective-restrictions"
"440","Iceland","ISL",2022-04-24,"Europe_Central_Asia","C8: International travel controls","0","0","29/04/22    No changes found  https://web.archive.org/web/20220327200017/https://www.covid.is/sub-categories/effective-restrictions"
"441","Iceland","ISL",2022-04-12,"Europe_Central_Asia","E1: Income support","2G","2G","23/04/22    The Government of Iceland has announced various measures to mitigate the economic and societal effects of the coronavirus outbreak.  https://web.archive.org/web/20220411092517/https://www.government.is/government/covid-19/"
"442","Iceland","ISL",2022-04-24,"Europe_Central_Asia","E1: Income support","2G","2G","29/04/22    N changes found  https://web.archive.org/web/20220411092517/https://www.government.is/government/covid-19/"
"443","Iceland","ISL",2022-04-12,"Europe_Central_Asia","E2: Debt/contract relief","2","2","23/04/22    The Government of Iceland has announced various measures to mitigate the economic and societal effects of the coronavirus outbreak.  https://web.archive.org/web/20220411092517/https://www.government.is/government/covid-19/"
"444","Iceland","ISL",2022-04-24,"Europe_Central_Asia","E2: Debt/contract relief","2","2","29/04/22    N changes found  https://web.archive.org/web/20220411092517/https://www.government.is/government/covid-19/"
"445","Iceland","ISL",2022-04-12,"Europe_Central_Asia","H1: Public information campaigns","2G","2G","23/04/22    Coordinated public campaign with dedicated website page.  https://web.archive.org/web/20211206174717/https://www.covid.is/"
"446","Iceland","ISL",2022-04-24,"Europe_Central_Asia","H1: Public information campaigns","2G","2G","29/04/22    Coordinated public campaign with dedicated website page.  https://web.archive.org/web/20211206174717/https://www.covid.is/"
"447","Iceland","ISL",2022-04-12,"Europe_Central_Asia","H2: Testing policy","2","2","23/04/22    No changes found  https://web.archive.org/web/20220228212122/https://www.covid.is/sub-categories/testing-due-to-symptoms"
"448","Iceland","ISL",2022-04-12,"Europe_Central_Asia","H3: Contact tracing","1","1","23/04/22    No changes found  https://web.archive.org/web/20220228212624/https://www.covid.is/app/en"
