"","CountryName","CountryCode","Date","region","PolicyType","PolicyCode","previous_PolicyCode","Notes"
"99","Israel","ISR",2022-02-11,"Middle_East_North_Africa","C1: School closing","2G","2G","""'Students in schools taking part of the Magen Education program - will not be required to take two rapid home tests a week, as long as they keep taking a weekly PCR test in school.""    **Education National Scheme**  General Guidance  •	Masking is required indoors from the 1st grade onward. In a class where one or more student is deaf or hard of hearing, staff members shall wear a transparent mask.    Preschools, Schools, Yeshivas and Boarding Schools  •	Students will be required to take an antigen test on Sundays and Wednesdays, before going to school  •	Test results must be reported on the Ministry of Education portal  •	If the home test result is negative - the student may arrive at school  •	If the home test result is positive - the student may not arrive at school and will take an accredited antigen test. If the result of the accredited test is negative, the student may arrive at school. If the result of the accredited test is positive, the student may not arrive at schools and will go into isolation until recovery.  •	Symptomatic students may not arrive at school and will be required to take a home antigen test  •	Unvaccinated or non-recovered workers will be required to present a negative result on an antigen test administered by an accredited facility every 84 hours    Establishments of Higher Education, Vocational Education and Training and Postsecondary Religious Education  •	Regular activity    **Schools testing**  The new scheme is for students under the age of 18 in the following educational institutes: kindergartens, nurseries, elementary schools, junior high schools, high schools, yeshivas and boarding schools.    How Does the Scheme Work?  Take the tests on Sunday and Wednesday morning, before heading to school, and report the results at the portal of the Ministry of Education.    •	If the test result is negative – the student can go to school or kindergarten.  •	If the test result is positive – take a rapid test at an accredited testing facility. If the result on that test is negative – the student can return to school or kindergarten. If the result on that test is positive, the student is required to go into isolation for at least 5 days and follow the guidance for confirmed COVID-19 cases.    Students in schools taking part of the Magen Education program - will not be required to take two rapid home tests a week, as long as they keep taking a weekly PCR test in school.    Sources:  https://web.archive.org/web/20220208201009/https://corona.health.gov.il/en/education/education-outline/  https://archive.vn/7RTQC [Local Councils Traffic Light Model]  https://archive.vn/TlAyl [Local Councils Traffic Light Model - text only]"
"100","Israel","ISR",2022-03-01,"Middle_East_North_Africa","C1: School closing","2G","2G","Education National Scheme  General Guidance  •	Masking is required indoors from the 1st grade onward. In a class where one or more student is deaf or hard of hearing, staff members shall wear a transparent mask.    Preschools, Elementary Schools and Boarding Schools  •	Students will take home antigen tests on Sundays and Wednesdays, before arriving to school.  •	Test results are to be reported in the Ministry of Education's portal. In case of failure to report, unvaccinated or non-infected students who came in close contact with a confirmed COVID-19 patient will be required to go into isolation.  •	If the result of the home test is negative – the student may go to school.  •	If the result of the home test is positive – the student may not go to school and needs to take an antigen test at an authorized testing site. If the result of the test is negative – the student may go to school. If the result of the test is positive – the student may not go to school and needs to go into isolation.  •	Symptomatic students – may not go to school and need to take a home antigen test.    Secondary Education Schools  •	On Sundays and Wednesdays, before arriving to school, students will report on the Ministry of Education's portal that they do not have any symptoms. In case of failure to report, unvaccinated or non-infected students who came in close contact with a confirmed COVID-19 case will be required to go into isolation.    Establishments of Higher Education, Vocational Education and Training and Postsecondary Religious Education  •	Regular activity    Sources:  https://archive.ph/D8qZ4 [Local Councils Traffic Light Model]  https://archive.ph/xSsVU [Local Councils Traffic Light Model - text only]  https://archive.ph/dCGQK   https://archive.ph/4YFGQ [Domestic restrictions lifting - Times of Israel article]  https://archive.ph/e4Ngk [Green pass]"
"101","Israel","ISR",2022-02-07,"Middle_East_North_Africa","C2: Workplace closing","2G","2G","Workplaces National Guidance  General Guidance  •	Masking is required indoors and in case of a gathering of over 50 people outdoors  •	Violation of the guidance shall incur a fine    Places where Admission is Based on Public or Individual Reception  •	Regular activity    Conferences including Food Service or Sale  •	Activity subject to the Green Pass scheme    Activities Subject to the Green Pass Scheme  •	Eligible to be admitted to venues that operate according to the Green Pass scheme:  •	Vaccinated individuals, according to the Ministry of Health's definition  •	Recovered individuals, according to the Ministry of Health's definition  •	Those who tested negative on a paid PCR test - effective for 72 hours from the time of sampling  •	Children under 12 and 3 months who tested negative on a PCR test taken as part of Magen Education program - effective for one week from the date of sampling  •	Those who tested negative on a rapid test taken up to 24 hours before arriving the venue  Exempt from the Green Pass Scheme:  •	Children under 3  •	Children under 12 and 3 months who present a certificate of disability from the National Insurance Institute of Israel    **Culture National Guidance**  General Guidance  •	Masking is required indoors and in case of a gathering of over 50 people outdoors  •	Violation of the guidance shall incur a fine    Movie Theaters  •	Regular activity    Theatres  •	Regular activity    Exhibitions and Museums  •	Regular activity    Libraries  •	Regular activity    Cultural Events that Are Not Seated Only  •	Activity subject to the Green Pass scheme    Activities under the Green Pass Scheme  •	Eligible to be admitted to venues that operate according to the Green Pass scheme:  •	Vaccinated individuals, according to the Ministry of Health's definition  •	Recovered individuals, according to the Ministry of Health's definition  •	Those tested negative on a paid PCR test - effective for 72 hours from the time of sampling  •	Children under 12 and 3 months who tested negative on a PCR test taken as part of Magen Education program - effective for one week from the date of sampling  •	Those tested negative on a rapid test taken up to 24 hours before arriving the venue  Exempt from the Green Pass Scheme:  •	Children under 3 years old  •	Children under 12 and 3 months who carry a certificate of disability from the National Insurance Institute of Israel    **Retail National Guidance**  General Guidance  •	Masking is required indoors and in case of a gathering of over 50 people outdoors  •	Violation of the guidance shall incur a fine    Malls and Commercial Centers  •	Regular activity    Stores  •	Regular activity    **Events National Guidance**  General Guidance  •	Masking is required indoors and in case of a gathering of over 50 people outdoors  •	Violation of the guidance shall incur a fine    Events Held in Event Venues and Gardens  •	Activity subject to the Green Pass scheme    Parties or Other Events  •	Regular activity    Activities Subject to the Green Pass Scheme  •	Eligible to be admitted to venues that operate according to the Green Pass scheme:  •	Vaccinated individuals, according to the Ministry of Health's definition  •	Recovered individuals, according to the Ministry of Health's definition  •	Those who tested negative on a paid PCR test - effective for 72 hours from the time of sampling  •	Children under 12 and 3 months who tested negative on a PCR test taken as part of Magen Education program - effective for one week from the date of sampling  •	Those who tested negative on a rapid test taken up to 24 hours before arriving the venue  Exempt from the Green Pass scheme:  •	Children under 3  •	Children under 12 and 3 months who present a certificate of disability from the National Insurance Institute of Israel    **Catering National Guidance**  General Guidance  •	Masking is required indoors, and in case of a gathering of over 50 people outdoors, not including during meals  •	Violation of the guidance shall incur a fine    Restaurants and Cafes  •	Regular activity    Bars  •	Regular activity    Dining Rooms  •	Regular activity    **Personal Care National Guidance**  General Guidance  •	Masking is required indoors and in case of a gathering of over 50 people outdoors  •	Violation of the guidance shall incur a fine    Beauty Salons  •	Regular activity    **Leisure National Guidance**  General Guidance  •	Masking is required indoors and in case of a gathering of over 50 people outdoors  •	Violation of the guidance shall incur a fine    Clubs  •	Activity subject to the Green Pass scheme    Tourist Attractions  •	Regular activity    Amusement Parks  •	Regular activity    Swimming Pools  •	Regular activity    National Parks and Nature Reserves  •	Regular activity    Safari and Zoos  •	Regular activity    Community Centers  •	Regular activity    Activities Subject to the Green Pass Scheme  •	Eligible to be admitted to venues that operate according to the Green Pass scheme:  •	Vaccinated individuals, according to the Ministry of Health's definition  •	Recovered individuals, according to the Ministry of Health's definition  •	Those who tested negative on a paid PCR test - effective for 72 hours from the time of sampling  •	Children under 12 and 3 months who tested negative on a PCR test taken as part of Magen Education program - effective for one week from the date of sampling  •	Those who tested negative on a rapid test taken up to 24 hours before arriving the venue  Exempt from the Green Pass scheme:  •	Children under 3  •	Children under 12 and 3 months who present a certificate of disability from the National Insurance Institute of Israel    **Sports National Guidance**  General Guidance  •	Masking is required indoors, and in case of a gathering of over 50 people outdoors, not including during physical activities  •	Violation of the guidance shall incur a fine    Gyms and Studios  •	Regular activity    Swimming Pools  •	Regular activity    Community Centers  •	Regular activity    Sporting Events  •	Regular activity    **School staff**  Unvaccinated staff members will continue taking a rapid test twice a week at accredited testing facilities, and go into isolation in case of close contact with a confirmed COVID-19 case (with the option to reduce the isolation period from the 5th day of isolation).    Sources:  https://archive.vn/7RTQC [Local Councils Traffic Light Model]  https://archive.vn/TlAyl [Local Councils Traffic Light Model - text only]  https://web.archive.org/web/20220208201009/https://corona.health.gov.il/en/education/education-outline/"
"102","Israel","ISR",2022-02-11,"Middle_East_North_Africa","C2: Workplace closing","2G","2G","Workplaces National Guidance  General Guidance  •	Masking is required indoors and in case of a gathering of over 50 people outdoors  •	Violation of the guidance shall incur a fine    Places where Admission is Based on Public or Individual Reception  •	Regular activity    Conferences including Food Service or Sale  •	Activity subject to the Green Pass scheme    Activities Subject to the Green Pass Scheme  •	Eligible to be admitted to venues that operate according to the Green Pass scheme:  •	Vaccinated individuals, according to the Ministry of Health's definition  •	Recovered individuals, according to the Ministry of Health's definition  •	Those who tested negative on a paid PCR test - effective for 72 hours from the time of sampling  •	Children under 12 and 3 months who tested negative on a PCR test taken as part of Magen Education program - effective for one week from the date of sampling  •	Those who tested negative on a rapid test taken up to 24 hours before arriving the venue  Exempt from the Green Pass Scheme:  •	Children under 3  •	Children under 12 and 3 months who present a certificate of disability from the National Insurance Institute of Israel    **Culture National Guidance**  General Guidance  •	Masking is required indoors and in case of a gathering of over 50 people outdoors  •	Violation of the guidance shall incur a fine    Movie Theaters  •	Regular activity    Theatres  •	Regular activity    Exhibitions and Museums  •	Regular activity    Libraries  •	Regular activity    Cultural Events that Are Not Seated Only  •	Activity subject to the Green Pass scheme    Activities under the Green Pass Scheme  •	Eligible to be admitted to venues that operate according to the Green Pass scheme:  •	Vaccinated individuals, according to the Ministry of Health's definition  •	Recovered individuals, according to the Ministry of Health's definition  •	Those tested negative on a paid PCR test - effective for 72 hours from the time of sampling  •	Children under 12 and 3 months who tested negative on a PCR test taken as part of Magen Education program - effective for one week from the date of sampling  •	Those tested negative on a rapid test taken up to 24 hours before arriving the venue  Exempt from the Green Pass Scheme:  •	Children under 3 years old  •	Children under 12 and 3 months who carry a certificate of disability from the National Insurance Institute of Israel    **Retail National Guidance**  General Guidance  •	Masking is required indoors and in case of a gathering of over 50 people outdoors  •	Violation of the guidance shall incur a fine    Malls and Commercial Centers  •	Regular activity    Stores  •	Regular activity    **Events National Guidance**  General Guidance  •	Masking is required indoors and in case of a gathering of over 50 people outdoors  •	Violation of the guidance shall incur a fine    Events Held in Event Venues and Gardens  •	Activity subject to the Green Pass scheme    Parties or Other Events  •	Regular activity    Activities Subject to the Green Pass Scheme  •	Eligible to be admitted to venues that operate according to the Green Pass scheme:  •	Vaccinated individuals, according to the Ministry of Health's definition  •	Recovered individuals, according to the Ministry of Health's definition  •	Those who tested negative on a paid PCR test - effective for 72 hours from the time of sampling  •	Children under 12 and 3 months who tested negative on a PCR test taken as part of Magen Education program - effective for one week from the date of sampling  •	Those who tested negative on a rapid test taken up to 24 hours before arriving the venue  Exempt from the Green Pass scheme:  •	Children under 3  •	Children under 12 and 3 months who present a certificate of disability from the National Insurance Institute of Israel    **Catering National Guidance**  General Guidance  •	Masking is required indoors, and in case of a gathering of over 50 people outdoors, not including during meals  •	Violation of the guidance shall incur a fine    Restaurants and Cafes  •	Regular activity    Bars  •	Regular activity    Dining Rooms  •	Regular activity    **Personal Care National Guidance**  General Guidance  •	Masking is required indoors and in case of a gathering of over 50 people outdoors  •	Violation of the guidance shall incur a fine    Beauty Salons  •	Regular activity    **Leisure National Guidance**  General Guidance  •	Masking is required indoors and in case of a gathering of over 50 people outdoors  •	Violation of the guidance shall incur a fine    Clubs  •	Activity subject to the Green Pass scheme    Tourist Attractions  •	Regular activity    Amusement Parks  •	Regular activity    Swimming Pools  •	Regular activity    National Parks and Nature Reserves  •	Regular activity    Safari and Zoos  •	Regular activity    Community Centers  •	Regular activity    Activities Subject to the Green Pass Scheme  •	Eligible to be admitted to venues that operate according to the Green Pass scheme:  •	Vaccinated individuals, according to the Ministry of Health's definition  •	Recovered individuals, according to the Ministry of Health's definition  •	Those who tested negative on a paid PCR test - effective for 72 hours from the time of sampling  •	Children under 12 and 3 months who tested negative on a PCR test taken as part of Magen Education program - effective for one week from the date of sampling  •	Those who tested negative on a rapid test taken up to 24 hours before arriving the venue  Exempt from the Green Pass scheme:  •	Children under 3  •	Children under 12 and 3 months who present a certificate of disability from the National Insurance Institute of Israel    **Sports National Guidance**  General Guidance  •	Masking is required indoors, and in case of a gathering of over 50 people outdoors, not including during physical activities  •	Violation of the guidance shall incur a fine    Gyms and Studios  •	Regular activity    Swimming Pools  •	Regular activity    Community Centers  •	Regular activity    Sporting Events  •	Regular activity    **School staff**  Unvaccinated staff members will continue taking a rapid test twice a week at accredited testing facilities, and go into isolation in case of close contact with a confirmed COVID-19 case (with the option to reduce the isolation period from the 5th day of isolation).    Sources:  https://archive.vn/7RTQC [Local Councils Traffic Light Model]  https://archive.vn/TlAyl [Local Councils Traffic Light Model - text only]  https://web.archive.org/web/20220208201009/https://corona.health.gov.il/en/education/education-outline/"
"103","Israel","ISR",2022-03-01,"Middle_East_North_Africa","C2: Workplace closing","0","2G","Most restrictions have now been lifted, and the green pass is no longer required when entering places and events. Masking is required indoors, otherwise activities as usual.    **Workplaces National Guidance**  General Guidance  •	Masking is required indoors  Places where Admission is Based on Public or Individual Reception  •	Regular activity  Conferences  •	Regular activity    Sources:  https://archive.ph/D8qZ4 [Local Councils Traffic Light Model]  https://archive.ph/xSsVU [Local Councils Traffic Light Model - text only]  https://archive.ph/dCGQK   https://archive.ph/4YFGQ [Domestic restrictions lifting - Times of Israel article]  https://archive.ph/e4Ngk [Green pass]"
"104","Israel","ISR",2022-02-07,"Middle_East_North_Africa","C3: Cancel public events","2G","2G","Events National Guidance  General Guidance  •	Masking is required indoors and in case of a gathering of over 50 people outdoors  •	Violation of the guidance shall incur a fine    Events Held in Event Venues and Gardens  •	Activity subject to the Green Pass scheme    Parties or Other Events  •	Regular activity    Activities Subject to the Green Pass Scheme  •	Eligible to be admitted to venues that operate according to the Green Pass scheme:  •	Vaccinated individuals, according to the Ministry of Health's definition  •	Recovered individuals, according to the Ministry of Health's definition  •	Those who tested negative on a paid PCR test - effective for 72 hours from the time of sampling  •	Children under 12 and 3 months who tested negative on a PCR test taken as part of Magen Education program - effective for one week from the date of sampling  •	Those who tested negative on a rapid test taken up to 24 hours before arriving the venue  Exempt from the Green Pass scheme:  •	Children under 3  •	Children under 12 and 3 months who present a certificate of disability from the National Insurance Institute of Israel    **Culture National Guidance**   Culture National Guidance  General Guidance  •	Masking is required indoors and in case of a gathering of over 50 people outdoors  •	Violation of the guidance shall incur a fine    Movie Theaters  •	Regular activity    Theatres  •	Regular activity    Exhibitions and Museums  •	Regular activity    Libraries  •	Regular activity    Cultural Events that Are Not Seated Only  •	Activity subject to the Green Pass scheme    Activities under the Green Pass Scheme  •	Eligible to be admitted to venues that operate according to the Green Pass scheme:  •	Vaccinated individuals, according to the Ministry of Health's definition  •	Recovered individuals, according to the Ministry of Health's definition  •	Those tested negative on a paid PCR test - effective for 72 hours from the time of sampling  •	Children under 12 and 3 months who tested negative on a PCR test taken as part of Magen Education program - effective for one week from the date of sampling  •	Those tested negative on a rapid test taken up to 24 hours before arriving the venue  Exempt from the Green Pass Scheme:  •	Children under 3 years old  •	Children under 12 and 3 months who carry a certificate of disability from the National Insurance Institute of Israel    Sources:  https://archive.vn/7RTQC [Local Councils Traffic Light Model]  https://archive.vn/TlAyl [Local Councils Traffic Light Model - text only]"
"105","Israel","ISR",2022-02-11,"Middle_East_North_Africa","C3: Cancel public events","2G","2G","Events National Guidance  General Guidance  •	Masking is required indoors and in case of a gathering of over 50 people outdoors  •	Violation of the guidance shall incur a fine    Events Held in Event Venues and Gardens  •	Activity subject to the Green Pass scheme    Parties or Other Events  •	Regular activity    Activities Subject to the Green Pass Scheme  •	Eligible to be admitted to venues that operate according to the Green Pass scheme:  •	Vaccinated individuals, according to the Ministry of Health's definition  •	Recovered individuals, according to the Ministry of Health's definition  •	Those who tested negative on a paid PCR test - effective for 72 hours from the time of sampling  •	Children under 12 and 3 months who tested negative on a PCR test taken as part of Magen Education program - effective for one week from the date of sampling  •	Those who tested negative on a rapid test taken up to 24 hours before arriving the venue  Exempt from the Green Pass scheme:  •	Children under 3  •	Children under 12 and 3 months who present a certificate of disability from the National Insurance Institute of Israel    **Culture National Guidance**   Culture National Guidance  General Guidance  •	Masking is required indoors and in case of a gathering of over 50 people outdoors  •	Violation of the guidance shall incur a fine    Movie Theaters  •	Regular activity    Theatres  •	Regular activity    Exhibitions and Museums  •	Regular activity    Libraries  •	Regular activity    Cultural Events that Are Not Seated Only  •	Activity subject to the Green Pass scheme    Activities under the Green Pass Scheme  •	Eligible to be admitted to venues that operate according to the Green Pass scheme:  •	Vaccinated individuals, according to the Ministry of Health's definition  •	Recovered individuals, according to the Ministry of Health's definition  •	Those tested negative on a paid PCR test - effective for 72 hours from the time of sampling  •	Children under 12 and 3 months who tested negative on a PCR test taken as part of Magen Education program - effective for one week from the date of sampling  •	Those tested negative on a rapid test taken up to 24 hours before arriving the venue  Exempt from the Green Pass Scheme:  •	Children under 3 years old  •	Children under 12 and 3 months who carry a certificate of disability from the National Insurance Institute of Israel    Sources:  https://archive.vn/7RTQC [Local Councils Traffic Light Model]  https://archive.vn/TlAyl [Local Councils Traffic Light Model - text only]"
"106","Israel","ISR",2022-03-01,"Middle_East_North_Africa","C3: Cancel public events","0","2G","Most restrictions have now been lifted, and the green pass is no longer required when entering places and events. Masking is required indoors, otherwise activities as usual.    **Events National Guidance**  General Guidance  •	Masking is required indoors  Events  •	Regular activity    Sources:  https://archive.ph/D8qZ4 [Local Councils Traffic Light Model]  https://archive.ph/xSsVU [Local Councils Traffic Light Model - text only]  https://archive.ph/dCGQK   https://archive.ph/4YFGQ [Domestic restrictions lifting - Times of Israel article]  https://archive.ph/e4Ngk [Green pass]"
"107","Israel","ISR",2022-02-07,"Middle_East_North_Africa","C4: Restrictions on gatherings","0","3G","General Guidance  Masking is required indoors and in case of a gathering of over 50 people outdoors  Violation of the guidance shall incur a fine    Sources:  https://archive.vn/7RTQC [Local Councils Traffic Light Model]  https://archive.vn/TlAyl [Local Councils Traffic Light Model - text only]"
