"","CountryName","CountryCode","Date","region","PolicyType","PolicyCode","previous_PolicyCode","Notes"
"1","Australia","AUS",2021-01-31,"East_Asia_Pacific","C1: School closing","1T","1T","15/02/2021: Code changed from T3 to T1.  Monday 1st Feb (not Sunday 31st Jan)  is the first school day after the announcement/implementation of this policy.       ""The Australian city of Perth has begun a snap five-day lockdown after a security guard working at a quarantine hotel tested positive for coronavirus.""     ""A scheduled return of schools on Monday has also been delayed by a week.""     https://web.archive.org/web/20210131214730/https://www.bbc.com/news/world-australia-55877150"
"2","Australia","AUS",2021-02-01,"East_Asia_Pacific","C1: School closing","3T","1T","Schools in Perth, Peel and Southwest of WA will be closed from Monday 1 February as part of the 5-day lockdown restrictions for these areas. The latest health advice of Sunday 31 January is that parts of WA - Perth, Peel and the Southwest - go into a 5-day lockdown from 6pm Sunday 31 January to 6pm Friday 5 February. All schools in these areas will be closed as an extension of the school holidays and no lessons or supervision will be provided.  http://web.archive.org/web/20210208171737/https://www.education.wa.edu.au/current-schooling-arrangements  ***Updated to include correctly archived link"
"3","Australia","AUS",2021-02-03,"East_Asia_Pacific","C1: School closing","3T","3T","The VIC govt COVID19  website states that ""new restrictions apply from 11:59pm, Wednesday 3 February 2021""...""In line with advice from the Victorian Chief Health Officer, all high-school students and school-based staff must carry a face mask at all times and wear a face mask in indoor settings such as schools, early childhood education centres and places of study, unless an exception applies.""  The VIC govt COVID19 website also outline physical distancing requirements for schools, which include that adults at school (staff and visitors) must maintain a 1.5m distance and also density limit of 1 person per 2m squared.  https://web.archive.org/web/20210208012821if_/https://www.coronavirus.vic.gov.au/face-masks-study-and-school https://web.archive.org/web/20210208013113if_/https://www.coronavirus.vic.gov.au/physical-distancing-health-and-hygiene  ***Updated to indicte this policy on actual start date of Feb 3"
"4","Australia","AUS",2021-02-05,"East_Asia_Pacific","C1: School closing","3T","3T","15/02/2021: Changed from T1 to T3.  Monday the 8th February is the first school day after the announcement and implementation of this policy change.       WA Premier Mark McGowan press release dated 4th Feb 2021 states, in part, "" Current lockdown ends, pending no further local cases, as planned at 6pm tomorrow [5th Feb 2021]""...""Under the post-lockdown transition measures, Perth and Peel schools will start from Monday, February 8, with the mandatory mask rule applying to all school staff and secondary students. Masks are not required for primary school students.""  While schools are open.  However, mandatory mask wearing is public health precautions that result in significant differences as compared to usual, non-Covid-19 operations. Therefore coded 1.   https://web.archive.org/web/20210207114449/https://www.wa.gov.au/government/announcements/transition-out-of-lockdown-6pm-friday-5-february  https://web.archive.org/web/20210208010107/https://www.mediastatements.wa.gov.au/Pages/McGowan/2021/02/Post-lockdown-plan-to-come-into-effect-6pm-Friday-February-5.aspx    Mask mandate continues in Victoria high schools   https://web.archive.org/web/20210208012821if_/https://www.coronavirus.vic.gov.au/face-masks-study-and-school"
"5","Australia","AUS",2021-02-08,"East_Asia_Pacific","C1: School closing","1T","3T","Monday the 8th February is the first school day after the announcement and implementation of this policy change.   WA Premier Mark McGowan press release dated 4th Feb 2021 states, in part, "" Current lockdown ends, pending no further local cases, as planned at 6pm tomorrow [5th Feb 2021]""...""Under the post-lockdown transition measures, Perth and Peel schools will start from Monday, February 8, with the mandatory mask rule applying to all school staff and secondary students. Masks are not required for primary school students.""  While schools are open.  However, mandatory mask wearing is public health precautions that result in significant differences as compared to usual, non-Covid-19 operations. Therefore coded 1.   https://web.archive.org/web/20210207114449/https://www.wa.gov.au/government/announcements/transition-out-of-lockdown-6pm-friday-5-february  https://web.archive.org/web/20210208010107/https://www.mediastatements.wa.gov.au/Pages/McGowan/2021/02/Post-lockdown-plan-to-come-into-effect-6pm-Friday-February-5.aspx    Mask mandate continues in Victoria high schools   https://web.archive.org/web/20210208012821if_/https://www.coronavirus.vic.gov.au/face-masks-study-and-school"
"6","Australia","AUS",2021-02-12,"East_Asia_Pacific","C1: School closing","1T","1T","15th Feb 2021 changed from T3 to T1 as the 15th February is the first school day impacted by this policy change.     12th Feb 2021: In a tightening of restrictions the Premier of Victoria announced a 5 day, Victoria Wide,  lock-down from 11:59pm Friday 12th February 2021 until 11:59pm on Wednesday, 17 February 2021.  Lock-down regulations for the Education and childcare sector are: Early learning centres, childcare, family day care: Open. School: Schools closed but open for vulnerable children and the children of essential workers. Higher education and training: Closed, remote learning only.  As schools and Higher education and training are closed (with the exception of vulnerable children or children of essential workers) changed code to 3T.     https://web.archive.org/web/20210212053031/https://www.premier.vic.gov.au/sites/default/files/2021-02/210212%20-%20Table%20of%20restrictions.pdf   https://web.archive.org/web/20210212053116/https://www.premier.vic.gov.au/statement-premier-85"
"7","Australia","AUS",2021-02-15,"East_Asia_Pacific","C1: School closing","3T","1T","In a tightening of restrictions the Premier of Victoria announced a 5 day, Victoria Wide,  lock-down from 11:59pm Friday 12th February 2021 until 11:59pm on Wednesday, 17 February 2021.  Lock-down regulations for the Education and childcare sector are: Early learning centres, childcare, family day care: Open. School: Schools closed but open for vulnerable children and the children of essential workers. Higher education and training: Closed, remote learning only.  As schools and Higher education and training are closed (with the exception of vulnerable children or children of essential workers) changed code to 3T. 15th February is the first school day impacted by this policy change.     https://web.archive.org/web/20210212053031/https://www.premier.vic.gov.au/sites/default/files/2021-02/210212%20-%20Table%20of%20restrictions.pdf   https://web.archive.org/web/20210212053116/https://www.premier.vic.gov.au/statement-premier-85"
"8","Australia","AUS",2021-02-18,"East_Asia_Pacific","C1: School closing","1T","3T","A 17 February 2021 media release from the Victorian Government published on the Victorian State Government Health and Human Service website announced that ""Restrictions under Victoria’s new circuit-breaker actions will end tonight. From 11:59pm 17 February 2021 Victoria returns to COVIDSafe Summer restrictions – with some revised conditions.... There will no longer be four reasons to leave home and the five-kilometre restriction will no longer apply. Schools, restaurants and retails can reopen and both public and private office workers can return up to 50 per cent on site.""  Schools across VIC have reopened.  In VIC Students age 12 yrs and older must where a mask while indoors at school and it is strongly recommended outside. Staff are required to practice 1.5m distancing with other adults where ever possible.  Density limits of one person per two square metres apply to staff areas such as staff lunchrooms and areas accessed by the public, such as reception areas.    https://web.archive.org/web/20210220060525/https://www.dhhs.vic.gov.au/sites/default/files/documents/202102/Stay%20Safe%20Directions%20(Victoria)%20(No%2015)%2017%20February%202021%20(signed).pdf    https://web.archive.org/web/20210219220907/https://www.dhhs.vic.gov.au/coronavirus-update-victoria-17-february-2021    https://web.archive.org/web/20210222013328if_/https://www.coronavirus.vic.gov.au/physical-distancing-health-and-hygiene    https://web.archive.org/web/20210222013320/https://www.coronavirus.vic.gov.au/face-masks-study-and-school"
"9","Australia","AUS",2021-01-31,"East_Asia_Pacific","C2: Workplace closing","3T","1T","""The Australian city of Perth has begun a snap five-day lockdown after a security guard working at a quarantine hotel tested positive for coronavirus.""     ""Schools, restaurants, bars, cinemas and gyms have been ordered to close.    Only essential travel is allowed and masks must be worn.    People in the city of two million - along with people living in the nearby Peel and South West regions - must stay at home, except for essential work, healthcare, food shopping or exercise, said Western Australia state Premier Mark McGowan.""     https://web.archive.org/web/20210131214730/https://www.bbc.com/news/world-australia-55877150"
"10","Australia","AUS",2021-02-01,"East_Asia_Pacific","C2: Workplace closing","3T","3T","People in the city of two million - along with people living in the nearby Peel and South West regions - must stay at home, except for essential work, healthcare, food shopping or exercise, said Western Australia state Premier Mark McGowan.  https://web.archive.org/web/20210131225608/https://www.bbc.com/news/world-australia-55877150"
"11","Australia","AUS",2021-02-05,"East_Asia_Pacific","C2: Workplace closing","2T","3T","***Recoded to reflect the required continued closing of casinos and nightclubs in Perth and Peel regions for the post-lockdown 14 day incubation period (1G to 2T)     WA:   WA Premier Mark McGowan press release dated 4th Feb 2021 states, in part, "" Current lockdown ends, pending no further local cases, as planned at 6pm tomorrow [5th Feb 2021]""...""The post lockdown transitional measures for the Perth and Peel regions, include: ... All business and venues can re-open, except for the casino and nightclubs;  4 square metre capacity rule and 150-person capacity at hospitality, entertainment, fitness venues and events including weddings, funerals (excluding staff);"".   https://web.archive.org/web/20210208010107/https://www.mediastatements.wa.gov.au/Pages/McGowan/2021/02/Post-lockdown-plan-to-come-into-effect-6pm-Friday-February-5.aspx  https://web.archive.org/web/20210207114449/https://www.wa.gov.au/government/announcements/transition-out-of-lockdown-6pm-friday-5-february     VIC:   The VIC Govt. COVID19 websites states that ""if you can’t work from home you can go to work. Workers who must attend onsite due to the nature of the work may continue to do so and there is no limit on the number of people who can attend. From Monday 18 January 2021, up to 50 per cent of office workers who are not in the public service have been able to return to on-site work as well as up to 25 per cent of public service workers. Offices with fewer than 40 staff can have 20 staff on-site subject to density quotients."" This is up to date at 8th Feb 2021.    https://web.archive.org/web/20210208014511/https://www.coronavirus.vic.gov.au/work-and-study    QLD:   The QLD GOVT. COVID -19 website states that from “1am AEST 22 January 2021, the Greater Brisbane region is subject to the same restrictions as the rest of the state.” … “All restricted businesses can open, in line with the COVID Safe Framework. All restricted businesses may now have one person per 2 square metres on their premises, other than a hospitality business that does not comply with the requirement to collect contact details electronically. Venues can operate with up to 100 per cent seated capacity if patrons are in ticketed, allocated seating. Dance floors are also allowed indoors and outdoors, and you can stand up and have a drink at bar.”  All businesses can open.  However, there are requirements for some businesses to collect customer contact details, some density requirements.  Some venues and events are required to use a COVID checklist or develop a COVID Safe Event Plan.   https://web.archive.org/web/20210208020314/https://www.health.qld.gov.au/system-governance/legislation/cho-public-health-directions-under-expanded-public-health-act-powers/business-activity-undertaking-direction   https://web.archive.org/web/20210208020752/https://www.qld.gov.au/health/conditions/health-alerts/coronavirus-covid-19/current-status/easing-greater-brisbane-restrictions     NSW:   Current as of 8th Feb 2021, The NSW Government COVID19 website outlines current restrictions on businesses.  Restrictions vary by type of business and include: mandatory staff mask wearing, customer density rules (one person per 2 or 4 square meters), and maximum numbers of people allowed in specific venues of events.  There are no current mandatory work from home restrictions in NSW.   https://web.archive.org/web/20210208020752/https://www.qld.gov.au/health/conditions/health-alerts/coronavirus-covid-19/current-status/easing-greater-brisbane-restrictions  https://web.archive.org/web/20210114055257/https://www.nsw.gov.au/covid-19/covid-safe     ACT:   The Australian Capital Territory Public Health (Restricted Activities –Gatherings, Business or Undertakings) Emergency Direction 2020 (No16), in effect since 11:59pm Mon 16 December 2020 and still current does not require the closure of any business.  However, it does outline restrictions including use of the ACT Government tracing App; total number of allowable customers; customer density requirements; and maximum allowable percentage of venue capacity used.   https://web.archive.org/web/20210208030940/https://www.covid19.act.gov.au/business-and-work  https://web.archive.org/web/20210208030914/https://www.legislation.act.gov.au/ni/2020-801/     TAS:   According to the Tasmania Government’s COVID-19 website, las updated 5th February 2021, “All businesses and workplaces are permitted to operate, but must implement measures to meet the minimum COVID-19 safety standards and record this in a COVID-19 Safety plan.”  Measures include mandatory contact tracing, maximum allowable numbers within venues/spaces, and maximum allowable percentage of venue capacity used.    https://web.archive.org/web/20210208031511/https://coronavirus.tas.gov.au/business-and-employees/business-restrictions  https://web.archive.org/web/20210208031755/https://coronavirus.tas.gov.au/families-community/gatherings-density-and-physical-distancing     SA:  The current South Australia Emergency Management (Public Activities No 18) (COVID-19) Direction 2021 does not require the closing of any business.  However, it does stipulate a range of restrictions on business operations.  Restrictions include: maximum person densities, that food and beverage must be consumed while seated at hospitality venues, appropriate personal protective equipment be worn by staff providing personal care services; maximum allowable percentage of venue capacity used.    https://web.archive.org/web/20210208032027/https://www.covid-19.sa.gov.au/documents/emergency-directions-covid-19/Emergency-Management-Public-Activities-No-18-Direction-2021.pdf  https://web.archive.org/web/20210208032042/https://www.covid-19.sa.gov.au/business-and-work/business-restrictions-and-closures    NT:   The Northern Territory COVID-19 Directions (No. 56) 2020: Safety Measures for Places, Businesses, Activities, Services and Premises does not require the closing of any business.  However, it does require that businesses provide customers with hand sanitiser, collection contract information from customers, ensure physical distancing of 1.5M otherwise keepi9ng contact to less than 15 minutes.   https://web.archive.org/web/20210208043605/https://coronavirus.nt.gov.au/__data/assets/pdf_file/0012/951879/cho-directions-no56-safety-measures-places-businesses-activities-services-premises.pdf"
"12","Australia","AUS",2021-02-12,"East_Asia_Pacific","C2: Workplace closing","3T","2T","12th Feb 2021: In a tightening of restrictions the Premier of Victoria announced a 5 day, Victoria Wide,  lock-down from 11:59pm Friday 12th February 2021 until 11:59pm on Wednesday, 17 February 2021.  Lock-down regulations include that : If you can work from home, you must work from home.  Essential workers and workplaces may remain open and are defined in information provided at the PDF link.   https://web.archive.org/web/20210212053031/https://www.premier.vic.gov.au/sites/default/files/2021-02/210212%20-%20Table%20of%20restrictions.pdf  https://web.archive.org/web/20210212053116/https://www.premier.vic.gov.au/statement-premier-85"
"13","Australia","AUS",2021-02-18,"East_Asia_Pacific","C2: Workplace closing","2T","3T","WA: In a further easing of restrictions Western Australian Premier Mark McGowan announced that ""The Perth and Peel restrictions will end as planned at 12.01am, Sunday, February 14.This means the whole of Western Australia will return to the pre-lockdown conditions, as experienced prior to 6pm on Sunday, January 31....Western Australians should continue to practise physical distancing where possible, maintain good personal hygiene at all times and get tested when unwell. It is vital that all Western Australians ensure they are registering their contact details, at businesses and venues where contact registers are mandatory, to assist contact tracing if it is required. As was the case before the lockdown, public or private events involving more than 500 patrons that require local government authority approval will need an approved COVID Event Plan as part of that process."" All businesses are allowed to reopen though some COVIDsafe measures remain in place.   https://web.archive.org/web/20210222020726/https://www.wa.gov.au/organisation/department-of-the-premier-and-cabinet/covid-19-coronavirus-what-you-can-and-cant-do  http://web.archive.org/web/20210222021353/https://www.mediastatements.wa.gov.au/Pages/McGowan/2021/02/Return-to-pre-lockdown-life-from-12-01am-Sunday-February-14.aspx      VIC: In an easy of restrictions, a 17 February 2021 media release from the Victorian Government published on the Victorian State Government Health and Human Service website announced that ""Restrictions under Victoria’s new circuit-breaker actions will end tonight. From 11:59pm 17 February 2021 Victoria returns to COVIDSafe Summer restrictions – with some revised conditions.... There will no longer be four reasons to leave home and the five-kilometre restriction will no longer apply. Schools, restaurants and retails can reopen and both public and private office workers can return up to 50 per cent on site.""  All workplaces are open with restrictions including recordkeeping, maximum people, percentage capacity restrictions, mask carrying/wearing, record keeping requirements,  square meter capacity rules, and 1.5m distance rules.      https://web.archive.org/web/20210222023521if_/https://www.coronavirus.vic.gov.au/how-we-work  https://web.archive.org/web/20210220060525/https://www.dhhs.vic.gov.au/sites/default/files/documents/202102/Stay%20Safe%20Directions%20(Victoria)%20(No%2015)%2017%20February%202021%20(signed).pdf  https://web.archive.org/web/20210219220907/https://www.dhhs.vic.gov.au/coronavirus-update-victoria-17-february-2021    NSW:  The most recent updates to the Public Health (COVID-19 Restrictions on  Gathering and Movement) Order (No 7) 2020 made on 11th February 2021.  The direction prohibits Nightclubs operating within Greater Sydney, Central Coast, and Wollongong.  No other work places are prohibited from operating.  However, there remain capacity restriction (square meter rules and percentage capacity) and record keeping    https://web.archive.org/web/20210222043855/https://www.legislation.nsw.gov.au/file/Public%20Health%20%28COVID-19%20Restrictions%20on%20Gathering%20and%20Movement%29%20Order%20%28No%207%29%202020_210212.pdf  https://web.archive.org/web/20210209073400/https://www.nsw.gov.au/covid-19/what-you-can-and-cant-do-under-rules/greater-sydney    Therefore reverted coding to T2 from T3."
"14","Australia","AUS",2021-01-22,"East_Asia_Pacific","C3: Cancel public events","1G","1G","NSW: from 22 January 2021 you can meet up in groups of up to 100 people in a public outdoor place from any number of households.  The number of people who can visit you at your home each day increases from 15 to 30. Babies under 12 months are not included in this limit. Dependents over 12 months of age are included in the 30-person limit.  http://web.archive.org/web/20210122132520/https://www.coronavirus.vic.gov.au/social-gatherings    QL: You can have 100 people gather in public outdoor spaces, and 50 people can gather at a private property – this number includes those who live with you.  http://web.archive.org/web/20210124101012/https://www.qld.gov.au/health/conditions/health-alerts/coronavirus-covid-19/current-status/easing-greater-brisbane-restrictions"
"15","Australia","AUS",2021-01-31,"East_Asia_Pacific","C3: Cancel public events","2T","1G","""The Australian city of Perth has begun a snap five-day lockdown after a security guard working at a quarantine hotel tested positive for coronavirus.""     https://web.archive.org/web/20210131214730/https://www.bbc.com/news/world-australia-55877150"
"16","Australia","AUS",2021-02-01,"East_Asia_Pacific","C3: Cancel public events","2T","2T","The lockdown began at 18:00 (10:00 GMT) and runs until Friday night.  Schools, restaurants, bars, cinemas and gyms have been ordered to close.  https://web.archive.org/web/20210131225608/https://www.bbc.com/news/world-australia-55877150"
"17","Australia","AUS",2021-02-05,"East_Asia_Pacific","C3: Cancel public events","1G","2T","In an easing of restrictions to the Perth and the Peel Region of WA; Premier Mark McGowan press release dated 4th Feb 2021 states, in part, "" Current lockdown ends, pending no further local cases, as planned at 6pm tomorrow [5th Feb 2021]"".  The WA COVID19 website states that restrictions from 6om Feb 2021 include “A 150 person capacity limit applies at all events, including weddings and funerals, and community sport”.   All other Australian states and territories also have some restrictions on public gatherings/events in place (variously including limits on total numbers of people, allowable percentage of total venue capacity, and square meter density rules)  https://web.archive.org/web/20210208010107/https://www.mediastatements.wa.gov.au/Pages/McGowan/2021/02/Post-lockdown-plan-to-come-into-effect-6pm-Friday-February-5.aspx  https://web.archive.org/web/20210206092332/https://www.wa.gov.au/organisation/department-of-the-premier-and-cabinet/covid-19-coronavirus-what-you-can-and-cant-do     VIC:   The Stay Safe Directions (Victoria) (No 13) come into force at 11.59pm on 3 February 2021 and replace the Stay Safe Directions (Victoria) (No 12). https://web.archive.org/web/20210208041842/https://www.dhhs.vic.gov.au/sites/default/files/documents/202102/Stay%20Safe%20Directions%20%28Victoria%29%20%28No%2013%29%20-%203%20February%202021%20-%20signed.pdf     ACT:   https://web.archive.org/web/20210208042020/https://www.covid19.act.gov.au/what-you-can-do     QLD:   https://web.archive.org/web/20210208042419/https://www.qld.gov.au/health/conditions/health-alerts/coronavirus-covid-19/current-status/public-health-directions/movements-gatherings     SA:   https://web.archive.org/web/20210208042616/https://www.covid-19.sa.gov.au/restrictions-and-responsibilities/activities-and-gatherings   https://web.archive.org/web/20210208032027/https://www.covid-19.sa.gov.au/documents/emergency-directions-covid-19/Emergency-Management-Public-Activities-No-18-Direction-2021.pdf     TAS:   https://web.archive.org/web/20210208042806/https://coronavirus.tas.gov.au/families-community/gatherings-density-and-physical-distancing     NSW:   https://www.nsw.gov.au/covid-19/what-you-can-and-cant-do-under-rules/greater-sydney#number-of-people-allowed     NT:   https://web.archive.org/web/20210113024835/https://coronavirus.nt.gov.au/__data/assets/pdf_file/0010/951895/cho-directions-no57-directions-major-public-events.pdf   https://web.archive.org/web/20210208043605/https://coronavirus.nt.gov.au/__data/assets/pdf_file/0012/951879/cho-directions-no56-safety-measures-places-businesses-activities-services-premises.pdf"
