countryname,countrycode,region,date,policytype,policyvalue,flag,new_level,prev_level,notes
Pakistan,PAK,South_Asia,20200929,C8: International travel controls,2,.,2.,2.,"No changes found.    ""Starting 20th June, all airlines that routinely fly to Pakistan would be allowed to operate inbound traffic to Pakistan, with roughly 250-300 inbound flights per week across the country.""  ""Passengers will undergo heightened screening at established health desks upon arrival to the airport. Screening will be carried out using thermal gun, thermal scanners and reviews by health professionals.  Each passenger must submit a signed Passenger Health Form (signed during the flight or upon arrival) before leaving the airport to ensure record keeping of inbound passengers, and confirming their willingness to abide by quarantine/home-isolation protocols.  · Asymptomatic passengers will be sent home, and added to the Track and Trace system by respective provincial/federal authorities, and monitored to ensure self-isolation is carried out for 14 days.  · Symptomatic passengers will be tested and quarantined until availability of test results; with option of paid / government quarantine facilities to be provided as per earlier policy.""    http://archive.fo/Whoxg"
Pakistan,PAK,South_Asia,20200929,E1: Income support,1,1,1A,1A,No changes found.
Pakistan,PAK,South_Asia,20200929,E2: Debt/contract relief,2,.,2.,2.,No changes found.
Pakistan,PAK,South_Asia,20200929,H2: Testing policy,2,.,2.,2.,"Special Assistant to PM Dr. Zafar Mirza Said ""We've only been testing visibly symptomatic patients thus far. It is possible that we will start testing asymptomatic people going forward provided they came in contact with those who have already tested positive"".  Link:https://web.archive.org/web/20200520105725/https://www.dawn.com/news/1548375"
Pakistan,PAK,South_Asia,20200929,H3: Contact tracing,2,.,2.,2.,"Comprehensive contract tracing exists throughout the country. ""Identification of contacts:  All persons categorized as a contact of confirmed cases should be followed-up, and  monitored for the development of symptoms for 14 days after the last exposure to the  case (i.e. the maximum incubation period). Contacts of suspected cases should also be  considered for contact management if there is likely to be a delay in confirming or  excluding COVID-19 infection in the suspected case, such as delayed testing"".    See website link, archived: https://archive.vn/LrQBq"
Pakistan,PAK,South_Asia,20200929,H6: Facial Coverings,3,1,3G,3G,"From Sunday, May 31, it became mandatory to wear a mask in public spaces across Pakistan.  http://web.archive.org/web/20200917135423/https://edition.cnn.com/world/live-news/coronavirus-pandemic-05-31-20-intl/h_1ea61f10e67d78e1644aa489f88ae7c4"
Pakistan,PAK,South_Asia,20200930,C1: School closing,1,1,1G,2G,"Primary schools have also reopened in Pakistan. It has however been reported that some schools had to be closed due to non compliance with SOPS.    http://web.archive.org/web/20201007162054/https://www.rferl.org/a/nearly-two-dozen-pakistani-schools-closed-for-flouting-coronavirus-rules/30844135.html    From September 15th 2020, in a phased return to full reopening, universities, colleges and classes of levels 9-12 will resume. (Classes 6-8 to return on Sept 23 after a review  Primary schools to reopen on Sept 30 in last phase  Strength of students in classes to be halved).  https://web.archive.org/web/20200917125652/https://www.dawn.com/news/1578399   "
Pakistan,PAK,South_Asia,20201008,C1: School closing,1,1,1G,1G,"There had been rumours about schools reclosing by October 15th. However, the government negated these rumours and maintained that schools will continue to remain open.     https://archive.fo/Qau8X    Primary schools have also reopened in Pakistan. It has however been reported that some schools had to be closed due to non compliance with SOPS.    http://web.archive.org/web/20201007162054/https://www.rferl.org/a/nearly-two-dozen-pakistani-schools-closed-for-flouting-coronavirus-rules/30844135.html    From September 15th 2020, in a phased return to full reopening, universities, colleges and classes of levels 9-12 will resume. (Classes 6-8 to return on Sept 23 after a review  Primary schools to reopen on Sept 30 in last phase  Strength of students in classes to be halved).  https://web.archive.org/web/20200917125652/https://www.dawn.com/news/1578399 "
Pakistan,PAK,South_Asia,20201008,C2: Workplace closing,1,1,1G,1G,"No changes found.     Dine-in restaurants and beauty salons will reopen on August 10, said Federal Minister for Planning, Development and Special Initiatives Asad Umar.     https://web.archive.org/web/20200812104757/https://www.thenews.com.pk/print/696942-covid-lockdown-over-pakistan-to-open-from-monday    Other sectors to reopen are: Hotels, restaurants and cafes, parks and grounds, cinemas and theatres, non-contact sports, sports clubs and gyms, sports tournaments (indoor and outdoor) without audience, beauty parlours and spas, shrines (for permitted gatherings), tourism, public transport with SOPs. Educational institutions, marriage halls, business and expo centres in the province will be allowed to reopen from September 15.    https://web.archive.org/web/20200812105643/https://www.dawn.com/news/1573652"
Pakistan,PAK,South_Asia,20201008,C3: Cancel public events,1,1,1G,1G,"Recent guidelines for mass gathering: ""No public gathering to be held in cities where test positivity ratio is consistently higher  than 6-9% or above as laid down in instructions (Quantified triggers and corresponding  NPIs)""    https://archive.fo/D30pw"
Pakistan,PAK,South_Asia,20201008,C4: Restrictions on gatherings,2,0,2T,2T,"In recent guidelines related to gatherings:    ""In In-door gathering, it is suggested to have maximum participation of not more than 500  persons where food is not served on the occasion, or 50% of seating capacity of the venue.""    ""No public gathering to be held in cities where test positivity ratio is consistently higher  than 6-9% or above as laid down in instructions (Quantified triggers and corresponding  NPIs).""    https://archive.fo/D30pw"
Pakistan,PAK,South_Asia,20201008,C6: Stay at home requirements,1,1,1G,1G,"Government of Pakistan's guidelines on ways to prevent the disease:     ""As an individual, you can lower your risk of infection by reducing your rate of contact with other people. Avoiding public spaces and unnecessary social gatherings, especially events with large numbers of people or crowds, will lower the chance that you will be exposed to the coronavirus as well as to other infectious diseases like flu.""    http://web.archive.org/web/20200906173639/http://covid.gov.pk/"
Pakistan,PAK,South_Asia,20201008,C8: International travel controls,2,.,2.,2.,"No changes found.    ""Starting 20th June, all airlines that routinely fly to Pakistan would be allowed to operate inbound traffic to Pakistan, with roughly 250-300 inbound flights per week across the country.""  ""Passengers will undergo heightened screening at established health desks upon arrival to the airport. Screening will be carried out using thermal gun, thermal scanners and reviews by health professionals.  Each passenger must submit a signed Passenger Health Form (signed during the flight or upon arrival) before leaving the airport to ensure record keeping of inbound passengers, and confirming their willingness to abide by quarantine/home-isolation protocols.  · Asymptomatic passengers will be sent home, and added to the Track and Trace system by respective provincial/federal authorities, and monitored to ensure self-isolation is carried out for 14 days.  · Symptomatic passengers will be tested and quarantined until availability of test results; with option of paid / government quarantine facilities to be provided as per earlier policy.""    http://archive.fo/Whoxg"
Pakistan,PAK,South_Asia,20201008,E2: Debt/contract relief,2,.,2.,2.,No changes found.  
Pakistan,PAK,South_Asia,20201008,H2: Testing policy,2,.,2.,2.,"Special Assistant to PM Dr. Zafar Mirza Said ""We've only been testing visibly symptomatic patients thus far. It is possible that we will start testing asymptomatic people going forward provided they came in contact with those who have already tested positive"".  Link:https://web.archive.org/web/20200520105725/https://www.dawn.com/news/1548375"
Pakistan,PAK,South_Asia,20201008,H3: Contact tracing,2,.,2.,2.,"Comprehensive contract tracing exists throughout the country. ""Identification of contacts:  All persons categorized as a contact of confirmed cases should be followed-up, and  monitored for the development of symptoms for 14 days after the last exposure to the  case (i.e. the maximum incubation period). Contacts of suspected cases should also be  considered for contact management if there is likely to be a delay in confirming or  excluding COVID-19 infection in the suspected case, such as delayed testing"".    See website link, archived: https://archive.vn/LrQBq"
Pakistan,PAK,South_Asia,20201008,H6: Facial Coverings,3,1,3G,3G,"From Sunday, May 31, it became mandatory to wear a mask in public spaces across Pakistan.  http://web.archive.org/web/20200917135423/https://edition.cnn.com/world/live-news/coronavirus-pandemic-05-31-20-intl/h_1ea61f10e67d78e1644aa489f88ae7c4"
,,,,,,,,,
Note: ,,,,,,,,,
,,,,,,,,,
