countryname,countrycode,region,startdate,enddate,policytype,policyvalue,flag,new_level,prev_level,initialnote
India,IND,South_Asia,20200609,,C4: Restrictions on gatherings,4,1,4G,4T,https://web.archive.org/web/20200608125435/https://www.mha.gov.in/sites/default/files/MHAOrderDt_30052020.pdf    https://web.archive.org/web/20200608125418/https://www.mha.gov.in/sites/default/files/MHADOLrDt_3052020.pdf
Sri Lanka,LKA,South_Asia,20200608,,C5: Close public transport,0,.,0,2T,Sri Lanka's Transport Ministry announced on June 9 had resumed public transport services in capital Colombo and the outskirts of Gampaha which had remained forbidden until now after over two months of no reported public transmission of COVID-19. Public transport in other districts was already allowed.     The measure has been in place since June 8.    Link:  http://web.archive.org/web/20200610195853/http://www.colombopage.com/archive_20A/Jun07_1591547671CH.php  http://web.archive.org/web/20200611083309/https://menafn.com/1100285729/Sri-Lanka-Inter-district-public-transport-to-resume-tomorrow  http://web.archive.org/web/20200611081941/https://www.outlookindia.com/newsscroll/sri-lanka-resumes-public-transport-in-capital/1860308
Sri Lanka,LKA,South_Asia,20200608,,C7: Restrictions on internal movement,0,.,0,2T,"All trains except for a few will operate on a regular schedule from June 8, Sri Lanka Railways department announced. Accordingly, all office trains, long-distance services, night mail trains, intercity express trains, except few intercity express trains including Denuwara Manike from Colombo Fort to Badulla, Air-conditioned intercity express from Mount Lavinia to Kankesanthurai and Pulathisi express from Colombo to Polonnaruwa, will operate as before.    The Ministry of Health and the Ministry of Transport Services Management have instructed that passengers should be transported according to the number of seats on the train and commuters will not be allowed to overcrowd or stand inside trains, therefore the public is advised to use trains only for essential travel.    Link: http://web.archive.org/web/20200611081425/http://www.sundayobserver.lk/2020/06/07/news/trains-track-tomorrow"
Pakistan,PAK,South_Asia,20200607,,C5: Close public transport,0,.,0,2T,Public Transport opened in Baluchistan also which was only province left to open.  Linkhttps://web.archive.org/web/20200607190028/https://www.geo.tv/latest/291975-balochistan-permits-public-transport-on-condition-of-coronavirus-sops
,,,,,,,,,,
Note: Data from 17 Jun 2020. Individual countries may be several days older.,,,,,,,,,,
Source: Oxford COVID-19 Government Response Tracker. More at: github.com/OxCGRT/covid-policy-tracker or bsg.ox.ac.uk/covidtracker,,,,,,,,,,
