"","CountryName","CountryCode","Date","region","PolicyType","PolicyCode","previous_PolicyCode","Notes"
"571","Singapore","SGP",2021-01-19,"East_Asia_Pacific","E1: Income support","2G","2G","The Ministry of Social and Family Development (MSF) will launch the COVID-19 Recovery Grant (CRG) on 18 January 2021 to support lower- to middle-income employees and self-employed persons (SEPs) who are financially impacted by COVID-19:  https://web.archive.org/web/20201221213411/https://www.msf.gov.sg/media-room/Pages/COVID-19-Recovery-Grant-for-Lower--to-Middle-Income-Workers.aspx  As the Self-Employed Person Income Relief Scheme (SIRS) will cease from 1 Jan 2021, a more generous COVID-19 Driver Relief Fund (CDRF) will replace the current Special Relief Fund (SRF) for taxi and private hire car (PHC) drivers at the same time, to moderate the impact on drivers. The new CDRF scheme will cost an additional $133 million, on top of the $55 million committed towards the SRF:  https://web.archive.org/web/20201221213351/https://www.lta.gov.sg/content/ltagov/en/newsroom/2020/december/news-releases/-188-million-sectoral-support-scheme-for-taxi-and-private-hire-c.html"
"572","Singapore","SGP",2021-01-26,"East_Asia_Pacific","E1: Income support","2G","2G","***Recoded from 1G to 2G. No explanation was given for change from 2G to 1G and income support continues to be in place.     There is currently a ""COVID-19 Recovery Grant"" for those lost at least 50% of their salary for 3 months. This grant is applicable those who are under contract or self-employed.   https://web.archive.org/web/20201221213411/https://www.msf.gov.sg/media-room/Pages/COVID-19-Recovery-Grant-for-Lower--to-Middle-Income-Workers.aspx"
"573","Singapore","SGP",2021-01-30,"East_Asia_Pacific","E1: Income support","2G","2G","No updates."
"574","Singapore","SGP",2021-01-16,"East_Asia_Pacific","E2: Debt/contract relief","2","2","No policy changes."
"575","Singapore","SGP",2021-01-19,"East_Asia_Pacific","E2: Debt/contract relief","2","2","No updates:  https://web.archive.org/web/20201221212844/https://www.moh.gov.sg/covid-19"
"576","Singapore","SGP",2021-01-30,"East_Asia_Pacific","E2: Debt/contract relief","2","2","No update"
"577","Singapore","SGP",2021-01-16,"East_Asia_Pacific","H1: Public information campaigns","2G","2G","No policy changes."
"578","Singapore","SGP",2021-01-19,"East_Asia_Pacific","H1: Public information campaigns","2G","2G","No change:  https://web.archive.org/web/20201221212844/https://www.moh.gov.sg/covid-19"
"579","Singapore","SGP",2021-01-26,"East_Asia_Pacific","H1: Public information campaigns","2G","2G","Strong campaign effort that is also very culturally sensitive to upcoming celebrations. Source:  http://web.archive.org/web/20210130221801/https://www.gov.sg/article/safe-management-measures-and-chinese-new-year  ***updated to properly archive link"
"580","Singapore","SGP",2021-01-30,"East_Asia_Pacific","H1: Public information campaigns","2G","2G","No update"
"581","Singapore","SGP",2021-01-16,"East_Asia_Pacific","H2: Testing policy","3","3","No policy changes."
"582","Singapore","SGP",2021-01-19,"East_Asia_Pacific","H2: Testing policy","3","3","""“As Singapore has made good progress to support a further resumption of activities, the Multi-Ministry Taskforce (MTF) will start Phase 3 of re-opening from 28 Dec 2020.  Update on pre-conditions for moving into Phase 3  To move into Phase 3, we needed:  (…) Sufficient testing capabilities for early detection and public health action: Singapore ramped up Polymerase Chain Reaction (PCR) test capacity significantly to be able to run over 50,000 tests a day. Antigen rapid tests were also introduced for larger and higher-risk events.”    Source: http://web.archive.org/web/20201231155002/https://www.gov.sg/article/moving-into-phase-3-of-re-opening-on-28-dec-2020"
"583","Singapore","SGP",2021-01-26,"East_Asia_Pacific","H2: Testing policy","3","3","No policy change.  Current policy: ""We strongly encourage all individuals in the identified community groups to come forward for testing. The costs of these tests will be fully borne by the Government.""   Notably, there is a culturally sensitive approach to testing: ""As community interactions are likely to increase in the leadup to Chinese New Year, we will carry out surveillance testing for stallholders, shop owners, persons in the food and beverage industry, as well as food delivery persons operating in and around Chinatown. While there has been no evidence that these community groups are at higher risk of infection, the Ministry of Health (MOH) will be offering tests to them as they are expected to interact more frequently with other members of the public during this time. The testing will take place from 8 February to 9 February 2021. MOH, together with other government agencies, will be progressively reaching out to these identified community groups with further details.""    Source: /web/20210130001917/https://www.moh.gov.sg/news-highlights/details/tightening-safe-management-measures-and-update-on-vaccination-plans"
"584","Singapore","SGP",2021-01-30,"East_Asia_Pacific","H2: Testing policy","3","3","No update.  See:   https://web.archive.org/web/20210201230423/https://www.moh.gov.sg/news-highlights/details/tightening-safe-management-measures-and-update-on-vaccination-plans"
"585","Singapore","SGP",2021-02-08,"East_Asia_Pacific","H2: Testing policy","3","3","""Singapore plans to tap the private sector to significantly ramp up its capacity to test for Covid-19 infections.    This will enable it to carry out more than 21,000 tests daily in dormitories and regional screening centres, amid ongoing efforts to vaccinate the country's population and avoid subsequent outbreaks.""    http://archive.today/2021.02.12-192816/https://www.straitstimes.com/singapore/covid-19-spore-looking-to-test-as-many-as-21000-daily-in-dorms-and-screening-centres"
"586","Singapore","SGP",2021-01-16,"East_Asia_Pacific","H3: Contact tracing","2","2","No policy changes."
"587","Singapore","SGP",2021-01-19,"East_Asia_Pacific","H3: Contact tracing","2","2","""""“As Singapore has made good progress to support a further resumption of activities, the Multi-Ministry Taskforce (MTF) will start Phase 3 of re-opening from 28 Dec 2020.  Update on pre-conditions for moving into Phase 3  To move into Phase 3, we needed:  (…) c) High adoption of TraceTogether (TT) for quick and effective contact tracing: As at 13 Dec 2020, around 65% of Singapore residents are on the TT Programme, and Singapore is on track to reaching the target of around 70% by the end-2020.”    Source: http://web.archive.org/web/20201231155002/https://www.gov.sg/article/moving-into-phase-3-of-re-opening-on-28-dec-2020"
"588","Singapore","SGP",2021-01-26,"East_Asia_Pacific","H3: Contact tracing","2","2","No update to policy.  Current policy: ""TraceTogether-only SafeEntry, where the TraceTogether App or Token is required for SafeEntry check-ins, will only be implemented early next year, after everyone who wants a Token has had a chance to collect one at a Community Club or Centre in their constituency.  Until we implement TraceTogether-only SafeEntry, visitors can still perform SafeEntry check-in via the TraceTogether App, SingPass Mobile, or QR reader apps, or use their identity cards with barcodes such as NRIC, Pioneer or Merdeka Generation cards.""  Source:  http://web.archive.org/web/20210130221513/https://www.gov.sg/article/moving-into-phase-3-of-re-opening-on-28-dec-2020  ***updated to properly archive link"
"589","Singapore","SGP",2021-01-30,"East_Asia_Pacific","H3: Contact tracing","2","2","No updates"
"590","Singapore","SGP",2021-02-12,"East_Asia_Pacific","H3: Contact tracing","2","2","https://web.archive.org/web/20210214163310/https://www.channelnewsasia.com/news/singapore/covid-19-places-visited-infectious-cases-feb-11-14146966"
"591","Singapore","SGP",2021-01-16,"East_Asia_Pacific","H6: Facial Coverings","4G","4G","No policy changes."
"592","Singapore","SGP",2021-01-19,"East_Asia_Pacific","H6: Facial Coverings","4G","4G","same as old"
"593","Singapore","SGP",2021-01-26,"East_Asia_Pacific","H6: Facial Coverings","4G","4G","No update in policies. Source: http://web.archive.org/web/20210130221801/https://www.gov.sg/article/safe-management-measures-and-chinese-new-year  ***updated to properly archive link"
"594","Singapore","SGP",2021-01-19,"East_Asia_Pacific","H7: Vaccination policy","1G","1G","""Singapore started the COVID-19 vaccination exercise on Wednesday morning, with the first batch of healthcare workers at the National Center for Infectious Diseases (NCID) getting vaccinated, according to the Ministry of Health (MOH).    (...) NCID said in a factsheet to media that the remaining NCID staff will be progressively vaccinated with the National Healthcare Group Management and Staff starting from January 2021.    MOH reported on Sunday that it aims to begin with vaccinating the elderly, starting with those aged 70 and above, from February 2021. Thereafter, other Singaporeans and long-term residents who are medically eligible for vaccination will get inoculation.""    Source: https://archive.vn/oFiHl    ""All Singaporeans and long-term residents will be able to get vaccinated by end-2021.    Vaccination is strongly encouraged for everyone, but it is voluntary. The vaccination will be free.""    Source: http://web.archive.org/web/20201231155854/https://www.gov.sg/article/securing-singapores-access-to-covid-19-vaccines"
"595","Singapore","SGP",2021-01-26,"East_Asia_Pacific","H7: Vaccination policy","1G","1G","No new policy."
"596","Singapore","SGP",2021-01-27,"East_Asia_Pacific","H7: Vaccination policy","2G","1G","A; C   Policy update: ""The first day of COVID-19 vaccination for our seniors aged 70 years old and above commenced on 27 January with two pilots at the Ang Mo Kio and Tanjong Pagar towns, which is home to a larger number of our elderly."" Source: http://web.archive.org/web/20210130223217/https://www.moh.gov.sg/news-highlights/details/update-on-covid-19-vaccination-programme  ***updated to include properly archived link and groups"
"597","Singapore","SGP",2021-02-03,"East_Asia_Pacific","H7: Vaccination policy","2G","2G","""The Expert Committee on COVID-19 Vaccination welcomes the interim authorisation of the Moderna COVID-19 vaccine by the Health Sciences Authority (HSA), for use in Singapore in individuals aged 18 years and above to prevent COVID-19 disease. ""    http://archive.today/2021.02.12-175849/https://www.moh.gov.sg/news-highlights/details/expert-committee-on-covid-19-vaccination-endorses-use-of-moderna-covid-19-vaccine"
"598","Singapore","SGP",2021-02-11,"East_Asia_Pacific","H7: Vaccination policy","2G","2G","Vaccine: Pfizer-BioNTech.  Groups: ""A,C:""    Article from Straits Times refers to the roll out of the vaccine to airline staff and maritime workers since January.  These workers who are referred to as ""front line workers"" in the article and could be considered to be ""Key workers"" in terms of the coding scheme.  However, it may also be relevant to consider these workers in terms described by the Minister of Health as those ""who are in jobs or settings where risk of a super-spreading event is high"" (see M1, 2nd February for link)    ""Front-line workers in the aviation and maritime sectors started getting jabs on Jan 13 as part of an operational trial, before the mass exercise began in earnest on Jan 18.  Bus and train workers started getting jabs from Jan 25.""    ""Transport Minister Ong Ye Kung, who spoke to crew members operating SQ956 on Thursday morning, said the vaccination drive has been ""proceeding like clockwork"".  He told reporters he is confident that a substantial number of workers from the aviation and maritime sectors will be fully vaccinated by the end of the month.""    http://archive.today/2021.02.12-202659/https://www.straitstimes.com/singapore/first-flights-with-fully-vaccinated-crew-depart-singapore-in-milestone-for-sia"
"599","Solomon Islands","SLB",2021-01-19,"East_Asia_Pacific","C1: School closing","0","0","contd: no measure on school closure    https://web.archive.org/web/20201101164134/https://www.solomontimes.com/news/sikaiana-plans-local-measures-as-fears-of-covid19-grows/10370"
"600","Solomon Islands","SLB",2021-02-02,"East_Asia_Pacific","C1: School closing","0","0","contd: no measure on school closure    https://web.archive.org/web/20201101164134/https://www.solomontimes.com/news/sikaiana-plans-local-measures-as-fears-of-covid19-grows/10370"
"601","Solomon Islands","SLB",2021-01-19,"East_Asia_Pacific","C2: Workplace closing","0","0","Since Nov 25: Bars, restaurants, hotels, and shops remain largely open and operating as normal. Emergency is also extended till March 2021.    https://web.archive.org/web/20201215172258/https://www.garda.com/crisis24/news-alerts/403366/solomon-islands-government-extends-national-state-of-emergency-march-2021-update-7"
"602","Solomon Islands","SLB",2021-02-02,"East_Asia_Pacific","C2: Workplace closing","0","0","Since Nov 25: Bars, restaurants, hotels, and shops remain largely open and operating as normal. Emergency is also extended till March 2021.    https://web.archive.org/web/20201215172258/https://www.garda.com/crisis24/news-alerts/403366/solomon-islands-government-extends-national-state-of-emergency-march-2021-update-7"
"603","Solomon Islands","SLB",2021-01-19,"East_Asia_Pacific","C3: Cancel public events","1G","1G","Old and contd:  All public gatherings are discouraged but large meetings, church gatherings and sporting events can be held subject to Ministry of Health approval and the observation of Covid-19 safety measures.    https://web.archive.org/web/20201129194927/https://www.rnz.co.nz/international/pacific-news/428243/early-childhood-centres-closed-under-new-solomons-covid-restrictions"
"604","Solomon Islands","SLB",2021-02-02,"East_Asia_Pacific","C3: Cancel public events","1G","1G","Old and contd:  All public gatherings are discouraged but large meetings, church gatherings and sporting events can be held subject to Ministry of Health approval and the observation of Covid-19 safety measures.    https://web.archive.org/web/20201129194927/https://www.rnz.co.nz/international/pacific-news/428243/early-childhood-centres-closed-under-new-solomons-covid-restrictions"
"605","Solomon Islands","SLB",2021-01-19,"East_Asia_Pacific","C4: Restrictions on gatherings","0","0","since nov25: Public gatherings remain banned, though some religious and sport-related gatherings may proceed subject to official approval from the Ministry of Health. There is no number reflected anywhere, so marked as 0.    https://web.archive.org/web/20201215172258/https://www.garda.com/crisis24/news-alerts/403366/solomon-islands-government-extends-national-state-of-emergency-march-2021-update-7"
"606","Solomon Islands","SLB",2021-02-02,"East_Asia_Pacific","C4: Restrictions on gatherings","0","0","since nov25: Public gatherings remain banned, though some religious and sport-related gatherings may proceed subject to official approval from the Ministry of Health. There is no number reflected anywhere, so marked as 0.    https://web.archive.org/web/20201215172258/https://www.garda.com/crisis24/news-alerts/403366/solomon-islands-government-extends-national-state-of-emergency-march-2021-update-7"
"607","Solomon Islands","SLB",2021-01-19,"East_Asia_Pacific","C5: Close public transport","1G","1G","No change    Limiting of passenger numbers on public transportation  https://web.archive.org/web/20201129194927/https://www.rnz.co.nz/international/pacific-news/428243/early-childhood-centres-closed-under-new-solomons-covid-restrictions"
"608","Solomon Islands","SLB",2021-02-02,"East_Asia_Pacific","C5: Close public transport","1G","1G","No change    Limiting of passenger numbers on public transportation  https://web.archive.org/web/20201129194927/https://www.rnz.co.nz/international/pacific-news/428243/early-childhood-centres-closed-under-new-solomons-covid-restrictions"
"609","Solomon Islands","SLB",2021-01-19,"East_Asia_Pacific","C6: Stay at home requirements","0","0","There is no measure on stay at home requirement."
"610","Solomon Islands","SLB",2021-02-02,"East_Asia_Pacific","C6: Stay at home requirements","0","0","There is no measure on stay at home requirement."
"611","Solomon Islands","SLB",2021-01-19,"East_Asia_Pacific","C7: Restrictions on internal movement","1T","1T","No change   The government is also strongly advising people in the provinces to avoid travelling to the capital Honiara unless it is absolutely necessary.    https://web.archive.org/web/20201129194927/https://www.rnz.co.nz/international/pacific-news/428243/early-childhood-centres-closed-under-new-solomons-covid-restrictions"
"612","Solomon Islands","SLB",2021-02-02,"East_Asia_Pacific","C7: Restrictions on internal movement","1T","1T","No change   The government is also strongly advising people in the provinces to avoid travelling to the capital Honiara unless it is absolutely necessary.    https://web.archive.org/web/20201129194927/https://www.rnz.co.nz/international/pacific-news/428243/early-childhood-centres-closed-under-new-solomons-covid-restrictions"
"613","Solomon Islands","SLB",2021-01-19,"East_Asia_Pacific","C8: International travel controls","3","3","No change  Foreign nationals are banned from entering the Solomon Islands. Honiara International Airport remains closed to scheduled international flights until at least 10 January, 2021.    https://web.archive.org/web/20201129191741/https://www.worldnomads.com/travel-safety/oceania/solomon-islands/latest-travel-alerts-and-warnings"
"614","Solomon Islands","SLB",2021-02-02,"East_Asia_Pacific","C8: International travel controls","3","3","No change  Foreign nationals are banned from entering the Solomon Islands. Honiara International Airport remains closed to scheduled international flights until at least 10 January, 2021.    https://web.archive.org/web/20201129191741/https://www.worldnomads.com/travel-safety/oceania/solomon-islands/latest-travel-alerts-and-warnings"
"615","Solomon Islands","SLB",2021-01-19,"East_Asia_Pacific","E1: Income support","0","0","Old    Original coding was ""1F"". However, the note did not point to information on SLB policies. I could not find any information about a new income support policy.    I am, therefore recoding to ""0"" and attaching the original note below for reference:  ---  Key findings: a lack of specific income support measures available for families; no specific support measures were available for Pacific migrant workers who were held back home due to travel restrictions.  Income support was available for those who had lost their jobs but is not available for those who were scheduled to leave on labour mobility visas to Australia and New Zealand.     Link: https://web.archive.org/web/20200901163235/https://publications.iom.int/system/files/pdf/iom-rapid-assessment-report.pdf"
"616","Solomon Islands","SLB",2021-02-02,"East_Asia_Pacific","E1: Income support","0","0","Old    Original coding was ""1F"". However, the note did not point to information on SLB policies. I could not find any information about a new income support policy.    I am, therefore recoding to ""0"" and attaching the original note below for reference:  ---  Key findings: a lack of specific income support measures available for families; no specific support measures were available for Pacific migrant workers who were held back home due to travel restrictions.  Income support was available for those who had lost their jobs but is not available for those who were scheduled to leave on labour mobility visas to Australia and New Zealand.     Link: https://web.archive.org/web/20200901163235/https://publications.iom.int/system/files/pdf/iom-rapid-assessment-report.pdf"
"617","Solomon Islands","SLB",2021-01-19,"East_Asia_Pacific","E2: Debt/contract relief","0","0","no measure on economy relief"
"618","Solomon Islands","SLB",2021-02-02,"East_Asia_Pacific","E2: Debt/contract relief","0","0","no measure on economy relief"
"619","Solomon Islands","SLB",2021-01-19,"East_Asia_Pacific","H1: Public information campaigns","2G","2G","Strong social media awareness campaign for Covid-19 on the Solomon Islands, which is fostered by a strong government-awareness program.     https://web.archive.org/web/20201129201947/https://youngchangeagents.com/challenges/covid19/solomon-islands-covid-awareness-campaign"
"620","Solomon Islands","SLB",2021-02-02,"East_Asia_Pacific","H1: Public information campaigns","2G","2G","Strong social media awareness campaign for Covid-19 on the Solomon Islands, which is fostered by a strong government-awareness program.     https://web.archive.org/web/20201129201947/https://youngchangeagents.com/challenges/covid19/solomon-islands-covid-awareness-campaign"
"621","Solomon Islands","SLB",2021-01-19,"East_Asia_Pacific","H2: Testing policy","1","1","The government of Solomon Islands has limited COVID-19 capacity. Testing services for individuals who meet the government’s case definition may be obtained at the National Referral Hospital in Honiara.    https://web.archive.org/web/20201129202606/https://pg.usembassy.gov/covid-19-information/"
"622","Solomon Islands","SLB",2021-02-02,"East_Asia_Pacific","H2: Testing policy","1","1","The government of Solomon Islands has limited COVID-19 capacity. Testing services for individuals who meet the government’s case definition may be obtained at the National Referral Hospital in Honiara.    https://web.archive.org/web/20201129202606/https://pg.usembassy.gov/covid-19-information/"
"623","Solomon Islands","SLB",2021-01-19,"East_Asia_Pacific","H3: Contact tracing","0","0","no measure found"
"624","Solomon Islands","SLB",2021-02-02,"East_Asia_Pacific","H3: Contact tracing","0","0","no measure found"
"625","Solomon Islands","SLB",2021-01-19,"East_Asia_Pacific","H6: Facial Coverings","4G","4G","Wear a mask to keep your nose and mouth covered when you are in shared spaces outside of your home, including when using public transportation.  Wear a mask and ask any household members who did not travel with you to wear masks in shared spaces inside your home.    https://web.archive.org/web/20201215180528/https://wwwnc.cdc.gov/travel/notices/covid-4/coronavirus-solomon-islands"
"626","Solomon Islands","SLB",2021-02-02,"East_Asia_Pacific","H6: Facial Coverings","4G","4G","Wear a mask to keep your nose and mouth covered when you are in shared spaces outside of your home, including when using public transportation.  Wear a mask and ask any household members who did not travel with you to wear masks in shared spaces inside your home.    https://web.archive.org/web/20201215180528/https://wwwnc.cdc.gov/travel/notices/covid-4/coronavirus-solomon-islands"
"627","Solomon Islands","SLB",2021-01-19,"East_Asia_Pacific","H7: Vaccination policy","0","0","no vaccination policy"
"628","Solomon Islands","SLB",2021-02-02,"East_Asia_Pacific","H7: Vaccination policy","0","0","no measure found"
"629","Thailand","THA",2021-01-16,"East_Asia_Pacific","C1: School closing","3T","3T","23rd Jan 2021 The Thailand Government Public Relations Department website has a press release dated 07 Jan 2021.  This is the most recent official government release regarding school closure able to be located. It states, in part, ""The Sheikhul Islam of Thailand announced the measures to protect public health and control of the spread of COVID-19 in the restricted areas. The Center of COVID-19 Situation Administration (CCSA) asks the public to follow the preventive practices and measures set out by the Department of Disease Control, Ministry of Public Health. The provinces in the Red Zone can work to control the spread of COVID-19 by strictly following these measures...(3) people should cooperate and avoid gatherings, including Dah’wa or evangelism, charity functions, religion classes, and studying at schools or mosques. These measures will be applied from now until the return of the normal situation or any change in the next announcement.."" https://web.archive.org/web/20210123075429/https://thailand.prd.go.th/ewt_news.php?nid=10608&filename=index     Further the Bangkok Post published an article 22 Jan 2021 stating, in part, ""that Schools are allowed to reopen on Feb 1 if the pandemic recedes and the Centre for Covid-19 Situation Administration (CCSA) gives the green light, says the secretary-general of the Office of the Basic Education Commission (Obec) Amporn Pinasa.""   - Error message received when trying to archive relevant link.     Thai PBS WORLD news website published an article on 23rd Jan 2021 stating, in part, that ""Schools in Thailand’s 28 red zone provinces will be allowed to resume onsite learning from February 1st. The country’s education minister, Nataphol Teepsuwan, said that the outbreak is under sufficient control whereby the ministry feels comfortable with the safety measures in place for classroom lessons."" https://web.archive.org/web/20210123080455/https://www.thaipbsworld.com/will-schools-reopen-on-february-1st/    Subsequently, it is concluded that schools remain closed in target areas."
"630","Thailand","THA",2021-02-01,"East_Asia_Pacific","C1: School closing","1T","3T","The Ministry of Education (MoE) of Thailand has instructed the full re-opening of schools from Feb 1st, 2021, except for those located in Samut Sakhon, which has been classified as a “maximum and strict control zone”.   https://web.archive.org/web/20210209074752/https:/www.sisb.ac.th/page/covid-19-frequently-asked-questions"
