"","CountryName","CountryCode","Date","region","PolicyType","PolicyCode","previous_PolicyCode","Notes"
"1","Argentina","ARG",2022-05-10,"Latin_America_Caribbean","C1: School closing","0","0","Schools are open and back to face to face class. No bubbles, masks, distancing or vaccination is mandatory.    https://archive.ph/UkU2S  https://archive.ph/3G6F1  https://archive.ph/KTq0r"
"2","Argentina","ARG",2022-05-10,"Latin_America_Caribbean","C2: Workplace closing","1G","1G","Workplaces are open with protocols.    https://archive.ph/UkU2S  https://archive.ph/p0rjt"
"3","Argentina","ARG",2022-05-10,"Latin_America_Caribbean","C3: Cancel public events","2G","2G","Proof of at least 2 doses of vaccination must be presented to attend any mass event. Masks are mandatory indoors, and outdoors when distancing is not possible.    https://archive.ph/UkU2S  https://archive.ph/p0rjt"
"4","Argentina","ARG",2022-05-10,"Latin_America_Caribbean","C4: Restrictions on gatherings","4G","4G","Covid vaccination passport is mandatory for mass events, masks are mandatory indoors and when distancing is not possible.    https://archive.ph/UkU2S  https://archive.ph/p0rjt"
"5","Argentina","ARG",2022-05-10,"Latin_America_Caribbean","C5: Close public transport","0","0","Public transportation is open. Masks are mandatory in indoors spaces.    https://archive.ph/UkU2S  https://archive.ph/p0rjt"
"6","Argentina","ARG",2022-05-10,"Latin_America_Caribbean","C6: Stay at home requirements","0","0","There are no stay at home requirements    https://archive.ph/UkU2S  https://archive.ph/p0rjt"
"7","Argentina","ARG",2022-05-10,"Latin_America_Caribbean","C7: Restrictions on internal movement","0","0","There are no restrictions on internal movement    https://archive.ph/cwM1T"
"8","Argentina","ARG",2022-05-10,"Latin_America_Caribbean","C8: International travel controls","1","1","Everyone must fill out an electronic sworn statement 48 hours previous to boarding. Non-resident foreigners must show proof of health insurance that covers isolation, sanitary transportation and/or internment.    https://archive.ph/OOxnc"
"9","Argentina","ARG",2022-05-10,"Latin_America_Caribbean","H1: Public information campaigns","2G","2G","There is a coordinated campaign on traditional as well as publicly available and updated information in social media and online.    https://archive.ph/UkU2S"
"10","Argentina","ARG",2022-05-10,"Latin_America_Caribbean","H2: Testing policy","3","2","Tests are generally available; both for free at public hospitals and testing centers, and at private labs for a fee.    https://archive.ph/cwM1T"
"11","Argentina","ARG",2022-05-10,"Latin_America_Caribbean","H3: Contact tracing","1","1","The contact tracing strategy in Argentina uses the mobile application (Cuidar). The recommendations for the study and confirmation of cases are adapted to optimize resources confirming cases by clinical and epidemiological criteria.   People under 60 years of age without risk conditions and symptoms and are contacts of people with Covid-19 are considered to have COVID-19 without the need to take a test. People over 60 years old or with risk factors and symptoms should contact the health system of the place where they live.    https://archive.ph/zQFE5"
"12","Argentina","ARG",2022-05-10,"Latin_America_Caribbean","H6: Facial Coverings","2G","3G","Masks are mandatory indoors, and outdoors when distancing is not possible.    https://archive.ph/UkU2S  https://archive.ph/p0rjt"
"13","Argentina","ARG",2022-05-10,"Latin_America_Caribbean","H7: Vaccination policy","5G","5G","Anyone over the age of 3 can get vaccinated. Booster shots available for anyone with complete vaccination scheme, additional booster shot available for inmunosuppressed people over 3 years old, anyone over 50 and people who are traveling abroad and have 2 doses of Sputnik V.    https://archive.ph/5zIRS"
"14","Argentina","ARG",2022-05-10,"Latin_America_Caribbean","H8: Protection of elderly people","1G","1G","People over 50 years old are eligible for an additional booster shot of vaccination.    https://archive.ph/5zIRS"
"15","Argentina","ARG",2022-05-10,"Latin_America_Caribbean","V2: Vaccine Availability","-2","18550","Anyone over the age of 3 can get vaccinated. Booster shots available for anyone with complete vaccination scheme, additional booster shot available for inmunosuppressed people over 3 years old, anyone over 50 and people who are traveling abroad and have 2 doses of Sputnik V.    https://archive.ph/5zIRS"
"16","Argentina","ARG",2022-05-10,"Latin_America_Caribbean","V3: Vaccine Financial Support","-2","18550","Anyone over the age of 3 can get vaccinated. Booster shots available for anyone with complete vaccination scheme, additional booster shot available for inmunosuppressed people over 3 years old, anyone over 50 and people who are traveling abroad and have 2 doses of Sputnik V.    https://archive.ph/5zIRS"
"17","Argentina","ARG",2022-05-10,"Latin_America_Caribbean","V4: Mandatory Vaccination","-2","27900","Anyone over the age of 3 can get vaccinated. Booster shots available for anyone with complete vaccination scheme, additional booster shot available for inmunosuppressed people over 3 years old, anyone over 50 and people who are traveling abroad and have 2 doses of Sputnik V.    https://archive.ph/5zIRS"
"18","Bahamas","BHS",2022-05-03,"Latin_America_Caribbean","C1: School closing","1G","0","Ministry of Health update May 12, number of covid cases in schools, despite this Ministry of Health & Wellness has not recommended the closure of any schools during the past several weeks. But as of 18-May-22 evidence that C19 protocols are in practice limiting full return to on site learning and hybrid learning models are still operating.    Links:  https://web.archive.org/web/20220523162101/https://www.bahamas.gov.bs/wps/portal/public/news%20and%20press%20release/health%20officials%20respond%20to%20increasing%20positive%20covid-19%20cases%20in%20new%20providence%20schools/%21ut/p/b1/vZTbjqM4EIafpR-AwcYcL0kcgjmHGALcRCSQkHRDIOH89JvRtrQa7U73zWxcV1X6ra_0u8pswkZsUqX95Zy2l1uVfvzME3GP1q69WfKyLYu8AgikDsErD60RZHdsZMV753DbDJj4p9HPXdNdV1F0f8TMmIcXbRy03bCKhVjJ0d2nKKn6j9KwOj0H2y6HKOtP64OwPgb3xwXKOzrHlt-SKW3HSSFFEeJm-1jRHi-DZ7KW9iTNC270i1PeVlLs88cdVm9Oz-9N_EFrDefXTrhEi-B8vWX-qPaP27Psk2IKykay-PMuBJ5aNghYW0dfEO6-1bRKZ8ZiiH1zCZWodmm3p0UhkpTRo2Hfup7uWafCqdK2kp1Kvz8YlB7ObVdVzLAXZEU8PI2Kn0aB3xwV_O0jWNuq-vTR5ehPH5dQNAMByFj8vP-F4Nt3SH5FrAUgAhJ4lupJOufy4FPwVYtfN8mz8VMg_V4gsZSNAL_fXqeazO-zf503wKYhcWg8wzkYHu_zzqEr5LQppDiG4BAMdvAA9myjdvYdmuleFvrBQsUePk_d18Ctxb8WKFPx1UD0YiACrwZyrwYKLwYar55S9Of30GCTy6H8MRzLH-CHACDkEJQFDkmixLGhcbyM-EaGFcFFOFX4fvLLcPQum2LUtA-vNgOug2Kq1B7mVvXMWBKTSboTzn6mDk6S6oo4RpCs0NKwFsfhIw9wD90yX0YL43bxG2F0D9z5Y-hVphf3Mi4aRxMdNTa0TduB99Nx8vSuuFXoOpFdWuwmhemYQW_q62LJOvqtzL9xbPFfUz89gsJx8IYD14CzsfV0THO2rfGsHUeIQ7K9-pY9r8D2ukZbh346pqpBNJ2_-7nE1wLlBXw1UPrfgSaHnkALWY68hNs1ejFQ_vND88uayQriFEECMi9DAQLIhm3ASIeHPWBvCC3_RpudK2W5rHfau7lL46takPpiTtleBwnhXN2qIc9jRJbQ4y3zrszB8aQgsOeV2S2TzmthYpzcCWsjE9Wrqtej2aZq885HplryB2OUD3eIvJ4ot-OCxOnq1rgd44VaUIQX0IFuARvDx1bfGyWoDvFSjwURi_ZxsBvD0iQ6ub3JJbZy1Eii2LUrbmRKQpAlQNNoNpQ0O9IL01t1m1GXPLiAnFJRtWllFPfCYsJq0ndRs4gTBeh108w5I8SdUNfLQwFqd7dSLDM-NcqmvjL3wMq8Vtir9pjouvzG1mVvWqKvz9G_Il_35T-hvr39BWEt_NU%21/dl4/d5/L2dBISEvZ0FBIS9nQSEh/    https://web.archive.org/web/20220523162212/https://ewnews.com/not-yet-min-of-health-still-monitoring-schools-for-full-face-to-face-return-3-feet-social-distancing-still-in-effect    https://web.archive.org/web/20220523162343/https://ewnews.com/status-quo-maintained-face-to-face-learning-and-national-examinations-to-remain-in-place-says-hanna-martin"
"19","Bahamas","BHS",2022-05-03,"Latin_America_Caribbean","C2: Workplace closing","2G","1G","Ministry of Health covid report update 17th May 2022 employees are encouraged to work from home, but non-essential businesses appear to be open with C19 protocols in place including mask mandate, increased sanitisation, social distancing. Guidance is available for  businesses regarding safe re-opening. Across all islands there is a restriction on Indoor dining which ""may continue provided that all persons are fully vaccinated or have a valid negative rapid antigen test and capacity is limited to 75 percent.""     Links:  https://web.archive.org/web/20220523162459/https://www.bahamas.gov.bs/wps/wcm/connect/70ff8665-16cc-4c35-96c8-802b7232eb0a/Update+%23782+-+Ministry+of+Health+%26+Wellness+-+COVID-19+Report+%2822%29.pdf?MOD=AJPERES    https://web.archive.org/web/20220523163522/https://www.bahamas.gov.bs/wps/wcm/connect/8b3203da-226e-438b-8330-20311fbe1401/Gazette+-+COVID+Prevention+%26+Management+Rules+Amendment+No+10.pdf?MOD=AJPERES    https://web.archive.org/web/20220523163642/https://www.bahamas.gov.bs/wps/wcm/connect/bc135f6a-cba9-45f0-84ed-ee29c5c3443c/MoH+COVID-19+Workplace+Reopening+Guidelines+%26+Assessment+v9+%5B23.7.2020%5D+%283%29.pdf?MOD=AJPERES"
"20","Bahamas","BHS",2022-05-03,"Latin_America_Caribbean","C3: Cancel public events","1G","1G","Health rules amendment 10, effective 31-Mar-22 public events are premitted, including  weddings/funerals, but with restrictions and C19 protocols. It appears that many events require authorisation from the Ministry with details of gathering size, etc    Links:  https://web.archive.org/web/20220523163522/https://www.bahamas.gov.bs/wps/wcm/connect/8b3203da-226e-438b-8330-20311fbe1401/Gazette+-+COVID+Prevention+%26+Management+Rules+Amendment+No+10.pdf?MOD=AJPERES"
"21","Bahamas","BHS",2022-05-03,"Latin_America_Caribbean","C4: Restrictions on gatherings","3G","3G","Social gatherings with not more than 40 people indoors and 100 people outdoors are permitted. Attendees must wear masks and adhere to social distancing protocols    Links:  https://web.archive.org/web/20220523163740/https://www.bahamas.com/travelupdates"
"22","Bahamas","BHS",2022-05-03,"Latin_America_Caribbean","C5: Close public transport","1G","1G","Domestic travel is open, but with covid-19 protocols in place including social distancing and face mask requirements    Link:  https://web.archive.org/web/20220523163740/https://www.bahamas.com/travelupdates"
"23","Bahamas","BHS",2022-05-03,"Latin_America_Caribbean","C6: Stay at home requirements","1G","1G","No policy change. There is still a recommendation for employees to stay at home (still valid as of 21st May 22) but there is freedom to roam on all islands. In addition, if receive a positive C19 test result isolation is required for 5-14 days.    “If a person tests positive, they will be required to follow up with a COVID-19 RT-PCR Test.   If a person test negative with the follow-up COVID-19 RT-PCR Test, they are permitted to continue with their vacation.  If a person test positive with the follow-up COVID-19 RT-PCR Test, they will be required to isolate for 5-14 days depending on the severity of the symptoms.”    Links:  https://web.archive.org/web/20220523163905/https://www.bahamas.gov.bs/wps/wcm/connect/32969f5b-4c3c-4b23-96a8-82c6d459105f/Update+%23786+-+Ministry+of+Health+%26+Wellness+-+COVID-19+Report+%2862%29.pdf?MOD=AJPERES    https://web.archive.org/web/20220523163740/https://www.bahamas.com/travelupdates"
"24","Bahamas","BHS",2022-05-03,"Latin_America_Caribbean","C7: Restrictions on internal movement","0","0","Domestic travel is open, but with covid-19 protocols in place including social distancing and face mask requirements. There is 'freedom to roam' on all islands.    Links:  https://web.archive.org/web/20220523163740/https://www.bahamas.com/travelupdates      Links:  https://web.archive.org/web/20220523163740/https://www.bahamas.com/travelupdates"
"25","Bahamas","BHS",2022-05-03,"Latin_America_Caribbean","C8: International travel controls","1","1","No policy change, screening for all passengers. Vaccinated. Effective 27 December 2021 those travelling to The Bahamas from other countries who have been fully vaccinated will be required to obtain a negative COVID-19 test (either a Rapid Antigen Test or RT- PCR), taken no more than three days (72 hours) prior to the date of arrival to The Bahamas. The name and address of the lab where the test was performed must be clearly displayed on the test result.     Persons travelling from The Bahamas to another country and returning within a 24-hour period will not be required to undergo a new COVID-19 test to re-enter The Bahamas. Uvaccinated: Effective 27 December 2021, unvaccinated travellers, ages 12 and older, entering The Bahamas must obtain a negative COVID-19 RT-PCR Test (including PCR, NAA, NAAT, TMA or RNA) test taken no more than three days (72 hours) prior to the date of arrival. In addition upon arrival, unvaccinated travellers must complete a Daily Health Questionnaire: Unvaccinated persons, ages 12 and older, travelling into and throughout The Bahamas will be required to complete a short daily Health Questionnaire during their stay.    Links:  https://web.archive.org/web/20220523163740/https://www.bahamas.com/travelupdates"
"26","Bahamas","BHS",2022-05-03,"Latin_America_Caribbean","E1: Income support","0","0","No evidence found for C19 household financial support measures.    Links:  https://web.archive.org/web/20220523164030/https://www.bahamas.gov.bs/wps/portal/public/fina/MOF/%21ut/p/b1/vVTbcqM4FPyW_ECQENdHbsbcxEUgsF8oG4fYsjHYJsbw9UOmpmo3qd3MPMyM9KQ63dV9-pwSt-YKbn3e3A-vm_7Qnjen9_daKhGwA00TlCDkUxU40ICSl4m26fAzYDUDwP8cDXzk22KoACeT00gTeWAbgMu5YrmadLN1BssiZXfbNVSifJg4KdMqoMSrQlN5D-fWHkRM3TKGX6bIjbXd7uhPR1OO7QbU6tttJC1PTFKE9LJIa7krdKl8pOdy29vb2iJdrwPn5bQc8RVX3ZuT2iCemIQ6tHpr9XMuplZ_iA-HIcj3WNhFvrhvmxLqfF0MWHj60ecXjXyVE4Cf-UCC_Dvf16mrQkD4X8v5C4Gf8HNu_RHyHw6-A74a5c-GiZdt88KtZpj8L5ivibOXUPSRt4B8JnIpVwChJGzsnOk4JQw8PMzcCJs0BCnFmJkp3tqAYBv2vjEAkzoBMx6BqSGcxojgKNrRJNM1rdYOTP0s-KF5QATwpwU_BeHBvy2I_mqk87r9ccFPSxPxv13Q5daHbfM8VM0zeEY8VGRB5mUgIxVCgaPuanyYrau9f0r73N3smpuMq8XqYiBiOQQXN78vtowOs-nXPlde1kHQF0nZVNnOdh_TtUfm7HsQcBE1N_1hJFiwm3HYPtLBxonFti2mlyCv_SMs6-V92MjH9uS1IS2RsIiEUyghudbD9JCdvKoCkXS_6OK5uirt00fvospLvCQhXoASL4oSR-ecYqYMrUeaIWM0xuT17qu1nwZXShQ5omnejgFyPbiCnsG8FFqQWMcbIWPnW3uKMxZOY-9O5J6wwZm843WeRYzrCO2EDuyFS2s3mSF5hkLHpT-pS5zhwoz8IRorZTHGm_OiISdt0etVuX6AJMu0KLhsmPb0xHVNdvc8X0qWA1T-uaiZi98ATeM2kg%21%21/dl4/d5/L2dJQSEvUUt3QS80SmtFL1o2XzMwR01BQTQ4TUc1TzgwSVU3VFBBNTIwR0Mw/"
"27","Bahamas","BHS",2022-05-03,"Latin_America_Caribbean","E2: Debt/contract relief","0","0","No evidence found for C19 fiscal support measures.    Links:  https://web.archive.org/web/20220523164030/https://www.bahamas.gov.bs/wps/portal/public/fina/MOF/%21ut/p/b1/vVTbcqM4FPyW_ECQENdHbsbcxEUgsF8oG4fYsjHYJsbw9UOmpmo3qd3MPMyM9KQ63dV9-pwSt-YKbn3e3A-vm_7Qnjen9_daKhGwA00TlCDkUxU40ICSl4m26fAzYDUDwP8cDXzk22KoACeT00gTeWAbgMu5YrmadLN1BssiZXfbNVSifJg4KdMqoMSrQlN5D-fWHkRM3TKGX6bIjbXd7uhPR1OO7QbU6tttJC1PTFKE9LJIa7krdKl8pOdy29vb2iJdrwPn5bQc8RVX3ZuT2iCemIQ6tHpr9XMuplZ_iA-HIcj3WNhFvrhvmxLqfF0MWHj60ecXjXyVE4Cf-UCC_Dvf16mrQkD4X8v5C4Gf8HNu_RHyHw6-A74a5c-GiZdt88KtZpj8L5ivibOXUPSRt4B8JnIpVwChJGzsnOk4JQw8PMzcCJs0BCnFmJkp3tqAYBv2vjEAkzoBMx6BqSGcxojgKNrRJNM1rdYOTP0s-KF5QATwpwU_BeHBvy2I_mqk87r9ccFPSxPxv13Q5daHbfM8VM0zeEY8VGRB5mUgIxVCgaPuanyYrau9f0r73N3smpuMq8XqYiBiOQQXN78vtowOs-nXPlde1kHQF0nZVNnOdh_TtUfm7HsQcBE1N_1hJFiwm3HYPtLBxonFti2mlyCv_SMs6-V92MjH9uS1IS2RsIiEUyghudbD9JCdvKoCkXS_6OK5uirt00fvospLvCQhXoASL4oSR-ecYqYMrUeaIWM0xuT17qu1nwZXShQ5omnejgFyPbiCnsG8FFqQWMcbIWPnW3uKMxZOY-9O5J6wwZm843WeRYzrCO2EDuyFS2s3mSF5hkLHpT-pS5zhwoz8IRorZTHGm_OiISdt0etVuX6AJMu0KLhsmPb0xHVNdvc8X0qWA1T-uaiZi98ATeM2kg%21%21/dl4/d5/L2dJQSEvUUt3QS80SmtFL1o2XzMwR01BQTQ4TUc1TzgwSVU3VFBBNTIwR0Mw/"
"28","Bahamas","BHS",2022-05-03,"Latin_America_Caribbean","H1: Public information campaigns","2G","2G","C19 information available on Ministry or Health and Wellness webpage plus there is  a facebook page.    Links:  https://web.archive.org/web/20220523200435/https://www.bahamas.gov.bs/wps/portal/public/!ut/p/b1/vdPNzqIwFAbga5kLUFqqgEugIKBARUBgY4ooAiL4w-_Vj5PMZjL5vtlM6Fk1eZMnb3IOEzEBE91pm6X0nVV3evv1j7gjAmtTFBeCabPuCuhQhtzGWwIBc8yBCbSwW2FBT1URH-XirQk3eTaUVzNX2pxaT1XRMtYiOVWl-Nie3JqvKZZpJCZU2OYGCLXnJUiovfFx46zToxwVdubbzz5Kmhgl2r3JJVK4oI8EY19hyBKWKEUZcz5Inb4me_Fx6AOjTxZmvRl8tMvay-a8tl-JU-UX8oRCanVlLN8_ZcJPGfDFE8G_u0Z_RtZLwAHdI1uR8BprL8DvwDdE-AnwXyM84zIBWBz3-VDrYzE6-bgDpuvrlhuOcPS6VzEeLFdB1ptCF4cQxF5nei9gjiZ6j47lJhpJfMeTRExwOjTfg_vtYlpQcLmpQTQxiMDUIDs1uJwYNKbeUvT_79Bgoiwu592pnIP5EkDIIigsWcRzPMv4xinrcaV3io6v_nDHz4tT-j3JdtdeVW-k3nhsAzm6qglmlXqcbflZwmuWPzqJ2FkR1VZcH0BdQbKxlU7d7ezhFtrlWQ4ko8qcx7K3Yza9da04a7mjgK8PS-UsMTTU3bsBxeU0EK25VneUD_qBXg_DatbMOu1R55LMWFpVnpm6bLecI8C_BqU_fgL5DQkR/dl4/d5/L2dBISEvZ0FBIS9nQSEh/"
"29","Bahamas","BHS",2022-05-03,"Latin_America_Caribbean","H2: Testing policy","3","3","PCR testing appears widely available and can be booked via a Government website, although query whether is now freely available on all islands. There are numerous covid testing sites, mostly with pre-booked appointments only and some restricted to tourists.    Links:  https://web.archive.org/web/20220523200051/https://covidtest.gov.bs/    https://web.archive.org/web/20220523163740/https://www.bahamas.com/travelupdates"
"30","Bahamas","BHS",2022-05-03,"Latin_America_Caribbean","H3: Contact tracing","2","2","No policy change. Press release on May 12, 2022 regarding increased C19 cases in schools suggests contact tracing is happening ""The Ministry wishes to further advise that contact tracing is an integral part of investigating cases and their possible linkages to others, which allows for the activation of isolation or quarantine measures ""    Links:  https://web.archive.org/web/20220523162101/https://www.bahamas.gov.bs/wps/portal/public/news%20and%20press%20release/health%20officials%20respond%20to%20increasing%20positive%20covid-19%20cases%20in%20new%20providence%20schools/%21ut/p/b1/vZTbjqM4EIafpR-AwcYcL0kcgjmHGALcRCSQkHRDIOH89JvRtrQa7U73zWxcV1X6ra_0u8pswkZsUqX95Zy2l1uVfvzME3GP1q69WfKyLYu8AgikDsErD60RZHdsZMV753DbDJj4p9HPXdNdV1F0f8TMmIcXbRy03bCKhVjJ0d2nKKn6j9KwOj0H2y6HKOtP64OwPgb3xwXKOzrHlt-SKW3HSSFFEeJm-1jRHi-DZ7KW9iTNC270i1PeVlLs88cdVm9Oz-9N_EFrDefXTrhEi-B8vWX-qPaP27Psk2IKykay-PMuBJ5aNghYW0dfEO6-1bRKZ8ZiiH1zCZWodmm3p0UhkpTRo2Hfup7uWafCqdK2kp1Kvz8YlB7ObVdVzLAXZEU8PI2Kn0aB3xwV_O0jWNuq-vTR5ehPH5dQNAMByFj8vP-F4Nt3SH5FrAUgAhJ4lupJOufy4FPwVYtfN8mz8VMg_V4gsZSNAL_fXqeazO-zf503wKYhcWg8wzkYHu_zzqEr5LQppDiG4BAMdvAA9myjdvYdmuleFvrBQsUePk_d18Ctxb8WKFPx1UD0YiACrwZyrwYKLwYar55S9Of30GCTy6H8MRzLH-CHACDkEJQFDkmixLGhcbyM-EaGFcFFOFX4fvLLcPQum2LUtA-vNgOug2Kq1B7mVvXMWBKTSboTzn6mDk6S6oo4RpCs0NKwFsfhIw9wD90yX0YL43bxG2F0D9z5Y-hVphf3Mi4aRxMdNTa0TduB99Nx8vSuuFXoOpFdWuwmhemYQW_q62LJOvqtzL9xbPFfUz89gsJx8IYD14CzsfV0THO2rfGsHUeIQ7K9-pY9r8D2ukZbh346pqpBNJ2_-7nE1wLlBXw1UPrfgSaHnkALWY68hNs1ejFQ_vND88uayQriFEECMi9DAQLIhm3ASIeHPWBvCC3_RpudK2W5rHfau7lL46takPpiTtleBwnhXN2qIc9jRJbQ4y3zrszB8aQgsOeV2S2TzmthYpzcCWsjE9Wrqtej2aZq885HplryB2OUD3eIvJ4ot-OCxOnq1rgd44VaUIQX0IFuARvDx1bfGyWoDvFSjwURi_ZxsBvD0iQ6ub3JJbZy1Eii2LUrbmRKQpAlQNNoNpQ0O9IL01t1m1GXPLiAnFJRtWllFPfCYsJq0ndRs4gTBeh108w5I8SdUNfLQwFqd7dSLDM-NcqmvjL3wMq8Vtir9pjouvzG1mVvWqKvz9G_Il_35T-hvr39BWEt_NU%21/dl4/d5/L2dBISEvZ0FBIS9nQSEh/"
"31","Bahamas","BHS",2022-05-03,"Latin_America_Caribbean","H6: Facial Coverings","3G","3G","No policy change,. Face masks are mandatory in public places. ""Wear a face mask and physical distance when in public places: When travelling in a taxi or on a bus, when standing in lines, when entering any establishment, while entering or exiting a restaurant / When entering and exiting beaches (not required on the beach) / Before and after exercise (masks must be visible on your person during exercise)""    Links:  https://web.archive.org/web/20220523190742/https://opm.gov.bs/covid19/"
"32","Bahamas","BHS",2022-05-03,"Latin_America_Caribbean","H7: Vaccination policy","5G","5G","Update on 10th May to add booster vaccine appointments to Government website. No other policy change, vaccines are available to all ages 12 and over.    Links:  https://web.archive.org/web/20220523194608/https://www.bahamas.gov.bs/wps/portal/public/news%20and%20press%20release/upgrade%20to%20covid-19%20online%20vaccination%20site%20accommodates%20scheduling%20of%202nd%20booster%20doses/%21ut/p/b1/vZbJrqM4GEafpR6AwmYwsGQwM87EENggAiQkAUJyw_j0nVJXq1Xqrns33bFXlj7r2Me_LdMJvaeTNhvOp-x5vrVZ_WOcoJQ1Vt5G5URPRJwELOgTS8Nr1mAhHdF7M5CU_LYZtXXvuNOcVJ6744uqFXQO2Zdsoz2MZOU9V0eJCq4o2iak7VHCK3ONGYmpRNAHwl3ZRWCo4mTKegdHdjhYA5KtAwc5ZqPqnChwbrOEFDyQDEyBf3x-1KZQ369m3RJDEBE8LfhKtqrZGdnjww7X8U1TSwPLoRvKhltl-uwHV1udnjFjVyU8XCiJTYPlsLrDopchqfK01OQ6vj4frTNh7ypN5wYPNTW2WZkwDc774UChAy7O_uPIjpm4lJddWh4fGkhds_O-vWTFL1ngN00Gf7oEhifLL5crxv_hUoXICXggaujn_E8CX5zFF_O5r88y-XWJBg8QsIK1K68Fk1lx4Gfgsy1-vknuqwCi41dA-H1AoH16D7h0d5k7a7ku28uyAZ4fWsSPF7gE48d1iYiPWfLMoK_FEByC0Qs-gLd47HPZEr8w10W4DRRZW2unuf8cuHO59wJFH70byL4ZyIJ3A5l3A_k3A-13Vyn7399Dm07Oh-b7mDffwXceQMiwUOQZVkACQ4d2fp60mzViS6vCudUex20TTuvzppp0vV53TsD0EGVSt9YY3C2UK1CFYJJw2RbySJLMlNC0hxZmVdtV8rEuA22Aq6ZU94p9O2_v_LQ6MKd6HGRqQKmoVXeiIyLHtr559uB6zOe12Ve3lr3MVpRV0SxRPTWa9-6iqDQxb035hTHlX6p-t_iYY8iVdyFmZh8_Xlrw4hU76GmFBbXQ3fkYeC97O39Ldk__L2OjPhXRVy8Xei9QVOC7gcL_DnQY9gV0WZeIKtwZ7JuB4n9fNL9cM1FiGYkXgMiJkIcA0uEzEIXg4_WbcxnH6EqBtP4G7Ffyh8xeGPw4G-EwR6S7SmlmmcHNMc4PqX0Kpp_yl4BiBvdRjaZX8suKyXu3HjN-jyuf43pevWwfkC1UPDmJi2a04u-JlGfuJKb9VDh6bN720TNQcFFQsk5uU0i4c8DlSqbmERdKHGEqfqisXFxaNtY2SXQxbAQFtGoUI7COein2back1d2KN1JXb25Zg1Un7k6ecDSSKtZtg4kfY5IPaXS87OtGHzyj2ez1dGa502ENtDjnkT-C8D7s--QQcFxFUic02QDp-nDwhckUJUPcokGgpFOIp2tc0l0zOI6LtvhI_tm5jPq7x9_-AI7unkk%21/dl4/d5/L2dBISEvZ0FBIS9nQSEh/"
"33","Bahamas","BHS",2022-05-03,"Latin_America_Caribbean","H8: Protection of elderly people","0","0","No evidence of policy change. No evidence of additional protections.    Links:  https://web.archive.org/web/20220523194747/https://www.bahamas.gov.bs/wps/portal/public/%21ut/p/b1/vZXJkqM4EIafpR_AbYmdI2Yxq9ht4EKAwTabbcBme_p2TffERE1Fdc2hx9JJ6M_4lD-p1DpaB-vokgzFKbkX10tSv60jKsbB1uA4gjFMzGOBAnlIaT4JGIFa79eBHI6swCgniRNi_tSXuXs-0vuzUYpDmaBOEuUCQ1aZSJs0Hg7ejb4lAp9EXJYweimNZskO3aOWpLaem-lqjljEXevgxmDHqMlil9T7yYvE2GhSztdbKctKtpxUtVnVmSIeEg-dtV3ma_lq5oEPOjDuSyfJH_csIfCtKXtddDiObXtUuG_fngmFz4TAJ4MD_8pXw_BnvjquI4aHLkb_iv_UEOJn_NY0bP65zVDE27aHFEG08C0OP8R_APy3-M8FX_6v6L1kSwIKKL6lcxYtYyYBfgl-Z9HvIcRXAmodPgX05wJ67a0DQMRuOd-UpVqccrGB4e0U5IULXPyxr5Y98kQc3RPoCSEEqT8afg-MxcDvi4O8TLayneNvOMESTvPj90BXJ14LZDzq1UD8xUAcvBqIvRpIvhiovrpK8T9_D9V1VKTN9_HQfAffSQAhhkOGxHCaorH1Tg3HSeiVUeD4uDqR-ZZZ9a5S1GHrADsRJ6TqpaM09V1nLqdHbSJyzujnARY340aUJluJnALJEHEe6ZvDWOe-MECzcfhgg66F09Zk3CfNkaOCiLwMTGbI9v66J71K4qHMJ-wS-QcKSw65bFyiVk5wMozHmJPEFM_6t9cDydcm_8K1zcfKByO8CxutB-MMRTAZi-f-5RpyEBISAJ7f0KIs7tNZr3RMlw3-du0o2rb2VfeiXgtkNvDVQPp_B75_h7f4i4HMny-ad1eNYXGMJWnAEAwkIYDrXe0zU9obo2DNmtRAdNPrVEw8FWhOSmChGqkPlfeLSkHSFFu9m96yBx3YMnMpmAOB07LozX0c7D3WBFOZ3E1A7y2oVckFPHBpOG7Gao5ofhVOyumQ55Jl2BCe4zyYVylNX2ArnZR6g9m92EbCLkZypfmj7bWLXReqVrZDbtLuHc1sYYXTmdK6MjmA6nTtl8a8uXp26edcJE9Wp52danuZsEp2hmkhUT0M8T2qT13acGG7n3dj5Rj7qczK2he1lr7NgsA_Ko0emt3cBbGw2hVxjtfzCt8sD_q9byzLQkiSgAA0ZAFJvfWo-WePEp1YdTAG3cioCvnabrRz5G_Phue4ROWqTtbG6tx5lodnF4eGd6WouHnzPNYO71jhaQf_GANj4wl1Ym8HcVZD5aAQ_aQpR5OaC4cRzvnlmscTbd8Pk1HaqdxVZb6T546fqqFY1B5GGBPN3X01zXHndBgWYlpPYAkcaC_zGFLnj_j61gyapumUIx7Rx0kkq39mujyb3A8Nt2cd/dl4/d5/L2dBISEvZ0FBIS9nQSEh/"
"34","Belize","BLZ",2022-05-09,"Latin_America_Caribbean","C1: School closing","2G","2G","No change in policy     https://web.archive.org/web/20220522210717/https://www.pressoffice.gov.bz/wp-content/uploads/2019/12/SI-No-37-of-2022-Public-Health.pdf     https://web.archive.org/web/20220522210856/https://www.pressoffice.gov.bz/statutory-instruments/"
"35","Belize","BLZ",2022-05-09,"Latin_America_Caribbean","C2: Workplace closing","2G","2G","No change in policy     https://web.archive.org/web/20220522210717/https://www.pressoffice.gov.bz/wp-content/uploads/2019/12/SI-No-37-of-2022-Public-Health.pdf     https://web.archive.org/web/20220522210856/https://www.pressoffice.gov.bz/statutory-instruments/"
"36","Belize","BLZ",2022-05-09,"Latin_America_Caribbean","C3: Cancel public events","1G","1G","No change in policy     https://web.archive.org/web/20220522210717/https://www.pressoffice.gov.bz/wp-content/uploads/2019/12/SI-No-37-of-2022-Public-Health.pdf     https://web.archive.org/web/20220522210856/https://www.pressoffice.gov.bz/statutory-instruments/"
"37","Belize","BLZ",2022-05-09,"Latin_America_Caribbean","C4: Restrictions on gatherings","0","0","No change in policy     https://web.archive.org/web/20220522210717/https://www.pressoffice.gov.bz/wp-content/uploads/2019/12/SI-No-37-of-2022-Public-Health.pdf     https://web.archive.org/web/20220522210856/https://www.pressoffice.gov.bz/statutory-instruments/"
"38","Belize","BLZ",2022-05-09,"Latin_America_Caribbean","C5: Close public transport","1G","1G","No change in policy     https://web.archive.org/web/20220522205734/https://bz.usembassy.gov/covid-19-information/"
"39","Belize","BLZ",2022-05-09,"Latin_America_Caribbean","C6: Stay at home requirements","0","0","No change in policy"
"40","Belize","BLZ",2022-05-09,"Latin_America_Caribbean","C7: Restrictions on internal movement","1T","1T","No change in policy     https://web.archive.org/web/20220522205734/https://bz.usembassy.gov/covid-19-information/"
"41","Belize","BLZ",2022-05-09,"Latin_America_Caribbean","E1: Income support","0","0","No change in policy     https://web.archive.org/web/20220522205211/https://www.imf.org/en/Topics/imf-and-covid19/Policy-Responses-to-COVID-19"
"42","Belize","BLZ",2022-05-09,"Latin_America_Caribbean","E2: Debt/contract relief","2","2","No change in policy    https://web.archive.org/web/20220522205211/https://www.imf.org/en/Topics/imf-and-covid19/Policy-Responses-to-COVID-19"
"43","Belize","BLZ",2022-05-09,"Latin_America_Caribbean","H1: Public information campaigns","2G","2G","No change in policy    https://web.archive.org/web/20220522205455/https://belizetourismboard.org/news-and-gallery/belize-covid-19-travel-updates/"
"44","Belize","BLZ",2022-05-09,"Latin_America_Caribbean","H2: Testing policy","3","3","No change in policy    https://web.archive.org/web/20220522205734/https://bz.usembassy.gov/covid-19-information/"
