"","CountryName","CountryCode","Date","region","PolicyType","PolicyCode","previous_PolicyCode","Notes"
"1","Albania","ALB",2022-05-05,"Europe_Central_Asia","C1: School closing","1G","1G","No policy change.    https://web.archive.org/web/20220504205256/https://al.usembassy.gov/updates_covid19/"
"2","Albania","ALB",2022-05-18,"Europe_Central_Asia","C1: School closing","0","1G","Schools are fully open with no closure recommendations found.  Source: http://web.archive.org/web/20220531205637/https://en.unesco.org/covid19/educationresponse & http://web.archive.org/web/20220531204648/https://punetejashtme.gov.al/informacion-mbi-levizjen-e-shtetasve-te-huaj-ne-shqiperi/"
"3","Albania","ALB",2022-05-05,"Europe_Central_Asia","C2: Workplace closing","1G","1G","No policy change. Info from the Ministry of Europe and Foreign Affairs indicates that mask wearing is still mandatory indoors:    Wearing the mask indoors as well as on public transport is mandatory. It is recommended to wear the mask wherever social distance can not be maintained, as well as for those who have not yet done the two doses of the vaccine.    https://web.archive.org/web/20220504211639/https://punetejashtme.gov.al/informacion-mbi-levizjen-e-shtetasve-te-huaj-ne-shqiperi/"
"4","Albania","ALB",2022-05-18,"Europe_Central_Asia","C2: Workplace closing","0","1G","No workplace closure recommendations found.  Source: http://web.archive.org/web/20220531204648/https://punetejashtme.gov.al/informacion-mbi-levizjen-e-shtetasve-te-huaj-ne-shqiperi/"
"5","Albania","ALB",2022-05-05,"Europe_Central_Asia","C3: Cancel public events","0","0","Restrictions from previous order have since been removed from the most recent order in effect from May 1.    https://web.archive.org/web/20220504211639/https://punetejashtme.gov.al/informacion-mbi-levizjen-e-shtetasve-te-huaj-ne-shqiperi/"
"6","Albania","ALB",2022-05-18,"Europe_Central_Asia","C3: Cancel public events","0","0","Public events can take place with no restrictions.  Source: http://web.archive.org/web/20220531203719/https://al.usembassy.gov/updates_covid19/ & http://web.archive.org/web/20220531204648/https://punetejashtme.gov.al/informacion-mbi-levizjen-e-shtetasve-te-huaj-ne-shqiperi/"
"7","Albania","ALB",2022-05-05,"Europe_Central_Asia","C4: Restrictions on gatherings","0","0","Restrictions from previous order have since been removed from the most recent order in effect from May 1.    https://web.archive.org/web/20220504211639/https://punetejashtme.gov.al/informacion-mbi-levizjen-e-shtetasve-te-huaj-ne-shqiperi/"
"8","Albania","ALB",2022-05-18,"Europe_Central_Asia","C4: Restrictions on gatherings","0","0","All of the restrictions on gatherings were lifted on May 5th  https://web.archive.org/web/20220530075425/https://partir.ouest-france.fr/albanie/covid-19"
"9","Albania","ALB",2022-05-29,"Europe_Central_Asia","C4: Restrictions on gatherings","0","0","There are no longer any restrictions on gatherings.  Source: http://web.archive.org/web/20220531203719/https://al.usembassy.gov/updates_covid19/ & http://web.archive.org/web/20220531204648/https://punetejashtme.gov.al/informacion-mbi-levizjen-e-shtetasve-te-huaj-ne-shqiperi/"
"10","Albania","ALB",2022-05-05,"Europe_Central_Asia","C5: Close public transport","0","0","No policy change.    https://web.archive.org/web/20220504211639/https://punetejashtme.gov.al/informacion-mbi-levizjen-e-shtetasve-te-huaj-ne-shqiperi/"
"11","Albania","ALB",2022-05-18,"Europe_Central_Asia","C5: Close public transport","0","0","Public transportation is working normally  https://web.archive.org/web/20220530075425/https://partir.ouest-france.fr/albanie/covid-19"
"12","Albania","ALB",2022-05-29,"Europe_Central_Asia","C5: Close public transport","0","0","Public transport is fully open, with a mask requirement.  Source: http://web.archive.org/web/20220531203719/https://al.usembassy.gov/updates_covid19/ & http://web.archive.org/web/20220531204648/https://punetejashtme.gov.al/informacion-mbi-levizjen-e-shtetasve-te-huaj-ne-shqiperi/"
"13","Albania","ALB",2022-05-05,"Europe_Central_Asia","C6: Stay at home requirements","0","0","No evidence of stay at home requirements.    https://web.archive.org/web/20220504211639/https://punetejashtme.gov.al/informacion-mbi-levizjen-e-shtetasve-te-huaj-ne-shqiperi/"
"14","Albania","ALB",2022-05-18,"Europe_Central_Asia","C6: Stay at home requirements","0","0","Cur-few was lifted on the 5th of May  https://web.archive.org/web/20220530075425/https://partir.ouest-france.fr/albanie/covid-19"
"15","Albania","ALB",2022-05-29,"Europe_Central_Asia","C6: Stay at home requirements","0","0","No stay at home requirements.  Source: http://web.archive.org/web/20220531203719/https://al.usembassy.gov/updates_covid19/ & http://web.archive.org/web/20220531204648/https://punetejashtme.gov.al/informacion-mbi-levizjen-e-shtetasve-te-huaj-ne-shqiperi/"
"16","Albania","ALB",2022-05-05,"Europe_Central_Asia","C7: Restrictions on internal movement","0","0","Restrictions from previous order have since been removed from the most recent order in effect from May 1.    https://web.archive.org/web/20220504211639/https://punetejashtme.gov.al/informacion-mbi-levizjen-e-shtetasve-te-huaj-ne-shqiperi/"
"17","Albania","ALB",2022-05-18,"Europe_Central_Asia","C7: Restrictions on internal movement","0","0","All of the domestic and international entry restrictions were lifted on the 5th of May  https://web.archive.org/web/20220530132318/https://al.usembassy.gov/updates_covid19/"
"18","Albania","ALB",2022-05-29,"Europe_Central_Asia","C7: Restrictions on internal movement","0","0","There are no restrictions on internal movement.  Source: http://web.archive.org/web/20220531203719/https://al.usembassy.gov/updates_covid19/"
"19","Albania","ALB",2022-05-05,"Europe_Central_Asia","C8: International travel controls","0","0","Restrictions from previous order have since been removed from the most recent order in effect from May 1.    Starting from May 1, 2022, for all trips to Albania, whether by sea, land or air, no specific document is required under the terms of Covid-19.    https://web.archive.org/web/20220504211639/https://punetejashtme.gov.al/informacion-mbi-levizjen-e-shtetasve-te-huaj-ne-shqiperi/"
"20","Albania","ALB",2022-05-18,"Europe_Central_Asia","C8: International travel controls","0","0","All of the domestic and international entry restrictions were lifted on the 5th of May  https://web.archive.org/web/20220530075425/https://partir.ouest-france.fr/albanie/covid-19"
"21","Albania","ALB",2022-05-29,"Europe_Central_Asia","C8: International travel controls","0","0","There are no longer entry requirements to enter Albania.  Source: http://web.archive.org/web/20220531203719/https://al.usembassy.gov/updates_covid19/"
"22","Albania","ALB",2022-05-05,"Europe_Central_Asia","E1: Income support","0","0","No evidence of income support."
"23","Albania","ALB",2022-05-18,"Europe_Central_Asia","E1: Income support","0","0","No changes from previous policy"
"24","Albania","ALB",2022-05-29,"Europe_Central_Asia","E1: Income support","0","0","No policy found.  Source: http://web.archive.org/web/20220531204453/https://www.ishp.gov.al/"
"25","Albania","ALB",2022-05-05,"Europe_Central_Asia","E2: Debt/contract relief","0","0","No evidence of debt/contract relief."
"26","Albania","ALB",2022-05-18,"Europe_Central_Asia","E2: Debt/contract relief","0","0","No changes from previous policy"
"27","Albania","ALB",2022-05-29,"Europe_Central_Asia","E2: Debt/contract relief","0","0","No policy found.  Source: http://web.archive.org/web/20220531204453/https://www.ishp.gov.al/"
"28","Albania","ALB",2022-05-05,"Europe_Central_Asia","H1: Public information campaigns","2G","2G","Ministry of Health continues to post daily Covid updates.    https://web.archive.org/web/20220504213754/https://shendetesia.gov.al/covid19-ministria-e-shendetesise-502-testime-14-qytetare-te-infektuar-asnje-humbje-jete-dhe-33-te-sheruar-ne-24-oret-e-fundit/"
"29","Albania","ALB",2022-05-18,"Europe_Central_Asia","H1: Public information campaigns","2G","2G","Official websites are not up to date    https://web.archive.org/web/20220530141828/https://coronavirus.al/"
"30","Albania","ALB",2022-05-29,"Europe_Central_Asia","H1: Public information campaigns","2G","2G","National public health institution publishes daily COVID-19 updates on their website.  Source: http://web.archive.org/web/20220531203547/https://www.ishp.gov.al/komunikimi-i-perditshem-per-koronavirusin-30-maj-2022/"
"31","Albania","ALB",2022-05-05,"Europe_Central_Asia","H2: Testing policy","3","3","Are PCR and/or antigen tests available for U.S. citizens in Albania? Yes  If so, are test results reliably available within one calendar day? Yes  Airport Covid-19 PCR test:  Tirana International Airport offers a Covid-19 PCR test for travelers. For more information, visit their website.  Public Health Labs:  Currently, to be tested for COVID-19 by the Albanian public health authority one must have symptoms and a recommendation from the public health authority’s family doctor.  However, private testing labs will perform a test for a fee, and no symptoms or a doctor’s recommendation is required (see details below).  If you have an Albanian social security number, you also have an assigned public health family doctor.  To learn who your public health family doctor is, call the help line at 0-800-4040 to find out.  Tests are free of charge if done by the Albanian Institute of Public Health (IPH).  Private Labs:  Individuals can also arrange private testing by going to a private testing lab. No symptoms or doctor’s order is required to arrange a private test, and no advance appointment is necessary.  According to the Albanian Ministry of Health and Social Protection, there are several private labs authorized to perform SARS-CoV-2 testing for administrative issues. For a full list, please see the Ministry of Health list here.    https://web.archive.org/web/20220504205256/https://al.usembassy.gov/updates_covid19/"
"32","Albania","ALB",2022-05-18,"Europe_Central_Asia","H2: Testing policy","3","3","Generally available.  https://web.archive.org/web/20220530132318/https://al.usembassy.gov/updates_covid19/"
"33","Albania","ALB",2022-05-29,"Europe_Central_Asia","H2: Testing policy","3","3","Currently, to be tested for COVID-19 by the Albanian public health authority one must have symptoms and a recommendation from the public health authority’s family doctor.  However, private testing labs will perform a test for a fee, and no symptoms or a doctor’s recommendation is required.  Source: http://web.archive.org/web/20220531203719/https://al.usembassy.gov/updates_covid19/"
"34","Albania","ALB",2022-05-05,"Europe_Central_Asia","H3: Contact tracing","0","0","No evidence of contact tracing."
"35","Albania","ALB",2022-05-18,"Europe_Central_Asia","H3: Contact tracing","0","0","No changes from previous"
"36","Albania","ALB",2022-05-29,"Europe_Central_Asia","H3: Contact tracing","0","0","No evidence of contact tracing.  Source: http://web.archive.org/web/20220531203719/https://al.usembassy.gov/updates_covid19/ & http://web.archive.org/web/20220531204319/https://coronavirus.al/keshilla/"
"37","Albania","ALB",2022-05-05,"Europe_Central_Asia","H6: Facial Coverings","2G","2G","Wearing the mask indoors as well as on public transport is mandatory. It is recommended to wear the mask wherever social distance can not be maintained, as well as for those who have not yet done the two doses of the vaccine.    https://web.archive.org/web/20220504211639/https://punetejashtme.gov.al/informacion-mbi-levizjen-e-shtetasve-te-huaj-ne-shqiperi/"
"38","Albania","ALB",2022-05-18,"Europe_Central_Asia","H6: Facial Coverings","2G","2G","Required in closed public spaces    https://web.archive.org/web/20220530075425/https://partir.ouest-france.fr/albanie/covid-19"
"39","Albania","ALB",2022-05-29,"Europe_Central_Asia","H6: Facial Coverings","2G","2G","Masks are mandatory in indoor public spaces and on public transport. Masks are recommended wherever social distance can not be maintained, as well as for those who have not yet done the two doses of the vaccine.  Source: http://web.archive.org/web/20220531204648/https://punetejashtme.gov.al/informacion-mbi-levizjen-e-shtetasve-te-huaj-ne-shqiperi/"
"40","Albania","ALB",2022-05-05,"Europe_Central_Asia","H7: Vaccination policy","5G","5G","The Ministry of Health appeals to citizens to be vaccinated as soon as possible, to protect themselves and the health of others. AntiCOVID vaccines reduce the chance of infection and greatly avoid hospitalizations and fatalities.  Every citizen over 12 years old can be vaccinated in health centers.    https://web.archive.org/web/20220504213754/https://shendetesia.gov.al/covid19-ministria-e-shendetesise-502-testime-14-qytetare-te-infektuar-asnje-humbje-jete-dhe-33-te-sheruar-ne-24-oret-e-fundit/"
"41","Albania","ALB",2022-05-29,"Europe_Central_Asia","H7: Vaccination policy","5G","5G","Every citizen over 12 years old can be vaccinated in health centers. Those who have already received two vaccines are encouraged to get their third booster dose and all those over 60 & the immunocompromised can get a fourth dose 4-6 months after their booster. The government is currently administering Pfizer-BioNTech, AstraZeneca-Oxford, Gamaleya and Sinovac vaccines.  Source: http://web.archive.org/web/20220531203547/https://www.ishp.gov.al/komunikimi-i-perditshem-per-koronavirusin-30-maj-2022/ & http://web.archive.org/web/20220531203719/https://al.usembassy.gov/updates_covid19/"
"42","Albania","ALB",2022-05-05,"Europe_Central_Asia","H8: Protection of elderly people","1G","1G","All passengers who are allowed to enter the territory of the Republic of Albania, in addition to respecting the protocols of international standards that airlines apply anywhere in the world, must also apply these rules:    • Only traveling passengers will enter the airport building, avoiding being escorted by their family members;    • Passengers must respect the social distance of 1.5 meters throughout their stay at the airport;    • Priority is given to the elderly, people in need and families with minor children;    https://web.archive.org/web/20220504211639/https://punetejashtme.gov.al/informacion-mbi-levizjen-e-shtetasve-te-huaj-ne-shqiperi/"
"43","Albania","ALB",2022-05-18,"Europe_Central_Asia","H8: Protection of elderly people","1G","1G","No changes"
"44","Albania","ALB",2022-05-29,"Europe_Central_Asia","H8: Protection of elderly people","1G","1G","Priority is given to older people as a recognised older group when travelling through airports.  Source: http://web.archive.org/web/20220531204648/https://punetejashtme.gov.al/informacion-mbi-levizjen-e-shtetasve-te-huaj-ne-shqiperi/"
"45","Austria","AUT",2022-05-16,"Europe_Central_Asia","C1: School closing","2T","2T","At schools in Austria, a PCR test once a week (or antigen test) is generally mandatory for schoolchildren. The mask requirement is no longer applicable for schoolchildren, teaching staff, administrative staff and external persons in the entire school area.    Source:  https://archive.ph/OYeVj#selection-1769.0-1773.149 [Nationwide measures]"
"46","Austria","AUT",2022-05-22,"Europe_Central_Asia","C1: School closing","2T","2T","The nationwide measures remains the same in Austria.      Sources:   https://archive.ph/OYeVj [Nationwide measures]  https://archive.ph/UbxYM [Coronavirus: current measures]"
"47","Austria","AUT",2022-05-16,"Europe_Central_Asia","C2: Workplace closing","2G","2G","At work  In justified cases, stricter regulations that go beyond this ordinance can be provided at the place of professional activity to prevent the further spread of COVID-19.    *Customer areas*  The FFP2 mask requirement applies when entering customer areas of daily life such as pharmacies, banks, post offices, grocery stores and tobacconists.    *Health and social sector*  In business premises and other places where health and care services are provided, patients, visitors, accompanying persons as well as operators, employees and service providers who are in direct contact with patients must wear an FFP2 mask, provided that Risk of infection cannot be minimized by technical protective measures such as the installation of partitions or plexiglass walls.    *Mobile care and support services*  Mobile nursing and care service providers may only enter external workplaces if they can show proof of a low epidemiological risk (vaccinated, recovered or tested) and wear an FFP2 mask when in contact with customers, provided that the risk of infection is not reduced by technical protective measures such as the attachment of Partition walls or plexiglass walls can be minimized.    *Hospitals and health resorts and other places where health services are provided*  In general, the FFP2 mask requirement applies in closed rooms for patients, visitors, accompanying persons as well as for operators, employees and service providers who are in direct contact with patients, provided that the risk of infection cannot be minimized by other suitable protective measures.    The following also applies to employees:   •	Operators may only admit employees if they can provide proof of a low epidemiological risk (vaccinated, recovered or tested).  •	This also applies to external service providers, residents' representatives, patient, disabled and nursing advocates, nursing supervisory bodies or members of established commissions.  The measures provided for in hospitals and sanatoriums and other places where health services are provided must not be disproportionate or lead to unreasonable hardship.    *Retirement and nursing homes as well as inpatient residential facilities for the disabled*  In general, the FFP2 mask requirement applies in closed rooms for visitors, accompanying persons, employees and external service providers in direct contact with residents and for residents (in places that do not belong to their own living area).  The following also applies to employees:   •	Operators may only admit employees if they can provide proof of a low epidemiological risk (vaccinated, recovered or tested).  •	Employees must wear a mask when in direct contact with residents unless the risk of infection can be minimized by technical protective measures such as the installation of partitions or plexiglass walls.  •	This also applies to external service providers, residents' representatives, patient, disabled and nursing advocates, nursing supervisory bodies or members of established commissions.  The measures planned in old people’s and nursing homes, in residential facilities for the disabled and in facilities of the day structures in the care of the elderly and in the area of the disabled must not be disproportionate or lead to unreasonable hardship.    Sources:  https://archive.ph/OYeVj  https://archive.ph/UbxYM"
"48","Austria","AUT",2022-05-22,"Europe_Central_Asia","C2: Workplace closing","2G","2G","The nationwide measures remains the same in Austria.      Sources:   https://archive.ph/OYeVj [Nationwide measures]  https://archive.ph/UbxYM [Coronavirus: current measures]"
"49","Austria","AUT",2022-06-01,"Europe_Central_Asia","C2: Workplace closing","2G","2G","New regulations come into place on 1 June 2022.    At work  In justified cases, stricter regulations that go beyond this ordinance can be provided at the place of professional activity to prevent the further spread of COVID-19.    Customer areas  There are currently no measures for entering customer areas.    Leisure, art and culture, sport  There are currently no specific measures for the areas of leisure, art and culture, or sport.  For meetings of more than 500 people, the measures described under ""Meetings"" apply.    Retirement and nursing homes as well as inpatient residential facilities for the disabled  In closed rooms of retirement and nursing homes, the FFP2 mask requirement applies to visitors, accompanying persons, employees and external service providers in direct contact with residents and for residents (in places that do not belong to their own living area). The FFP2 mask requirement does not apply in residential facilities for the disabled.    The following also applies to employees:   •	Operators may only admit employees if they can provide proof of a low epidemiological risk (vaccinated, recovered or tested). This also applies to external service providers, residents' representatives, patient, disabled and nursing advocates, nursing supervisory bodies or members of established commissions.  •	In old people's and nursing homes, employees must wear an FFP2 mask when they are in direct contact with residents, unless the risk of infection can be minimized by technical protective measures such as the installation of partitions or Plexiglas walls. This also applies to external service providers, residents' representatives, patient, disabled and nursing advocates, nursing supervisory bodies or members of established commissions. The FFP2 mask requirement does not apply to inpatient residential facilities for the disabled.    The measures planned in old people’s and nursing homes, in residential facilities for the disabled and in facilities of the day structures in the care of the elderly and in the area of the disabled must not be disproportionate or lead to unreasonable hardship.    Sources:  https://archive.ph/Rol1W [Novelle zur 2. COVID-19-Basismaßnahmenverordnung]  https://archive.ph/lppBh [Nationwide measures]  https://archive.ph/Y4E2A [Coronavirus: current measures]"
"50","Austria","AUT",2022-05-16,"Europe_Central_Asia","C3: Cancel public events","1G","1G","Gatherings  For gatherings of more than 500 people, the following measures apply:  •	Organizers must appoint a COVID-19 officer and develop and implement a COVID-19 prevention concept. The district administration authority has to randomly check compliance with the COVID-19 prevention concepts. For this purpose, the COVID-19 prevention concept must be kept available for the duration of the meeting and presented to the district administrative authority upon request. Exceptions to this are:  	o	gatherings in private homes,  	o	funerals,  	o	assemblies according to the Assembly Act,  	o	Meetings for professional purposes if these are necessary to maintain professional activity,  	o	meetings of organs of political parties,  	o	meetings of bodies of legal persons,  	o	Meetings under the Labor Constitution Act,  	o	Driving into theatres, concert halls and arenas, cinemas, music halls and cabarets when this is done with multi-track motor vehicles.    Sources:  https://archive.ph/OYeVj  https://archive.ph/UbxYM"
"51","Austria","AUT",2022-05-22,"Europe_Central_Asia","C3: Cancel public events","1G","1G","The nationwide measures remains the same in Austria.      Sources:   https://archive.ph/OYeVj [Nationwide measures]  https://archive.ph/UbxYM [Coronavirus: current measures]"
"52","Austria","AUT",2022-06-01,"Europe_Central_Asia","C3: Cancel public events","1G","1G","Gatherings  A requirement to appoint a COVID-19 officer for gatherings of over 500 people is still in place.    For gatherings of more than 500 people, the following measures apply:  •	Organizers must appoint a COVID-19 officer and develop and implement a COVID-19 prevention concept. The district administration authority has to randomly check compliance with the COVID-19 prevention concepts. For this purpose, the COVID-19 prevention concept must be kept available for the duration of the meeting and presented to the district administrative authority upon request. Exceptions to this are:  	o	gatherings in private homes,  	o	funerals,  	o	assemblies according to the Assembly Act,  	o	Meetings for professional purposes if these are necessary to maintain professional activity,  	o	meetings of organs of political parties,  	o	meetings of bodies of legal persons,  	o	Meetings under the Labor Constitution Act,  	o	Driving into theatres, concert halls and arenas, cinemas, music halls and cabarets if this is done with multi-track motor vehicles.    Sources:  https://archive.ph/Rol1W [Novelle zur 2. COVID-19-Basismaßnahmenverordnung]  https://archive.ph/lppBh [Nationwide measures]  https://archive.ph/Y4E2A [Coronavirus: current measures]"
"53","Austria","AUT",2022-05-16,"Europe_Central_Asia","C4: Restrictions on gatherings","2G","2G","Gatherings  For gatherings of more than 500 people, the following measures apply:  •	Organizers must appoint a COVID-19 officer and develop and implement a COVID-19 prevention concept. The district administration authority has to randomly check compliance with the COVID-19 prevention concepts. For this purpose, the COVID-19 prevention concept must be kept available for the duration of the meeting and presented to the district administrative authority upon request. Exceptions to this are:  	o	gatherings in private homes,  	o	funerals,  	o	assemblies according to the Assembly Act,  	o	Meetings for professional purposes if these are necessary to maintain professional activity,  	o	meetings of organs of political parties,  	o	meetings of bodies of legal persons,  	o	Meetings under the Labor Constitution Act,  	o	Driving into theatres, concert halls and arenas, cinemas, music halls and cabarets when this is done with multi-track motor vehicles.    Sources:  https://archive.ph/OYeVj  https://archive.ph/UbxYM"
"54","Austria","AUT",2022-05-22,"Europe_Central_Asia","C4: Restrictions on gatherings","2G","2G","The nationwide measures remains the same in Austria.      Sources:   https://archive.ph/OYeVj [Nationwide measures]  https://archive.ph/UbxYM [Coronavirus: current measures]"
