"","CountryName","CountryCode","Date","region","PolicyType","PolicyCode","previous_PolicyCode","Notes"
"359","Solomon Islands","SLB",2022-06-14,"East_Asia_Pacific","C2: Workplace closing","2G","2G","No changes.    Hotels (except for residents), bars, nightclubs and restaurants are all closed. Some restaurants are open for takeaways. Shops are generally only open between 8am and 5pm daily (except Sunday).    Retail can operate at 25-percent capacity, but owners, employees, and patrons must be fully vaccinated.    https://web.archive.org/web/20220624151523/https://www.gov.uk/foreign-travel-advice/solomon-islands/coronavirus"
"360","Solomon Islands","SLB",2022-06-25,"East_Asia_Pacific","C2: Workplace closing","2G","2G","Note: Some uncertainty about situation on the ground. Conflicting information about restrictions for workplace, between what the Ministry of Health and Medical Services (MHMS) and the UK government travel advisory for the Solomon Islands states.     MHMS guidance appears to not require vaccinations to enter some workplaces, whereas UK advisory states it is still required.     For now, coded conservatively on the assumption that measures may not have changed as *2G/1G*, unless new information clarifying the picture is found.     Sources:    1.	Solomon Islands Ministry of Health & Medical Services, Health Advisory posted on 16 June 2022, on official Facebook page:     -        Facebook post, showing date it was posted:     http://web.archive.org/web/20220711170107/https://www.facebook.com/photo/?fbid=338325501804847&set=a.187903646847034    -        Zoomed in version:   https://archive.ph/mmQDu    “For business houses…implement COVID-19 measures mentioned above (i.e social distancing, wearing of face masks, hand hygiene, ‘get vaccinated now’). Ensure social distancing is practiced.”    No explicit mention of requiring vaccination cards for entry, which is a change from the MHMS’ previous guidance on 22 April 2022, which had explicitly stated: “For businesses houses…Patrons need to show vaccination card to enter premises.” Uncertain as to whether ‘get vaccinated now’ is supposed to form a vaccine mandate for entry into businesses.     22 April 2022 MHMS directive:     -	Facebook post with graphic (partially obscured by banner): https://archive.ph/CTCjb        -	Entire poster, zoomed in: https://archive.ph/pIG5X     2.	UK travel advisory, Solomon Islands, archived 24 June 2022:     “Only those who are fully (double) vaccinated and can produce evidence of this are permitted to enter shops, Government buildings and use public transport.”    http://web.archive.org/web/20220624150129/https://www.gov.uk/foreign-travel-advice/solomon-islands/coronavirus    Section remains unchanged on UK page archived 6 July 2022: (*Note— This coding update was made on 11 July 2022; consequently unable to link archived pages on other dates between 25 June and 30 June as those pages had not been saved on those dates.)    http://web.archive.org/web/20220706160908/https://www.gov.uk/foreign-travel-advice/solomon-islands/coronavirus    3.	US Embassy for PNG, Solomon Islands and Vanuatu > Solomon Islands > Country Specific Information, archived 25 June 2022:    https://web.archive.org/web/20220625093525/https://pg.usembassy.gov/covid-19-information/     “Most in-country services are operating as normal.” No mention of any vaccination requirement for entry into shops or government buildings, thought it mentions one for public transport, similarly to UK advisory."
"361","Solomon Islands","SLB",2022-07-01,"East_Asia_Pacific","C2: Workplace closing","1G","2G","Coding change to *1G* for 1—11 July 2022, mainly due to Ministry of Health & Medical Services’ most recent health advisory posted on 1 July 2022, which states that workplaces must implement measures like social distancing, but does not mention a requirement for individuals to show their vaccination card to enter workplace premises.     Note: This seems to conflict with information provided by UK travel advisory, but judgment call made here to privilege what is stated on the local authorities’ health advisory for the time-being. Combined with the fact that US embassy travel advisory does not mention such a requirement either.      Subsequent updates/review could monitor or search for information clarifying the matter.      1.	Source: Solomon Islands Ministry of Health & Medical Services, posted 1 July 2022: https://archive.ph/y1gzr     “For business houses and critical infrastructure (shops, banks, restaurants etc.) and public areas (markets etc.): Continue to follow and strengthen the COVID-19 safe practices at the workplaces include maintaining social distancing of at least two meters, hand hygiene and wearing of facemask.”    Wording about workplace measures is notably different from MHMS’ previous guidance on 22 April 2022, which had explicitly stated: “For businesses houses…Patrons need to show vaccination card to enter premises.”     22 April 2022 MHMS guidance:     -	Facebook post with graphic (partially obscured by banner): https://archive.ph/CTCjb        -	Entire poster, zoomed in: https://archive.ph/pIG5X     *NOTE:* Conflicting information from UK travel advisory, which states:    2.	6 July 2022:     https://web.archive.org/web/20220706160908/https://www.gov.uk/foreign-travel-advice/solomon-islands/coronavirus     “Only those travellers who are fully (double) vaccinated and can produce evidence of this are permitted to enter shops, Government buildings and use public transport.”    This advice (exact same phrasing and sentence) has been listed as far as back as the 10 February 2022 version of the travel advisory page; concern that it may be an area that was simply not updated correctly in line with local developments.    10 February 2022:     https://web.archive.org/web/20220210135330/https://www.gov.uk/foreign-travel-advice/solomon-islands/coronavirus     3. US Embassy for PNG, Solomon Islands and Vanuatu > Under Solomon Islands section — does not mention vaccine mandate for entering shops and other workplaces:    25 June 2022:     https://web.archive.org/web/20220625093525/https://pg.usembassy.gov/covid-19-information/     11 July 2022:     https://web.archive.org/web/20220711105819/https://pg.usembassy.gov/covid-19-information/"
"362","Solomon Islands","SLB",2022-06-14,"East_Asia_Pacific","C3: Cancel public events","0","0","Domestic restrictions removed by the end of May 2022. No new restrictions reported.    https://web.archive.org/web/20220613205935/https://www.sibconline.com.sb/borders-to-reopen-on-july-1st/    https://web.archive.org/web/20220613204531/https://www.gov.uk/foreign-travel-advice/solomon-islands/entry-requirements    https://web.archive.org/web/20220624145109/https://pg.usembassy.gov/covid-19-information/"
"363","Solomon Islands","SLB",2022-06-25,"East_Asia_Pacific","C3: Cancel public events","1G","0","For 25 June—30 July 2022, coded *1G*, primarily due to the precautions stated by the Ministry of Health & Medical Services (MHMS) in a 16 June 2022 advisory, where people were told to practice 2m social distancing and the authorities issued a recommendation to avoid organising events, despite earlier government announcement on 23 May 2022 that had suggested total lifting of domestic restrictions.     16 June 2022 advisory is the most recent/closest health guidance to be found that likely applies for this period (the next update was issued only on 1 July 2022):    1.	Government announcement on 23 May 2022: “domestic restrictions will be lifted by the end of May 2022…[including] restrictions on mass gatherings such as churches, weddings, sporting activities, night clubs and lifting restrictions on international cargo vessels.”    https://web.archive.org/web/20220613205935/https://www.sibconline.com.sb/borders-to-reopen-on-july-1st/     2.	16 June 2022 Solomon Islands Ministry of Health & Medical Services, Health Advisory, posted on official Facebook page:     https://web.archive.org/web/20220708053301/https://www.facebook.com/photo/?fbid=338325501804847&set=a.187903646847034       -	Zoomed in version showing full advisory w/o Facebook banner blocking it:     https://archive.ph/mmQDu       “Although the situation in Honiara is showing signs of a reduction in COVID-19 cases, we expect that there may be new infections reported in Honiara due to the easing of public health restrictions, opening of schools, mass gatherings and the international borders.”    “FOR EVERYONE:  Practice physical distancing of at least 2 meters apart. Avoid going to areas that have a lot of people. Avoid organizing any social events attracting mass gathering.”"
"364","Solomon Islands","SLB",2022-07-01,"East_Asia_Pacific","C3: Cancel public events","1G","1G","Coding retained at *1G* for 1—11 July 2022, due to government advisory asking the public to maintain 2m social distancing wherever possible, which would presumably apply at a public event. There does not seem to be a requirement to completely cancel some or all events, but simply to modify them for COVID-19 situation; evidence of a public event (Independence Day celebrations) going ahead during this period.    1.	Source: Solomon Islands Ministry of Health & Medical Services, posted 1 July 2022: https://archive.ph/y1gzr     No mention of public events being cancelled but instead: “Public is encouraged to continue practicing physical distancing of at least 2 meters whenever possible.”     2.	Independence day celebrations seem to have gone ahead, though more muted than in pre-pandemic times. Mentions of parade and concert. (Published 5 July 2022).     “Low Key Celebrations for 44th Anniversary.”     http://web.archive.org/web/20220709074031/https://www.solomontimes.com/news/low-key-celebrations-for-44th-anniversary/11957"
"365","Solomon Islands","SLB",2022-06-14,"East_Asia_Pacific","C4: Restrictions on gatherings","0","0","Domestic restrictions removed by the end of May 2022. No new restrictions reported.    https://web.archive.org/web/20220613205935/https://www.sibconline.com.sb/borders-to-reopen-on-july-1st/    https://web.archive.org/web/20220613204531/https://www.gov.uk/foreign-travel-advice/solomon-islands/entry-requirements    https://web.archive.org/web/20220624145109/https://pg.usembassy.gov/covid-19-information/"
"366","Solomon Islands","SLB",2022-06-25,"East_Asia_Pacific","C4: Restrictions on gatherings","0","0","Coded *0* for the entire period of 25 June—11 July 2022, because while the government has advised people to generally observe 2m social distancing or even recommended that people avoid organizing large events, it *has not* placed any numerical cap on group size limits, unlike the way it had previously done.     Have not found any other sources listing restrictions on group sizes during this period or any vaccine-differentiation in relation to this indicator.    The Ministry of Health & Medical Services issued two advisories that likely cover this period. First one was issued earlier on 16 June 2022, and then the next on 1 July 2022, with the following rules:     1.	Solomon Islands Ministry of Health & Medical Services, Health Advisory posted on 16 June 2022:     https://archive.ph/mmQDu    “Although the situation in Honiara is showing signs of a reduction in COVID-19 cases, we expect that there may be new infections reported in Honiara due to the easing of public health restrictions, opening of schools, mass gatherings and the international borders.”    “FOR EVERYONE: Practice physical distancing of at least 2 meters apart. Avoid going to areas that have a lot of people. Avoid organizing any social events attracting mass gathering.”    2.	Next advisory — Solomon Islands Ministry of Health & Medical Services, posted 1 July 2022    https://archive.ph/y1gzr     No mention of limits on group size, and advice to avoid organizing gatherings is removed. Advisory states: “Public is encouraged to continue practicing physical distancing of at least 2 meters whenever possible.”     3.	Evidence of large event being permitted to go ahead during this period, which members of the public were invited to join without mentions of having to observe group-size limits:    Independence Day celebrations (Published 5 July 2022).     http://web.archive.org/web/20220709074031/https://www.solomontimes.com/news/low-key-celebrations-for-44th-anniversary/11957     “The Independence Working Committee is preparing the Maranatha Hall at Burns Creek in East Honiara this week to host the thanksgiving service on Thursday 7 July from 8:00am to11:30am.    Prior to the service, a float parade to be led by the Royal Solomon Islands Police Band and Cultural Drum Beaters will proceed from White River to the Maranatha Hall. Government Ministries, Schools and other selected groups will join the parade from Point Cruz.    Members of the public are also invited to join the celebrations in prayer during the service.    Meanwhile, a mini live string band concert is also organized at the National Museum grounds which will feature selected string bands representing the 9 provinces.”"
"367","Solomon Islands","SLB",2022-06-14,"East_Asia_Pacific","C5: Close public transport","2G","2G","Is public transportation operating? Yes, with strict limits on the number of passengers. All passengers must be fully vaccinated and carry a vaccination certificate.    https://web.archive.org/web/20220624145109/https://pg.usembassy.gov/covid-19-information/"
"368","Solomon Islands","SLB",2022-06-14,"East_Asia_Pacific","C6: Stay at home requirements","0","0","No specific restrictions or curfews reported.    https://web.archive.org/web/20220624145109/https://pg.usembassy.gov/covid-19-information/"
"369","Solomon Islands","SLB",2022-06-25,"East_Asia_Pacific","C6: Stay at home requirements","0","0","No coding change. No evidence of curfews or lockdowns reported for the entire period of 25 June—11 July. Domestic flights between different parts of the country/islands are operating without mention of any disruptions/lockdowns in certain places.     Sources:     1.	Solomon Islands Ministry of Health & Medical Services, posted 1 July 2022; no mentions of any curfews or movement restrictions.     https://archive.ph/y1gzr     2.	US Embassy for PNG, Solomon Islands & Vanuatu > Solomon Islands > Movement Restrictions:    “Is a curfew in place? No.”  “Are there restrictions on intercity or interstate travel? No.”    25 June 2022: http://web.archive.org/web/20220625093525/https://pg.usembassy.gov/covid-19-information/     6 July 2022: https://archive.ph/DyyAq#selection-3223.0-3239.4     11 July 2022: http://web.archive.org/web/20220711105819/https://pg.usembassy.gov/covid-19-information/     3.	Solomon Airlines posted domestic flight schedule for 6 June 2022—31 July 2022    http://web.archive.org/web/20220706102914/https://www.flysolomons.com/library/articlecontent/revised-domestic-schedule-from-6-jun-2022-to-31-jul-2022.pdf"
"370","Solomon Islands","SLB",2022-06-14,"East_Asia_Pacific","C7: Restrictions on internal movement","0","0","No reports of current restrictions on internal movement.    https://web.archive.org/web/20220624151503/https://pg.usembassy.gov/covid-19-information/"
"371","Solomon Islands","SLB",2022-06-25,"East_Asia_Pacific","C7: Restrictions on internal movement","1G","0","Most recent government advisory issued presumed to apply to this period recommends against unnecessary domestic travel, and for people to take COVID-19 tests and vaccinations before travelling. However, note that the language used phrases these as *suggestions or recommendations*, rather than mandatory for internal travel.     Accordingly, coded *1G* for the period 25—30 June 2022.     Sources:     1.	Solomon Islands Ministry of Health COVID-19 advisory, posted on official Facebook page on 16 June 2022 (the next government advisory was released on 1 July 2022):    https://web.archive.org/web/20220708053301/https://www.facebook.com/photo/?fbid=338325501804847&set=a.187903646847034        -	Zoomed in version showing full advisory w/o banner blocking it:     https://archive.ph/mmQDu     “[The Ministry of Health] is issuing the following advice to *all residents in Honiara as well as across the country* to strictly observe COVID-19 safe measures of…”    “FOR EVERYONE: Avoid unnecessary travel as it may lead to spread of infection, especially if you have COVID-19 symptoms. It is applicable to both public and inter-provincial travel.”     “DOMESTIC TRAVEL: Only travel if it is necessary. For all persons travelling inter islands, it is strongly advised to get tested and only proceed to travel once results return negative with proof of complete vaccination card.”    2.	US Embassy for PNG, Solomon Islands & Vanuatu > Solomon Islands >  Movement Restrictions:     “Are there restrictions on intercity or interstate travel? No.”    Archived 25 June 2022:     http://web.archive.org/web/20220625093525/https://pg.usembassy.gov/covid-19-information/"
"372","Solomon Islands","SLB",2022-07-01,"East_Asia_Pacific","C7: Restrictions on internal movement","1G","1G","No coding change for period of 1—11 July 2022. Interprovincial travel is permitted, but government specifically suggests that individuals who have symptoms or may be exposed to COVID-19 avoid travelling.     On 1 July 2022, the Ministry of Health and Medical Services issued another advisory on COVID-19 measures:    “It is not mandatory to undertake a COVID-19 test for inter-provincial travel, but you should reconsider your travel if you are experiencing COVID-19 symptoms or if you have been exposed to someone diagnosed with COVID-19.”     Links:    1. 	Ministry of Health advisory, posted on official Facebook page:     https://archive.ph/h1XjZ     Zoomed in version of full text of advisory, without banner obscuring bottom text:    https://archive.ph/pnIHo     http://web.archive.org/web/20220712153724/https://scontent.fsin15-1.fna.fbcdn.net/v/t39.30808-6/291317723_348903770747020_7738610304995631180_n.jpg?_nc_cat=108&ccb=1-7&_nc_sid=730e14&_nc_ohc=-MtapdWMr20AX_KTACG&_nc_ht=scontent.fsin15-1.fna&oh=00_AT-0WrLXisH5EDjVwLMq3RLeLjUI5qMBJOktA6ZmmiDNAg&oe=62D2D912     2.	US Embassy for PNG, Solomon Islands & Vanuatu > Solomon Islands >  Movement Restrictions— similarly states there are no restrictions on domestic travel on multiple dates during this period.      “Are there restrictions on intercity or interstate travel? No.”    Archived 6 July 2022:    https://web.archive.org/web/20220706093214/https://pg.usembassy.gov/covid-19-information/     Archived 11 July 2022:    https://web.archive.org/web/20220711105819/https://pg.usembassy.gov/covid-19-information/"
"373","Solomon Islands","SLB",2022-06-14,"East_Asia_Pacific","C8: International travel controls","4","4","With the continued outbreak of COVID-19 in Honiara no scheduled international flights are currently operating. With the permission of the Prime Minister’s Office and the Solomon Island Government’s Oversight Committee, it may be possible to enter on the Wednesday and Friday Solomon Airlines flights from Brisbane.    You must be vaccinated at least 15 days prior to arrival in Solomon Islands and you must be able to provide documentary evidence of your vaccination.    Quarantine is mandatory and is currently set at 10 days. Non-Solomon Island citizens must pay for their quarantine costs.     https://web.archive.org/web/20220624145820/https://www.gov.uk/foreign-travel-advice/solomon-islands/entry-requirements"
"374","Solomon Islands","SLB",2022-06-25,"East_Asia_Pacific","C8: International travel controls","4","4","No coding change for entire period of 25—30 June 2022. Coded *4* (unvaccinated) / *2* (vaccinated). Entry requirements are as follow:     1.	Must have proof of being *fully-vaccinated*. 2nd vaccine dose must have been taken at least *4 weeks* before date of travel. Unvaccinated or partially-vaccinated travellers banned; no option to test or quarantine in lieu of vaccination.    2.	Vaccinated travellers must quarantine for 6 days upon arrival. No option to test out of quarantine early.     *Additional note:* Formally, the government states that borders are closed. Even for vaccinated travellers, entry is in practice extremely restrictive, because:     1. Travellers (even fully vaccinated) must first apply for entry permission from the Prime Minister’s Office and the Solomon Islands Government Oversight Committee.    2. Most international flights have been suspended; only one international flight route still operating to the Solomon Islands, from Brisbane, Australia. Twice weekly flight, and places are limited.     Sources:    1.	US Embassy for PNG, Solomon Islands and Vanuatu > See under “Solomon Islands” section > Entry and Exit Requirements [Archived 25 June 2022]    http://web.archive.org/web/20220625093525/https:/pg.usembassy.gov/covid-19-information/     “Are U.S. citizens permitted to enter? Yes, but with strict requirements for pre-approval for travel.”    Are health screening procedures in place at airports and other ports of entry? Yes, all arriving passengers are required to complete quarantine at a government-assigned site.    “Is there a vaccination requirement? Yes. All travelers age 18 and older must be fully vaccinated to enter the Solomon Islands. The final dose of the vaccination must be received four weeks prior to the travel date.”    2.	UK travel advisory, 24 June 2022:     https://web.archive.org/web/20220624145657/https:/www.gov.uk/foreign-travel-advice/solomon-islands/entry-requirements     “With the continued outbreak of COVID-19 in Honiara no scheduled international flights are currently operating. With the permission of the Prime Minister’s Office and the Solomon Island Government’s Oversight Committee, it may be possible to enter on the Wednesday and Friday Solomon Airlines flights from Brisbane. Numbers are, though, strictly limited.”    3.	Stuff.NZ article:    https://archive.ph/WJgXA#selection-843.1-843.108     “[Prime Minister] Sogavare said that from June 1, all vaccinated travellers arriving in Honiara will quarantine for six days.”    4.	Solomon Islands government press release, 28 June 2022. Mentions quarantine requirement for vaccinated travellers will remain until 1 July 2022, whereby borders will formally reopen.     http://web.archive.org/web/20220706104045/https:/solomons.gov.sb/solomon-islands-lift-travel-restrictions-starting-july-1/"
"375","Solomon Islands","SLB",2022-07-01,"East_Asia_Pacific","C8: International travel controls","3","4","Policy change. On 1 July 2022, the Solomon Islands formally reopened its borders to international travel.     Entry requirements are as follow:    1.	Vaccine requirement: Travellers 18 and older must have proof of being fully-vaccinated. Fully-vaccinated travellers no longer need to quarantine; however must show negative PCR test 72 hours before travel. The Solomon Islands authorities’ definition of “fully-vaccinated” is for the second dose to have been completed at least *4 weeks* earlier.     2.	Unvaccinated or partially vaccinated travellers still banned. Only exceptions are for: children below 18 and those with medical contraindications to being vaccinated.    Accordingly, coding change to 3/1    -	*3* (ban) for unvaccinated as borders have formally reopened.    -	*1* (screening) for vaccinated due to removal of quarantine, as vaccination certificates and PCR tests constitute forms of screening.     Sources:     1.	ABC News, reported 1 July 2022:     http://web.archive.org/web/20220708130908/https://www.abc.net.au/news/2022-07-01/solomon-islands-re-opens-after-china-deal/101198914     2.	Solomon Times newspaper, reported 28 June 2022     http://web.archive.org/web/20220708131407/https://www.solomontimes.com/news/solomon-islands-opens-its-borders-today/11952     “After more than 800 days, the Solomon Islands will reopen its border on 01 July with all existing quarantine requirements to be immediately discontinued.    Announcing the news, Solomon Islands Prime Minister, Manesseh Sogavare said While quarantine will be dropped, visitors will still need to be fully vaccinated and a negative PCR test result actioned 72 hours prior to arrival.”     http://web.archive.org/web/20220712113708/https://www.solomontimes.com/news/quarantinefree-solomon-islands-to-fully-reopen-border-on-01-july/11942    3.	Solomon Islands Ministry of Health & Medical Services, posted 1 July 2022 on official Facebook page.    https://archive.ph/y1gzr     “5. Incoming International Travellers: All incoming international passengers… must produce one negative PCR test within 72 hours before travelling into the country. All incoming international passengers must be fully vaccinated except for children less than 18 years and those not eligible for vaccination due to contraindications. All incoming travellers still need to complete the pre-departure questionnaires.”     4.	US Embassy, travel Advisory for PNG, Solomon Islands and Vanuatu,     Archived version on 8 July 2022:     http://web.archive.org/web/20220708131307/https://pg.usembassy.gov/covid-19-information/#solomon     Archived version on 11 July 2022:     http://web.archive.org/web/20220711105819/https:/pg.usembassy.gov/covid-19-information/"
"376","Solomon Islands","SLB",2022-06-14,"East_Asia_Pacific","E1: Income support","0","0","No changes."
"377","Solomon Islands","SLB",2022-06-14,"East_Asia_Pacific","E2: Debt/contract relief","0","0","No changes."
"378","Solomon Islands","SLB",2022-06-14,"East_Asia_Pacific","H1: Public information campaigns","1G","1G","There are reports that the Health Ministry is not updating Covid information as often since its last update.    https://web.archive.org/web/20220613201623/https://www.solomonstarnews.com/mhms-fail-to-update-the-countrys-covid-status/"
