"","CountryName","CountryCode","Date","region","PolicyType","PolicyCode","previous_PolicyCode","Notes"
"1","United Arab Emirates","ARE",2022-02-18,"Middle_East_North_Africa","C2: Workplace closing","1G","1G","2/27/2022    From 3rd January 2022, unvaccinated employees will not be allowed entry to federal government entities starting. Moreover, federal government entities must adhere to the guidelines issued by the competent authorities and urge their employees to take the COVID-19 vaccine as soon as possible to be allowed to enter their workplace.    The authority also instructed all federal government entities to regulate procedures relating to COVID-19 positive employees and contact tracing by using, as a reference, FAHR's instruction manual on ways of dealing with employees who are suspected or confirmed of having COVID-19 and those who came into contact with positive cases in the workplace. Federal government entities must also abide by the mechanisms for registering such cases, as well as vaccinated employees and remote work applications, in federal government-approved electronic systems.    https://web.archive.org/web/20220101172632/https://www.wam.ae/en/details/1395303007682"
"2","United Arab Emirates","ARE",2022-02-15,"Middle_East_North_Africa","C3: Cancel public events","0","1G","2/22/2022  Effective 15 Feb 2022: The Supreme Committee of Crisis & Disaster Management, The National Emergency Crisis and Disasters Management Authority (NCEMA) announced that all activities, events and social gatherings in the country will gradually return to full capacity with each Emirate dictating the capacity limits. Social distancing in places of worship will be reduced to one metre and all visitors must have a Green Pass on their Al Hosn app or a negative PCR test no more than 96 hours old to enter any sports venue.    https://web.archive.org/web/20220227140328/https://www.khaleejtimes.com/coronavirus/covid-19-uae-to-lift-capacity-restrictions-from-tomorrow-all-you-need-to-know"
"3","United Arab Emirates","ARE",2022-02-15,"Middle_East_North_Africa","C4: Restrictions on gatherings","0","3G","2/22/2022  Effective 15 Feb 2022: The Supreme Committee of Crisis & Disaster Management, The National Emergency Crisis and Disasters Management Authority (NCEMA) announced that all activities, events and social gatherings in the country will gradually return to full capacity with each Emirate dictating the capacity limits. Social distancing in places of worship will be reduced to one meter and all visitors must have a Green Pass on their Al Hosn app or a negative PCR test no more than 96 hours old to enter any sports venue.      https://web.archive.org/web/20220227140328/https://www.khaleejtimes.com/coronavirus/covid-19-uae-to-lift-capacity-restrictions-from-tomorrow-all-you-need-to-know"
"4","United Arab Emirates","ARE",2022-02-15,"Middle_East_North_Africa","C6: Stay at home requirements","0","1G","2/22/2022  Effective 15 Feb 2022: The Supreme Committee of Crisis & Disaster Management, The National Emergency Crisis and Disasters Management Authority (NCEMA) announced that all activities, events and social gatherings in the country will gradually return to full capacity with each Emirate dictating the capacity limits.  https://web.archive.org/web/20220227140328/https://www.khaleejtimes.com/coronavirus/covid-19-uae-to-lift-capacity-restrictions-from-tomorrow-all-you-need-to-know"
"5","United Arab Emirates","ARE",2022-02-18,"Middle_East_North_Africa","C7: Restrictions on internal movement","1T","1G","21/2/22  Are there restrictions on intercity or interstate travel? Yes  Travelers entering Abu Dhabi at land borders are required to undergo an Exponential Deep Examination (EDE) scan to determine whether they have COVID-19. The test involves a device being held up to the traveler’s face for a few seconds.  If it detects possible COVID-19 infection, the traveler will undergo an antigen test on site, with results in about 20 minutes. More information is available at mediaoffice.abudhabi .    https://web.archive.org/web/20220220092350/https://ae.usembassy.gov/covid-19-information/#:~:text=All%2520travelers%2520from%2520the%2520US,48%2520hours%2520prior%2520to%2520departure."
"6","United Arab Emirates","ARE",2022-02-26,"Middle_East_North_Africa","C7: Restrictions on internal movement","1G","1T","2/27/2022  Effective from 26th February 2022, The National Authority for Emergency, Crisis and Disaster Management (NCEMA) said UAE-bound vaccinated travelers are not required to present a PCR test ahead of their travels. Instead, travelers need to present an approved Covid-19 vaccination certificate containing a QR code. Unvaccinated individuals, however, must present an approved PCR examination result 48 hours ahead of their travels. Unvaccinated persons can also present a certificate of recovery from a Covid-19 infection within one month from the date of travel containing a system QR code.     https://web.archive.org/web/20220227160021/https://gulfnews.com/uae/covid-19-uae-residents-welcome-scrapping-of-pcr-test-for-vaccinated-arrivals-1.86031391"
"7","United Arab Emirates","ARE",2022-02-26,"Middle_East_North_Africa","C8: International travel controls","1","1","2/27/2022    Effective 26th February 2022, the committee has approved the removal of the green list system, for international travelers coming to the UAE capital, as well as the removal of PCR testing requirements. Fully-vaccinated passengers coming to the UAE will only need to show an approved vaccination certificate with a readable QR code.     https://web.archive.org/web/20220227160021/https://gulfnews.com/uae/covid-19-uae-residents-welcome-scrapping-of-pcr-test-for-vaccinated-arrivals-1.86031391"
"8","United Arab Emirates","ARE",2022-02-18,"Middle_East_North_Africa","E1: Income support","0","0","No change.  https://web.archive.org/web/20211220100250/https://www.imf.org/en/Topics/imf-and-covid19/Policy-Responses-to-COVID-19"
"9","United Arab Emirates","ARE",2022-02-18,"Middle_East_North_Africa","E2: Debt/contract relief","0","0","No change.  https://web.archive.org/web/20211220100250/https://www.imf.org/en/Topics/imf-and-covid19/Policy-Responses-to-COVID-19"
"10","United Arab Emirates","ARE",2022-02-18,"Middle_East_North_Africa","H1: Public information campaigns","1G","2G","No Change.    https://web.archive.org/web/20220226202643/https://www.weqaya.ae/en"
"11","United Arab Emirates","ARE",2022-02-26,"Middle_East_North_Africa","H2: Testing policy","1","1","2/28/2022    Effective 26 February 2022,   The National Authority for Emergency, Crisis and Disaster Management (NCEMA) said UAE-bound vaccinated travelers are not required to present a PCR test ahead of their travels. Instead, travelers need to present an approved Covid-19 vaccination certificate containing a QR code. Unvaccinated individuals, however, must present an approved PCR examination result 48 hours ahead of their travels. Unvaccinated persons can also present a certificate of recovery from a Covid-19 infection within one month from the date of travel containing a system QR code.     https://web.archive.org/web/20220227160021/https://gulfnews.com/uae/covid-19-uae-residents-welcome-scrapping-of-pcr-test-for-vaccinated-arrivals-1.86031391"
"12","United Arab Emirates","ARE",2022-02-18,"Middle_East_North_Africa","H3: Contact tracing","2","2","2/28/2022  No Change.  The UAE's Ministry of Health and Prevention (MOHAP) launched in Jan 24- 27 at Arab Health 2022 surveillance through the electronic system (SPHERE), which is imperative for the rapid response required to combat infectious diseases that will help contact tracing and mitigate future pandemic-like situations. This technology will monitor data and information to assess the burden and distribution of health risks, prioritising public health actions in the UAE.    https://web.archive.org/web/20220228120853/https://mohap.gov.ae/en/media-center/news/24/1/2022/ministry-of-health-launches-sphere-platform-to-strengthen-early-surveillance-of-future-pandemics"
"13","United Arab Emirates","ARE",2022-02-26,"Middle_East_North_Africa","H6: Facial Coverings","2G","2G","Effective 26th February 2022,  Wearing of face masks is now optional in open spaces, The Supreme Committee of Crisis and Disaster Management in Dubai announced. However, it remains mandatory in public indoor spaces, in line with the National Emergency Crisis and Disasters Management Authority’s (NCEMA) announcement on updates to COVID-19 precautionary measures in the country.    https://web.archive.org/web/20220227160021/https://gulfnews.com/uae/covid-19-uae-residents-welcome-scrapping-of-pcr-test-for-vaccinated-arrivals-1.86031391"
"14","United Arab Emirates","ARE",2022-02-18,"Middle_East_North_Africa","H7: Vaccination policy","5G","5G","No Change.  All health services related to vaccination are free of charge. The vaccine can be given to everyone starting from the age of 16 years. However, it is recommended to give priority for vaccination to those at highest risk of contracting the infection.    https://web.archive.org/web/20220228123527/https://covid19.ncema.gov.ae/en/page/about-the-vaccine"
"15","United Arab Emirates","ARE",2022-02-18,"Middle_East_North_Africa","H8: Protection of elderly people","1G","1G","No Change.    https://web.archive.org/web/20220228124857/https://www.dha.gov.ae/en/Covid19/Pages/CaringElderlyFamilyMembers.aspx"
"16","United Arab Emirates","ARE",2022-02-18,"Middle_East_North_Africa","V1: Vaccine Prioritisation","-3","-3","21/2/22  In November 2021, Ministry of Health and Prevention (MoHaP) approved the emergency local use of Pfizer vaccine for children between the ages of 5 and 11 following clinical trials and a strict assessment.    https://archive.vn/oCcXd#selection-995.0-1003.93"
"17","United Arab Emirates","ARE",2022-02-18,"Middle_East_North_Africa","V2: Vaccine Availability","22165","21823","21/2/22  In November 2021, Ministry of Health and Prevention (MoHaP) approved the emergency local use of Pfizer vaccine for children between the ages of 5 and 11 following clinical trials and a strict assessment.    https://archive.vn/oCcXd#selection-995.0-1003.93"
"18","United Arab Emirates","ARE",2022-02-22,"Middle_East_North_Africa","V2: Vaccine Availability","23645","22165",NA
"19","United Arab Emirates","ARE",2022-02-18,"Middle_East_North_Africa","V3: Vaccine Financial Support","22165","21823","Free"
"20","United Arab Emirates","ARE",2022-02-22,"Middle_East_North_Africa","V3: Vaccine Financial Support","23645","22165","Free"
"21","United Arab Emirates","ARE",2022-02-18,"Middle_East_North_Africa","V4: Mandatory Vaccination","22165","21823","From 3 August, all students over the age of 16 years must be vaccinated for COVID-19 to attend school in person.   16 August 2021    Over 15s can get vaccinated     https://archive.vn/KiWkG"
"22","United Arab Emirates","ARE",2022-02-22,"Middle_East_North_Africa","V4: Mandatory Vaccination","23645","22165","mandates for schools"
"23","Bahrain","BHR",2022-02-15,"Middle_East_North_Africa","C1: School closing","1G","1G","Starting February 15th ""Bahrain will transition to the ‘green' level of restrictions on Tuesday, the government said, lifting all restrictions for both vaccinated and non-vaccinated individuals.""  https://web.archive.org/web/20220213155338/https://www.argusmedia.com/en/news/2301531-bahrain-to-lift-covid19-curbs-despite-high-cases"
"24","Bahrain","BHR",2022-02-15,"Middle_East_North_Africa","C2: Workplace closing","1G","2G","Starting February 15th ""Bahrain will transition to the ‘green' level of restrictions on Tuesday, the government said, lifting all restrictions for both vaccinated and non-vaccinated individuals.""  https://web.archive.org/web/20220213155338/https://www.argusmedia.com/en/news/2301531-bahrain-to-lift-covid19-curbs-despite-high-cases"
"25","Bahrain","BHR",2022-02-15,"Middle_East_North_Africa","C3: Cancel public events","1G","2G","Starting February 15th ""Bahrain will transition to the ‘green' level of restrictions on Tuesday, the government said, lifting all restrictions for both vaccinated and non-vaccinated individuals.""  https://web.archive.org/web/20220213155338/https://www.argusmedia.com/en/news/2301531-bahrain-to-lift-covid19-curbs-despite-high-cases"
"26","Bahrain","BHR",2022-02-15,"Middle_East_North_Africa","C4: Restrictions on gatherings","2G","3G","Starting February 15th ""Bahrain will transition to the ‘green' level of restrictions on Tuesday, the government said, lifting all restrictions for both vaccinated and non-vaccinated individuals.""  https://web.archive.org/web/20220213155338/https://www.argusmedia.com/en/news/2301531-bahrain-to-lift-covid19-curbs-despite-high-cases"
"27","Bahrain","BHR",2022-02-15,"Middle_East_North_Africa","C6: Stay at home requirements","1G","1G","(Continued)  Is a curfew in place? No, but the government advises citizens to refrain from interacting with people or attending social gatherings.    https://web.archive.org/web/20211122081303/https://healthalert.gov.bh/en/category/what-we-advise  https://web.archive.org/web/20220131220003/https://bh.usembassy.gov/covid-19-information/"
"28","Bahrain","BHR",2022-02-15,"Middle_East_North_Africa","C8: International travel controls","2","2","Continued)  - All unvaccinated arrivals aged 12 years and above, must quarantine for 10 days.     -All vaccination certificates issued from GCC countries, or issued by countries which Bahrain has signed a mutual vaccination recognition agreement, or issued by countries whose citizens are eligible for a visa on arrival will be accepted upon entry, or containing a QR code for vaccines approved by the World Health Organization, or the Kingdom of Bahrain, will be accepted upon entry will be accepted.    - Fully vaccinated: completed 14 days after the second dose in a two-dose vaccination series (e.g. Pfizer, Moderna, AstraZeneca, etc.) or completed 14 days after administration of a single dose for single-dose vaccination series (e.g. Johnson & Johnson).    - All passengers and airline staff are screened at all entry points of the airport and at travel gates.  - All travelers arriving in the Kingdom of Bahrain aged 6 years and above are required to:  1. Present a verified PCR test certificate bearing a QR code, administered no more than 72 hours before boarding the inbound flight.   2. Take a PCR test upon arrival.  3. Recently recovered passengers (age 6 years and above) are not required to present a negative PCR test before departure. In lieu of a negative PCR test, passengers who have recently recovered from a COVID-19 infection can present documentary proof in the form of a recovery certificate or a positive PCR test taken no later than 14 days prior to departure and no earlier than 30 days prior to departure. Passengers are still required to undergo a PCR test on arrival in Bahrain.    https://web.archive.org/web/20220130141228/https://www.bahrainairport.bh/covid-19-travel-information"
"29","Bahrain","BHR",2022-02-15,"Middle_East_North_Africa","H1: Public information campaigns","2G","2G","Coordinated public information is available and regularly updated.    https://web.archive.org/web/20211122081303/https://healthalert.gov.bh/en/category/what-we-advise"
"30","Bahrain","BHR",2022-02-15,"Middle_East_North_Africa","H2: Testing policy","3","3","COVID-19 tests through the 444 hotline are free for citizens and residents of Bahrain.    https://web.archive.org/web/20220131220003/https://bh.usembassy.gov/covid-19-information/"
"31","Bahrain","BHR",2022-02-15,"Middle_East_North_Africa","H3: Contact tracing","2","2","All arrivals to Bahrain must activate the 'BeAware Bahrain' application.    https://web.archive.org/web/20220130141228/https://www.bahrainairport.bh/covid-19-travel-information"
"32","Bahrain","BHR",2022-02-15,"Middle_East_North_Africa","H6: Facial Coverings","4G","4G","The current COVID Alert level is yellow. It is required to wear a mask indoors at all times. Mask wearing is mandatory outdoors during Yellow, Orange, and Red levels.    https://web.archive.org/web/20220131220003/https://bh.usembassy.gov/covid-19-information/"
"33","Bahrain","BHR",2022-02-15,"Middle_East_North_Africa","H7: Vaccination policy","5G","5G","Citizens and residents of Bahrain can now register for the Pfizer-BioNTech, Sinopharm, AstraZeneca, or Sputnik V COVID-19 vaccines on the Ministry of Health’s website.    https://web.archive.org/web/20220131220003/https://bh.usembassy.gov/covid-19-information/"
"34","Bahrain","BHR",2022-02-15,"Middle_East_North_Africa","H8: Protection of elderly people","2G","2G","Bahrain has launched mobile units providing home vaccinations against COVID-19 for the elderly and people with special needs. Bahrain’s official news agency BNA said that the service is the first of its kind in the region and is offered by medical teams who make home visits to the people who cannot make it to the vaccination centres and give them the jabs.    https://web.archive.org/web/20210406052034/https://gulfnews.com/world/gulf/bahrain/bahrain-launches-mobile-covid-19-vaccination-service-1.76481985"
"35","Bahrain","BHR",2022-02-15,"Middle_East_North_Africa","V2: Vaccine Availability","22157","21345",NA
"36","Bahrain","BHR",2022-02-15,"Middle_East_North_Africa","V3: Vaccine Financial Support","22157","21345",NA
"37","Bahrain","BHR",2022-02-15,"Middle_East_North_Africa","V4: Mandatory Vaccination","22157","21345",NA
"38","Djibouti","DJI",2022-02-17,"Middle_East_North_Africa","C1: School closing","1G","1G","""Schools have resumed in-person classes.""    https://web.archive.org/web/20220216120454/https://crisis24.garda.com/alerts/2022/01/djibouti-authorities-maintaining-covid-19-related-domestic-and-international-travel-restrictions-as-of-jan-17-update-23"
"39","Djibouti","DJI",2022-02-17,"Middle_East_North_Africa","C2: Workplace closing","1G","1G","""Domestically, most businesses are operating; however, social distancing measures and other requirements to prevent the further spread of COVID-19 remain in force.""    https://web.archive.org/web/20220216120454/https://crisis24.garda.com/alerts/2022/01/djibouti-authorities-maintaining-covid-19-related-domestic-and-international-travel-restrictions-as-of-jan-17-update-23"
"40","Djibouti","DJI",2022-02-17,"Middle_East_North_Africa","C3: Cancel public events","2G","2G","""Public gatherings of more than 10 people remain prohibited.""    https://web.archive.org/web/20220216120454/https://crisis24.garda.com/alerts/2022/01/djibouti-authorities-maintaining-covid-19-related-domestic-and-international-travel-restrictions-as-of-jan-17-update-23"
"41","Djibouti","DJI",2022-02-17,"Middle_East_North_Africa","C4: Restrictions on gatherings","4G","3G","""Public gatherings of more than 10 people remain prohibited.""    https://web.archive.org/web/20220216120454/https://crisis24.garda.com/alerts/2022/01/djibouti-authorities-maintaining-covid-19-related-domestic-and-international-travel-restrictions-as-of-jan-17-update-23"
"42","Djibouti","DJI",2022-02-17,"Middle_East_North_Africa","C5: Close public transport","1G","1G","""Public transport has resumed operation, albeit with limitations on the number of passengers allowed on buses, trains, and other public transport vehicles.""    https://web.archive.org/web/20220216120454/https://crisis24.garda.com/alerts/2022/01/djibouti-authorities-maintaining-covid-19-related-domestic-and-international-travel-restrictions-as-of-jan-17-update-23"
"43","Djibouti","DJI",2022-02-17,"Middle_East_North_Africa","C6: Stay at home requirements","1G","0","Since most business and activities are open it seems that there is no stay at home requirements.   ""Hotels, restaurants, and leisure and amusement sites are operating, as are conference venues, event halls, and cinemas. Schools have resumed in-person classes.""    https://web.archive.org/web/20220216120454/https://crisis24.garda.com/alerts/2022/01/djibouti-authorities-maintaining-covid-19-related-domestic-and-international-travel-restrictions-as-of-jan-17-update-23"
"44","Djibouti","DJI",2022-02-17,"Middle_East_North_Africa","C7: Restrictions on internal movement","1G","0","Most public places are open so it seems there are little restrictions on internal mouvement.   ""Retail shops, grocery stores, and places of worship have reopened. Hotels, restaurants, and leisure and amusement sites are operating, as are conference venues, event halls, and cinemas.""    https://web.archive.org/web/20220216120454/https://crisis24.garda.com/alerts/2022/01/djibouti-authorities-maintaining-covid-19-related-domestic-and-international-travel-restrictions-as-of-jan-17-update-23"
"45","Djibouti","DJI",2022-02-17,"Middle_East_North_Africa","C8: International travel controls","1","2","Travellers entering the country must show a negative negative COVID-19 PCR test 72 hours prior entering the country; and will be tested up arrival.  ""All passengers over the age of 11 leaving or entering Djibouti, including those who have been vaccinated, must show a negative result from a COVID-19 PCR test taken within 72 hours of boarding any flight bound for Djibouti and not more than 120 hours prior to their arrival at Ambouli International Airport (JIB). All travelers entering the country will also be tested for COVID-19 upon arrival and must wait at the port of entry until the results become available.""    https://web.archive.org/web/20220216120454/https://crisis24.garda.com/alerts/2022/01/djibouti-authorities-maintaining-covid-19-related-domestic-and-international-travel-restrictions-as-of-jan-17-update-23"
"46","Djibouti","DJI",2022-02-17,"Middle_East_North_Africa","E1: Income support","0","0","No support found"
"47","Djibouti","DJI",2022-02-17,"Middle_East_North_Africa","E2: Debt/contract relief","0","0","No support found"
"48","Djibouti","DJI",2022-02-17,"Middle_East_North_Africa","H1: Public information campaigns","2G","2G","Coordinated public campaign to raise awareness about COVID-19.    http://web.archive.org/web/20220101162250/https://covid19.gouv.dj/"
"49","Djibouti","DJI",2022-02-17,"Middle_East_North_Africa","H2: Testing policy","2","2","The Government of Djibouti offers COVID-19 tests at King Fahd and has a pop-up site near the Treasury. While the test itself is free, a negative COVID-19 test certificate costs 5,000 Fdj or $30. Additionally, you may pay 5,000 Fdj to request a test be conducted at your residence. Test results are delivered by phone.    https://web.archive.org/web/20220101162250/https://covid19.gouv.dj/  https://web.archive.org/web/20220101161354/https://dj.usembassy.gov/covid-19-information/  https://web.archive.org/web/20220101161426/https://www.garda.com/crisis24/news-alerts/557591/djibouti-authorities-maintaining-covid-19-related-domestic-and-international-travel-restrictions-as-of-dec-17-update-2"
"50","Djibouti","DJI",2022-02-17,"Middle_East_North_Africa","H3: Contact tracing","0","0","No policy update.    https://web.archive.org/web/20220101162250/https://covid19.gouv.dj/  https://web.archive.org/web/20220101161354/https://dj.usembassy.gov/covid-19-information/  https://web.archive.org/web/20220101161426/https://www.garda.com/crisis24/news-alerts/557591/djibouti-authorities-maintaining-covid-19-related-domestic-and-international-travel-restrictions-as-of-dec-17-update-22"
"51","Djibouti","DJI",2022-02-17,"Middle_East_North_Africa","H6: Facial Coverings","3G","2G","""wearing of a mask Wearing a mask is compulsory in all public or private spaces in which social distancing cannot be observed.""    https://web.archive.org/web/20210116095233/https://www.presidence.dj/texte.php?ID=2020-080&ID2=2020-05-10&ID3=D%E9cret&ID4=9&ID5=2020-05-14&ID6=n#:~:text=Article%25201%2520%253A%2520Le%2520pr%25C3%25A9sent%2520d%25C3%25A9cret,l'ensemble%2520du%2520territoire%2520national.&text=Le%2520port%2520du%2520masque%2520est,sociale%2520ne%2520peut%2520%25C3%25AAtre%2520observ%25C3%25A9e."
"52","Djibouti","DJI",2022-02-17,"Middle_East_North_Africa","H7: Vaccination policy","5G","5G","""This donation, coordinated by COVAX, will help protect the population of Djibouti, including persons under the age of 18, from the COVID-19 virus and prevent the further spread of the virus’ new strains. The U.S. Government fully supports the Djiboutian authorities’ vaccination efforts and encourages everyone to get vaccinated.""    https://web.archive.org/web/20220105155650/https://dj.usembassy.gov/united-states-donates-pfizer-covid-19-vaccines-to-djibouti/"
"53","Djibouti","DJI",2022-02-17,"Middle_East_North_Africa","H8: Protection of elderly people","0","0","No measures found"
"54","Djibouti","DJI",2022-02-17,"Middle_East_North_Africa","V1: Vaccine Prioritisation","-3","-3","Djibouti currently has supplies of AstraZeneca, Sinovac, and Sputnik V and Johnson & Johnson. Individuals ages 18 and above are currently eligible to be vaccinated. Vaccinations are being conducted at the Palais de Peuple. To be vaccinated, eligible individuals must appear at a vaccination site and present evidence of identity such as a passport or valid residence card.    https://web.archive.org/web/20220101162250/https://covid19.gouv.dj/  https://web.archive.org/web/20220101161354/https://dj.usembassy.gov/covid-19-information/  https://web.archive.org/web/20220101161426/https://www.garda.com/crisis24/news-alerts/557591/djibouti-authorities-maintaining-covid-19-related-domestic-and-international-travel-restrictions-as-of-dec-17-update-22"
