countryname,countrycode,region,startdate,enddate,policytype,policyvalue,flag,new_level,prev_level,initialnote
Jamaica,JAM,Latin_America_Caribbean,20200615,,C8: International travel controls,1,.,1.,4.,"Minister of Tourism, Hon Edmund Bartlett and Health and Wellness Minister, Hon Christopher Tufton announce the June 15 full reopening of Jamaica’s borders to international travel.  http://archive.fo/5z5mQ      They were required to undergo health screening and risk assessment, including temperature checks and an interview by a health officer.  http://archive.vn/JOFVU      Access to island is limited to a contained corridor for visitors:  https://web.archive.org/web/20200620131132/https://jis.gov.jm/covid-19-resilient-corridor-established-for-tourists/"
Puerto Rico,PRI,Latin_America_Caribbean,20200616,,C4: Restrictions on gatherings,3,1,3G,4G,"""In a press conference at one of the main movie theaters in the San Juan metropolitan area, Gov. Wanda Vázquez Garced announced the lifting of the island’s lockdown and the reopening of practically all businesses and services to the public, leaving the responsibility to continue with the safety measures to avoid the spread of COVID-19 up to citizens and the private sector.    The opening of beaches and spas is authorized, but the grouping of people is not allowed without precautionary measures and social distancing. Beach chairs and coolers are allowed.    The new guidelines will take effect June 16 and run through July 1.""    Most businesses etc are open at 50% capacity e.g. gyms, restaurants, museums.    https://web.archive.org/web/20200623095534/https://caribbeanbusiness.com/52221-2/"
Puerto Rico,PRI,Latin_America_Caribbean,20200616,,C6: Stay at home requirements,1,1,1G,2G,"""In a press conference at one of the main movie theaters in the San Juan metropolitan area, Gov. Wanda Vázquez Garced announced the lifting of the island’s lockdown and the reopening of practically all businesses and services to the public, leaving the responsibility to continue with the safety measures to avoid the spread of COVID-19 up to citizens and the private sector.    The new guidelines will take effect June 16 and run through July 1.""    https://web.archive.org/web/20200623095534/https://caribbeanbusiness.com/52221-2/"
Puerto Rico,PRI,Latin_America_Caribbean,20200616,,C7: Restrictions on internal movement,0,.,0,2G,"""In a press conference at one of the main movie theaters in the San Juan metropolitan area, Gov. Wanda Vázquez Garced announced the lifting of the island’s lockdown and the reopening of practically all businesses and services to the public, leaving the responsibility to continue with the safety measures to avoid the spread of COVID-19 up to citizens and the private sector.    The new guidelines will take effect June 16 and run through July 1.""    https://web.archive.org/web/20200623095534/https://caribbeanbusiness.com/52221-2/"
Suriname,SUR,Latin_America_Caribbean,20200621,,C2: Workplace closing,2,1,2G,3G,"The total lockdown will be lifted with effect from Sunday, June 21, starting at 5:00 AMCompanies and organizations can again maintain their normal opening hours; taking into account the social distances, wash hands and wear mouth and nose cover. Of course, taking into account that everyone is home at 8 p.m. The following sectors will remain closed to the public, namely: hotels, casinos, places of worship, covered vegetable, fruit, meat and fish markets, brothels and barsIndoor gyms remain closed.  Linkhttps://web.archive.org/web/20200624114229/https://covid-19.sr/president-bouterse-kondigt-versoepeling-en-zestal-maatregelen-aan/"
Suriname,SUR,Latin_America_Caribbean,20200621,,C7: Restrictions on internal movement,0,.,0,2T,". According to address of President on 20th June ""Domestic flights of persons and goods are allowed under strict guidelines"". This shows internal movement is allowed.  Linkhttps://web.archive.org/web/20200624114229/https://covid-19.sr/president-bouterse-kondigt-versoepeling-en-zestal-maatregelen-aan/"
,,,,,,,,,,
Note: Data from 25 Jun 2020. Individual countries may be several days older.,,,,,,,,,,
Source: Oxford COVID-19 Government Response Tracker. More at: github.com/OxCGRT/covid-policy-tracker or bsg.ox.ac.uk/covidtracker,,,,,,,,,,
