"","CountryName","CountryCode","Date","region","PolicyType","PolicyCode","previous_PolicyCode","Notes"
"1","Australia","AUS",2022-06-18,"East_Asia_Pacific","C1: School closing","0","0","No new policy. Schools are teaching in-person with certain precautions. Ex. teachers wearing masks, students wearing masks.  On 13 January 2022, National Cabinet agreed to a national framework to promote a nationally consistent approach to the ongoing delivery of high-quality education for all students during COVID-19. This framework ensure all schools are open and be able to stay open, with as little disruption from COVID-19 as possible.  https://archive.ph/OQoOw  https://archive.ph/nRGj7"
"2","Australia","AUS",2022-06-18,"East_Asia_Pacific","C2: Workplace closing","0","0","There are no longer capacity or density limits. There are no vaccination rules for entry into venues.  https://archive.ph/9HC2o"
"3","Australia","AUS",2022-06-18,"East_Asia_Pacific","C3: Cancel public events","0","0","There are no longer capacity or density limits. There are no vaccination rules for entry into venues.  https://archive.ph/9HC2o"
"4","Australia","AUS",2022-06-18,"East_Asia_Pacific","C4: Restrictions on gatherings","0","0","There are no longer capacity or density limits.   https://archive.ph/vJZ4A"
"5","Australia","AUS",2022-06-18,"East_Asia_Pacific","C5: Close public transport","0","0","All public transport modes are returned to 100 percent. There continues to be a notice that for NSW COVID-related staff shortages have impacted most public transport services - but capacity is no longer impacted.   https://web.archive.org/web/20220712092002/https://transportnsw.info/covid-19/covid-19-safer-travel-guidance"
"6","Australia","AUS",2022-06-18,"East_Asia_Pacific","C6: Stay at home requirements","0","0","No new policy. No lockdowns or lock-ins are currently in place.   https://archive.ph/VYGEq"
"7","Australia","AUS",2022-06-15,"East_Asia_Pacific","C7: Restrictions on internal movement","0","2T","As of 15 June restrictions on accessing remote Aboriginal communities have lifted after more than two years. Some communities are voluntarily deciding to enforce their own restrictions on people entering.   https://archive.ph/xyhLM  https://archive.ph/8maep"
"8","Australia","AUS",2022-06-18,"East_Asia_Pacific","C7: Restrictions on internal movement","0","0","No policy change. As of 15 June restrictions on accessing remote Aboriginal communities have lifted after more than two years. Some communities are voluntarily deciding to enforce their own restrictions on people entering.   https://web.archive.org/web/20220712102242/https://www.wa.gov.au/government/covid-19-coronavirus/covid-19-coronavirus-what-you-can-and-cant-do  https://archive.ph/8maep"
"9","Australia","AUS",2022-06-18,"East_Asia_Pacific","C8: International travel controls","1","1","No new policy. Continuing from 17 April restrictions are relaxed where travelers no longer must provide a negative pre-departure test to enter Australia.    International travellers into and out of Australia will still be required to provide proof of double vaccination against COVID-19.    The following additional measures have ended:  - restrictions on the entry of cruise vessels into and within Australian territory.    https://web.archive.org/web/20220712102551/https://www.health.gov.au/health-alerts/covid-19/international-travel  https://archive.ph/YveM5"
"10","Australia","AUS",2022-06-18,"East_Asia_Pacific","H1: Public information campaigns","2G","2G","No new policy. The Australian Government Department of Health maintains a website with the latest updates on coronavirus status across the nation.   They are also present on social media such as twitter @healthgovau.   https://web.archive.org/web/20220617073142/https://www.health.gov.au/news  https://web.archive.org/web/20220617073153/https://www.health.gov.au/health-alerts/covid-19  http://web.archive.org/web/20220219105227/https://twitter.com/healthgovau?lang=en"
"11","Australia","AUS",2022-06-18,"East_Asia_Pacific","H2: Testing policy","2","2","No new policy. The Department of Health advises people to get tested when they have COVID-19 symptoms, cold or flu symptoms, are in close contact with someone with COVID-19, or have been advised by  a medical professional.  https://web.archive.org/web/20220712091514/https://www.health.gov.au/health-alerts/covid-19/testing"
"12","Australia","AUS",2022-06-18,"East_Asia_Pacific","H3: Contact tracing","2","2","No new policy. Continuing from 26 April 2020 government contact tracers and regular citizens enter data into an integrated app COVIDSafe.   https://archive.ph/B000C  https://web.archive.org/web/20210921075506/https://www.covidsafe.gov.au/technology.html"
"13","Australia","AUS",2022-06-18,"East_Asia_Pacific","H6: Facial Coverings","2T","2T","No new policy. Continuing policy in Western Australia and Tasmania still has mask requirements.   WA anyone aged 12 years and over must wear a face mask in:  - Hospitals and health care settings including: GPs, Aboriginal health services, Dental and optical health clinics, Allied health services such as physiotherapy, radiology and occupational therapy services  - Aged care facilities, residential care facilities including disability service facilities and mental health residential facilities  - Public and passenger transport, including school buses, taxis and rideshare vehicles  - Correctional facilities  - Aircraft  Masks are encouraged where physical distancing is not possible.     Tasmania:   Anyone aged 12 years and over must wear a face mask in the following indoor areas — unless they’re exempt:  - aboard aircraft  - all close contacts when outside their home — unless they’re exempt  https://web.archive.org/web/20220712102242/https://www.wa.gov.au/government/covid-19-coronavirus/covid-19-coronavirus-what-you-can-and-cant-do  https://archive.ph/xVoyd"
"14","Australia","AUS",2022-06-18,"East_Asia_Pacific","H7: Vaccination policy","5G","5G","No new policy. Continuing from 31 March health measures are at Level 1 (Western Australia region).  Masks are required for people aged 8 years and over (year 3 and over for schools):  - everywhere indoors, other than in the home  - when on public transport, in taxis and rideshare vehicles  - at hospitals and residential aged care or residential disability care facilities.  https://archive.ph/uBFBe"
"15","Australia","AUS",2022-06-18,"East_Asia_Pacific","H8: Protection of elderly people","2T","2T","No new policy. Continuing policy from 29 April in Western Australia include external visitor restrictions for residential aged and disability care facilities (same as previous threat levels):  - 2 visitors permitted per resident patient per day  - Masks must be worn by staff and visitors indoors and outdoors  - Proof of vaccination applies for visitors    National policy still in place outlines recommended guidelines to protect the elderly along a three tiered system. The visitation restrictions and guidelines for residential aged care facilities follow social distancing, vaccination and COVID screening norms. It is up to providers to manage and mitigate COVID-19 risks to aged care residents, including the risks that isolation poses to their physical, social and emotional wellbeing. Face-to-face get togethers between residents, family members and friends should be facilitated where they can be undertaken safely and are permitted under public health orders. Residents of an aged care facility have the right to choose to have vaccinations or not.      https://web.archive.org/web/20220712102242/https://www.wa.gov.au/government/covid-19-coronavirus/covid-19-coronavirus-what-you-can-and-cant-do  https://web.archive.org/web/20220322082432/https://www.health.gov.au/node/18602/coronavirus-covid-19-advice-for-people-in-residential-aged-care-facilities-and-visitors  https://web.archive.org/web/20210415104420/https://www.health.gov.au/sites/default/files/documents/2020/11/coronavirus-covid-19-national-aged-care-guidance-escalation-tiers-and-aged-care-provider-responses.pdf"
"16","Brunei","BRN",2022-06-21,"East_Asia_Pacific","C1: School closing","0","0","Brunei has returned to in-person teaching for most levels (except primary schools), after schools were moved online after the surge in Covid-19 cases due to the Omicron wave. However, given the rollout of the vaccination programme for age 5-11 in Brunei, it will allow primary schools to reopen on May 14 (as reported by the Star)    As previously reported by the Scoop,    'Child care centres, kindergartens, secondary schools, religious schools, colleges and sixth form centres will resume classroom learning on either April 4 or 5, pending the sighting of the moon this Friday which will determine the first day of Ramadan.    However only primary schools with less than 50 pupils — such as those in rural areas — will be allowed to reopen, while the rest must wait until the government kicks off its COVID-19 vaccination programme for children aged 5-11.    Face-to-face learning has been suspended since March 7 after schools reported low attendance at the height of the Omicron surge.    Before retuning to classrooms, the minister urged parents to conduct ART testing on their children twice a week and to regularly report their results to the school.    “If there are any students experiencing symptoms such as a cold or cough, we hope parents or guardians can send them to the clinic for treatment and not send them to school.”    He added that adolescents aged 12 to 17 who are not yet vaccinated will be allowed to return to schools next week, rescinding a previous policy which did not allow unvaccinated children to attend in-person classes.    This recent announcement brings to an end the third school closure since the pandemic started. The first suspension of classroom learning lasted from March 26, 2020 to June 2, 2020, while the second closure spanned August 9, 2021 to January 2, 2022.'    See the Scoop's report, entitled ""Schools to resume face-to-face learning next week"", archived at https://archive.ph/ElXxD  See the Star's report, entitled ""Brunei: May 14 back to school for children 5-11 years old, says education minister"", archived at https://archive.ph//NJhiZ"
"17","Brunei","BRN",2022-06-21,"East_Asia_Pacific","C2: Workplace closing","0","0","Public health measures enacted under the 'early endemic phase' has been lifted since 01 June.    ""The minister said, “In this regard, beginning June 1, the guidelines for COVID-19 control measures will be updated. There is no limitation on the capacity of mass gatherings (regardless of location, either at home or halls) and all sporting activities including competitions are allowed with no limitation on the number of spectators.    “Food preparation for any event at any premises is allowed without any restrictions including buffet meals; and no age restrictions for all congregations at mosques to perform the Friday prayers and five-time daily prayers.""    See the Prime Minister's Office statement, archived at https://archive.ph/uQiU2  See the Xinhua News report about Brunei's lifting of the early endemic phase measures, archived at https://archive.ph/fX494  See the Borneo Bulletin report, archived at https://archive.ph/ibSY5"
"18","Brunei","BRN",2022-06-21,"East_Asia_Pacific","C3: Cancel public events","0","0","Public health measures enacted under the 'early endemic phase' has been lifted since 01 June.    ""The minister said, “In this regard, beginning June 1, the guidelines for COVID-19 control measures will be updated. There is no limitation on the capacity of mass gatherings (regardless of location, either at home or halls) and all sporting activities including competitions are allowed with no limitation on the number of spectators.    “Food preparation for any event at any premises is allowed without any restrictions including buffet meals; and no age restrictions for all congregations at mosques to perform the Friday prayers and five-time daily prayers.""    See the Prime Minister's Office statement, archived at https://archive.ph/uQiU2  See the Xinhua News report about Brunei's lifting of the early endemic phase measures, archived at https://archive.ph/fX494  See the Borneo Bulletin report, archived at https://archive.ph/ibSY5"
"19","Brunei","BRN",2022-06-21,"East_Asia_Pacific","C4: Restrictions on gatherings","0","0","Public health measures enacted under the 'early endemic phase' has been lifted since 01 June.    Measures have been eased, with no limitation on the capacity of mass gatherings.    See the Prime Minister's Office statement, archived at https://archive.ph/uQiU2  See the Xinhua News report about Brunei's lifting of the early endemic phase measures, archived at https://archive.ph/fX494  See the Borneo Bulletin report, archived at https://archive.ph/ibSY5"
"20","Brunei","BRN",2022-06-21,"East_Asia_Pacific","C5: Close public transport","0","0","Public health measures enacted under the 'early endemic phase' has been lifted since 01 June.    ""The minister said, “In this regard, beginning June 1, the guidelines for COVID-19 control measures will be updated. There is no limitation on the capacity of mass gatherings (regardless of location, either at home or halls) and all sporting activities including competitions are allowed with no limitation on the number of spectators.    “Food preparation for any event at any premises is allowed without any restrictions including buffet meals; and no age restrictions for all congregations at mosques to perform the Friday prayers and five-time daily prayers.""    See the Prime Minister's Office statement, archived at https://archive.ph/uQiU2  See the Xinhua News report about Brunei's lifting of the early endemic phase measures, archived at https://archive.ph/fX494  See the Borneo Bulletin report, archived at https://archive.ph/ibSY5"
"21","Brunei","BRN",2022-06-21,"East_Asia_Pacific","C6: Stay at home requirements","0","0","Public health measures enacted under the 'early endemic phase' has been lifted since 01 June.    Measures have been eased, with no limitation on the capacity of mass gatherings: at home or in the halls, or on sporting activities or congregations at mosques.    See the Prime Minister's Office statement, archived at https://archive.ph/uQiU2  See the Xinhua News report about Brunei's lifting of the early endemic phase measures, archived at https://archive.ph/fX494  See the Borneo Bulletin report, archived at https://archive.ph/ibSY5"
"22","Brunei","BRN",2022-06-21,"East_Asia_Pacific","C7: Restrictions on internal movement","0","0","Public health measures enacted under the 'early endemic phase' has been lifted since 01 June.    As per the US Embassy in Brunei's website, last updated on 23 June,    Are there restrictions on intercity or interstate travel?  No.  The government has not restricted intercity or interstate travel.    See the US Embassy in Brunei's website, archived at https://archive.ph/1jQaD  See the Borneo Bulletin report, archived at https://archive.ph/ibSY5"
"23","Brunei","BRN",2022-06-15,"East_Asia_Pacific","C8: International travel controls","2","4","As per the US Embassy in Brunei's website, last updated on 17 June, foreigners are now allowed.    According the the Prime Minister Office's statement dated 09 June, from 15 June onwards, pre-departure swab tests for inbound travellers are no longer required regardless of vaccination status, and fully vaccinated travellers are no longer required to undergo ART testing and self-isolation upon arrival in the country.    Travellers who have not completed the COVID-19 vaccination are required to undergo ART testing upon arrival, with three days of self-isolation and will only be released if tested negative with a PCR test on day three.    Cross-border travel via land and seaports will also be allowed for essential reasons, with an intention to fully open cross-border travel from 01 August.    See the Prime Minister Office's statement, dated 09 June, archived at https://archive.ph/cMzbN  See the US Embassy in Brunei's website, archived at https://archive.ph/2zJhM"
"24","Brunei","BRN",2022-06-21,"East_Asia_Pacific","C8: International travel controls","2","2","As per the US Embassy in Brunei's website, last updated on 23 June, foreigners are now allowed.    According the the Prime Minister Office's statement dated 09 June, from 15 June onwards, pre-departure swab tests for inbound travellers are no longer required regardless of vaccination status, and fully vaccinated travellers are no longer required to undergo ART testing and self-isolation upon arrival in the country.    Travellers who have not completed the COVID-19 vaccination are required to undergo ART testing upon arrival, with three days of self-isolation and will only be released if tested negative with a PCR test on day three.    Cross-border travel via land and seaports will also be allowed for essential reasons, with an intention to fully open cross-border travel from 01 August.    See the Prime Minister Office's statement, dated 09 June, archived at https://archive.ph/cMzbN  See the US Embassy in Brunei's website, archived at https://archive.ph/1jQaD"
"25","Brunei","BRN",2022-06-21,"East_Asia_Pacific","E1: Income support","0","0","No changes.    See the International Monetary Fund's section on Brunei, last updated June 3, 2021.    See IMF's website, archived at https://web.archive.org/web/20220625220742/https://www.imf.org/en/Topics/imf-and-covid19/Policy-Responses-to-COVID-19"
"26","Brunei","BRN",2022-06-21,"East_Asia_Pacific","E2: Debt/contract relief","0","0","No changes.    Deferment measures have expired on April 1, 2021. See the International Monetary Fund's section on Brunei, last updated June 3, 2021.    See IMF's website, archived at https://web.archive.org/web/20220625220742/https://www.imf.org/en/Topics/imf-and-covid19/Policy-Responses-to-COVID-19"
"27","Brunei","BRN",2022-06-21,"East_Asia_Pacific","H1: Public information campaigns","2G","2G","No changes/deviation; Brunei continues to maintain a systematic, coordinated public campaign re: COVID.    The government continues to maintain an overall website where citizens can access any information related to COVID.   https://archive.ph/MNMK4    There is also an overall site on the Ministry of Health's website pertaining to Covid-19 vaccination (the programme, FAQ, public health messaging).  https://archive.vn/G2iCn    The Ministry of Health continues to update COVID case numbers almost daily. See, for example, 24 Jun (https://archive.ph/hQa40) and 25 Jun (https://archive.ph/ScQFE)."
"28","Brunei","BRN",2022-06-21,"East_Asia_Pacific","H2: Testing policy","3","3","No change.    As per the US Embassy in Brunei's website, last updated on 23 June,    Are PCR and/or antigen tests available for U.S. citizens in Brunei?  Yes.  If so, are test results reliably available within 72 hours?  Yes.  Members of the public who need to undergo a swab test for any reason are advised to go to the Sports Complex, Raja Isteri Pengiran Anak Saleha (RIPAS) Hospital, or other health centers where testing is provided.  The testing fee for foreigners is BND $200 [sic, current cost as per Brunei's Ministry of Health is BND $50].  More information is available here.  Test results will be delivered through SMS.    See the US Embassy in Brunei's website, archived at https://archive.ph/1jQaD  See the Ministry of Health press release on testing cost (22 May), archived at https://archive.vn/kU9pS"
"29","Brunei","BRN",2022-06-21,"East_Asia_Pacific","H3: Contact tracing","2","2","As per previous entries, contact tracing continues to be done for every new case.    See, for example, cases detected on 24 Jun (https://archive.ph/hQa40) and 25 Jun (https://archive.ph/ScQFE)."
"30","Brunei","BRN",2022-06-21,"East_Asia_Pacific","H6: Facial Coverings","2G","2G","As per the US Embassy in Brunei's website, last updated on 23 June,    ""Starting June 1, 2022, outdoor masking is not mandatory but encouraged especially in crowded places and should still be worn indoors.""    See the US Embassy in Brunei's website, archived at https://archive.ph/1jQaD  See the Prime Minister's Office statement, archived at https://archive.ph/uQiU2  See the Xinhua News report about Brunei's lifting of the early endemic phase measures, archived at https://archive.ph/fX494"
"31","Brunei","BRN",2022-06-21,"East_Asia_Pacific","H7: Vaccination policy","5G","5G","Brunei's Phase 3 of its Vaccination Strategy, for individuals aged 18 years and above, commenced on 05 July 2021. ""[Individuals] who wish to get the COVID-19 vaccinations during Phase 3 are required to reserve a slot"".    Vaccinations have also been rolled out to adolescents aged 12 to 17 from November 8, utilising the Pfizer-BioNTech vaccine. This has been extended to children ages 5–11 from 03 April 2022.    Booster shots have been available to the general public since 17 December.    See:  The Ministry of Health's press release ""Registration For The National Vaccination Program For Covid-19 For The Phase Three"" (dated 01 Jul), archived at https://archive.vn/M1nb1  The Ministry of Health's press release ""Registration For The National Vaccination Program For COVID-19 For The Second Phase"" (dated 14 Jun), archived at https://archive.vn/nzwGg  The Scoop's report, entitled ""Phase 2 of COVID-19 vaccination starts on June 21"" (dated 14 Jun), archived at https://archive.vn/qgiQm  The Ministry of Health's press release ""COVID-19 Moderna vaccine arrived in Brunei Darussalam"" (dated 20 Jun), archived at https://archive.vn/2onLe  Borneo Bulletin's report, entitled ""Second phase of COVID-19 vaccination begins"" (dated 22 Jun), archived at https://archive.vn/XhM2i  The Star Online's report, entitled ""Brunei: Over 76, 000 received Covid-19 vaccination as country goes 417 without local cases"" (dated 28 Jun), archived at https://archive.is/7F2bK  Xinhua's report, entitled ""Brunei continues COVID-19 vaccination with China's Sinopharm donations"" (dated 16 Sep), archived at https://archive.vn/k5deH  The Scoop's report, entitled ""MoH: Two jabs 83% effective in preventing COVID-19 infection"" (dated 15 Sep), archived at https://archive.vn/5NITD  The Scoop's report, entitled ""AstraZeneca is now Brunei’s default vaccine"" (dated 18 Sep), archived at https://archive.vn/SbAOq  The Ministry of Health's press release ""Contribution of Moderna Vaccine from Singapore"" (dated 28 Sep), archived at https://archive.vn/kgAa3  The Scoop's report, entitled ""First shipment of Pfizer vaccines arrives in Brunei"" (dated 05 Nov), archived at https://archive.vn/yOuzj  The Scoop's report, entitled ""International travel to resume in January, schools to reopen in stages as Brunei enters ‘early endemic phase’"" (dated 13 Dec), archived at https://archive.vn/uA4rP  The Scoop's article, on children aged 5–10 vaccinations, archived at https://archive.ph/4xLx6"
"32","Brunei","BRN",2022-06-21,"East_Asia_Pacific","H8: Protection of elderly people","1G","1G","No change in policy since last iteration.    Additionally, under Brunei's Vaccination Strategy, senior citizens of age 60 and above belong to Phase 1, alongside Bruneians studying abroad and frontliners.    The advice for elderly people to be protected via vaccinations was reiterated on 07 Aug, when Brunei first detected its first local transmission cases in over a year. ""Individuals who have not yet received COVID-19 vaccination especially those at high risk such as the elderly and those with chronic diseases are advised to reserve an vaccination slot as soon as possible. Walk-ins at vaccination centres will only be allowed for senior citizens aged 60 and above or individuals with special needs.""    See https://web.archive.org/web/20210111022516/http://www.moh.gov.bn/Lists/Latest%20news/NewDispForm.aspx?ID=727  See also, Brunei's Vaccination Strategy, archived on Dropbox, at https://www.dropbox.com/s/yri6djij3ieblma/BRN-202103__-MOH-VaccinationStrategyV2.pdf  See also, IMF's summary on the vaccination groups under ""Brunei: Reopening of the Economy"", archived at https://web.archive.org/web/20220212053517/https://www.imf.org/en/Topics/imf-and-covid19/Policy-Responses-to-COVID-19  See the Ministry of Health's press release dated 07 Aug, archived at https://archive.vn/C5fBL"
"33","China","CHN",2022-06-16,"East_Asia_Pacific","C1: School closing","3T","3T","There is no change in policy."
"34","China","CHN",2022-06-27,"East_Asia_Pacific","C1: School closing","3T","3T","At the 326th press conference on COVID-19 prevention and control on June 25, 2022, according to Beijing Municipal Education Commission, primary and secondary schools will reopen on June 27 and have their summer vacation on July 15.  https://web.archive.org/web/20220628112852/http://www.beijing.gov.cn/fuwu/bmfw/sy/jrts/202206/t20220626_2751537.html"
"35","Fiji","FJI",2022-06-17,"East_Asia_Pacific","C1: School closing","0","0","No changes found."
"36","Fiji","FJI",2022-06-17,"East_Asia_Pacific","C2: Workplace closing","2G","2G","No changes to policy since February 7 2022.    https://web.archive.org/web/20220704052324/https://www.mcttt.gov.fj/wp-content/uploads/2022/02/Protocol-for-COVID-Safe-Retail-Operation-07-02-2022.pdf    https://web.archive.org/web/20220704060613/https://www.mcttt.gov.fj/wp-content/uploads/2022/02/Protocols-for-COVID-Safe-Business-Operation-7-02-2022-1.pdf"
"37","Fiji","FJI",2022-06-17,"East_Asia_Pacific","C3: Cancel public events","2G","2G","https://web.archive.org/web/20220704053246/https://www.mcttt.gov.fj/wp-content/uploads/2022/02/Protocol-for-COVID-Safe-Operations-for-Outdoor-Event-07.02.22.pdf"
"38","Fiji","FJI",2022-06-17,"East_Asia_Pacific","C4: Restrictions on gatherings","0","0","No changes.    https://web.archive.org/web/20220704053712/https://www.fijitimes.com/carefiji-app-and-qr-not-required-for-entry-anymore/"
