"","CountryName","CountryCode","Date","region","PolicyType","PolicyCode","previous_PolicyCode","Notes"
"65","Australia","AUS",2021-01-17,"East_Asia_Pacific","H6: Facial Coverings","2G","2G","VIC:   In an easing of restrictions the VIC govt has announced that from 11.59pm, Sunday 17 January 2021, face masks will no longer be mandatory in all public indoor settings. “Face masks continue to be mandatory in the following locations: on public transport; when riding in a ride share or taxi; inside shopping centres; including the retail stores inside shopping centres, such as clothing stores inside indoor markets in large retail stores (over 2000 sqm), such as department stores, electronics stores, furniture stores, hardware stores or supermarkets; on domestic flights to and from Victoria at airports;  when working in or visiting hospitals and care facilities. You must always carry a face mask with you when you leave home unless you have a lawful reason not to. It is strongly recommended you wear one whenever you cannot keep 1.5 metres distance from others.  https://web.archive.org/web/20210118031856if_/https://www.coronavirus.vic.gov.au/face-masks     NSW:  At noted on 13th January 2021 and remaining current as of 17th January 2021- from Sunday 3 January 2021 (restriction still current) the NSW govt made facemasks in Greater Sydney (including Wollongong, Central Coast and Blue Mountains) face masks are mandatory in the following indoor settings:  shopping (retail, supermarkets and shopping centres)  on public/shared transport and waiting areas for public/shared transport  indoor entertainment (including cinemas and theatres)  places of worship  hair and beauty premises  visiting an aged care facility.  https://web.archive.org/web/20210118031221/https://www.nsw.gov.au/covid-19/face-masks     QLD:  At noted on 13th January 2021 and remaining current and remaining current as of 17th January 2021 - from 6pm AEST 11 January 2021, the Greater Brisbane region was subject to new mask restrictions.  This required individuals to carry a face mask at all times and wear them: on public transport infrastructure or at public transport infrastructure; in a commercial passenger vehicle or waiting in a designated outdoor space that is not a residence for a commercial passenger vehicle; in an indoor space.   https://web.archive.org/web/20210118031337/https://www.qld.gov.au/health/conditions/health-alerts/coronavirus-covid-19/current-status/public-health-directions/mandatory-masks     SA, TAS, WA, and the ACT currently as of 17th January 2021 have mandated the use of masks only at airports and domestic and international flights.  WA additionally mandates the use of masks when transporting a person subject to a quarantine direction.   SA: https://web.archive.org/web/20210118033038/https://www.sahealth.sa.gov.au/wps/wcm/connect/public+content/sa+health+internet/conditions/infectious+diseases/covid-19/about+covid-19/protecting+yourself+and+others+from+covid-19/face+masks   WA: https://web.archive.org/web/20201102061242/https://www.healthywa.wa.gov.au/Articles/A_E/Coronavirus/Face-masks     Australia Wide:  At noted on 13th January 2021 and remaining current  - On the 8th Jan 2021 and remaining current as of 17th January 2021 - the National Cabinet met and all state and territory representatives agreed to make directions such that All passengers, excluding children 12 and under or those with particular exemptions, and air crew must wear masks on flights and in airports. https://web.archive.org/web/20210113093456/https://www.pm.gov.au/media/statement-national-cabinet"
"66","Australia","AUS",2021-01-31,"East_Asia_Pacific","H6: Facial Coverings","3T","2G","On the 15/02/2021 changed from G2 to T3 to reflect the policy documented immediately below.     WA Perth and Peel region entered a lockdown period 31st Jan 2021 – 5th Feb 2021.  During this period the FACE COVERING DIRECTIONS were in force, requiring that:   "" A person in an affected area [Perth and the Peel Region] must wear a face covering at all times while they are outside the place where they ordinarily reside including while in a vehicle unless:   (a) the person is a child under the age of 12 years; or  (b) the person has a physical or mental illness, condition or disability which makes  wearing a face covering unsuitable; or  ( c) the person is a prisoner or detainee in a prison, detention centre or other place  of custody; or   ( d) the person falls within one or more of the exceptions specified in paragraph 4  and is carrying a face covering ( or, in the case of paragraph 4( d), the person has  access to a facemask close by) and resumes wearing the face mask as soon as  reasonably practicable.     4. The exceptions specified in this paragraph are as follows:  (a) the person is communicating with a person who is deaf or hard of hearing and  visibility of the mouth is essential for communication;  (b) the nature of a person's work means that wearing a face covering creates a risk  to their health and safety;  ( c) the nature of a person's work or the activity that they are engaging in means that  clear enunciation or visibility of the mouth is essential;  ( d) the person is engaged in swimming as a form of physical exercise;  (e) the person is travelling in a private vehicle and is the sole occupant of that  vehicle;  (f) the person is consuming food, drink or medicine provided that they are seated  at the time and they are not in a vehicle;  (g) the person is undergoing medical care or treatment to the extent that such care  or treatment requires that no face covering be worn;  (h) the person is asked to remove the face covering to ascertain identity;  (i) not wearing a face covering is required for emergency purposes ( other than  emergency preparation or emergency preparation activities, unless another  exception specified in this paragraph applies);  U) not wearing a face covering is otherwise required or authorised by law;  (k) wearing a face covering is not safe in all the circumstances. ""    https://web.archive.org/web/20210209070941/https://www.wa.gov.au/sites/default/files/2021-01/310121-Face-Covering-Directions.pdf"
"67","Australia","AUS",2021-02-02,"East_Asia_Pacific","H6: Facial Coverings","3T","3T","WA Perth and Peel region entered a lockdown period 31st Jan 2021 – 5th Feb 2021.  During this period the FACE COVERING DIRECTIONS were in force, requiring that:   "" A person in an affected area [Perth and the Peel Region] must wear a face covering at all times while they are outside the place where they ordinarily reside including while in a vehicle unless:   (a) the person is a child under the age of 12 years; or  (b) the person has a physical or mental illness, condition or disability which makes  wearing a face covering unsuitable; or  ( c) the person is a prisoner or detainee in a prison, detention centre or other place  of custody; or   ( d) the person falls within one or more of the exceptions specified in paragraph 4  and is carrying a face covering ( or, in the case of paragraph 4( d), the person has  access to a facemask close by) and resumes wearing the face mask as soon as  reasonably practicable.     4. The exceptions specified in this paragraph are as follows:  (a) the person is communicating with a person who is deaf or hard of hearing and  visibility of the mouth is essential for communication;  (b) the nature of a person's work means that wearing a face covering creates a risk  to their health and safety;  ( c) the nature of a person's work or the activity that they are engaging in means that  clear enunciation or visibility of the mouth is essential;  ( d) the person is engaged in swimming as a form of physical exercise;  (e) the person is travelling in a private vehicle and is the sole occupant of that  vehicle;  (f) the person is consuming food, drink or medicine provided that they are seated  at the time and they are not in a vehicle;  (g) the person is undergoing medical care or treatment to the extent that such care  or treatment requires that no face covering be worn;  (h) the person is asked to remove the face covering to ascertain identity;  (i) not wearing a face covering is required for emergency purposes ( other than  emergency preparation or emergency preparation activities, unless another  exception specified in this paragraph applies);  U) not wearing a face covering is otherwise required or authorised by law;  (k) wearing a face covering is not safe in all the circumstances. ""    https://web.archive.org/web/20210209070941/https://www.wa.gov.au/sites/default/files/2021-01/310121-Face-Covering-Directions.pdf"
"68","Australia","AUS",2021-02-05,"East_Asia_Pacific","H6: Facial Coverings","3T","3T","At 6pm 5th Feb 2021 SAFE TRANSITION FOR WESTERN AUSTRALIA DIRECTIONS came into effect and remain current.   These directions state that a ""A person in the affected area [Perth and the Peel Region] must wear a face covering at all times while they are outside the place where they ordinarily reside, including while in a vehicle (including a motor  vehicle, boat or aircraft), unless:  (a) the person is a child 12 years of age or under, except at a time when the child is  attending school in Year 7 or above; or  (b) the person has a physical, developmental or mental illness, injury, condition or  disability which makes wearing a face covering unsuitable; or  ( c) the person is a prisoner or detainee in a prison, detention centre or other place  of custody; or  Note: nothing in these directions affects any other power a person may have to  require a prisoner or detainee to wear a face covering.  ( d) the person falls within one or more of the exceptions specified in paragraph 14  and is carrying a face covering (or, in the case of paragraph 14(g) or (h), the person has access to a face covering close by) and resumes wearing the face covering as soon as reasonably practicable.  14. The exceptions specified in this paragraph are as follows:  (a) the person is communicating with a person who is deaf or hard of hearing and  visibility of the mouth is essential for communication;  (b) the person is at the time attending school as a student in Year 6 or below;  ( c) the nature of a person's occupation means that wearing a face covering is  impractical to perform that occupation or creates a risk to their health and safety;  ( d) the person needs to temporarily remove their mask so as to enable another  person to appropriately perform their occupation;  ( e) the nature of a person's work or the activity that they are engaging in means that  clear enunciation or visibility of the mouth is essential;  (f) the person is a teacher who at the time is engaging in teaching primary,  secondary or tertiary students or a child care worker engaging in child care;  (g) the person is engaged in an activity involving swimming;  (h) the person is running or jogging or otherwise engaged in some form of strenuous  or vigorous exercise or physical activity that is taking place outside;  (i) the person is travelling in a motor vehicle and is the sole occupant of that  vehicle;  G) the person is consuming food, drink or medicine, provided that they are seated  at the time and they are not in a vehicle;  (k) the person is undergoing medical, dental or beauty related care or treatment to  the extent that such care or treatment requires that no face covering be worn;  (1) the person is asked to remove the face covering to ascertain identity;  (m) not wearing a face covering is required for emergency purposes ( other than  emergency preparation or emergency preparation activities, unless another  exception specified in this paragraph applies);  (n) the person is directed by a judicial officer or tribunal member in proceedings in  a court or tribunal to remove their mask to ensure the proper conduct of those  proceedings;  ( o) not wearing a face covering is otherwise required or authorised by law; or  (p) wearing a face covering is not safe in all the circumstances. ""  https://web.archive.org/web/20210209070248/https://www.wa.gov.au/sites/default/files/2021-02/2021-02-05-Safe-Transition-for-Western-Australia-Directions.pdf"
"69","Australia","AUS",2021-02-12,"East_Asia_Pacific","H6: Facial Coverings","4T","3T","12th Feb 2021: In a tightening of restrictions the Premier of Victoria announced a 5 day, Victoria Wide,  lock-down from 11:59pm Friday 12th February 2021 until 11:59pm on Wednesday, 17 February 2021.  Lock-down regulations include that : Face coverings Must be carried at all times and Must be worn indoors and outdoors except if at home, or if an exemption applies. As of the time of publication, the Victorian Government has not yet updated directions (legal frame work) published on its website and it is not clear what exemptions to face coverings apply.   https://web.archive.org/web/20210212053031/https://www.premier.vic.gov.au/sites/default/files/2021-02/210212%20-%20Table%20of%20restrictions.pdf  https://web.archive.org/web/20210212053116/https://www.premier.vic.gov.au/statement-premier-85"
"70","Australia","AUS",2021-01-19,"East_Asia_Pacific","H7: Vaccination policy","0","0","0"
"71","Australia","AUS",2021-01-25,"East_Asia_Pacific","H7: Vaccination policy","0","0","The Pfizer vaccine has met strict standards for safety, quality and efficacy, a statement from the prime minister’s office said on Monday, and the vaccine has been approved for rollout in Australia for people aged 16 years and older.    The first vaccinations are expected to be in late February and the first 1.4m doses of Pfizer and other vaccines once they are available will go to a priority group that includes quarantine and border workers, frontline health workers in high-risk settings, and aged care and disability staff and residents.   http://web.archive.org/web/20210125035042/https://www.theguardian.com/australia-news/2021/jan/25/pfizer-covid-vaccine-approved-for-australia-rollout-but-pm-warns-jabs-not-a-silver-bullet"
"72","Australia","AUS",2021-01-26,"East_Asia_Pacific","H7: Vaccination policy","0","0","Vaccines yet to rollout as of Jan 30   https://web.archive.org/web/20210131215546/https://www.theguardian.com/australia-news/2021/jan/30/australias-covid-vaccine-rollout-everything-you-need-to-know"
"73","Brunei","BRN",2021-01-25,"East_Asia_Pacific","C1: School closing","1G","1G","No updates in the policy."
"74","Brunei","BRN",2021-02-02,"East_Asia_Pacific","C1: School closing","1G","1G","No updates in the policy.  http://web.archive.org/save/https://www.moe.gov.bn/Articles/School%20Reopening%20Plan%20Protocol.pdf"
"75","Brunei","BRN",2021-01-25,"East_Asia_Pacific","C2: Workplace closing","1G","1G","No update in the policy."
"76","Brunei","BRN",2021-02-02,"East_Asia_Pacific","C2: Workplace closing","1G","1G","The Ministry of Health would like to emphasize and remind the public, especially for managers and staff of business premises to comply with the instructions issued by the Ministry of Health and other government agencies.   Ensure that operators, food supervisors and their staff wear face masks.  Implement their respective social responsibilities and cultivate measures to prevent the spread of COVID-19 in their respective business premises.  Obtain a BruHealth QR code specific to their premises and print a QR code and affix it in an area that is easily scanned by customers.  Using the Premise Scan Application to facilitate customers who do not use the BruHealth Application on their mobile phones.  Practicing hygiene measures in business premises and especially for food premises are reminded to follow the guidelines issued by the Government if preparing food in a buffet  https://archive.vn/un3qp"
"77","Brunei","BRN",2021-01-25,"East_Asia_Pacific","C3: Cancel public events","1G","1G","Mosques and other places of worship are open. Restaurants and cafes are operating normally. All public areas have a limit of permitting up to 350 people. For Chinese New Year celebrations; 'those with large families are permitted to hold private events at banquet halls in hotels or restaurants provided that Mass Gathering guidelines are adhered to, including provision of hand sanitizers and conducting temperature checks at the premises. If the number of family members is huge, limit attendance to a maximum of 350 people.'    http://web.archive.org/web/20210201130640/http://www.moh.gov.bn/Lists/Latest%20news/NewDispForm.aspx?ID=764&ContentTypeId=0x0104009A3003A09F8D6E42981D262E322516A2"
"78","Brunei","BRN",2021-02-02,"East_Asia_Pacific","C3: Cancel public events","1G","1G","Avoiding crowded public areas continue to be recommended.  https://web.archive.org/web/20210111022516/http://www.moh.gov.bn/Lists/Latest%20news/NewDispForm.aspx?ID=727"
"79","Brunei","BRN",2021-01-25,"East_Asia_Pacific","C4: Restrictions on gatherings","2G","2G","All public areas have a limit of permitting up to 350 people. For Chinese New Year celebrations; 'those with large families are permitted to hold private events at banquet halls in hotels or restaurants provided that Mass Gathering guidelines are adhered to, including provision of hand sanitizers and conducting temperature checks at the premises. If the number of family members is huge, limit attendance to a maximum of 350 people.'    http://web.archive.org/web/20210201130640/http://www.moh.gov.bn/Lists/Latest%20news/NewDispForm.aspx?ID=764&ContentTypeId=0x0104009A3003A09F8D6E42981D262E322516A2"
"80","Brunei","BRN",2021-02-02,"East_Asia_Pacific","C4: Restrictions on gatherings","2G","2G","With the latest developments and the current global situation, the Ministry of Health would like to remind the public not to be complacent in practising their social responsibilities.   The public are reminded to maintain personal hygiene, practice proper cough and sneeze etiquette. The public, especially individuals at risk such as the elderly, pregnant women and individuals with chronic diseases such as diabetes, kidney patients, respiratory problems and others, are recommended to wear a face mask in public places, including when visiting crowded places such as shopping malls, sales expos and sightseeing venues. The public are also advised not to leave the house if they feel unwell and avoid visiting crowded places.  https://web.archive.org/web/20210111022516/http://www.moh.gov.bn/Lists/Latest%20news/NewDispForm.aspx?ID=727"
"81","Brunei","BRN",2021-01-25,"East_Asia_Pacific","C5: Close public transport","0","0","No restrictions.    https://web.archive.org/web/20210125015143/https://bn.usembassy.gov/u-s-citizen-services-covid-19-information/"
"82","Brunei","BRN",2021-02-02,"East_Asia_Pacific","C5: Close public transport","0","0","Public Transport Operators are allowed to operate 100% vehicle seating capacity. However, Public Transport Operators as well passengers are still required to adhere to the prescribed guidelines  by the Ministry of Health.  1. Scan the Bruhealth QR code before entering Public transportation. Only Green and Yellow Codes are allowed to use Public Transport;  ii. Use of face mask when  in Public Transport vehicles and along the way;  iii. Avoid physical contact.  iv. Avoid chatting while inside vehicle.  v. Check body temperature before boarding vehicle.  vi. For bus passengers, must sit along the way.  http://web.archive.org/save/http://www.mtic.gov.bn/Documents/covid19/Pengemaskinian%20Garispanduan%20PT%207%20Sept%202020.pdf"
"83","Brunei","BRN",2021-01-25,"East_Asia_Pacific","C6: Stay at home requirements","0","0","No curfew.     https://web.archive.org/web/20210125015143/https://bn.usembassy.gov/u-s-citizen-services-covid-19-information/"
"84","Brunei","BRN",2021-02-02,"East_Asia_Pacific","C6: Stay at home requirements","0","0","No curfew or restriction.  http://web.archive.org/save/https://bn.usembassy.gov/u-s-citizen-services-covid-19-information/"
"85","Brunei","BRN",2021-01-25,"East_Asia_Pacific","C7: Restrictions on internal movement","0","0","No restrictions on intercity or interstate travel.    https://web.archive.org/web/20210125015143/https://bn.usembassy.gov/u-s-citizen-services-covid-19-information/"
"86","Brunei","BRN",2021-02-02,"East_Asia_Pacific","C7: Restrictions on internal movement","0","0","The government has not restricted intercity or interstate travel.  http://web.archive.org/save/https://bn.usembassy.gov/u-s-citizen-services-covid-19-information/"
"87","Brunei","BRN",2021-01-25,"East_Asia_Pacific","C8: International travel controls","2","2","Although commercial flights are operating, RBA has suspended most of its routes until March 27, 2021, with limited scheduled service continuing to Hong Kong, Jakarta, Kuala Lumpur, London, Manila, Melbourne, and Singapore only.      The government requires all passengers arriving in Brunei through Brunei International Airport to undergo immediate isolation for up to 14 days at a designated monitoring center, as well as a COVID-19 test.     https://web.archive.org/web/20210125015143/https://bn.usembassy.gov/u-s-citizen-services-covid-19-information/"
"88","Brunei","BRN",2021-02-02,"East_Asia_Pacific","C8: International travel controls","2","2","The government requires all passengers arriving in Brunei through Brunei International Airport to undergo immediate isolation for up to 14 days at a designated monitoring center, as well as a COVID-19 test.  Foreign citizens arriving in Brunei must pay the cost of the quarantine accommodation and the test.  Quarantine accommodation information is available here, and a hardcopy will also be provided to travelers upon arrival at the airport.  The COVID-19 testing fee for foreigners who have been granted permission to enter the country is BND $350.   http://web.archive.org/save/https://bn.usembassy.gov/u-s-citizen-services-covid-19-information/"
"89","Brunei","BRN",2021-01-25,"East_Asia_Pacific","E1: Income support","0","0","No update in policy"
"90","Brunei","BRN",2021-02-02,"East_Asia_Pacific","E1: Income support","0","0","No announcements."
"91","Brunei","BRN",2021-01-25,"East_Asia_Pacific","E2: Debt/contract relief","2","2","No update in policy"
"92","Brunei","BRN",2021-02-02,"East_Asia_Pacific","E2: Debt/contract relief","2","2","On March 21, the Ministry of Finance and Economy (MOFE) announced targeted measures centered mainly around tax, utility and social security deductions/deferments to assist hardest-hit households and firms affected by the COVID-19 pandemic, while supporting demand. An interim fiscal package (effective April 1) has been deployed to support SMEs and self-employed groups in sectors such as tourism, hospitality, transport and restaurants. The fiscal measures include amongst others, the deferment of payments on Employees Trust Fund (TAP) and Supplementary Contributory Pension (SCP) contributions, discounts on corporate income taxes, rents and utilities.  http://web.archive.org/web/20210125014308/https://www.imf.org/en/Topics/imf-and-covid19/Policy-Responses-to-COVID-19"
"93","Brunei","BRN",2021-01-25,"East_Asia_Pacific","H1: Public information campaigns","2G","2G","The government is sharing regular updates.     http://web.archive.org/web/20210201130640/http://www.moh.gov.bn/Lists/Latest%20news/NewDispForm.aspx?ID=764&ContentTypeId=0x0104009A3003A09F8D6E42981D262E322516A2"
"94","Brunei","BRN",2021-02-02,"East_Asia_Pacific","H1: Public information campaigns","2G","2G","Information and latest updates, members of the public can visit the official website of the Ministry of Health at www.moh.gov.bn or by contacting the Health Advice Line 148 or through the BruHealth App.  http://web.archive.org/save/http://www.moh.gov.bn/Lists/Latest%20news/NewDispForm.aspx?ID=772"
"95","Brunei","BRN",2021-01-25,"East_Asia_Pacific","H2: Testing policy","3","3","PCR and/or antigen tests available.    Charges for the same available here:  https://web.archive.org/web/20201219023333/http://www.moh.gov.bn/Shared%20Documents/2019%20ncov/Swab%20charges_website_14082020.pdf"
"96","Brunei","BRN",2021-02-02,"East_Asia_Pacific","H2: Testing policy","3","3","Are PCR and/or antigen tests available for U.S. citizens in Brunei?  Yes.  If so, are test results reliably available within 72 hours?  Yes.  Members of the public who need to undergo a swab test for any reason are advised to go to the Sports Complex, Raja Isteri Pengiran Anak Saleha (RIPAS) Hospital, or other health centers where testing is provided.  The testing fee for foreigners is BND $200.  More information is available here.  Test results will be delivered through SMS.  http://web.archive.org/save/https://bn.usembassy.gov/u-s-citizen-services-covid-19-information/  PCR and/or antigen tests available.    Charges for the same available here:  https://web.archive.org/web/20201219023333/http://www.moh.gov.bn/Shared%20Documents/2019%20ncov/Swab%20charges_website_14082020.pdf"
"97","Brunei","BRN",2021-01-25,"East_Asia_Pacific","H3: Contact tracing","2","2","No changes in the policy."
"98","Brunei","BRN",2021-02-02,"East_Asia_Pacific","H3: Contact tracing","2","2","A contact-tracing app (“BruHealth”) has also been widely implemented, which is a necessary pre-condition for re-opening, in order to minimize the risk of a “second wave”.   http://web.archive.org/web/20210125014308/https://www.imf.org/en/Topics/imf-and-covid19/Policy-Responses-to-COVID-19"
"99","Brunei","BRN",2021-01-25,"East_Asia_Pacific","H6: Facial Coverings","2G","2G","No updates in the policy."
"100","Brunei","BRN",2021-02-02,"East_Asia_Pacific","H6: Facial Coverings","2G","2G","Recommended to wear a face mask in public places, including when visiting crowded places such as shopping malls, sales expos and sightseeing venues.  https://web.archive.org/web/20210111022516/http://www.moh.gov.bn/Lists/Latest%20news/NewDispForm.aspx?ID=727"
