countryname,countrycode,region,date,policytype,policyvalue,flag,new_level,prev_level,notes
Australia,AUS,East_Asia_Pacific,20200802,C2: Workplace closing,3,0,3T,2T,"  All but essential workplaces are closed. Supermarkets will continue to stay open to allow people to buy food so there is no need to stock up on groceries. Other shops will only be available for delivery or click and collect.    Metropolitan Melbourne, Australia’s second largest city, and capital of the Victoria region,  entered Stage 4 restrictions on 2 August, to last 6 weeks and Stage 3 restrictions apply to regional Victoria as of 5 August. From 6pm on Sunday 2 August, if you live in metropolitan Melbourne, Stage 4 restrictions apply.      Victoria State Government Source: https://web.archive.org/web/20200812100657/https://www.dhhs.vic.gov.au/stage-4-restrictions-summary-covid-19    "
Australia,AUS,East_Asia_Pacific,20200802,C6: Stay at home requirements,3,0,3T,2T,"A curfew is in place between the hours of 8pm until 5am. This means you must be at your home during these hours. The only reasons to leave home between 8pm and 5am will be work, medical care and caregiving. Only one person per household can leave home to get necessary goods and services. They can leave once a day, which means people can’t do multiple shopping trips. You should limit the time you spend away from home. If you are unable to leave a child, children or an person in your care at home unattended, then they may accompany you.      Metropolitan Melbourne, Australia’s second largest city, and capital of the Victoria region,  entered Stage 4 restrictions on 2 August, to last 6 weeks and Stage 3 restrictions apply to regional Victoria as of 5 August. From 6pm on Sunday 2 August, if you live in metropolitan Melbourne, Stage 4 restrictions apply.      Victoria State Government Source: https://web.archive.org/web/20200812100657/https://www.dhhs.vic.gov.au/stage-4-restrictions-summary-covid-19"
Australia,AUS,East_Asia_Pacific,20200802,C7: Restrictions on internal movement,2,0,2T,2T,"Metropolitan Melbourne, Australia’s second largest city, and capital of the Victoria region,  entered Stage 4 restrictions on 2 August, to last 6 weeks and Stage 3 restrictions apply to regional Victoria as of 5 August. From 6pm on Sunday 2 August, if you live in metropolitan Melbourne, Stage 4 restrictions apply.      Victoria State Government Source: https://web.archive.org/web/20200812100657/https://www.dhhs.vic.gov.au/stage-4-restrictions-summary-covid-19    You can only travel up to 5km from your home. You should stay as close to your home as possible, for example shopping at the nearest supermarket. For some people the nearest essential goods and services will be more than 5km away. In this situation you may travel beyond 5km to the nearest provider.    "
Australia,AUS,East_Asia_Pacific,20200803,C1: School closing,3,0,3T,2T,All students in Victoria returned to online learning with the introduction of Stage 4 restrictions on Monday 3rd August. https://web.archive.org/web/20200807024234/https://www.theguardian.com/australia-news/2020/aug/07/victoria-stage-4-restrictions-melbourne-lockdown-rules-covid-19-stage-four-metropolitan-metro-explained-what-you-need-to-know
Brunei,BRN,East_Asia_Pacific,20200813,C4: Restrictions on gatherings,2,1,2G,3G,"On 13th August 2020, the Government raised the limit of people at public and social gatherings from 100 to 200 people at a time.   https://web.archive.org/web/20200817154003/https://thescoop.co/2020/08/13/govt-announces-further-easing-of-covid-19-curbs/"
Brunei,BRN,East_Asia_Pacific,20200814,C8: International travel controls,4,.,4.,4.,"Beginning 14th August 2020, Brunei will reduce the cost of nasal swab testing to $350 for foreign nationals who have been granted permission to enter the country beginning.  The government previously imposed a $1,000 fee on inbound foreigners for the COVID-19 test.  https://web.archive.org/web/20200817154003/https://thescoop.co/2020/08/13/govt-announces-further-easing-of-covid-19-curbs/"
Brunei,BRN,East_Asia_Pacific,20200817,C2: Workplace closing,1,1,1G,0,"From 17th August 2020 onwards, Cinemas will proceed to the third stage of reopening, operating at 80 percent of its full capacity compared to 60 percent in the second phase, and children will be allowed to go to cinemas. Cinemagoers must be kept one seat apart but family members can sit together.  Buffet restaurants will reopen, however only restaurant employees who wear protective face masks can serve food to the patrons. There is no capacity limit for dine-in at restaurants, cafés and food courts since the fourth phase of de-escalation plan took effect.  indoor and outdoor playgrounds as well as game arcades can operate at 60 percent of their normal capacity.  Museums, exhibition galleries and public libraries will also move to the final stage of reopening, hosting a maximum number of 100 people at a time as opposed to the previous 70 people.  For senior citizen centres, attendance is capped at 80 percent at a specific time – an increase from 60 percent.  Under the third phase of de-escalation plan, swimming pools are allowed to operate every day with no age restrictions and can accommodate 80 percent of its total capacity.  Visitors of swimming pools can use the facilities up to two hours a day.  The ministry has also increased the number of people allowed to train for team sports from 10 to 15 people.  Special needs centres and childcare facilities will be able to resume full operations next Monday as part of the fourth phase of de-escalation plan, said the minister of culture, youth and sports. Children of all ages can return to childcare centres, except those who display flu symptoms such as fever or are at high risk of developing a severe infection.  Special needs centres are also open to all, excluding those with chronic diseases.  https://web.archive.org/web/20200817154003/https://thescoop.co/2020/08/13/govt-announces-further-easing-of-covid-19-curbs/"
Brunei,BRN,East_Asia_Pacific,20200817,C5: Close public transport,0,.,0,0,"Starting 17th August 2020, buses and water taxis can run at full capacity. Passengers must wear face masks on buses and scan the BruHealth QR code before boarding. Only passengers with green and yellow BruHealth codes can get on the bus.  https://web.archive.org/web/20200817154003/https://thescoop.co/2020/08/13/govt-announces-further-easing-of-covid-19-curbs/"
China,CHN,East_Asia_Pacific,20200804,C2: Workplace closing,3,0,3T,3T,"Selected archives, museums, and libraries in Beijing and Shenzhen reopen from 4 August with reduced capacity, real-name pre-booking system, and other measures.    http://web.archive.org/web/20200806173024/http://www.bjnews.com.cn/culture/2020/08/04/755158.html"
China,CHN,East_Asia_Pacific,20200807,C1: School closing,3,0,3T,3T,"According to UNESCO database, there are localized school closures in China.  http://web.archive.org/web/20200816190829/https://en.unesco.org/covid19/educationresponse  The central government has published guidelines to prepare reopening of the schools in the fall semester, local authorities will decide which schools and when schools can reopen for the fall semester based on the preparedness of individual schools and the local risk level.  http://web.archive.org/web/20200817205522/http://www.gov.cn/zhengce/zhengceku/2020-08/14/content_5534747.htm  "
Guam,GUM,East_Asia_Pacific,20200808,C2: Workplace closing,2,1,2G,1G,"""All bars on Guam must close for at least two weeks starting Saturday [8 August] to combat the rising number of confirmed coronavirus cases on the island, Gov. Lou Leon Guerrero said.""  http://archive.fo/evIcH"
Guam,GUM,East_Asia_Pacific,20200808,C3: Cancel public events,2,1,2G,2G,"In addition to existing restrictions on public gathering, the government continues to discourage events: ""Additional Caution Against Unnecessary Activity and Off-island Travel. Guam residents are encouraged to exercise caution when engaging in non-essential activities and discouraged from unnecessary travel off-island to any destination.""  http://archive.fo/w/gAZv9"
Guam,GUM,East_Asia_Pacific,20200808,C4: Restrictions on gatherings,3,1,3G,3G,"The Executive Order issued on 8 August included the following measures:  ""There will also be additional restrictions on social gatherings. The number of people allowed at indoor or outdoor gatherings will be reduced from 50 to 25. Funeral services will be limited to 10 people, with viewings available exclusively for immediate family members. At-home wakes will also be prohibited.  The governor said many of the new cases have been linked to funeral gatherings.""  http://archive.fo/evIcH"
Guam,GUM,East_Asia_Pacific,20200808,H2: Testing policy,3,.,3.,3.,"Testing is widely available.  ""DPHSS, in collaboration with the Government of Guam, the Mayors Council of Guam, private, and federal agencies, continues expanded COVID-19 testing.  Testing is free and open to the public while supplies last. No symptoms are needed to qualify for testing. If your village is not listed, please proceed to a neighboring village for testing.""  http://archive.fo/w7m8s"
Hong Kong,HKG,East_Asia_Pacific,20200807,H2: Testing policy,3,.,3.,2.,On Friday 7 August Hong Kong announced that voluntary free virus tests will be available to all 7 million residents in order to achieve universal testing to identify asymptomatic carriers. News articles report that capacity is able to fulfil this.    Media source 1:   https://web.archive.org/web/20200810212626/https://www.bloomberg.com/news/articles/2020-08-07/hong-kong-to-offer-free-virus-testing-to-whole-city-says-hk01    Media source 2:  https://web.archive.org/web/20200812091126/https://www.wsj.com/articles/hong-kong-offers-free-testing-as-china-sends-in-teams-to-contain-coronavirus-11596815359  
Indonesia,IDN,East_Asia_Pacific,20200831,C8: International travel controls,3,.,3.,4.,"Bali island to allow domestic tourists entry on 31 July if they hold a negative COVID 19 test certificate and comply with requirements. Coded as a 3 as while this is not the whole of IDN, 3 seems a good fit for not a *total* border closure.    https://web.archive.org/web/20200730090341/https://www.straitstimes.com/asia/se-asia/indonesias-bali-island-to-welcome-local-tourists-on-july-31-targeting-sept-11-for"
Japan,JPN,East_Asia_Pacific,20200806,C2: Workplace closing,1,0,1T,1G,"Aichi prefecture reinstates regional state of emergency. ""Gov. Hideaki Ohmura on Thursday asked businesses to close altogether or close early and urged people to stay home at night.""  As in April, recommendations are almost law de facto, but de jure the govt has no power to force people to close their businesses or to stay home.  http://archive.fo/Ay30X"
Japan,JPN,East_Asia_Pacific,20200806,C6: Stay at home requirements,1,0,1T,1T,"Aichi prefecture reinstates regional state of emergency. ""Gov. Hideaki Ohmura on Thursday asked businesses to close altogether or close early and urged people to stay home at night.""  As in April, recommendations are almost law de facto, but de jure the govt has no power to force people to close their businesses or to stay home.  http://archive.fo/Ay30X"
Cambodia,KHM,East_Asia_Pacific,20200801,C1: School closing,3,1,3G,3G,"Schools still closed nation wide, though list of 20 private schools in Phnom Penh, Siem Reap and Battambang are allowed to reopen as part of phase one of gradually reopening schools.     http://archive.vn/NOLEG  http://archive.vn/qgLgI  http://archive.vn/0LUEZ"
Cambodia,KHM,East_Asia_Pacific,20200804,C1: School closing,3,1,3G,3G,"Ministry spokesman Ros Soveachea said, “MoEYS has reconsidered and agreed with the Ministry of Health on COVID-19 testing for the 20 education institutions for the Schools Re-opening Phase One, as approved by Prime Minister Hun Sen.  “If students, their parents, or staff members of the 20 education institutions have returned from an oversea trip before early June, or have not travelled outside of Cambodia, they do not need to undergo a COVID-19 test,” he said.  http://archive.vn/zBbqL"
South Korea,KOR,East_Asia_Pacific,20200731,C1: School closing,3,1,3G,3T,
South Korea,KOR,East_Asia_Pacific,20200810,H3: Contact tracing,2,.,2.,2.,"To this date, more than 1.6 million tests have been done.  Source: https://web.archive.org/web/20200813133701/https://www.aa.com.tr/en/asia-pacific/south-korea-finds-new-mutated-coronavirus/1936968"
South Korea,KOR,East_Asia_Pacific,20200816,C3: Cancel public events,2,0,2T,1T,"On the 16th August 2020 the Korea Centers for Disease Control and Prevention implemented a number of targeted measures for the Seoul City and Gyeonggi Province. With respect to public events, the measures included: ""Postpone or cancel non-essential outings, social gatherings, events, or travel"". If people were to go out, they were required to ""wear mask and follow infection prevention guidelines"".      Link: https://web.archive.org/web/20200820120017/https://is.cdc.go.kr/upload_comm/syview/doc.html?fn=159765107610200.pdf&rs=%2Fupload_comm%2Fdocu%2F0030%2F"
South Korea,KOR,East_Asia_Pacific,20200816,C4: Restrictions on gatherings,4,0,4T,4T,"On the 16th August 2020 the Korea Centers for Disease Control and Prevention implemented a number of targeted measures for the Seoul City and Gyeonggi Province. With respect to restrictions on gatherings, the measures included: ""Postpone or cancel non-essential outings, social gatherings, events, or travel"".     Link: https://web.archive.org/web/20200820120017/https://is.cdc.go.kr/upload_comm/syview/doc.html?fn=159765107610200.pdf&rs=%2Fupload_comm%2Fdocu%2F0030%2F"
South Korea,KOR,East_Asia_Pacific,20200816,C6: Stay at home requirements,1,0,1T,1T,"On the 16th August 2020 the Korea Centers for Disease Control and Prevention implemented a number of targeted measures for the Seoul City and Gyeonggi Province. With respect to stay at home requirements, the measures included: ""Postpone or cancel non-essential outings, social gatherings, events, or travel"", but also ""do not go to work if feeling sick"". Also, ""wear mask and follow infection prevention guidelines"".    Link: https://web.archive.org/web/20200820120017/https://is.cdc.go.kr/upload_comm/syview/doc.html?fn=159765107610200.pdf&rs=%2Fupload_comm%2Fdocu%2F0030%2F"
Laos,LAO,East_Asia_Pacific,20200801,C2: Workplace closing,2,1,2G,0,"Covid-19 prevention measures in place since July will continue until 31 August, including the closure of entertainment venues such as karaoke bars, nightclubs, and internet cafes.  Source: http://web.archive.org/web/20200812103542/https://laotiantimes.com/2020/07/31/laos-updates-covid-19-prevention-measures-grounds-charter-flights/"
Laos,LAO,East_Asia_Pacific,20200801,C3: Cancel public events,2,1,2G,0,"Not sure if this goes under 'public events' or 'restrictions on gatherings'? ""Closure of entertainment venues, karaoke, and gaming shops."" Following the rising of cases around the world, Laos has decided to re-enforce some of the previous measures for the month of August. "
Laos,LAO,East_Asia_Pacific,20200801,C4: Restrictions on gatherings,0,.,0,0,"Covid-19 prevention measures in place since July will continue until 31 August:  - Under the notice, a ban on sporting competitions has been lifted, however, organizers are to ensure stadiums do not become overcrowded;  - Strict Covid-19 prevention guidelines issued by the national taskforce must remain in place at all sporting events, such as social distancing measures and provision of face masks and hand gel;  - Casinos will be allowed to resume operations, according to the notice, but must also comply with covid prevention measures;  - Social gatherings, weddings, parties, and traditional festivals may now be held, however, organizers must follow strict guidelines laid out by the national taskforce.  - Meanwhile, entertainment venues including karaoke bars, nightclubs, and internet cafes will remain closed.  Sources: http://web.archive.org/web/20200812103542/https://laotiantimes.com/2020/07/31/laos-updates-covid-19-prevention-measures-grounds-charter-flights/  http://web.archive.org/web/20200812104403/https://laotiantimes.com/2020/07/01/laos-further-relaxes-covid-19-prevention-measures/"
Laos,LAO,East_Asia_Pacific,20200801,C8: International travel controls,3,.,3.,2.,"“The government as decided to suspend the shuttle flights along with maintaining the prevention measures enforced since the end of June after learning of the challenge of a possible outbreak in the days ahead. In addition to these measures, the government also decided to:  - Close traditional and local border checkpoints, except those permitted by the government for goods transport. International checkpoints remain closed for regular travellers, except essential crossings for Lao and foreign nationals who are permitted by the task force committee. Transportation of goods via the international checkpoints is allowed as normal,   - Suspend the issuing of tourist or visiting visas for those travelling from or transiting via countries where a COVID-19 outbreak is taking place. Foreign diplomats, the staff of international organisations, experts, investors, businesspeople, technical personnel, and workers deemed essential to take up missions in Laos can enter the country upon approval by the task force committee.  The measures will be imposed from August 1-31. In case new cases are reported, these measures will be will be revised and imposed accordingly in the province(s) where the cases take place.”  Source: http://web.archive.org/web/20200812093146/http://www.vientianetimes.org.la/sub-new/VTTimes_PDF/147cd2020.pdf    Furthermore, all citizens arriving in Laos must bring negative COVID test results taken within 72 hours of departure for Laos and will be tested for COVID-19 again at the airport. All entrants will be subject to COVID-19 testing and a 14-day self-quarantine requirement at their own expense.  Source: http://web.archive.org/web/20200812100509/https://la.usembassy.gov/health-and-travel-alert-u-s-embassy-vientiane-laos-13/"
Laos,LAO,East_Asia_Pacific,20200803,C3: Cancel public events,1,1,1G,2G,"Covid-19 prevention measures in place since July will continue until 31 August:  - Under the notice, a ban on sporting competitions has been lifted, however, organizers are to ensure stadiums do not become overcrowded;  - Strict Covid-19 prevention guidelines issued by the national taskforce must remain in place at all sporting events, such as social distancing measures and provision of face masks and hand gel;  - Casinos will be allowed to resume operations, according to the notice, but must also comply with covid prevention measures;  - Social gatherings, weddings, parties, and traditional festivals may now be held, however, organizers must follow strict guidelines laid out by the national taskforce.  - Meanwhile, entertainment venues including karaoke bars, nightclubs, and internet cafes will remain closed.  Sources: http://web.archive.org/web/20200812103542/https://laotiantimes.com/2020/07/31/laos-updates-covid-19-prevention-measures-grounds-charter-flights/  http://web.archive.org/web/20200812104403/https://laotiantimes.com/2020/07/01/laos-further-relaxes-covid-19-prevention-measures/"
Macao,MAC,East_Asia_Pacific,20200807,C8: International travel controls,3,.,3.,3.,"Effective from 6am 7 August, ""persons intending to travel from Hong Kong to Macao must hold a nucleic acid certificate issued within 24 hours of intended arrival, proving they have tested negative for COVID-19 infection"".  http://archive.vn/512YG    The Macao government still has no intention to allow foreigners and non-Chinese working-visa holders who are currently outside Macao to enter the city.  http://archive.vn/fhwhi"
Macao,MAC,East_Asia_Pacific,20200813,H2: Testing policy,3,.,3.,3.,"The Macao government lifted the conditions for people eligible to be tested in Macau Forum, one of the largest indoor venues in Macau, on 13 August; prior to 13 August, only people below 18, above 65, and with special reasons could be tested at the Macao Forum.    http://archive.vn/TVyff"
Myanmar,MMR,East_Asia_Pacific,20200801,C4: Restrictions on gatherings,3,1,3G,4G,"Myanmar extended COVID-19 restrictions on 29 July until 31 August, following the gatherings limit increased on 1 August from 5 persons to 15 persons.  http://archive.fo/aqyrQ"
Myanmar,MMR,East_Asia_Pacific,20200801,C8: International travel controls,3,.,3.,3.,"Myanmar extended restrictions on international flights until August 31, with consular approval for essential businesses and officials required for exemptions  http://archive.fo/aqyrQ"
Myanmar,MMR,East_Asia_Pacific,20200813,C4: Restrictions on gatherings,3,1,3G,3G,"On 13 August, the government expanded gathering limits to 30 persons from 15 persons  http://archive.fo/1U05z"
Mongolia,MNG,East_Asia_Pacific,20200801,C8: International travel controls,4,.,4.,4.,"Green Gateway”, a temporary regulation targeted to revive trade and economic cooperation and move  large-scale projects and programs forward in a time of the pandemic, will come into effect from tomorrow, August 1. With implementation of the temporary regulation, freight vehicle drivers will have greater access to enter Mongolian and Chinese border checkpoints than before. A citizen who made a request to travel according to the “Green Gateway” regulation, will cross the country’s border after getting permission from corresponding organizations of the two countries and getting involved in COVID-19 test. After their passage through the border, they will follow relevant infection prevention rules of that country. Within it, citizens arrived in Mongolia from China will be put into 21+14-day mandatory isolation.    http://archive.vn/czUUD"
Mongolia,MNG,East_Asia_Pacific,20200805,C1: School closing,3,1,3G,3G,No change (opening on 1 Sep)
Mongolia,MNG,East_Asia_Pacific,20200805,C2: Workplace closing,2,1,2G,2G,"Swimming pools reopen on 4 Aug after cultural and child centres, libraries and cinemas opened in July. Still with safety measures such as: Provide services for 50 percent of the site area;  Keep a distance of 1.5–2 meters between people; Check body temperature, and Wear a mask or face mask.  http://archive.fo/OhsHg"
Mongolia,MNG,East_Asia_Pacific,20200805,C3: Cancel public events,0,.,0,2G,"I could not really find guidelines on this matter, but I can clearly see tens of parties and concerts happening in Ulaanbaatar over the weekend on Facebook.  http://archive.fo/9zTM7"
Mongolia,MNG,East_Asia_Pacific,20200805,C4: Restrictions on gatherings,0,.,0,0,No policy change
Mongolia,MNG,East_Asia_Pacific,20200805,C5: Close public transport,0,.,0,0,No policy change
Mongolia,MNG,East_Asia_Pacific,20200805,C6: Stay at home requirements,0,.,0,0,No policy change
Mongolia,MNG,East_Asia_Pacific,20200805,C7: Restrictions on internal movement,2,0,2T,2T,"Could not find any new information. Also, the nature of the restriction seemed pretty arbitrary to me (with permits being required) and do not really know how hard affects people wanting to travel to and from Ulaanbaator"
Mongolia,MNG,East_Asia_Pacific,20200805,C8: International travel controls,4,.,4.,4.,"As of 29 July (latest data available) ""Travel Restrictions: Mongolia has extended a ban on all international travel and prohibited entry to all foreigners, even those with family ties to Mongolian citizens or who hold legal residency visas.""  http://archive.fo/GW39j"
Mongolia,MNG,East_Asia_Pacific,20200805,E1: Income support,1,1,1A,0,"Government on 2 Aug on how it is using international aid:  ""For example, the child allowance was increased to MNT 100,000, funding for food purchases for low-income families was doubled, MNT 73,000 was provided to 73,000 people from 6.9 thousand low-income enterprises, and social welfare pensioners and permanent care recipients were provided. An additional MNT 768 billion has been spent so far, including an increase of MNT 100,000 in child benefits.  In addition, in order to protect the income of citizens, business entities and organizations, a total of 1 trillion 877.9 billion MNT of social insurance premiums, personal income and corporate income tax, its interest and fines were completely exempted. The Kovid-19 epidemic has created a total budget burden of 2.5 trillion MNT. ""  http://archive.fo/E0dVy"
Mongolia,MNG,East_Asia_Pacific,20200805,H1: Public information campaigns,2,1,2G,2G,https://web.archive.org/web/20200813235916/https://covid19.mohs.mn/
Mongolia,MNG,East_Asia_Pacific,20200805,H3: Contact tracing,2,.,2.,2.,"Could not find the guidelines, but they at least know where do all their new cases come from:  ""As of Saturday, Mongolia has reported a total of 293 COVID-19 cases, all of which were imported. No local transmissions or deaths have been reported in the Asian country so far.""  http://archive.fo/0Bn5L"
Malaysia,MYS,East_Asia_Pacific,20200803,C1: School closing,2,0,2T,0," Five schools in Kedah have been closed in four sub-districts in the Malaysian state of Kedah have been put under the ""targeted enhanced movement control order (MCO)"" following the growing number of Covid-19 cases linked to the Sivagangga cluster in the state on 3 August.    https://web.archive.org/web/20200804131004/http://www.straitstimes.com/asia/se-asia/4-areas-in-malaysias-kedah-under-lockdown-5-schools-ordered-to-close-amid-rise-in-covid"
