"","CountryName","CountryCode","Date","region","PolicyType","PolicyCode","previous_PolicyCode","Notes"
"1","Bermuda","BMU",2021-10-13,"North_America","C1: School closing","1G","2G","A total of three schools opened.  https://web.archive.org/web/20211026060813/https://www.royalgazette.com/education/news/article/20211014/schools-and-preschools-reopen-classrooms-today/"
"2","Bermuda","BMU",2021-10-14,"North_America","C1: School closing","1G","1G","On October 14th,  the Premier has announced the majority of public schools will be open to in-classroom learning by the end of the week.  https://web.archive.org/web/20211015183710/https://www.royalgazette.com/education/news/article/20211014/majority-of-public-schools-to-be-open-by-end-of-the-week-burt/"
"3","Bermuda","BMU",2021-10-27,"North_America","C2: Workplace closing","1G","1G","There is a night-time curfew in effect from 12:30 am - 05:00 am daily and the guidance must be followed.  https://web.archive.org/web/20211102040253/https://www.gov.bm/coronavirus-workplace"
"4","Bermuda","BMU",2021-10-27,"North_America","C3: Cancel public events","1G","1G","If you are planning to organize an event with more than 20 persons, you must first apply to the Minister of Youth, Culture, and Sport for an exemption.   https://web.archive.org/web/20211102034541/https://www.gov.bm/covid-19-guidance-events-and-gatherings"
"5","Bermuda","BMU",2021-10-27,"North_America","C4: Restrictions on gatherings","3G","3G","Gatherings are restricted to groups of no more than 20 people.   The Minister of Youth, Culture, and Sport may grant a Large Group Exemption permitting more than 20 persons to assemble, provided appropriate physical distancing is maintained and relevant guidance is followed at all times.  https://web.archive.org/web/20211102034541/https://www.gov.bm/covid-19-guidance-events-and-gatherings"
"6","Bermuda","BMU",2021-10-27,"North_America","C5: Close public transport","1G","1G","Passengers onboard public transport or in taxis have to wear masks.  https://web.archive.org/web/20211102035708/https://www.gov.bm/mask-guidance"
"7","Bermuda","BMU",2021-10-27,"North_America","C6: Stay at home requirements","1G","1G","There is a night-time curfew in effect from 00:30 - 05:00am daily (12:30am - 05:00am)  https://web.archive.org/web/20211005171442/https://www.gov.bm/coronavirus-guidance"
"8","Bermuda","BMU",2021-10-27,"North_America","C7: Restrictions on internal movement","0","0","No updates  https://web.archive.org/web/20211005171442/https://www.gov.bm/coronavirus-guidance"
"9","Bermuda","BMU",2021-10-27,"North_America","C8: International travel controls","2","2","No updates   https://web.archive.org/web/20211102041450/https://bm.usconsulate.gov/covid-19-information/"
"10","Bermuda","BMU",2021-10-27,"North_America","E1: Income support","2T","2T","No updates  https://web.archive.org/web/20211102051444/https://www.gov.bm/articles/ministry-finance-update-14-october-2021"
"11","Bermuda","BMU",2021-10-27,"North_America","E2: Debt/contract relief","2","0","In addition to giving numerous concessions, relief, and benefits during the height of the pandemic, the Bermuda Government has continued, in this fiscal year,  to offer tax relief, concessions, and financial assistance, where possible, to sectors and persons, severely impacted by this crisis.  https://web.archive.org/web/20211102051444/https://www.gov.bm/articles/ministry-finance-update-14-october-2021"
"12","Bermuda","BMU",2021-10-27,"North_America","H1: Public information campaigns","2G","2G","No updates  https://web.archive.org/web/20211102041146/https://www.gov.bm/coronavirus"
"13","Bermuda","BMU",2021-10-27,"North_America","H2: Testing policy","3","3","PCR and antigen test are avaible.  The Government of Bermuda provides free COVID-19 testing for visitors and residents.  The Ministry of Health books the required tests for all travelers (residents and visitors) arriving on the island.  Travelers will receive an email with the date, time, and location of their test.  https://web.archive.org/web/20211102041450/https://bm.usconsulate.gov/covid-19-information/"
"14","Bermuda","BMU",2021-10-27,"North_America","H3: Contact tracing","2","2","Effective September 18, 2021, there will be an automated notification email process for notifying COVID-positive patients and named close contacts of their status and their need to isolate or quarantine.    When a test result comes back positive, persons will be notified via the email address provided on their test booking. The notification email will include necessary information on the steps the person who tested must take with respect to isolation and other matters. It will also include a link to an online form that allows the positive person to list off their close contacts, so they can be notified as well about their exposure, without disclosing who the positive person is.    This new automated notification email process replaces a manual process of phone calls and emails that the contact tracing team was using to notify positives and close contacts. The automatic email notification will replace the many calls contact tracers must make to ensure residents know they are positive and their close contacts know they have been exposed.     https://web.archive.org/web/20211102035217/https://www.gov.bm/quarantine-contact-tracing"
"15","Bermuda","BMU",2021-10-27,"North_America","H6: Facial Coverings","2G","2G","Masks are required in (but not limited to) the following situations:  -Workers at all workplace premises - in accordance with the relevant  guidance  -Passengers on board public transport or in taxis   -When visiting any establishment (indoor) (e.g. grocery store, shop, bank, office, gallery, etc) unless otherwise allowed by specific guidance.  -School children in accordance with the relevant guidance  -In crowded places (indoors and outdoors) where you cannot maintain an appropriate physical distance of 6 feet (2 meters) from others who are not from your household or whose immunization status is unknown    *NOTE:  Persons with medical vulnerabilities should continue to wear masks if physical distancing cannot be maintained.  Although masks are generally not required outdoors, there have been cases where the virus has spread in outdoor settings, which is why it is important to wear masks in crowded outdoor places.  https://web.archive.org/web/20211102035708/https://www.gov.bm/mask-guidance"
"16","Bermuda","BMU",2021-10-27,"North_America","H7: Vaccination policy","5G","5G","Vaccines: Pfizer and AstraZeneca  https://web.archive.org/web/20211102050747/https://bernews.com/2021/10/92770-total-vaccinations-70-4-one-dose/"
"17","Bermuda","BMU",2021-10-31,"North_America","H7: Vaccination policy","5G","5G","Boosters are available for individuals aged 65 or older, medical workers, and essential workers.  https://web.archive.org/web/20211105054918/https://www.gov.bm/vaccines"
"18","Bermuda","BMU",2021-10-27,"North_America","H8: Protection of elderly people","1G","1G","No updates  https://web.archive.org/web/20211102041450/https://bm.usconsulate.gov/covid-19-information/"
"19","Canada","CAN",2021-10-18,"North_America","C1: School closing","3T","3T","On 18 october 2021, in Yellowknife, capital city of the Northwest Territories (NWT), and surrounding region: “Junior Kindergarten to Grade 12 schools, colleges, and trade schools shall close to in-person learning ...until October 22, 2021 at 5:00pm”. Elementary and/or secondary schools experiencing high numbers of covid cases are closed and operating online in other regions of Canada. For example in New Brunswick (NB), “schools with cases may close or move to online learning for at least one calendar day to support contact tracing”. NB requires vaccination or regular testing for all school staff and restricts sports and other extra activities for students born in 2009 or earlier to those vaccinated. Many universities across Canada are requiring students and staff to be vaccinated or tested regularly -- e.g., “students at Mount Royal University [Alberta] have been deregistered from classes after refusing to declare their vaccination status”. See NWT and NB governments, University Affairs Canada, Globe and Mail newspaper, CP24 news, CTV news websites, archived:  https://web.archive.org/web/20211018202532/https://www.gov.nt.ca/covid-19/sites/covid/files/resources/gatherings_order_-_yk_ndilo_dettah_october_14_final.pdf  https://web.archive.org/web/20211018174016/https://www.cp24.com/news/nearly-100-more-school-related-cases-of-covid-19-reported-as-new-poll-raises-questions-about-potential-vaccine-rollout-among-younger-kids-1.5627475  https://web.archive.org/web/20211018200138/https://atlantic.ctvnews.ca/dartmouth-n-s-school-to-close-due-to-covid-19-outbreak-1.5627163  https://web.archive.org/web/20211018150854/https://www.thestar.com/news/gta/2021/10/16/biggest-ontario-universities-record-high-vaccine-coverage-ahead-of-immunization-deadlines.html  https://web.archive.org/web/20211018175743/https://www.universityaffairs.ca/news/news-article/covid-19-updates-for-canadas-universities/  https://web.archive.org/web/20211017002950/https://www.theglobeandmail.com/canada/article-covid-19-vaccine-passports-mandates-restrictions-explainer/  https://web.archive.org/web/20211008130205/https://www2.gnb.ca/content/dam/gnb/Departments/ed/pdf/2021-22-guidelines.pdf"
"20","Canada","CAN",2021-10-22,"North_America","C1: School closing","3T","3T","22 october 2021 is the last day of a school-closing order in Yellowknife, capital city of the Northwest Territories (NWT), and surrounding region: “Junior Kindergarten to Grade 12 schools, colleges, and trade schools shall close to in-person learning ...until October 22, 2021 at 5:00pm”. Elementary and/or secondary schools experiencing high numbers of covid cases are closed and operating online in other regions of Canada. For example on 18 October in New Brunswick (NB) with “students in five schools were asked to stay home because of COVID-19 exposures ... are learning from home ... the  Education Minister said the province “will also continue to see school closures ... based on the advice of Public Health. It should reduce a lot as the [rapid test] kits roll out.” NB requires vaccination or regular testing for all school staff and restricts sports and other extra activities for students born in 2009 or earlier to those vaccinated. Many universities across Canada are requiring students and staff to be vaccinated or tested regularly. See NWT and NB governments, University Affairs Canada, Globe and Mail newspaper, CP24 news, CTV news websites, archived:  https://web.archive.org/web/20211018202532/https://www.gov.nt.ca/covid-19/sites/covid/files/resources/gatherings_order_-_yk_ndilo_dettah_october_14_final.pdf  https://web.archive.org/web/20211022152202/https://www.cbc.ca/news/canada/north/nwt-schools-open-monday-oct-25-1.6218175  https://web.archive.org/web/20211022154124/https://www.cbc.ca/news/canada/new-brunswick/new-brunswick-school-closure-dominic-cardy-1.6214709  https://web.archive.org/web/20211022155003/https://www.universityaffairs.ca/news/news-article/covid-19-updates-for-canadas-universities/  https://web.archive.org/web/20211017002950/https://www.theglobeandmail.com/canada/article-covid-19-vaccine-passports-mandates-restrictions-explainer/  https://web.archive.org/web/20211008130205/https://www2.gnb.ca/content/dam/gnb/Departments/ed/pdf/2021-22-guidelines.pdf"
"21","Canada","CAN",2021-10-23,"North_America","C1: School closing","2T","3T","23 october 2021 is the first full day after the expiry of the school-closing order in Yellowknife, capital city of the Northwest Territories (NWT), and surrounding region. School staff began preparing to reopen school for Monday, 25 Oct. Elementary and/or secondary schools experiencing high numbers of covid cases are closed and operating online in some locations in Canada. Many universities across Canada are requiring students and staff to be vaccinated or tested regularly. See University Affairs Canada, and CBC news websites, archived:  https://web.archive.org/web/20211022152202/https://www.cbc.ca/news/canada/north/nwt-schools-open-monday-oct-25-1.6218175  https://web.archive.org/web/20211022181503/https://www.cbc.ca/news/canada/newfoundland-labrador/unexpected-covid-briefing-oct22-1.6220957  https://web.archive.org/web/20211022154124/https://www.cbc.ca/news/canada/new-brunswick/new-brunswick-school-closure-dominic-cardy-1.6214709  https://web.archive.org/web/20211022155003/https://www.universityaffairs.ca/news/news-article/covid-19-updates-for-canadas-universities/"
"22","Canada","CAN",2021-11-01,"North_America","C1: School closing","2T","2T","On 1 november 2021, elementary and/or secondary schools experiencing high numbers of covid cases are closed and operating online in some locations in Canada. All public elementary and secondary schools closed effective 29 October in the province of New Brunswick during labour-management negotiations. Many universities across Canada are requiring students and staff to be vaccinated or tested regularly. See University Affairs Canada, and CBC news websites, archived:  https://web.archive.org/web/20211101145028/https://www.universityaffairs.ca/news/news-article/covid-19-updates-for-canadas-universities/  https://web.archive.org/web/20211029203129/https://www.cbc.ca/news/canada/new-brunswick/new-brunswick-public-sector-strike-1.6229766"
"23","Canada","CAN",2021-11-05,"North_America","C1: School closing","2T","2T","On 5 november 2021, all public elementary and secondary schools remain closed (effective 29 October)with students learning online in the province of New Brunswick (NB) during labour-government negotiations on a new contract for non-teaching employees. In the rest of Canada, a few elementary and/or secondary schools experiencing high numbers of covid cases are closed and operating online in some locations in Canada. Many universities across Canada are requiring students and staff to be vaccinated or tested regularly. See University Affairs Canada, Globe and Mail newspaper, government of NWT, and CBC, Global news websites, archived:  https://web.archive.org/web/20211104134838/https://www.universityaffairs.ca/news/news-article/covid-19-updates-for-canadas-universities/  https://web.archive.org/web/20211104171735/https://www.cbc.ca/news/canada/new-brunswick/cupe-strike-parents-online-learning-1.6236216  https://web.archive.org/web/20211105180933/https://globalnews.ca/news/8352230/meeting-of-n-b-premier-and-striking-union-ends-with-no-word-on-progress-or-next/  https://web.archive.org/web/20211104172008/https://www.gov.nt.ca/covid-19/sites/covid/files/resources/public_health_order_-_katlodeeche_first_nation_reserve_lands_hay_river_reserve_temporary_covid-19_restrictions.pdf  https://web.archive.org/web/20211029165211/https://www.gov.nt.ca/covid-19/sites/covid/files/resources/behchoko_temporary_restrictions_order_amended_oct_27.pdf  https://web.archive.org/web/20211104173919/https://www.theglobeandmail.com/canada/article-covid-19-vaccine-passports-mandates-restrictions-explainer/"
"24","Canada","CAN",2021-10-18,"North_America","C2: Workplace closing","3T","3T","On 18 october 2021, in the Northwest Territories (NWT): “Behchoko` is currently under a Containment Order… Non-essential businesses … must close.”  In the rest of Canada, businesses are open with varying levels of restrictions. Many provinces now restrict access to some non-essential businesses to fully vaccinated customers (or require proof of a recent negative test). See globe and mail newspaper and NWT websites, archived:  https://web.archive.org/web/20211017110425/https://www.gov.nt.ca/covid-19/en/services/gatherings-and-events  https://web.archive.org/web/20211017002950/https://www.theglobeandmail.com/canada/article-covid-19-vaccine-passports-mandates-restrictions-explainer/"
"25","Canada","CAN",2021-10-22,"North_America","C2: Workplace closing","3T","3T","On 22 october 2021, in the Northwest Territories (NWT) communities of Behchoko` and Hay River Reserve: “Non-essential businesses … must close.” In the rest of Canada, businesses are open with varying levels of restrictions. Many provinces now restrict access to some non-essential businesses to fully vaccinated customers (or require proof of a recent negative test). See Retail Council of Canada and NWT websites, archived:  https://web.archive.org/web/20211021184432/https://www.gov.nt.ca/covid-19/sites/covid/files/resources/katlodeeche_covid19_restrictions_order_oct_19.pdf  https://web.archive.org/web/20211011220541/https://www.gov.nt.ca/covid-19/sites/covid/files/resources/behchoko_temporary_restrictions_order_amended_oct_4.pdf  https://web.archive.org/web/20211021185313/https://www.retailcouncil.org/coronavirus-info-for-retailers/vaccination-requirements-by-province/"
"26","Canada","CAN",2021-11-01,"North_America","C2: Workplace closing","3T","3T","On 1 november 2021, in the Northwest Territories (NWT) communities of Behchoko` and Hay River Reserve: “Non-essential businesses … must close.” In the rest of Canada, businesses are open with varying levels of restrictions. Many provinces now restrict access to some non-essential businesses to fully vaccinated customers (or require proof of a recent negative test). See Retail Council of Canada and NWT websites, archived:  https://web.archive.org/web/20211029165211/https://www.gov.nt.ca/covid-19/sites/covid/files/resources/behchoko_temporary_restrictions_order_amended_oct_27.pdf  https://web.archive.org/web/20211029204312/https://www.gov.nt.ca/covid-19/sites/covid/files/resources/katlodeeche_covid19_restrictions_order_amended_oct_22.pdf  https://web.archive.org/web/20211029204459/https://www.retailcouncil.org/coronavirus-info-for-retailers/vaccination-requirements-by-province/"
"27","Canada","CAN",2021-11-05,"North_America","C2: Workplace closing","3T","3T","On 5 november 2021, in the Northwest Territories (NWT) communities of Behchoko` and Hay River Reserve: “Non-essential businesses … must close.” In the rest of Canada, businesses are open with varying levels of restrictions. Many provinces now restrict access to some non-essential businesses to fully vaccinated customers (or require proof of a recent negative test). See Retail Council of Canada, Globe and Mail newspaper and NWT websites, archived:  https://web.archive.org/web/20211104172008/https://www.gov.nt.ca/covid-19/sites/covid/files/resources/public_health_order_-_katlodeeche_first_nation_reserve_lands_hay_river_reserve_temporary_covid-19_restrictions.pdf  https://web.archive.org/web/20211029165211/https://www.gov.nt.ca/covid-19/sites/covid/files/resources/behchoko_temporary_restrictions_order_amended_oct_27.pdf  https://web.archive.org/web/20211104172242/https://www.retailcouncil.org/coronavirus-info-for-retailers/vaccination-requirements-by-province/  https://web.archive.org/web/20211104173919/https://www.theglobeandmail.com/canada/article-covid-19-vaccine-passports-mandates-restrictions-explainer/"
"28","Canada","CAN",2021-10-18,"North_America","C3: Cancel public events","2T","2T","On 18 october 2021, in the Northwest Territories (NWT): “Behchoko` is currently under a Containment Order… Non-essential … facilities … must close.” In other provinces and territories, public events are permitted with capacity limits, mask requirements and other guidelines. In many provinces, sports and performing arts events are limited to vaccinated spectators. See globe and mail newspaper and NWT websites, archived:  https://web.archive.org/web/20211017110425/https://www.gov.nt.ca/covid-19/en/services/gatherings-and-events  https://web.archive.org/web/20211017002950/https://www.theglobeandmail.com/canada/article-covid-19-vaccine-passports-mandates-restrictions-explainer/"
"29","Canada","CAN",2021-10-22,"North_America","C3: Cancel public events","2T","2T","On 22 october 2021, in the Northwest Territories (NWT) communities of Behchoko` and Hay River Reserve: Non-essential … facilities … must close.” In other provinces and territories, public events are permitted with capacity limits, mask requirements and other guidelines. In many provinces, sports and performing arts events are limited to vaccinated spectators. See Retail Council of Canada, globe and mail newspaper and NWT websites, archived:  https://web.archive.org/web/20211021184432/https://www.gov.nt.ca/covid-19/sites/covid/files/resources/katlodeeche_covid19_restrictions_order_oct_19.pdf  https://web.archive.org/web/20211011220541/https://www.gov.nt.ca/covid-19/sites/covid/files/resources/behchoko_temporary_restrictions_order_amended_oct_4.pdf  https://web.archive.org/web/20211021185313/https://www.retailcouncil.org/coronavirus-info-for-retailers/vaccination-requirements-by-province/  https://web.archive.org/web/20211017002950/https://www.theglobeandmail.com/canada/article-covid-19-vaccine-passports-mandates-restrictions-explainer/"
"30","Canada","CAN",2021-11-01,"North_America","C3: Cancel public events","2T","2T","On 1 november 2021, in the Northwest Territories (NWT) communities of Behchoko` and Hay River Reserve: Non-essential … facilities … must close.” In other provinces and territories, public events are permitted with capacity limits, mask requirements and other guidelines. In many provinces, sports and cultural events are limited to vaccinated spectators. See Retail Council of Canada, globe and mail newspaper and NWT websites, archived:  https://web.archive.org/web/20211029165211/https://www.gov.nt.ca/covid-19/sites/covid/files/resources/behchoko_temporary_restrictions_order_amended_oct_27.pdf  https://web.archive.org/web/20211029204312/https://www.gov.nt.ca/covid-19/sites/covid/files/resources/katlodeeche_covid19_restrictions_order_amended_oct_22.pdf  https://web.archive.org/web/20211029204459/https://www.retailcouncil.org/coronavirus-info-for-retailers/vaccination-requirements-by-province/"
"31","Canada","CAN",2021-11-05,"North_America","C3: Cancel public events","2T","2T","On 5 november 2021, in the Northwest Territories (NWT) communities of Behchoko` and Hay River Reserve: Non-essential … facilities … must close.” In other provinces and territories, public events are permitted with capacity limits, mask requirements and/or other guidelines. In many provinces, sports and cultural events are limited to vaccinated spectators. See Retail Council of Canada, globe and mail newspaper and NWT websites, archived:  https://web.archive.org/web/20211104172008/https://www.gov.nt.ca/covid-19/sites/covid/files/resources/public_health_order_-_katlodeeche_first_nation_reserve_lands_hay_river_reserve_temporary_covid-19_restrictions.pdf  https://web.archive.org/web/20211029165211/https://www.gov.nt.ca/covid-19/sites/covid/files/resources/behchoko_temporary_restrictions_order_amended_oct_27.pdf  https://web.archive.org/web/20211104172242/https://www.retailcouncil.org/coronavirus-info-for-retailers/vaccination-requirements-by-province/  https://web.archive.org/web/20211104173919/https://www.theglobeandmail.com/canada/article-covid-19-vaccine-passports-mandates-restrictions-explainer/"
"32","Canada","CAN",2021-10-18,"North_America","C4: Restrictions on gatherings","4T","4T","As of 18 october 2021 in the province of Alberta: “Indoor private gatherings aren’t allowed for unvaccinated Albertans 12 and older, and for fully vaccinated people, the limit is two households to a maximum of 10 vaccine-eligible people. Outdoor private gatherings are restricted to 20 people.” In the Northwest Territories (NWT) Behchoko remains under a containment order prohibiting all gatherings. In those parts of New Brunswick (NB) under “circuit-breaker” rules: “gatherings at private homes inside or outside with anyone who does not live at that home is not permitted”. Gathering limits and rules vary in the rest of Canada. See globe and mail newspaper and governments of NB and NWT websites, archived:  https://web.archive.org/web/20211017110425/https://www.gov.nt.ca/covid-19/en/services/gatherings-and-events  https://web.archive.org/web/20211017002950/https://www.theglobeandmail.com/canada/article-covid-19-vaccine-passports-mandates-restrictions-explainer/  https://web.archive.org/web/20211018110257/https://www2.gnb.ca/content/gnb/en/corporate/promo/covid-19/circuit_breaker.html"
"33","Canada","CAN",2021-10-22,"North_America","C4: Restrictions on gatherings","4T","4T","As of 22 october 2021 in those parts of New Brunswick (NB) under “circuit-breaker” rules: “gatherings at private homes inside or outside with anyone who does not live at that home is not permitted”. In the Northwest Territories (NWT) communities of Behchoko` and Hay River Reserve, a containment order prohibits all gatherings. In the province of Alberta: “Indoor private gatherings aren’t allowed for unvaccinated Albertans 12 and older, and for fully vaccinated people, the limit is two households to a maximum of 10 vaccine-eligible people. Outdoor private gatherings are restricted to 20 people.” Gathering limits and rules vary in the rest of Canada. See globe and mail newspaper and governments of NB and NWT websites, archived:  https://web.archive.org/web/20211021184432/https://www.gov.nt.ca/covid-19/sites/covid/files/resources/katlodeeche_covid19_restrictions_order_oct_19.pdf  https://web.archive.org/web/20211011220541/https://www.gov.nt.ca/covid-19/sites/covid/files/resources/behchoko_temporary_restrictions_order_amended_oct_4.pdf  https://web.archive.org/web/20211017002950/https://www.theglobeandmail.com/canada/article-covid-19-vaccine-passports-mandates-restrictions-explainer/  https://web.archive.org/web/20211021111005/https://www2.gnb.ca/content/gnb/en/corporate/promo/covid-19/circuit_breaker.html"
