"","CountryName","CountryCode","Date","region","PolicyType","PolicyCode","previous_PolicyCode","Notes"
"319","Bosnia and Herzegovina","BIH",2022-01-04,"Europe_Central_Asia","E1: Income support","0","0","No evidence of continued income support."
"320","Bosnia and Herzegovina","BIH",2022-01-04,"Europe_Central_Asia","E2: Debt/contract relief","0","2","No evidence of continued debt/contract relief."
"321","Bosnia and Herzegovina","BIH",2022-01-04,"Europe_Central_Asia","H1: Public information campaigns","2G","2G","https://web.archive.org/web/20220115122723/https://www.facebook.com/login/?next=https%3A%2F%2Fwww.facebook.com%2FKrizniStabStozerFederalnogMinistarstvaZdravstva%2F"
"322","Bosnia and Herzegovina","BIH",2022-01-04,"Europe_Central_Asia","H2: Testing policy","3","3","Are PCR and/or antigen tests available for U.S. citizens in BiH? Yes  If so, are test results reliably available within 72 hours? Yes  Private and public clinics throughout BiH perform PCR and serological COVID-19 tests. Payment is due in full at the time of the test and current prices are roughly 100 convertible marks (km) for PCR and 40km for antigen.  Turnaround of results and availability of testing appointments vary based on the city yet clinics in most large cities have testing options daily and return results within 24 hours.  A list of clinics known to provide COVID-19 testing in BiH can be found on our website here  Public Health Centers (Dom Zdravlja) test symptomatic individuals regardless of nationality, free of charge. To arrange a test, contact your canton’s health center for additional guidance.    https://web.archive.org/web/20220114112145/https://ba.usembassy.gov/covid-19-information/"
"323","Bosnia and Herzegovina","BIH",2022-01-04,"Europe_Central_Asia","H3: Contact tracing","0","0","No evidence of contact tracing."
"324","Bosnia and Herzegovina","BIH",2022-01-04,"Europe_Central_Asia","H6: Facial Coverings","3G","2G","The adopted order still requires the wearing of the mask indoors, as well as outdoors if a distance of 2 meters cannot be achieved. It is mandatory to wear masks at public transport stops, markets / open markets and other places where there is a greater fluctuation in population.    https://web.archive.org/web/20220115120320/https://covid19.fmoh.gov.ba/novost/822/od-danas-na-snazi-nove-naredbe-kriznog-stozera-federalnog-ministarstva-zdravstva-koje-je-usvojila-vlada-fbih"
"325","Bosnia and Herzegovina","BIH",2022-01-04,"Europe_Central_Asia","H7: Vaccination policy","5G","4G","The new order continues to instruct the competent authorities in the cantons / counties, as well as the health institutions in the cantons / counties, to provide COVID-19 vaccination points at the level of each municipality in order to make COVID-19 vaccination more accessible to the public. They are also required to organize vaccinations against COVID-19 every working day, at least three times a week until 20:00, at least one day during the weekend, and at least once a week at places of larger public gatherings.     https://web.archive.org/web/20220115120320/https://covid19.fmoh.gov.ba/novost/822/od-danas-na-snazi-nove-naredbe-kriznog-stozera-federalnog-ministarstva-zdravstva-koje-je-usvojila-vlada-fbih"
"326","Bosnia and Herzegovina","BIH",2022-01-04,"Europe_Central_Asia","H8: Protection of elderly people","1G","1G","The recommendations of the FMZ Crisis Staff / Headquarters to the elderly, especially those with chronic diseases, recommend that they continue to avoid unnecessary movements and use of public transport, and that they regularly use protective equipment.     https://web.archive.org/web/20220115120320/https://covid19.fmoh.gov.ba/novost/822/od-danas-na-snazi-nove-naredbe-kriznog-stozera-federalnog-ministarstva-zdravstva-koje-je-usvojila-vlada-fbih"
"327","Bosnia and Herzegovina","BIH",2022-01-04,"Europe_Central_Asia","V1: Vaccine Prioritisation","-3","-3","The new order continues to instruct the competent authorities in the cantons / counties, as well as the health institutions in the cantons / counties, to provide COVID-19 vaccination points at the level of each municipality in order to make COVID-19 vaccination more accessible to the public. They are also required to organize vaccinations against COVID-19 every working day, at least three times a week until 20:00, at least one day during the weekend, and at least once a week at places of larger public gatherings.     https://web.archive.org/web/20220115120320/https://covid19.fmoh.gov.ba/novost/822/od-danas-na-snazi-nove-naredbe-kriznog-stozera-federalnog-ministarstva-zdravstva-koje-je-usvojila-vlada-fbih    https://web.archive.org/web/20220115133650/https://vakcine.ba/covid-19-i-vakcinacija/pitanja-i-odgovori/vakcinacija-djece-i-mladih-protiv-covid-19-sta-treba-znati/"
"328","Bosnia and Herzegovina","BIH",2022-01-04,"Europe_Central_Asia","V2: Vaccine Availability","16915","15461","https://web.archive.org/web/20220115133650/https://vakcine.ba/covid-19-i-vakcinacija/pitanja-i-odgovori/vakcinacija-djece-i-mladih-protiv-covid-19-sta-treba-znati/"
"329","Bosnia and Herzegovina","BIH",2022-01-04,"Europe_Central_Asia","V3: Vaccine Financial Support","16915","15461","Eligible individuals (residents and/or persons with local health insurance) can sign up following instructions from their locality.  Which vaccines are available in BiH? Pfizer, AstraZeneca, Sputnik V, Sinopharm, Moderna  Follow official local sources (also see Local Resources, below) for announcements about vaccines in your area.  Visit the FDA’s website to learn more about FDA-approved vaccines in the United States.  The United States Government does not plan to provide COVID-19 vaccinations to private U.S. citizens overseas. Please follow host country developments and guidelines for COVID-19 vaccination.    https://web.archive.org/web/20220115122605/https://ba.usembassy.gov/covid-19-information/"
"330","Belarus","BLR",2022-01-09,"Europe_Central_Asia","C1: School closing","0","0","No measure are found  https://web.archive.org/web/20220121173229/http://minzdrav.gov.by/ru/dlya-belorusskikh-grazhdan/COVID-19/faq_covid-19.php"
"331","Belarus","BLR",2022-01-09,"Europe_Central_Asia","C2: Workplace closing","1G","0","Some measures of social distancing are required in the workplace, to limit contact.  https://web.archive.org/web/20220121172822/http://minzdrav.gov.by/ru/dlya-belorusskikh-grazhdan/COVID-19/metodicheskie-rekomendatsii-po-profilaktike-covid-19-v-organizatsiyakh.php"
"332","Belarus","BLR",2022-01-09,"Europe_Central_Asia","C3: Cancel public events","0","0","No measure found  https://web.archive.org/web/20220121173229/http://minzdrav.gov.by/ru/dlya-belorusskikh-grazhdan/COVID-19/faq_covid-19.php"
"333","Belarus","BLR",2022-01-09,"Europe_Central_Asia","C4: Restrictions on gatherings","0","0","No measure found  https://web.archive.org/web/20220121173229/http://minzdrav.gov.by/ru/dlya-belorusskikh-grazhdan/COVID-19/faq_covid-19.php"
"334","Belarus","BLR",2022-01-09,"Europe_Central_Asia","C5: Close public transport","0","0","No measure found  https://web.archive.org/web/20220121173229/http://minzdrav.gov.by/ru/dlya-belorusskikh-grazhdan/COVID-19/faq_covid-19.php"
"335","Belarus","BLR",2022-01-09,"Europe_Central_Asia","C6: Stay at home requirements","0","0","No measure found  https://web.archive.org/web/20220121173229/http://minzdrav.gov.by/ru/dlya-belorusskikh-grazhdan/COVID-19/faq_covid-19.php"
"336","Belarus","BLR",2022-01-09,"Europe_Central_Asia","C7: Restrictions on internal movement","0","0","No measure found  https://web.archive.org/web/20220121173229/http://minzdrav.gov.by/ru/dlya-belorusskikh-grazhdan/COVID-19/faq_covid-19.php"
"337","Belarus","BLR",2022-01-09,"Europe_Central_Asia","C8: International travel controls","3","3","Foreigners who do not possess a residency or temporary visa have to show a PCR test to enter Belarus, unless they can show prove of vaccination. They are allowed to enter the country through airports ONLY, and are banned from entering through land.   https://web.archive.org/web/20220122113022/https://gpk.gov.by/covid-19/"
"338","Belarus","BLR",2022-01-09,"Europe_Central_Asia","E1: Income support","0","0","No measure found   https://web.archive.org/web/20220121173229/http://minzdrav.gov.by/ru/dlya-belorusskikh-grazhdan/COVID-19/faq_covid-19.php"
"339","Belarus","BLR",2022-01-09,"Europe_Central_Asia","E2: Debt/contract relief","0","0","No measure found  https://web.archive.org/web/20220121173229/http://minzdrav.gov.by/ru/dlya-belorusskikh-grazhdan/COVID-19/faq_covid-19.php"
"340","Belarus","BLR",2022-01-09,"Europe_Central_Asia","H1: Public information campaigns","2G","2G","Public information available but mostly in Russian   https://web.archive.org/web/20220121173229/http://minzdrav.gov.by/ru/dlya-belorusskikh-grazhdan/COVID-19/faq_covid-19.php"
"341","Belarus","BLR",2022-01-09,"Europe_Central_Asia","H2: Testing policy","3","3","Tests can be obtained at the airport or health clinics in several cities.  It can take several days to weeks to schedule a test, and payment must be made at the time of the test, by the recipient.  Depending on the location, test results can be in either Russian, English, or both.  Test results will typically be a paper copy.    https://web.archive.org/web/20220122113824/https://by.usembassy.gov/covid-19-information/"
"342","Belarus","BLR",2022-01-09,"Europe_Central_Asia","H3: Contact tracing","0","0","No policy found  https://web.archive.org/web/20220121173229/http://minzdrav.gov.by/ru/dlya-belorusskikh-grazhdan/COVID-19/faq_covid-19.php"
"343","Belarus","BLR",2022-01-09,"Europe_Central_Asia","H6: Facial Coverings","1G","1G","The use of mask is recommended but not mandatory.   https://web.archive.org/web/20220121173229/http://minzdrav.gov.by/ru/dlya-belorusskikh-grazhdan/COVID-19/faq_covid-19.php"
"344","Belarus","BLR",2022-01-09,"Europe_Central_Asia","H7: Vaccination policy","4G","4G","Vaccination is organized following a national plan of action. It is recommended and never mandatory, and it is government funded.   https://web.archive.org/web/20220121173229/http://minzdrav.gov.by/ru/dlya-belorusskikh-grazhdan/COVID-19/faq_covid-19.php"
"345","Belarus","BLR",2022-01-09,"Europe_Central_Asia","H8: Protection of elderly people","0","0","No measure found  https://web.archive.org/web/20220121173229/http://minzdrav.gov.by/ru/dlya-belorusskikh-grazhdan/COVID-19/faq_covid-19.php"
"346","Belarus","BLR",2022-01-09,"Europe_Central_Asia","V1: Vaccine Prioritisation","-3","-3","Vaccination is organized following a national plan of action. It is recommended and never mandatory, and it is government funded. Available for those over 12, booster available for those over 18.   https://web.archive.org/web/20220121173229/http://minzdrav.gov.by/ru/dlya-belorusskikh-grazhdan/COVID-19/faq_covid-19.php"
"347","Belarus","BLR",2022-01-09,"Europe_Central_Asia","V2: Vaccine Availability","17878","16019","Vaccination is organized following a national plan of action. It is recommended and never mandatory, and it is government funded. Available for those over 12, booster available for those over 18.   https://web.archive.org/web/20220121173229/http://minzdrav.gov.by/ru/dlya-belorusskikh-grazhdan/COVID-19/faq_covid-19.php"
"348","Belarus","BLR",2022-01-09,"Europe_Central_Asia","V3: Vaccine Financial Support","17878","16019","Vaccination is organized following a national plan of action. It is recommended and never mandatory, and it is government funded. Available for those over 12, booster available for those over 18.   https://web.archive.org/web/20220121173229/http://minzdrav.gov.by/ru/dlya-belorusskikh-grazhdan/COVID-19/faq_covid-19.php"
"349","Switzerland","CHE",2022-01-01,"Europe_Central_Asia","C1: School closing","1G","1G","No evidence of policy change. Schools are open in Switzerland although they are subject to protective measures such as mask-wearing.     Link:  http://web.archive.org/web/20220105154829/https://www.bag.admin.ch/bag/en/home/krankheiten/ausbrueche-epidemien-pandemien/aktuelle-ausbrueche-epidemien/novel-cov/massnahmen-des-bundes.html"
"350","Switzerland","CHE",2022-01-09,"Europe_Central_Asia","C1: School closing","1G","1G","No evidence of policy change. Schools remain mostly open in Switzerland under the application of certain protective measures such as mask-wearing.     Link:  http://web.archive.org/web/20220115213925/https://www.bag.admin.ch/bag/en/home/krankheiten/ausbrueche-epidemien-pandemien/aktuelle-ausbrueche-epidemien/novel-cov/massnahmen-des-bundes.html"
"351","Switzerland","CHE",2022-01-01,"Europe_Central_Asia","C2: Workplace closing","2G","2G","Working from home is mandatory in Switzerland. If that is not possible, masks must be worn in indoor spaces.     Link:  http://web.archive.org/web/20220105154829/https://www.bag.admin.ch/bag/en/home/krankheiten/ausbrueche-epidemien-pandemien/aktuelle-ausbrueche-epidemien/novel-cov/massnahmen-des-bundes.html"
"352","Switzerland","CHE",2022-01-09,"Europe_Central_Asia","C2: Workplace closing","2G","2G","Working at home is mandatory in Switzerland. If not possible, masks must be worn in indoor spaces.    Link:  http://web.archive.org/web/20220115213925/https://www.bag.admin.ch/bag/en/home/krankheiten/ausbrueche-epidemien-pandemien/aktuelle-ausbrueche-epidemien/novel-cov/massnahmen-des-bundes.html"
"353","Switzerland","CHE",2022-01-01,"Europe_Central_Asia","C3: Cancel public events","2G","2G","Access to indoor and outdoor events is limited to people holding a Covid certificate. There only exist limited exceptions, such as religious ceremonies or funerals.     Link:  http://web.archive.org/web/20220105154829/https://www.bag.admin.ch/bag/en/home/krankheiten/ausbrueche-epidemien-pandemien/aktuelle-ausbrueche-epidemien/novel-cov/massnahmen-des-bundes.html"
"354","Switzerland","CHE",2022-01-09,"Europe_Central_Asia","C3: Cancel public events","2G","2G","Access to indoor and outdoor events is limited to people holding a Covid certificate. There only exist limited exceptions, such as religious ceremonies or funerals.     Link:  http://web.archive.org/web/20220115213925/https://www.bag.admin.ch/bag/en/home/krankheiten/ausbrueche-epidemien-pandemien/aktuelle-ausbrueche-epidemien/novel-cov/massnahmen-des-bundes.html"
"355","Switzerland","CHE",2022-01-01,"Europe_Central_Asia","C4: Restrictions on gatherings","3G","3G","No evidence of policy change. This is what can be read on the government's website:    ""The number of people allowed to attend events among friends and family (for example gatherings and parties) that are not held in publicly accessible establishments and businesses is limited. The numbers include children.      Rule indoors without certificate: A maximum of 30 people is allowed.    If more than 10 people are present, it is recommended to limit access to people with a certificate.    Rule outdoors: A maximum of 50 people is allowed    Link:  http://web.archive.org/web/20220105154829/https://www.bag.admin.ch/bag/en/home/krankheiten/ausbrueche-epidemien-pandemien/aktuelle-ausbrueche-epidemien/novel-cov/massnahmen-des-bundes.html"
"356","Switzerland","CHE",2022-01-09,"Europe_Central_Asia","C4: Restrictions on gatherings","3G","3G","No evidence of policy change. This is what can be read on the government's website:    ""The number of people allowed to attend events among friends and family (for example gatherings and parties) that are not held in publicly accessible establishments is limited. The numbers include children.      Rule indoors without certificate: A maximum of 30 people is allowed if everyone is vaccinated or recovered. As soon as one person is present who is not vaccinated or recovered and is aged over 16, only up to 10 people may gather.    Rule outdoors: A maximum of 50 people is allowed.""    Link:  http://web.archive.org/web/20220115213925/https://www.bag.admin.ch/bag/en/home/krankheiten/ausbrueche-epidemien-pandemien/aktuelle-ausbrueche-epidemien/novel-cov/massnahmen-des-bundes.html"
"357","Switzerland","CHE",2022-01-01,"Europe_Central_Asia","C5: Close public transport","0","0","No evidence of policy change.     link:  http://web.archive.org/web/20220105154829/https://www.bag.admin.ch/bag/en/home/krankheiten/ausbrueche-epidemien-pandemien/aktuelle-ausbrueche-epidemien/novel-cov/massnahmen-des-bundes.html"
"358","Switzerland","CHE",2022-01-09,"Europe_Central_Asia","C5: Close public transport","0","0","No policy change. Public transportation functions as normal in Switzerland.     Link:  https://www.bag.admin.ch/bag/en/home/krankheiten/ausbrueche-epidemien-pandemien/aktuelle-ausbrueche-epidemien/novel-cov/massnahmen-des-bundes.html"
"359","Switzerland","CHE",2022-01-01,"Europe_Central_Asia","C8: International travel controls","1","3","There are several measures travelers must take in order to enter the country. Vaccinated or recovered individuals must complete an entry form and present a negative test.  Not recovered and not vaccinated individuals must fill out the entry form, present a negative test, and turn in a second negative test between 4-7 days upon the arrival.     The government of Switzerland had a ban in place for ""countries with a variant of concern"", which meant that travelers from these destinations were prohibited from entering the country. However, as of now, there are no countries under this category.     Link:  http://web.archive.org/web/20220105160134/https://www.bag.admin.ch/bag/en/home/krankheiten/ausbrueche-epidemien-pandemien/aktuelle-ausbrueche-epidemien/novel-cov/empfehlungen-fuer-reisende/quarantaene-einreisende.html    http://web.archive.org/web/20220105160156/https://www.bag.admin.ch/bag/en/home/krankheiten/ausbrueche-epidemien-pandemien/aktuelle-ausbrueche-epidemien/novel-cov/empfehlungen-fuer-reisende/liste.html"
"360","Switzerland","CHE",2022-01-09,"Europe_Central_Asia","C8: International travel controls","1","1","There are several measures travelers must take in order to enter the country. Vaccinated or recovered individuals must complete an entry form and present a negative test.  Not recovered and not vaccinated individuals must fill out the entry form, present a negative test, and turn in a second negative test between 4-7 days upon the arrival.     The government of Switzerland had a ban in place for ""countries with a variant of concern"", which meant that travelers from these destinations were prohibited from entering the country. However, as of now, there are no countries under this category.     Link:  http://web.archive.org/web/20220115214529/https://www.bag.admin.ch/bag/en/home/krankheiten/ausbrueche-epidemien-pandemien/aktuelle-ausbrueche-epidemien/novel-cov/empfehlungen-fuer-reisende/quarantaene-einreisende.html"
"361","Switzerland","CHE",2022-01-01,"Europe_Central_Asia","H6: Facial Coverings","3G","3G","Masks are required in all public spaces.     Link:  http://web.archive.org/web/20220105160156/https://www.bag.admin.ch/bag/en/home/krankheiten/ausbrueche-epidemien-pandemien/aktuelle-ausbrueche-epidemien/novel-cov/empfehlungen-fuer-reisende/liste.html"
"362","Switzerland","CHE",2022-01-01,"Europe_Central_Asia","H7: Vaccination policy","5G","5G","Vaccines are generally available in Switzerland for people of all age groups.       Link:  http://web.archive.org/web/20220105154631/https://www.bag.admin.ch/bag/en/home/krankheiten/ausbrueche-epidemien-pandemien/aktuelle-ausbrueche-epidemien/novel-cov/impfen.html#-134524438"
"363","Switzerland","CHE",2022-01-09,"Europe_Central_Asia","V1: Vaccine Prioritisation","-3","-3","Although there are some groups that are highly encouraged to get the jab, there's no vaccine prioritization plan in Switzerland. At this point, the inoculation campaign has become universal. Anyone above 5 years old can receive the vaccine.     Link:  http://web.archive.org/web/20220115214734/https://www.bag.admin.ch/bag/en/home/krankheiten/ausbrueche-epidemien-pandemien/aktuelle-ausbrueche-epidemien/novel-cov/impfen.html"
"364","Switzerland","CHE",2022-01-09,"Europe_Central_Asia","V2: Vaccine Availability","-2","-2","No evidence of policy change.    http://web.archive.org/web/20220115214734/https://www.bag.admin.ch/bag/en/home/krankheiten/ausbrueche-epidemien-pandemien/aktuelle-ausbrueche-epidemien/novel-cov/impfen.html"
"365","Switzerland","CHE",2022-01-09,"Europe_Central_Asia","V3: Vaccine Financial Support","-2","-2","No evidence of policy change.     http://web.archive.org/web/20220115214734/https://www.bag.admin.ch/bag/en/home/krankheiten/ausbrueche-epidemien-pandemien/aktuelle-ausbrueche-epidemien/novel-cov/impfen.html"
"366","Czech Republic","CZE",2021-12-28,"Europe_Central_Asia","C1: School closing","1G","1G","Schools are open but mask are required.   Preventive routine antigen testing in schools will be carried out every Monday and Thursday (2 times a week) from 3 January to 16 January. The school may replace the antigen tests with PCR tests, in which case the test will be carried out once a week.    https://archive.ph/v3rsY"
"367","Czech Republic","CZE",2021-12-28,"Europe_Central_Asia","C2: Workplace closing","1G","1G","Masks are required in all indoor areas of the workplace.    https://archive.ph/RdoLc"
"368","Czech Republic","CZE",2021-12-28,"Europe_Central_Asia","C3: Cancel public events","1G","1G","Public events are allowed. When more than 20 people are gathered, a proof of covid vaccination or recovery is required for participants over 12. A limit of 50 participants applies. From January 3, the maximum of persons allowed to meet at social events will be increased to 100.     https://archive.ph/PHLpq"
"369","Czech Republic","CZE",2021-12-28,"Europe_Central_Asia","C4: Restrictions on gatherings","3G","3G","50 people can gather freely indoors or outdoors. When more than 20 people gather, they need to present a proof  of covid vaccination or recovery, and a limit of 100 people applies. Masks must be worn indoors.    https://archive.ph/PHLpq"
"370","Czech Republic","CZE",2021-12-28,"Europe_Central_Asia","C5: Close public transport","0","0","Masks must be worn while using public transport    https://archive.ph/1tLBp"
"371","Czech Republic","CZE",2021-12-28,"Europe_Central_Asia","C6: Stay at home requirements","0","0","No stay home requirement was indicated.    https://archive.ph/QKqp7"
"372","Czech Republic","CZE",2021-12-28,"Europe_Central_Asia","C7: Restrictions on internal movement","0","0","No restriction on internal movement    https://archive.ph/QKqp7"
"373","Czech Republic","CZE",2021-12-28,"Europe_Central_Asia","C8: International travel controls","2","2","Different regulations applies to different countries. Most travelers must be tested. Travelers coming from a country listed as dark red must quarantine until they receive the results of their tests taken between 5 and 7 days after their arrival.     https://archive.ph/oI2U1"
"374","Czech Republic","CZE",2021-12-28,"Europe_Central_Asia","E1: Income support","2T","2T","This compensation applies to cases where employees are ordered to quarantine or to be isolated due to COVID-19. The amount of the support is set at 80% of eligible costs (compensation of wages paid to employees + the corresponding amount of statutory contributions), but a maximum of CZK 39,000 per employee and month. For employees, this means that they are in obstacles and receive a wage compensation of 60% of average earnings.    https://archive.ph/ZFpbh"
"375","Czech Republic","CZE",2021-12-28,"Europe_Central_Asia","E2: Debt/contract relief","2","2","No change of policy found    https://web.archive.org/web/20220115211415/https://www.vlada.cz/en/media-centrum/aktualne/measures-adopted-by-the-czech-government-against-coronavirus-180545/"
"376","Czech Republic","CZE",2021-12-28,"Europe_Central_Asia","H1: Public information campaigns","2G","2G","There is a government website to provide information    https://web.archive.org/web/20220115211813/https://covid.gov.cz/en/"
"377","Czech Republic","CZE",2021-12-28,"Europe_Central_Asia","H2: Testing policy","3","3","Tests are available for all, they can be free of charge with a doctor request, paid for by the health insurance under certain conditions, or if none of the conditions apply, self-paid.    https://archive.ph/QfGBW"
"378","Czech Republic","CZE",2021-12-28,"Europe_Central_Asia","H3: Contact tracing","1","1","Self-reporting is recommended and tracing centers are organizing the tracing effort.    https://web.archive.org/web/20220115211944/https://covid.gov.cz/en/situations/infection-and-general-measures/how-does-tracing-work"
"379","Czech Republic","CZE",2021-12-28,"Europe_Central_Asia","H6: Facial Coverings","2G","2G","Mask are required in most indoor areas.    https://archive.ph/pgX7x"
"380","Czech Republic","CZE",2021-12-28,"Europe_Central_Asia","H7: Vaccination policy","5G","5G","Vaccinations are available for age 5 or above.    https://archive.ph/amYTt"
"381","Czech Republic","CZE",2021-12-28,"Europe_Central_Asia","H8: Protection of elderly people","2G","2G","Some restrictions and protections still in place for people visiting elderly care facilities, such as pre-visit PCR/antigen testing or proof of vaccination.    https://web.archive.org/web/20220115212351/https://covid.gov.cz/en/situations/hospitals-and-sanitary-facilities/visits-social-facilities"
"382","Czech Republic","CZE",2021-12-28,"Europe_Central_Asia","V1: Vaccine Prioritisation","-3","-3","Vaccines are available for age 5 or above.    https://archive.ph/amYTt"
"383","Czech Republic","CZE",2021-12-28,"Europe_Central_Asia","V2: Vaccine Availability","16954","14761","Vaccines are available for all over the age of 5. Prioritization might be given to vulnerable population groups as elderly and those suffering under a chronic disease as well as essential infrastructure workers (medical workers, social workers, school staff, etc.).     https://archive.ph/amYTt"
