countryname,countrycode,region,startdate,enddate,policytype,policyvalue,flag,new_level,prev_level,initialnote
Australia,AUS,East_Asia_Pacific,20200612,,C3: Cancel public events,1,0,1T,2G,"Today the government announced that for outdoor venues up to 40,000 spectator capacity, ticketed and seated events will be able to be held in front of a crowd of no more than 25 per cent of capacity. Also social distancing of 1 person per 4sqm and/or staying 1.5 metres away from other people must be adhered to whenever and wherever possible, and also maintain good hygiene of handwashing.     However, it is up to individual States and territories to make decisions on when to move to this situation. It is likely that some states will not want to change things too quickly, for example Victoria where there are more cases is easing restrictions more slowly.    This doesn't include non-ticketed standing events such as music festivals.    https://web.archive.org/web/20200622145532/https://www.pm.gov.au/media/update-coronavirus-measures-12june20"
Australia,AUS,East_Asia_Pacific,20200612,,C4: Restrictions on gatherings,2,0,2T,3G,"National Cabinet agreed to remove the 100 person limit on non-essential indoor gatherings under the Step 3 Framework and replace it with:    1 person per 4sqm;  staying 1.5 metres away from other people whenever and wherever possible;    From this I have changed the restrictions to 101-1000 as that seems reasonable for the type of gatherings mentioned here.    The easing of restrictions is ultimately decided State-by-State, and hence the reason I have used the targeted code.    https://web.archive.org/web/20200622145532/https://www.pm.gov.au/media/update-coronavirus-measures-12june20"
Australia,AUS,East_Asia_Pacific,20200612,,C7: Restrictions on internal movement,1,0,1T,2T,"Australia’s federal government stepped up pressure on state and territory leaders on Friday to reopen internal borders, a step viewed as key to reviving the country’s coronavirus-hit economy    Opening up borders will ultimately be decided by the leaders of the respective States and territories.    https://web.archive.org/web/20200622152123/https://www.reuters.com/article/health-coronavirus-australia/australian-pm-pushes-for-internal-borders-to-be-reopened-idUSL4N2DO4HP"
China,CHN,East_Asia_Pacific,20200616,,C1: School closing,3,0,3T,2T,A local outbreak in Beijing has led to the closure of schools in many districts.     https://archive.vn/MREU2
Philippines,PHL,East_Asia_Pacific,20200615,,C6: Stay at home requirements,3,0,3T,1G,"Philippine officials have placed a central city back under strict lockdown and retained quarantine restrictions in the capital for another two weeks as coronavirus infections continue to spike alarmingly.    President Rodrigo Duterte approved in a televised meeting Monday night with key Cabinet officials a recommendation to lock down Cebu city anew and retain quarantine restrictions in metropolitan Manila where many of the nearly 26,500 infections and more than 1,000 deaths have been recorded.  Link: https://abcnews.go.com/Health/wireStory/latest-india-train-carriages-virus-beds-71250586"
Singapore,SGP,East_Asia_Pacific,20200619,,C2: Workplace closing,1,1,1G,2G,"From June 19, Singapore has entered Phase Two of its COVID19 policy, and most sectors are now open with special safety measures in place, including dine-in restaurants and retail outlets. Businesses are still required to offer the option for remote work by default, wherever possible. Businesses that fail to comply with the necessary safety measures may be obliged to close.     https://archive.vn/qVq8N"
Singapore,SGP,East_Asia_Pacific,20200619,,C5: Close public transport,0,.,0,1G,"Phase Two of Singapore's Circuit Breaker policy, which began on June 19, does not include any recommendations to close public transport.    https://archive.vn/qVq8N"
Singapore,SGP,East_Asia_Pacific,20200619,,C6: Stay at home requirements,1,1,1G,2G,"People are encouraged to work from home wherever possible, and social distancing measures must be complied with, but there are no curfews or requirements in place.    https://archive.vn/qVq8N"
Singapore,SGP,East_Asia_Pacific,20200619,,C7: Restrictions on internal movement,0,.,0,2G,
Timor-Leste,TLS,East_Asia_Pacific,20200615,,C8: International travel controls,4,.,4.,3.,"June 2 - From June 2 to 26, the land ported will only be open on Tuesday from 10 am to 12 pm. The priority of entry should be given to Timorese nationals and traded goods. On June 18 it was ruled that drivers of trucks transporting traded goods must change at the border.  Link: https://web.archive.org/web/20200625065149/http://www.laohamutuk.org/Justice/2020/JRGABMI1Jun2020pt.pdf  https://web.archive.org/web/20200625065220/http://www.laohamutuk.org/Justice/2020/GABMI18Jun2020pt.pdf    No policy change. The state of emergency is set to last until June 26.    The government approved an extension on the state of emergency, whose restrictions now only regard to the sanitary control at the entrance and exit points of the national territory, circulation in national territory and establishment of residence are maintained. The execution measures are clarified in a decree approved on April 29, stating that entry into the national territory is forbidden to foreign nationals. The prohibition does not apply to foreign nationals who were born in Timor-Leste territory and who usually reside here or who are the legal representatives of Timorese minors or third-country nationals who are legal residents of Timor-Leste over whom they exercise parental authority or ensure their support and education. The prohibition provided does not apply to foreign nationals who carry out their professional activity on oil platforms located in the Timor Sea.    Link:   http://web.archive.org/web/20200606073432/http://www.laohamutuk.org/Justice/2020/JRPresDec35Lei4-27Maiu2020pt.pdf  http://web.archive.org/web/20200606071429/http://timor-leste.gov.tl/?p=24530&lang=en  http://web.archive.org/web/20200606073342/http://www.laohamutuk.org/Justice/2020/GovDec9-29May2020en.pdf  http://web.archive.org/web/20200606075632/http://timor-leste.gov.tl/wp-content/uploads/2020/05/EE2-sai-husi-umaa2.pd"
Timor-Leste,TLS,East_Asia_Pacific,20200615,,H2: Testing policy,1,.,1.,2.,"Tests ongoing on suspect cases (in the link illegal immigrants from Vietnam were tested). Until June 15, about 1830 tests have been conducted.    Link: https://web.archive.org/web/20200625071246/http://www.tatoli.tl/2020/06/15/covid-19-rezultadu-ezame-laboratoriu-ba-sidadaun-estanjeiru-nain-13-negativu/  https://web.archive.org/web/20200625071720/http://www.tatoli.tl/2020/06/15/durante-loron-52-la-deteta-kazu-foun-covid-19/"
,,,,,,,,,,
Note: Data from 24 Jun 2020. Individual countries may be several days older.,,,,,,,,,,
Source: Oxford COVID-19 Government Response Tracker. More at: github.com/OxCGRT/covid-policy-tracker or bsg.ox.ac.uk/covidtracker,,,,,,,,,,
