"","CountryName","CountryCode","Date","region","PolicyType","PolicyCode","previous_PolicyCode","Notes"
"131","Israel","ISR",2022-01-10,"Middle_East_North_Africa","C8: International travel controls","4","4","Conditions for the arrival of foreign nationals to Israel have changed, but essentially remain the same for the unvaccinated. For those without the appropriate locally recognised vaccinations/documentation of recovery, entry to Israel is only possible with a clearance for exceptional entry.    Conditions for the arrival of foreign nationals to Israel  Foreign nationals may arrive in Israel if they meet the following conditions:  •	Less than 180 days has passed since completion of a WHO approved vaccine course or a WHO approved booster.  or  •	Less than 180 days has passed since recovery and the traveler holds a EU equivalent recovery certificate based on a positive NAAT test.  or  •	The traveler holds a EU equivalent recovery certificate based on a positive NAAT test, and has received at least a single dose of vaccine and less than 180 days has passed since the latter event.    •	If there is no other hindrance for their arrival in Israel  •	If they arrived in Israel either by Ben Gurion International Airport or by Ramon Airport    Foreign nationals who do not meet these conditions will not permitted entry, except for those who have received a clearance for exceptional entry.    Sources:  https://archive.vn/cNMen [International Travel]  https://archive.vn/uddYq [Local Councils Traffic Light Model - Red Locality]  https://archive.vn/eHMBE [Local Councils Traffic Light Model - Red Locality - text only]"
"132","Israel","ISR",2022-01-17,"Middle_East_North_Africa","C8: International travel controls","4","4","Arrival of Foreign Nationals by Air Travel  NB: Foreign nationals who will not meet the conditions below will not be allowed to arrive in Israel, save for those who received a clearance for exceptional arrival from the Population and Immigration Authority.    Conditions for the arrival of foreign nationals to Israel  Foreign nationals who will be arriving from orange or yellow destinations will be allowed to arrive in Israel and to stay in short isolation of 24 hours or until they test negative on the PCR test taken upon arrival in Israel (whichever is earlier), if they meet the conditions below.    Conditions for the arrival of foreign nationals to Israel  •	If you did not stay in any countries on the red list within 14 days before arrival in Israel.  •	If you've been vaccinated with a WHO (World Health Organization) approved vaccine in accordance with the required protocol in Israel, or if your recovery has been confirmed in accordance with the required protocol in Israel, and you have a digital certificate recognized by the Ministry of Health in Israel – see details below.  •	If there is no other hindrance for your arrival in Israel    Foreign nationals who will not meet these conditions will not be allowed to arrive in Israel, save for those who received a clearance for exceptional arrival from the Population and Immigration Authority.    Foreign nationals who are considered vaccinated  Foreign nationals vaccinated with the vaccines by Pfizer, Moderna, AstraZeneca, Sinovac, Bharat Biotech, Sinopharm, Johnson and Johnson or Sputnik – in accordance with the required protocol in Israel:  •	Vaccinated with two vaccine doses (or a single dose in case of the Johnson and Johnson vaccine) and 14 days or more have passed since the date of the second dose on the day of arrival in Israel (and no more than 180 days on the day of leaving Israel). Not including the day of vaccination.  or:  •	They have been vaccinated with a booster dose and 14 days or more have passed since the date of the vaccination on the day of arrival in Israel. Not including the day of vaccination.    Foreign nationals vaccinated with the Sputnik vaccine:  Upon arrival in Israel, you are required to take a serologic test and to stay in isolation until you receive a positive result (in addition to the isolation of 24 hours or until you receive a negative result on the PCR test that you took at the airport in Israel.    Foreign nationals who are considered recovered  Foreign nationals who will present a certificate of recovery that can be digitally verified in the Ministry of Health's systems in Israel, based on a positive result on a PCR test (or a NAAT-based equivalent), provided:  •	On the day of entry to Israel, at least 8 days have passed since the date of the test (but no more than 190 days on the day of leaving Israel).  or:  •	They received at least one dose of the vaccines approved by the WHO (regardless of the sequence of events and the date of vaccination or recovery).    Source: https://archive.vn/rQ1g7 [Arrival of Foreign Nationals by Air Travel]"
"133","Israel","ISR",2022-01-24,"Middle_East_North_Africa","C8: International travel controls","4","4","Non-Israeli citizens who will not meet these [below] requirements will not be allowed to enter Israel, except those who received permission from the Population and Immigration Authority.    ""Non-Israeli citizens who arrive from countries on the orange or yellow lists will be allowed to enter Israel and short 24-hour isolation or until they test negative on a PCR test taken upon arrival in Israel (whichever is earlier), if they meet the requirements below.""    ""Entry requirements of non-Israeli citizens  •	If you did not visit any countries on the red list within 14 days before arrival in Israel.  •	If you've been vaccinated with a WHO (World Health Organization) approved vaccine in accordance with the protocol set by Israel, or if your recovery has been confirmed in accordance with the protocol set by Israel, and you have a digital certificate recognized by the Israeli Ministry of Health – see details below.  •	If there is no other hindrance for your arrival in Israel.""    ""Non-Israeli citizens who will not meet these requirements will not be allowed to enter Israel, except those who received permission from the Population and Immigration Authority.""    Sources:  https://web.archive.org/web/20220124195412/https://corona.health.gov.il/en/abroad/arriving-foreign-nationals/  https://web.archive.org/web/20220124195536/https://corona.health.gov.il/en/abroad/isolation/"
"134","Israel","ISR",2022-02-04,"Middle_East_North_Africa","C8: International travel controls","4","4","Non-Israeli citizens who arrive from countries on the orange or yellow lists will be allowed to enter Israel and short 24-hour isolation or until they test negative on a PCR test taken upon arrival in Israel (whichever is earlier), if they meet the requirements below.    Entry requirements of non-Israeli citizens  •	If you did not visit any countries on the red list within 14 days before arrival in Israel.  •	If you've been vaccinated with a WHO (World Health Organization) approved vaccine in accordance with the protocol set by Israel, or if your recovery has been confirmed in accordance with the protocol set by Israel, and you have a digital certificate recognized by the Israeli Ministry of Health – see details below.  •	If there is no other hindrance for your arrival in Israel.    Non-Israeli citizens who will not meet these requirements will not be allowed to enter Israel, except those who received permission from the Population and Immigration Authority.    Source: https://web.archive.org/web/20220204204212/https://corona.health.gov.il/en/abroad/arriving-foreign-nationals/"
"135","Israel","ISR",2022-02-07,"Middle_East_North_Africa","C8: International travel controls","4","4","Non-Israeli citizens who arrive from countries on the orange or yellow lists will be allowed to enter Israel and short 24-hour isolation or until they test negative on a PCR test taken upon arrival in Israel (whichever is earlier), if they meet the requirements below.    Entry requirements for non-Israeli citizens  •	If you did not visit any countries on the red list within 14 days before arrival in Israel.  •	If you've been vaccinated with a WHO (World Health Organization) approved vaccine in accordance with the protocol set by Israel, or if your recovery has been confirmed in accordance with the protocol set by Israel, and you have a digital certificate recognized by the Israeli Ministry of Health – see details below.  •	If there is no other hindrance for your arrival in Israel.    Non-Israeli citizens who do not meet these requirements will not be allowed to enter Israel, except those who meet the requirements of the Population and Immigration Authority or received an exceptional entry permission from the Population and Immigration Authority.    Sources:  https://web.archive.org/web/20211220073524/https://www.gov.il/en/departments/news/border_closing_coronavirus_14062020  https://web.archive.org/web/20220208214022/https://corona.health.gov.il/en/abroad/arriving-foreign-nationals/  https://archive.vn/7RTQC [Local Councils Traffic Light Model]  https://archive.vn/TlAyl [Local Councils Traffic Light Model - text only]"
"136","Israel","ISR",2022-02-01,"Middle_East_North_Africa","E1: Income support","2G","2G","Everyone can apply online for an ""employment grant""    The purpose of an ""employment grant"" is to increase the disposable income of low-wage workers, thereby reducing economic disparities while encouraging participation in the labor market. Employees and self-employed people, aged 23 and older, who are parents of children or people aged 55 and older, with/without children, whose average monthly income is more than NIS 2,130 and less than NIS 7,030, are entitled to the grant. Single parents are entitled to a subsidy if their average monthly income is higher than NIS 1,310 and lower than NIS 11,860.    Source: https://archive.vn/PLqQk"
"137","Israel","ISR",2022-01-25,"Middle_East_North_Africa","E2: Debt/contract relief","1","1","""As part of the fight against the Omicron wave while maintaining an active economy, Finance Minister Avigdor Lieberman announced a series of new measures to help the cash flow of businesses and the self-employed. As part of these measures, cash flow relief worth more than NIS 1.3 billion will be provided, as well as relief from bureaucratic procedures for businesses, relief in obtaining state-guaranteed loans and relief for small and medium-sized exporters.""    Source: https://archive.vn/szGsU [Ministry of Finance]"
"138","Israel","ISR",2022-01-07,"Middle_East_North_Africa","H2: Testing policy","2","2","Update of the testing and isolation policy for close contacts of a confirmed COVID-19 case introduced 7 January.    Sources:  https://archive.vn/YTvTd [details of the new policy]  https://archive.vn/Etuxk [When Do I Take a PCR Test and When a Rapid Test? Ministry of Health]"
"139","Israel","ISR",2022-01-10,"Middle_East_North_Africa","H6: Facial Coverings","2G","2G","General Guidance  Masking is required indoors and in case of a gathering of over 50 people outdoors.    In schools, ""masking is required indoors for anyone from the 1st grade onward. In a class where one or more student is deaf or hard of hearing, staff members shall wear a transparent mask.""    Sources:  https://archive.vn/uddYq [Local Councils Traffic Light Model - Red Locality]  https://archive.vn/eHMBE [Local Councils Traffic Light Model - Red Locality - text only]"
"140","Israel","ISR",2022-01-17,"Middle_East_North_Africa","H6: Facial Coverings","2G","2G","Masks are required indoors and in case of a gathering of over 50 people outdoors.    Sources:  https://archive.vn/KqgJR [Local Councils Traffic Light Model - red locality]  https://archive.vn/XCbuR [Local Councils Traffic Light Model - red locality - text only]"
"141","Israel","ISR",2022-01-24,"Middle_East_North_Africa","H6: Facial Coverings","2G","2G","General Guidance  Masking is required indoors, and in case of a gathering of over 50 people outdoors, not including during physical activities.    Sources:  https://archive.vn/KqgJR [Local Councils Traffic Light Model - red locality - still valid as of 24 January]  https://archive.vn/XCbuR [Local Councils Traffic Light Model - red locality - text only - still valid as of 24 January]"
"142","Israel","ISR",2022-02-04,"Middle_East_North_Africa","H6: Facial Coverings","2G","2G","General Guidance  Masking is required indoors and in case of a gathering of over 50 people outdoors  Violation of the guidance shall incur a fine    Sources:  https://archive.vn/hw36N [Local Councils Traffic Light Model]  https://archive.vn/wq3kR [Local Councils Traffic Light Model - text only]"
"143","Israel","ISR",2022-02-07,"Middle_East_North_Africa","H6: Facial Coverings","2G","2G","General Guidance  •	Masking is required indoors and in case of a gathering of over 50 people outdoors  •	Violation of the guidance shall incur a fine    Sources:  https://archive.vn/7RTQC [Local Councils Traffic Light Model]  https://archive.vn/TlAyl [Local Councils Traffic Light Model - text only]"
"144","Israel","ISR",2022-01-25,"Middle_East_North_Africa","H7: Vaccination policy","5G","5G","Recommendation: a Fourth Dose to People under 60  The Advisory Committee on Epidemic Control and the Advisory Board on COVID-19 Vaccination have recommended a fourth dose to people under 60 and above 18, if 5 months pass from recovery or third dose administration date.    The recommendation is based on encouraging results demonstrating 3 – 5 fold increase of protection from severe illness after receiving the fourth dose and double increase in the level of protection compared to those vaccinated with three doses.    The Advisory Committee on Epidemic Control and the Advisory Board on COVID-19 Vaccination recommendation must be approved by the Ministry of Health Director General Prof. Nachman Ash.      Source: https://archive.vn/xGhbQ [Ministry of Health press release]"
"145","Israel","ISR",2022-01-26,"Middle_East_North_Africa","H7: Vaccination policy","5G","5G","Fourth dose approved for people above 18 with underlying conditions, and contacts at the workplace to be administered 4 months after the booster shot.    Ministry of Health press release  ""Director General Prof. Nachman Ash has approved this evening (Wednesday) a fourth dose to people above 18 with underlying conditions and a high risk of severe COVID illness, and to caregivers of these cases. Approval has been given to people above 18 with very high risk of exposure at the workplace.    ""The decision is based on encouraging preliminary results of a study of the fourth dose. It was administrated to people 60 years of age and above. Two-fold increase in protection and 3-5 fold increase in the level of protection against severe illness in comparison to the third dose (booster) have been demonstrated. The decision also considered the spread of COVID-19, number of hospitalizations, and very high probability of infection.    ""A fourth dose will be administered 4 months after the booster shot.""    Source:  https://archive.vn/yTbtg [Ministry of Health press release]"
"146","Israel","ISR",2022-01-07,"Middle_East_North_Africa","H8: Protection of elderly people","2G","2G","Healthcare Services National Guidance    General Guidance  •	Masking is required indoors and in case of a gathering of over 50 people outdoors  •	Workers and visitors who are neither recovered nor vaccinated are required to wear a mask next to patients also in outdoor areas  •	Violation of the guidance shall incur a fine    Health and Social Services Facilities  •	Health and social services facilities are geriatric hospitals, homes for the frail operated by social services, assisted living facilities operated by social services, housing for people with disabilities operated by the social services, housing complexes operated by the Ministry of Housing and Integration, mental health hostels, community housing for the rehabilitation of people with mental health disabilities and facilities for rehabilitation from drug and alcohol abuse that include housing  •	Visitors (aged 3 and older) who are vaccinated or recovered will present a certificate attesting to a negative result on an antigen test administered by an official facility, or a signed declaration that they tested positive on a home antigen test kit, administered in the 24 hours preceding the visit.  •	Visitors (aged 3 and older) who are unvaccinated or non-infected will present a certificate attesting to a negative result on an antigen test administered by an official facility.  •	The number of visitors per tenant or permanent resident – no more than 1 visitor per day, not including minor visitors who are accompanied by an adult.    Activities Subject to the Green Pass Scheme  Visitors eligible to be admitted to places operating subject to the Green Pass Scheme:  •	Vaccinated individuals  •	Recovered individuals  •	Those who tested negative in a paid PCR test valid for 72 hours from the time of sampling  •	Children under 12 and 3 months who tested negative in a PCR test taken as part of Magen Education program, effective for up to one week from the date of sampling  •	Those who tested negative in a rapid test taken up to 24 hours before arrival in the venue    Exempt from the Green Pass Scheme:  •	Children under 3  •	Children under 12 and 3 months who present a certificate of disability from the National Insurance Institute of Israel    Sources:   https://archive.vn/MZnrs [Local Councils Traffic Light Model]  https://archive.vn/ADGzR [Local Councils Traffic Light Model text only]"
"147","Israel","ISR",2022-01-10,"Middle_East_North_Africa","H8: Protection of elderly people","2G","2G","Healthcare Services National Guidance  General Guidance  •	Masking is required indoors and in case of a gathering of over 50 people outdoors  •	Workers and visitors who are neither recovered nor vaccinated are required to wear a mask next to patients also in outdoor areas  •	Violation of the guidance shall incur a fine    Health and Social Services Facilities  •	Health and social services facilities are geriatric hospitals, homes for the frail operated by social services, assisted living facilities operated by social services, housing for people with disabilities operated by the social services, housing complexes operated by the Ministry of Housing and Integration, mental health hostels, community housing for the rehabilitation of people with mental health disabilities and facilities for rehabilitation from drug and alcohol abuse that include housing  •	Visitors (aged 3 and older) who are vaccinated or recovered will present a certificate attesting to a negative result on an antigen test administered by an official facility, or a signed declaration that they tested positive on a home antigen test kit, administered in the 24 hours preceding the visit.  •	Visitors (aged 3 and older) who are unvaccinated or non-infected will present a certificate attesting to a negative result on an antigen test administered by an official facility.  •	The number of visitors per tenant or permanent resident – no more than 1 visitor per day, not including minor visitors who are accompanied by an adult.    Activities Subject to the Green Pass Scheme  •	Visitors eligible to be admitted to places operating subject to the Green Pass Scheme:  •	Vaccinated individuals, according to the Ministry of Health's definition  •	Recovered individuals, according to the Ministry of Health's definition  •	Those who tested negative in a paid PCR test valid for 72 hours from the time of sampling  •	Children under 12 and 3 months who tested negative in a PCR test taken as part of Magen Education program, effective for up to one week from the date of sampling  •	Those who tested negative in a rapid test taken up to 24 hours before arrival in the venue    Exempt from the Green Pass Scheme:  •	Children under 3  •	Children under 12 and 3 months who present a certificate of disability from the National Insurance Institute of Israel    Sources:  https://archive.vn/uddYq [Local Councils Traffic Light Model - Red Locality]  https://archive.vn/eHMBE [Local Councils Traffic Light Model - Red Locality - text only]"
"148","Israel","ISR",2022-01-17,"Middle_East_North_Africa","H8: Protection of elderly people","2G","2G","Healthcare Services National Guidance    General Guidance  •	Masking is required indoors and in case of a gathering of over 50 people outdoors  •	Workers and visitors who are neither recovered nor vaccinated are required to wear a mask next to patients also in outdoor areas  •	Violation of the guidance shall incur a fine    Health and Social Services Facilities  •	Health and social services facilities are geriatric hospitals, homes for the frail operated by social services, assisted living facilities operated by social services, housing for people with disabilities operated by the social services, housing complexes operated by the Ministry of Housing and Integration, mental health hostels, community housing for the rehabilitation of people with mental health disabilities and facilities for rehabilitation from drug and alcohol abuse that include housing  •	Visitors (aged 3 and older) who are vaccinated or recovered will present a certificate attesting to a negative result on an antigen test administered by an official facility, or a signed declaration that they tested positive on a home antigen test kit, administered in the 24 hours preceding the visit.  •	Visitors (aged 3 and older) who are unvaccinated or non-infected will present a certificate attesting to a negative result on an antigen test administered by an official facility.  •	The number of visitors per tenant or permanent resident – no more than 1 visitor per day, not including minor visitors who are accompanied by an adult.    Activities Subject to the Green Pass Scheme  Visitors eligible to be admitted to places operating subject to the Green Pass Scheme:  •	Vaccinated individuals, according to the Ministry of Health's definition  •	Recovered individuals, according to the Ministry of Health's definition  •	Those who tested negative in a paid PCR test valid for 72 hours from the time of sampling  •	Children under 12 and 3 months who tested negative in a PCR test taken as part of Magen Education program, effective for up to one week from the date of sampling  •	Those who tested negative in a rapid test taken up to 24 hours before arrival in the venue  Exempt from the Green Pass Scheme:  •	Children under 3  •	Children under 12 and 3 months who present a certificate of disability from the National Insurance Institute of Israel    Sources:  https://archive.vn/KqgJR [Local Councils Traffic Light Model - red locality]  https://archive.vn/XCbuR [Local Councils Traffic Light Model - red locality - text only]"
"149","Israel","ISR",2022-01-24,"Middle_East_North_Africa","H8: Protection of elderly people","2G","2G","Healthcare Services National Guidance    General Guidance  •	Masking is required indoors and in case of a gathering of over 50 people outdoors  •	Workers and visitors who are neither recovered nor vaccinated are required to wear a mask next to patients also in outdoor areas  •	Violation of the guidance shall incur a fine    Health and Social Services Facilities  •	Health and social services facilities are geriatric hospitals, homes for the frail operated by social services, assisted living facilities operated by social services, housing for people with disabilities operated by the social services, housing complexes operated by the Ministry of Housing and Integration, mental health hostels, community housing for the rehabilitation of people with mental health disabilities and facilities for rehabilitation from drug and alcohol abuse that include housing  •	Visitors (aged 3 and older) who are vaccinated or recovered will present a certificate attesting to a negative result on an antigen test administered by an official facility, or a signed declaration that they tested positive on a home antigen test kit, administered in the 24 hours preceding the visit.  •	Visitors (aged 3 and older) who are unvaccinated or non-infected will present a certificate attesting to a negative result on an antigen test administered by an official facility.  •	The number of visitors per tenant or permanent resident – no more than 1 visitor per day, not including minor visitors who are accompanied by an adult.    Activities Subject to the Green Pass Scheme  Visitors eligible to be admitted to places operating subject to the Green Pass Scheme:  •	Vaccinated individuals, according to the Ministry of Health's definition  •	Recovered individuals, according to the Ministry of Health's definition  •	Those who tested negative in a paid PCR test valid for 72 hours from the time of sampling  •	Children under 12 and 3 months who tested negative in a PCR test taken as part of Magen Education program, effective for up to one week from the date of sampling  •	Those who tested negative in a rapid test taken up to 24 hours before arrival in the venue  Exempt from the Green Pass Scheme:  •	Children under 3  •	Children under 12 and 3 months who present a certificate of disability from the National Insurance Institute of Israel    Sources:  https://archive.vn/KqgJR [Local Councils Traffic Light Model - red locality - still valid as of 24 January]  https://archive.vn/XCbuR [Local Councils Traffic Light Model - red locality - text only - still valid as of 24 January]"
