"","CountryName","CountryCode","Date","region","PolicyType","PolicyCode","previous_PolicyCode","Notes"
"1","Albania","ALB",2022-01-04,"Europe_Central_Asia","C1: School closing","1G","1G","As of June 1, 2020:  — Preschools and kindergartens reopened.  — All cultural events and other large public gatherings in Albania are cancelled indefinitely.  — Professional sporting events have resumed, with no spectators allowed to attend.  — Malls and shops are open with strict social distancing guidelines in place.  — Hairdressers and dentists are open with strict social distancing guidelines in place.  — Restaurants and cafes are open.  — All indoor activity centers reopened.  — Beaches are open.  — Outdoor exercise is permitted.  — Libraries and museums are open.  — Public transportation has resumed.  — All maritime and air borders have reopened.    https://web.archive.org/web/20211211025324/https://al.usembassy.gov/updates_covid19/"
"2","Albania","ALB",2022-01-11,"Europe_Central_Asia","C1: School closing","1G","1G","NO policy changes"
"3","Albania","ALB",2022-01-18,"Europe_Central_Asia","C1: School closing","1G","1G","No change from previous policy found."
"4","Albania","ALB",2022-01-04,"Europe_Central_Asia","C2: Workplace closing","1T","1T","From the 4th of January 2022 employees of public administration, shopping centres, supermarkets (which have been highlighted as at-risk areas) are required to either take a PCR test every 5 days or deposit one of the following documents:  - COVID-19 vaccination certificate  - COVID-19 recovery certificate    https://archive.ph/tjWZW"
"5","Albania","ALB",2022-01-11,"Europe_Central_Asia","C2: Workplace closing","1T","1T","no policy changes"
"6","Albania","ALB",2022-01-18,"Europe_Central_Asia","C2: Workplace closing","1G","1T","By December 31, all employees of public administration, employees of supermarkets and shopping centers who have not been vaccinated, to be vaccinated, as from January 4, 2022 will be required vaccination card or negative PCR test every 5 days.    https://web.archive.org/web/20211205155142/https://punetejashtme.gov.al/al/informacion-mbi-levizjen-e-shtetasve-te-huaj-ne-shqiperi"
"7","Albania","ALB",2022-01-04,"Europe_Central_Asia","C3: Cancel public events","1G","1G","C3 - 1G  As of June 1, 2020:  — Preschools and kindergartens reopened.  — All cultural events and other large public gatherings in Albania are cancelled indefinitely.  — Professional sporting events have resumed, with no spectators allowed to attend.  — Malls and shops are open with strict social distancing guidelines in place.  — Hairdressers and dentists are open with strict social distancing guidelines in place.  — Restaurants and cafes are open.  — All indoor activity centers reopened.  — Beaches are open.  — Outdoor exercise is permitted.  — Libraries and museums are open.  — Public transportation has resumed.  — All maritime and air borders have reopened.    https://web.archive.org/web/20211211025324/https://al.usembassy.gov/updates_covid19/"
"8","Albania","ALB",2022-01-11,"Europe_Central_Asia","C3: Cancel public events","1G","1G","No policy changes"
"9","Albania","ALB",2022-01-18,"Europe_Central_Asia","C3: Cancel public events","1G","1G","Sports championships, theater activities, artistic and cultural performances, conferences with the presence of fans with reduced capacities up to 30% are allowed according to the IPH protocol.    https://web.archive.org/web/20211205155142/https://punetejashtme.gov.al/al/informacion-mbi-levizjen-e-shtetasve-te-huaj-ne-shqiperi"
"10","Albania","ALB",2022-01-04,"Europe_Central_Asia","C4: Restrictions on gatherings","3G","3G","As of June 15, 2021, gathering outdoors is permitted up to 50 individuals.  https://web.archive.org/web/20211211025324/https://al.usembassy.gov/updates_covid19/"
"11","Albania","ALB",2022-01-11,"Europe_Central_Asia","C4: Restrictions on gatherings","3G","3G","no policy changes"
"12","Albania","ALB",2022-01-18,"Europe_Central_Asia","C4: Restrictions on gatherings","3G","3G","Outdoor gatherings are allowed up to 50 people, following the rules according to the protocols of the Institute of Public Health.  E Nightclubs, discos, continue to remain closed.   Bars, restaurants are closed from 23:00 to 06:00, with the exception of ""delivery"" service.     https://web.archive.org/web/20211205155142/https://punetejashtme.gov.al/al/informacion-mbi-levizjen-e-shtetasve-te-huaj-ne-shqiperi"
"13","Albania","ALB",2022-01-11,"Europe_Central_Asia","C5: Close public transport","0","0","no policy changes"
"14","Albania","ALB",2022-01-18,"Europe_Central_Asia","C5: Close public transport","1G","0","Wearing the mask indoors, in shopping malls, supermarkets, shops and on public transport is mandatory. It is recommended to wear the mask wherever social distance can not be maintained, as well as for those who have not yet done the two doses of the vaccine.    https://web.archive.org/web/20211205155142/https://punetejashtme.gov.al/al/informacion-mbi-levizjen-e-shtetasve-te-huaj-ne-shqiperi"
"15","Albania","ALB",2022-01-04,"Europe_Central_Asia","C6: Stay at home requirements","2G","2G","Movement Restrictions:    Is a curfew in place? Yes.  Effective September 1, 2021, public movement is restricted during the hours between 11:00pm and 6:00am, until further notice.  Are there restrictions on intercity or interstate travel? No.    https://web.archive.org/web/20211211025324/https://al.usembassy.gov/updates_covid19/"
"16","Albania","ALB",2022-01-11,"Europe_Central_Asia","C6: Stay at home requirements","2G","2G","NO policy changes"
"17","Albania","ALB",2022-01-18,"Europe_Central_Asia","C6: Stay at home requirements","1G","2G","If you suspect that you are affected by COVID19 or have signs of the disease, isolate yourself immediately and contact your family doctor to be tested as soon as possible or call the National Emergency on the unique number 127.    https://web.archive.org/web/20220120161304/https://shendetesia.gov.al/covid19-ministria-e-shendetesise-8136-testime-2177-qytetare-te-infektuar-6-humbje-jete-dhe-639-te-sheruar-ne-24-oret-e-fundit/"
"18","Albania","ALB",2022-01-18,"Europe_Central_Asia","C7: Restrictions on internal movement","2G","0","Restriction of movement throughout the territory of the Republic of Albania, from 23:00 to 06:00. Movement is allowed only for health or emergency reasons. Use the E-Albania application for specific permissions.    https://web.archive.org/web/20211205155142/https://punetejashtme.gov.al/al/informacion-mbi-levizjen-e-shtetasve-te-huaj-ne-shqiperi"
"19","Albania","ALB",2022-01-04,"Europe_Central_Asia","C8: International travel controls","2","3","From 6th September 2021 onwards:  International travellers are not required to quarantine but have to present a negative PCR test within 72 hours of departure/vaccination passport  Albanian citizens who do not have a negative test have to self-isolate for 10 days and inform health authorities     https://web.archive.org/web/20211113152620/https://al.usembassy.gov/updates_covid19/"
"20","Albania","ALB",2022-01-11,"Europe_Central_Asia","C8: International travel controls","2","2","no policy changes"
"21","Albania","ALB",2022-01-18,"Europe_Central_Asia","C8: International travel controls","3","2","From 02 December 2021, to enter the Republic of Albania, from all border points, such as land, sea or air, as well as transit travel, you must submit one of the following documents:    Imi Vaccination passport, where the date of the last vaccination is at least 2 weeks applied from the date of entry into the border.    PC PCR test, performed within 72 hours or rapid antigen test within 48 hours of border entry.    Ars Transmission test for Sars-Cov-2 infection valid up to 6 months after cure.    ? Exception from the set rules is made for children up to 6 years old.      Residents of the Republic of Albania and who do not have any of the documents mentioned above, must be isolated for a period of 10 days and inform the health authorities to perform a test at the end of the isolation period.    ? Given the fact that the new Omicron variant has been identified in citizens who have had travel history and contacts with South African countries, as well as the fact that the nature of the virus' aggressiveness is still unclear, measures taken by other countries of the world, the Committee of Experts in Albania, decided to recommend the ban on the entry of foreign nationals with travel history within the last 14 days, starting from December 3, 2021 for three weeks, for countries:    - South Africa    - Kenya    - Angola    - Zambia    - Botswana    - Senegal      Resident Albanian citizens, who come to Albania and have a travel history of the last 14 days before arrival, in the countries listed above will be quarantined in their homes for 14 days and will be monitored by health units.    https://web.archive.org/web/20211205155142/https://punetejashtme.gov.al/al/informacion-mbi-levizjen-e-shtetasve-te-huaj-ne-shqiperi"
"22","Albania","ALB",2022-01-04,"Europe_Central_Asia","E1: Income support","1G","1G","Various economic packages e.g. doubling payment for people receiving unemployment benefits   https://web.archive.org/web/20211113154058/https://www.imf.org/en/Topics/imf-and-covid19/Policy-Responses-to-COVID-19#A    https://web.archive.org/web/20211113161424/https://financa.gov.al/raporte-per-covid-19/"
"23","Albania","ALB",2022-01-11,"Europe_Central_Asia","E1: Income support","1G","1G","no policy changes"
"24","Albania","ALB",2022-01-18,"Europe_Central_Asia","E1: Income support","1G","1G","No evidence of policy change."
"25","Albania","ALB",2022-01-04,"Europe_Central_Asia","E2: Debt/contract relief","1","1","To address the liquidity bottlenecks of companies and individuals, the Bank of Albania extended a temporary suspension of requirements for loan classifications and provisioning to August 31, 2020, enabling clients to ask banks to defer loan installments without penalties. On May 28, the BoA also adopted regulations to allow banks to restructure loans within 2020 without additional provisioning or downgrades for borrowers’ status. Entry in force of more stringent classification and provisioning measures for reclassified loans was postponed by one year to 2022. Out of court restructuring for distressed borrowers under a special regulation will be possible for an additional year until 2022.     http://web.archive.org/web/20210812095454/https://www.imf.org/en/Topics/imf-and-covid19/Policy-Responses-to-COVID-19"
"26","Albania","ALB",2022-01-11,"Europe_Central_Asia","E2: Debt/contract relief","1","1","no policy changes"
"27","Albania","ALB",2022-01-18,"Europe_Central_Asia","E2: Debt/contract relief","1","1","No evidence of policy change."
"28","Albania","ALB",2022-01-04,"Europe_Central_Asia","H1: Public information campaigns","2G","2G","New campaign launched by health professionals and public health officials at targeting vaccine misinformation:    https://web.archive.org/web/20211122234319/https://www.independent.co.uk/news/albania-edi-rama-covid-people-tirana-b1959498.html"
"29","Albania","ALB",2022-01-11,"Europe_Central_Asia","H1: Public information campaigns","2G","2G","no policy changes"
"30","Albania","ALB",2022-01-18,"Europe_Central_Asia","H1: Public information campaigns","2G","2G","https://web.archive.org/web/20211218065432/https://shendetesia.gov.al/koronavirusi-i-ri-dhe-masat-ndaj-tij/"
"31","Albania","ALB",2022-01-04,"Europe_Central_Asia","H2: Testing policy","2","2","Testing available for those who show Covid-symptoms, not clear if asymptomatic testing also available   ""Currently, to be tested for COVID-19 by the Albanian public health authority one must have symptoms and a recommendation from the public health authority’s family doctor.  However, private testing labs will perform a test for a fee, and no symptoms or a doctor’s recommendation is required (see details below).""    https://web.archive.org/web/20211113152620/https://al.usembassy.gov/updates_covid19/"
"32","Albania","ALB",2022-01-11,"Europe_Central_Asia","H2: Testing policy","2","2","no policy changes"
"33","Albania","ALB",2022-01-18,"Europe_Central_Asia","H2: Testing policy","3","2","Are PCR and/or antigen tests available for U.S. citizens in Albania? Yes  If so, are test results reliably available within one calendar day? Yes  Airport Covid-19 PCR test:  Tirana International Airport offers a Covid-19 PCR test for travelers. For more information, visit their website.  Public Health Labs:  Currently, to be tested for COVID-19 by the Albanian public health authority one must have symptoms and a recommendation from the public health authority’s family doctor.  However, private testing labs will perform a test for a fee, and no symptoms or a doctor’s recommendation is required (see details below).  If you have an Albanian social security number, you also have an assigned public health family doctor.  To learn who your public health family doctor is, call the help line at 0-800-4040 to find out.  Tests are free of charge if done by the Albanian Institute of Public Health (IPH).  Private Labs:  Individuals can also arrange private testing by going to a private testing lab. No symptoms or doctor’s order is required to arrange a private test, and no advance appointment is necessary.  According to the Albanian Ministry of Health and Social Protection, there are several private labs authorized to perform SARS-CoV-2 testing for administrative issues. For a full list, please see the Ministry of Health list here.    https://web.archive.org/web/20220121115604/https://al.usembassy.gov/updates_covid19/"
"34","Albania","ALB",2022-01-04,"Europe_Central_Asia","H3: Contact tracing","1","1","Albanian medical staff have launched a nationwide campaign taking medical teams door to door to convince unvaccinated people to get their shots against COVID-19  https://web.archive.org/web/20211122234319/https://www.independent.co.uk/news/albania-edi-rama-covid-people-tirana-b1959498.html"
"35","Albania","ALB",2022-01-11,"Europe_Central_Asia","H3: Contact tracing","1","1","no policy changes"
"36","Albania","ALB",2022-01-18,"Europe_Central_Asia","H3: Contact tracing","0","1","No evidence of coordinated effort for contact tracing."
"37","Albania","ALB",2022-01-04,"Europe_Central_Asia","H6: Facial Coverings","3G","3G","Masks are mandatory for any individual 11 years old and above in all indoor and outdoor spaces to include public transportation.    Effective September 1, 2021 wearing a mask indoors is mandatory for any individual 11 years old and above,  Wearing a mask outdoors is also mandatory when social distancing is not possible as per the standard 2 meters (~6 feet) distance.  Non-compliance with this rule may result in a fine up to 3,000 ALL.    https://web.archive.org/web/20211211025324/https://al.usembassy.gov/updates_covid19/"
"38","Albania","ALB",2022-01-11,"Europe_Central_Asia","H6: Facial Coverings","3G","3G","no policy changes"
"39","Albania","ALB",2022-01-18,"Europe_Central_Asia","H6: Facial Coverings","3G","3G","Mask placement is mandatory in any enclosed environment. Avoid crowds and ventilate your premises to limit the spread of Covid-19.    https://web.archive.org/web/20220120161304/https://shendetesia.gov.al/covid19-ministria-e-shendetesise-8136-testime-2177-qytetare-te-infektuar-6-humbje-jete-dhe-639-te-sheruar-ne-24-oret-e-fundit/    Wearing the mask indoors, in shopping malls, supermarkets, shops and on public transport is mandatory. It is recommended to wear the mask wherever social distance can not be maintained, as well as for those who have not yet done the two doses of the vaccine.    https://web.archive.org/web/20211205155142/https://punetejashtme.gov.al/al/informacion-mbi-levizjen-e-shtetasve-te-huaj-ne-shqiperi"
"40","Albania","ALB",2022-01-04,"Europe_Central_Asia","H7: Vaccination policy","5G","5G","All individuals above the age of 16+ are eligible for a vaccine     ""Albanians can choose between the Chinese Sinovac vaccine, Russia’s Sputnik, or limited amounts of AstraZeneca and Pfizer.""    https://web.archive.org/web/20211113172241/https://www.euractiv.com/section/coronavirus/news/albanian-parliament-agrees-on-mandating-vaccines-for-ministers/"
"41","Albania","ALB",2022-01-11,"Europe_Central_Asia","H7: Vaccination policy","5G","5G","no policy changes"
"42","Albania","ALB",2022-01-18,"Europe_Central_Asia","H7: Vaccination policy","5G","5G","The Ministry of Health appeals to citizens to be vaccinated as soon as possible, to protect themselves and the health of others.  Any citizen over 16 years of age can be vaccinated at the health center or at the nearest centralized vaccination point.  Vaccination is also open for children +12 years old with immune system problems, with a doctor's recommendation.  MSHMS appeals to citizens who have passed 6 months from the second dose of vaccine, to go to health centers or centralized vaccination points, to be vaccinated with the third booster dose.    https://web.archive.org/web/20220120161304/https://shendetesia.gov.al/covid19-ministria-e-shendetesise-8136-testime-2177-qytetare-te-infektuar-6-humbje-jete-dhe-639-te-sheruar-ne-24-oret-e-fundit/"
"43","Albania","ALB",2022-01-04,"Europe_Central_Asia","H8: Protection of elderly people","1G","1G","General recommendations, but no specific restrictions noted.    http://web.archive.org/web/20210812095931/https://shendetesia.gov.al/manastirliu-muaji-gusht-i-hapur-per-vaksinimin-anticovid-per-te-gjithe-qytetaret-18-vjec-vaksinimi-detyrim-moral-2/    https://web.archive.org/web/20211103021435/https://al.usembassy.gov/updates_covid19/"
"44","Albania","ALB",2022-01-11,"Europe_Central_Asia","H8: Protection of elderly people","1G","1G","no policy changes"
"45","Albania","ALB",2022-01-18,"Europe_Central_Asia","H8: Protection of elderly people","0","1G","No evidence of specific protection measures to protect the elderly."
"46","Albania","ALB",2022-01-04,"Europe_Central_Asia","V1: Vaccine Prioritisation","-3","-3","Albania's Minister of Health and Social Protection, Ogerta Manastirliu, announced on 29 Jul 2021 that 'August will be an open month for vaccination of citizens +18 years old'. Moreover, [quote]  ""The numbers have increased slightly, as well as hospitalizations, where what is noticed is that the citizens who have been hospitalized are not vaccinated and are in the age group +70 years old, +60 years old, which means that there are still citizens who have not been vaccinated, who belong to risk groups, to an appeal from the Ministry of Health and Social Protection: Vaccination is a civic obligation, a moral obligation, to protect ourselves to protect all those we want ""- underlined Manastirliu.""  Therefore, although there is still a priority list in place, the vaccines have effectively become universal eligible.    https://archive.vn/OXfMk"
"47","Albania","ALB",2022-01-11,"Europe_Central_Asia","V1: Vaccine Prioritisation","-3","-3","no policy changes"
"48","Albania","ALB",2022-01-18,"Europe_Central_Asia","V1: Vaccine Prioritisation","-3","-3","Any citizen over 16 years of age can be vaccinated at the health center or at the nearest centralized vaccination point.  Vaccination is also open for children +12 years old with immune system problems, with a doctor's recommendation.  MSHMS appeals to citizens who have passed 6 months from the second dose of vaccine, to go to health centers or centralized vaccination points, to be vaccinated with the third booster dose.    https://web.archive.org/web/20220120161304/https://shendetesia.gov.al/covid19-ministria-e-shendetesise-8136-testime-2177-qytetare-te-infektuar-6-humbje-jete-dhe-639-te-sheruar-ne-24-oret-e-fundit/"
"49","Albania","ALB",2022-01-04,"Europe_Central_Asia","V2: Vaccine Availability","16504","15853","Open days throughout August. 'August will be an open vaccination month for all citizens +18 years old, to be vaccinated anywhere in health centers or in centralized vaccination points, where anyone can present their ID card. For the disabled, mobile vaccination units will be everywhere in the territory to give the opportunity to carry out vaccination against COVID19 to all citizens.'    https://archive.vn/6Zd2t  https://archive.vn/RMvJ3    https://archive.fo/NYPjZ"
"50","Albania","ALB",2022-01-11,"Europe_Central_Asia","V2: Vaccine Availability","17697","16504",NA
"51","Albania","ALB",2022-01-18,"Europe_Central_Asia","V2: Vaccine Availability","17796","17697","Any citizen over 16 years of age can be vaccinated at the health center or at the nearest centralized vaccination point.  Vaccination is also open for children +12 years old with immune system problems, with a doctor's recommendation.  MSHMS appeals to citizens who have passed 6 months from the second dose of vaccine, to go to health centers or centralized vaccination points, to be vaccinated with the third booster dose.    https://web.archive.org/web/20220120161304/https://shendetesia.gov.al/covid19-ministria-e-shendetesise-8136-testime-2177-qytetare-te-infektuar-6-humbje-jete-dhe-639-te-sheruar-ne-24-oret-e-fundit/"
"52","Albania","ALB",2022-01-04,"Europe_Central_Asia","V3: Vaccine Financial Support","16504","15853","Government funded   Free of charge.    https://archive.vn/RMvJ3"
"53","Albania","ALB",2022-01-11,"Europe_Central_Asia","V3: Vaccine Financial Support","17697","16504",NA
"54","Albania","ALB",2022-01-18,"Europe_Central_Asia","V3: Vaccine Financial Support","17796","17697","Any citizen over 16 years of age can be vaccinated at the health center or at the nearest centralized vaccination point.  Vaccination is also open for children +12 years old with immune system problems, with a doctor's recommendation.  MSHMS appeals to citizens who have passed 6 months from the second dose of vaccine, to go to health centers or centralized vaccination points, to be vaccinated with the third booster dose.    https://web.archive.org/web/20220120161304/https://shendetesia.gov.al/covid19-ministria-e-shendetesise-8136-testime-2177-qytetare-te-infektuar-6-humbje-jete-dhe-639-te-sheruar-ne-24-oret-e-fundit/"
"55","Andorra","AND",2022-01-06,"Europe_Central_Asia","C1: School closing","1G","1G","No changes, mandatory mask wearing indoors and outside for those over 6. https://archive.vn/FfExD"
"56","Andorra","AND",2022-01-20,"Europe_Central_Asia","C1: School closing","1G","1G","Masks and screening (no changes). https://archive.vn/7b2tm"
"57","Andorra","AND",2022-01-06,"Europe_Central_Asia","C2: Workplace closing","2G","2G","No changes. https://archive.vn/FfExD"
"58","Andorra","AND",2022-01-20,"Europe_Central_Asia","C2: Workplace closing","2G","2G","No changes. https://archive.vn/7b2tm"
"59","Andorra","AND",2022-01-06,"Europe_Central_Asia","C3: Cancel public events","1G","1G","Covid passes and reduced capacities across industries. https://archive.vn/FfExD"
"60","Andorra","AND",2022-01-20,"Europe_Central_Asia","C3: Cancel public events","1G","1G","No changes. https://archive.vn/7b2tm"
"61","Andorra","AND",2022-01-06,"Europe_Central_Asia","C4: Restrictions on gatherings","4G","4G","No changes (now max 6 indoors). https://archive.vn/FfExD"
"62","Andorra","AND",2022-01-20,"Europe_Central_Asia","C4: Restrictions on gatherings","4G","4G","No changes. https://archive.vn/7b2tm"
"63","Andorra","AND",2022-01-06,"Europe_Central_Asia","C5: Close public transport","0","1G","Masks recommended. https://archive.vn/FfExD"
"64","Andorra","AND",2022-01-20,"Europe_Central_Asia","C5: Close public transport","0","0","No changes. https://archive.vn/7b2tm"
"65","Andorra","AND",2022-01-06,"Europe_Central_Asia","C6: Stay at home requirements","0","1G","Telework recommended. https://archive.vn/FfExD"
"66","Andorra","AND",2022-01-20,"Europe_Central_Asia","C6: Stay at home requirements","0","0","No changes. https://archive.vn/7b2tm"
"67","Andorra","AND",2022-01-06,"Europe_Central_Asia","C7: Restrictions on internal movement","0","1G","No changes. https://archive.vn/FfExD"
"68","Andorra","AND",2022-01-20,"Europe_Central_Asia","C7: Restrictions on internal movement","0","0","No changes. https://archive.vn/7b2tm"
"69","Andorra","AND",2022-01-06,"Europe_Central_Asia","C8: International travel controls","2","2","Free movement to Andorra now with the exemption of visitors from Botswana, Eswatini, Lesotho, Mozambique, Namibia, South Africa and Zimbabwe who are subject to mandatory 10 day isolation. https://archive.vn/YztWD"
"70","Andorra","AND",2022-01-20,"Europe_Central_Asia","C8: International travel controls","3","2","No changes. https://archive.vn/7b2tm.    For those issued vaccination statuses ""from competent authorities"" of countries, travel is unimpeded https://archive.vn/5v9QR."
"71","Andorra","AND",2022-01-06,"Europe_Central_Asia","E1: Income support","2G","2G","No changes. https://archive.vn/cgyTh"
"72","Andorra","AND",2022-01-20,"Europe_Central_Asia","E1: Income support","2G","2G","No changes. https://archive.vn/7b2tm."
"73","Andorra","AND",2022-01-06,"Europe_Central_Asia","E2: Debt/contract relief","2","2","No changes. https://archive.vn/cgyTh"
"74","Andorra","AND",2022-01-20,"Europe_Central_Asia","E2: Debt/contract relief","2","2","No changes. https://archive.vn/7b2tm."
"75","Andorra","AND",2022-01-06,"Europe_Central_Asia","H1: Public information campaigns","2G","2G","No changes. https://archive.vn/FfExD"
"76","Andorra","AND",2022-01-20,"Europe_Central_Asia","H1: Public information campaigns","2G","2G","No changes. https://archive.vn/7b2tm."
"77","Andorra","AND",2022-01-06,"Europe_Central_Asia","H2: Testing policy","3","3","No changes. https://archive.vn/FfExD"
"78","Andorra","AND",2022-01-20,"Europe_Central_Asia","H2: Testing policy","3","3","No changes. https://archive.vn/7b2tm."
"79","Andorra","AND",2022-01-06,"Europe_Central_Asia","H3: Contact tracing","2","2","No changes. https://archive.vn/FfExD"
