"","CountryName","CountryCode","Date","region","PolicyType","PolicyCode","previous_PolicyCode","Notes"
"290","Israel","ISR",2021-01-31,"Middle_East_North_Africa","H3: Contact tracing","2","2","contract racing web page and app   HaMagen is an app that is endorsed by the Ministry of Health. It can tell you have been in the presence of anyone who has been diagnosed with coronavirus.    The app cross-checks the GPS history of your mobile phone with historical geographic data of patients from the Ministry of Health.    https://coronaupdates.health.gov.il/corona-updates/grid/place     http://archive.today/mXLXP"
"291","Israel","ISR",2021-01-31,"Middle_East_North_Africa","H6: Facial Coverings","3G","3G","Why should I wear a mask?  The corona virus spreads via small droplets that are sprayed when you talk or cough.  The mask blocks the droplets and thus protects you from carriers in your vicinity and protects those close to you if you are a carrier without being aware of it.  In addition, the mask prevents you from touching your mouth and nose.     When should I wear a mask?  You must wear a mask while in public settings and at work.    https://archive.vn/Ycve7"
"292","Israel","ISR",2021-02-07,"Middle_East_North_Africa","H6: Facial Coverings","3G","3G","""You must wear a face mask anywhere except your home""  But then a list of exceptions given, including 'People engaged in physical activities' so coding as a 3 rather than 4.    Sources:  https://web.archive.org/web/20210212092847if_/https://docs.google.com/document/d/1PVyzZYAJYPOs4MQh1H4_2_vCxKJ07AVPdxVDVC0CaZs/edit    https://web.archive.org/web/20210124021043/https://govextra.gov.il/media/15533/facemask_en.pdf"
"293","Israel","ISR",2021-02-11,"Middle_East_North_Africa","H6: Facial Coverings","3G","3G","""You must wear a face mask anywhere except your home""  But then a list of exceptions is given, so coding as a 3 rather than 4. ***Updated to add source  Sources: https://web.archive.org/web/20210212092847if_/https://docs.google.com/document/d/1PVyzZYAJYPOs4MQh1H4_2_vCxKJ07AVPdxVDVC0CaZs/edit  https://web.archive.org/web/20210124021043/https://govextra.gov.il/media/15533/facemask_en.pdf"
"294","Israel","ISR",2021-01-26,"Middle_East_North_Africa","H7: Vaccination policy","4G","4G","A; B; C     ""Some 1,729,000 Israelis – almost 20% of the country’s population have already received both doses of the coronavirus vaccine, and over three million people at least the first""     http://web.archive.org/web/20210131101629/https://www.jpost.com/health-science/coronavirus-govt-to-meet-on-extending-lockdown-20-percent-of-israelis-got-both-vaccines-657292"
"295","Israel","ISR",2021-02-03,"Middle_East_North_Africa","H7: Vaccination policy","4G","4G","Coded as a 4 as insufficient evidence to suggest that access is completely universal, but significant coverage as all over 16s are made eligible for vaccination. Some evidence of low uptake and vaccines being thrown away in this news report    https://web.archive.org/web/20210205115000/https://www.theguardian.com/world/2021/feb/03/israel-opens-coronavirus-vaccines-to-all-over-16s"
"296","Israel","ISR",2021-02-07,"Middle_East_North_Africa","H7: Vaccination policy","4G","4G","On 3 Feb the Minustry of Health press release:  ""The Ministry of Health's Director General Prof. Chezy Levy has issued guidance to open the vaccination operation to all members of the public aged 16 and older, starting tomorrow (Thursday).  ""Members of the public aged 18-35 are encouraged to contact the HMOs to schedule an appointment for vaccination (starting tomorrow).  ""Despite the opening of the vaccination operation to the general public, Minister of Health Yuli Edelstein and the Ministry's Director General have ordered the HMOs to focus their efforts on those aged 50 and older and those confined to their homes.""  https://web.archive.org/web/20210212120510/https://www.gov.il/en/departments/news/03022021-01  ***Updated to add source"
"297","Jordan","JOR",2021-02-02,"Middle_East_North_Africa","C1: School closing","3G","3G","No change in policy."
"298","Jordan","JOR",2021-02-07,"Middle_East_North_Africa","C1: School closing","2G","3G","Starting February 7, children in grades kindergarten to third grade and twelfth grade will gradually resume in-person?classes. ?This re-opening will include both private and public schools. ?Nurseries are open.??Students in grades four through eleven, universities, cultural centers, and vocational training institutes?will continue remote learning until further notice.    Source: http://web.archive.org/web/20210215173432/https://jo.usembassy.gov/covid-19-information/"
"299","Jordan","JOR",2021-02-16,"Middle_East_North_Africa","C1: School closing","2G","2G","With a number of sectors reopening in January, schools also started gradually reopening in early February and students are returning to the classrooms after months of distant learning.   https://web.archive.org/web/20210221142024/https://reliefweb.int/report/jordan/unhcr-jordan-covid-19-response-17-february-2021    Ministry of Education on Saturday announced that the second stage of resuming in-class education, which includes 10th and 11th graders, will be suspended for one week continuing remote learning due to the epidemiological situation.   The ministry, in a statement, said that students in kindergarten, grades one, two and three and Tawjihi (General Secondary Education Certificate Examination), who have already attended schools since the beginning of the second semester, will continue the in-class and/or hybrid schooling according to the epidemiological update, which is subject to daily assessment, especially amid the spread of the new variant of the virus. https://web.archive.org/web/20210221100454/https://www.albawaba.com/news/jordan-more-economic-sectors-will-not-be-opened-covid-cases-rise-1412381"
"300","Jordan","JOR",2021-02-02,"Middle_East_North_Africa","C2: Workplace closing","1G","2G","The Government of Jordan continues to implement social distancing regulations and mandatory mask?wearing in business establishments, public transportation, and government facilities due to COVID-19.  The tourist sector has reopened for domestic tourism. Leisure facilities will reopen gradually. Public swimming pools and gyms will reopen from 1 February. Hotels, cafes, restaurants, mosques and churches have reopened at limited capacity.  Other recreational sectors including cinemas, entertainment venues, children’s play areas, exhibition and conference centres are due to reopen in March.    Source: http://web.archive.org/web/20210215173432/https://jo.usembassy.gov/covid-19-information/"
"301","Jordan","JOR",2021-02-16,"Middle_East_North_Africa","C2: Workplace closing","1G","1G","Jordan on Sunday recorded 2,477 new coronavirus cases, raising the total number of infections to 347,250.  Also, the death toll from the virus climbed to 4,455 as 11 more fatalities were reported.  In this context, Jordan's National Committee for Epidemics (NCE) held an extraordinary session on Sunday (Feb 14th)  to review the developments of the epidemiological situation.  The committee discussed the need to reimpose strict precautionary measures, including increasing curfew hours and shutting down economic institutions and sectors to limit the spread of the new virus variant amid its second wave.  https://web.archive.org/web/20210219014942/https://english.aawsat.com/home/article/2806016/jordan-records-highest-daily-spike-covid-19-cases"
"302","Jordan","JOR",2021-02-02,"Middle_East_North_Africa","C3: Cancel public events","1G","2G","Public swimming pools and gyms will reopen from 1 February. Hotels, cafes, restaurants, mosques and churches have reopened at limited capacity.  Other recreational sectors including cinemas, entertainment venues, children’s play areas, exhibition and conference centres are due to reopen in March.    Source: http://web.archive.org/web/20210215173432/https://jo.usembassy.gov/covid-19-information/"
"303","Jordan","JOR",2021-02-16,"Middle_East_North_Africa","C3: Cancel public events","1G","1G","unable to find any updates  https://web.archive.org/web/20210122011932/https://corona.moh.gov.jo/en"
"304","Jordan","JOR",2021-02-02,"Middle_East_North_Africa","C4: Restrictions on gatherings","3G","3G","No change.  Gatherings are restricted to 20 people.    Source: http://web.archive.org/web/20210215173432/https://jo.usembassy.gov/covid-19-information/"
"305","Jordan","JOR",2021-02-16,"Middle_East_North_Africa","C4: Restrictions on gatherings","3G","3G","More Action:  The Ministry of Health calls on everyone to abide by the Defense Production Act, and to follow precautionary measures; wearing masks, not holding/attending gatherings of more than (20) people, and to follow the awareness campaigns launched in partnership with a number of ministries and organizations in order to prevent COVID-19 spread. And to register on www.vaccine.jo to take the vaccine. https://web.archive.org/web/20210222213557/https://corona.moh.gov.jo/en/MediaCenter/2633"
"306","Jordan","JOR",2021-02-02,"Middle_East_North_Africa","C5: Close public transport","1G","1G","No change.  The Government of Jordan continues to implement social distancing regulations and mandatory mask?wearing in business establishments, public transportation, and government facilities due to COVID-19.    Source: http://web.archive.org/web/20210215173432/https://jo.usembassy.gov/covid-19-information/"
"307","Jordan","JOR",2021-02-16,"Middle_East_North_Africa","C5: Close public transport","1G","1G","unable to find any updates  https://web.archive.org/web/20210122011932/https://corona.moh.gov.jo/en"
"308","Jordan","JOR",2021-02-02,"Middle_East_North_Africa","C6: Stay at home requirements","2G","2G","No change.  A nightly curfew – midnight to 6:00 AM for individuals and 11:00 PM to 6:00 AM for businesses?–? remains?in effect.    Source: http://web.archive.org/web/20210215173432/https://jo.usembassy.gov/covid-19-information/"
"309","Jordan","JOR",2021-02-16,"Middle_East_North_Africa","C6: Stay at home requirements","2G","2G","The Government of Jordan continues to implement social distancing regulations and mandatory mask?wearing in business establishments, public transportation, and government facilities due to COVID-19.? On January 13,?the Government of Jordan announced the lifting of some of?its COVID-19 restrictions, including eliminating the Friday mandatory comprehensive curfew.? A nightly curfew – midnight to 6:00 AM for individuals and 11:00 PM to 6:00 AM for businesses?–? remains?in effect.? Jordan restricts gatherings to 20 people.??Starting February 7, children in grades kindergarten to third grade and twelfth grade will gradually resume in-person?classes. ?This re-opening will include both private and public schools. ?Nurseries are open.??Students in grades four through eleven, universities, cultural centers, and vocational training institutes?will continue remote learning until further notice.? Delivery services for food?and?public transportation?remain available?during non-curfew hours. https://web.archive.org/web/20210222224735/https://jo.usembassy.gov/covid-19-information/"
"310","Jordan","JOR",2021-02-02,"Middle_East_North_Africa","C7: Restrictions on internal movement","0","1G","There are no restrictions on intercity or interstate travel during non-curfew hours    Source: http://web.archive.org/web/20210215173432/https://jo.usembassy.gov/covid-19-information/"
"311","Jordan","JOR",2021-02-16,"Middle_East_North_Africa","C7: Restrictions on internal movement","0","0","unable to find any updates  https://web.archive.org/web/20210122011932/https://corona.moh.gov.jo/en"
"312","Jordan","JOR",2021-02-02,"Middle_East_North_Africa","C8: International travel controls","3","3","No change.  The Jordanian government suspended all direct air passenger flights between the UK and Jordan from 21 December 2020 until further notice.    Source: http://web.archive.org/web/20210215175111/https://www.gov.uk/foreign-travel-advice/jordan/coronavirus"
"313","Jordan","JOR",2021-02-16,"Middle_East_North_Africa","C8: International travel controls","3","3","unable to find any updates  https://web.archive.org/web/20210122011932/https://corona.moh.gov.jo/en"
"314","Jordan","JOR",2021-02-02,"Middle_East_North_Africa","E1: Income support","1T","1T","No change.  [The government] also instituted a temporary cash transfer program for the unemployed and self-employed (JD 81 million – about USD 114 million).  On December 3, Prime Minister Khasawneh announced expansion of the cash transfer program to cover 100,000 new families and daily workers.  Source: http://web.archive.org/web/20210215192421/https://www.imf.org/en/Topics/imf-and-covid19/Policy-Responses-to-COVID-19"
"315","Jordan","JOR",2021-02-16,"Middle_East_North_Africa","E1: Income support","1T","1T","unable to find any policy or noted changes in policy  https://web.archive.org/web/20210222224735/https://jo.usembassy.gov/covid-19-information/"
"316","Jordan","JOR",2021-02-02,"Middle_East_North_Africa","E2: Debt/contract relief","1","1","No change."
"317","Jordan","JOR",2021-02-16,"Middle_East_North_Africa","E2: Debt/contract relief","1","1","https://web.archive.org/web/20210222224735/https://jo.usembassy.gov/covid-19-information/"
"318","Jordan","JOR",2021-02-02,"Middle_East_North_Africa","H1: Public information campaigns","2G","2G","No change in policy."
"319","Jordan","JOR",2021-02-16,"Middle_East_North_Africa","H1: Public information campaigns","2G","2G","no change  https://web.archive.org/web/20210222224735/https://jo.usembassy.gov/covid-19-information/"
"320","Jordan","JOR",2021-02-02,"Middle_East_North_Africa","H2: Testing policy","2","2","No change in policy."
"321","Jordan","JOR",2021-02-16,"Middle_East_North_Africa","H2: Testing policy","2","2","COVID-19 Testing:    Are PCR and/or antigen tests?available for U.S. citizens in Jordan????Yes  If so, are test results reliably available within 72 hours????Yes  The cost of COVID-19 testing in Jordan is 28 JD, and most labs accept cash or credit cards.? Individuals are responsible for the cost of the test.  Most labs in Jordan communicate the initial test results through PDF sent by text message. However, some labs require individuals to pick up a hard copy of the results.? Each lab will clarify the process of obtaining results after conducting the COVID-19 test.? The Ministry of Health provides?a list (in Arabic)?of 33 laboratories?in Jordan authorized to perform COVID-19 diagnostic testing. https://web.archive.org/web/20210222224735/https://jo.usembassy.gov/covid-19-information/"
"322","Jordan","JOR",2021-02-02,"Middle_East_North_Africa","H3: Contact tracing","1","1","No change in policy."
"323","Jordan","JOR",2021-02-16,"Middle_East_North_Africa","H3: Contact tracing","1","1","no evidence of comprehensive tracing: https://web.archive.org/web/20210122011932/https://corona.moh.gov.jo/en"
"324","Jordan","JOR",2021-02-02,"Middle_East_North_Africa","H6: Facial Coverings","3G","3G","No change.  By law, everyone must comply with social distancing by keeping 1.5 metres away from other people when outside the home, and by wearing gloves and a mask when entering public places such as government buildings, shops, companies and health centres. Failure to comply with these rules is punishable by a fine.    Source: http://web.archive.org/web/20210215175111/https://www.gov.uk/foreign-travel-advice/jordan/coronavirus"
"325","Jordan","JOR",2021-02-16,"Middle_East_North_Africa","H6: Facial Coverings","3G","3G","The Government of Jordan continues to implement social distancing regulations and mandatory mask?wearing in business establishments, public transportation, and government facilities due to COVID-19.? On January 13,?the Government of Jordan announced the lifting of some of?its COVID-19 restrictions, including eliminating the Friday mandatory comprehensive curfew.? A nightly curfew – midnight to 6:00 AM for individuals and 11:00 PM to 6:00 AM for businesses?–? remains?in effect.? Jordan restricts gatherings to 20 people.??Starting February 7, children in grades kindergarten to third grade and twelfth grade will gradually resume in-person?classes. ?This re-opening will include both private and public schools. ?Nurseries are open.??Students in grades four through eleven, universities, cultural centers, and vocational training institutes?will continue remote learning until further notice.? Delivery services for food?and?public transportation?remain available?during non-curfew hours."
"326","Jordan","JOR",2021-02-02,"Middle_East_North_Africa","H7: Vaccination policy","3G","3G","No change in policy."
"327","Jordan","JOR",2021-02-16,"Middle_East_North_Africa","H7: Vaccination policy","3G","3G","Not noted who is eligible  Has the government of Jordan approved a COVID-19 vaccine for use????Yes  Individuals in Jordan may register to receive a vaccine at?https://vaccine.jo/cvms/?(English and Arabic). Both Jordanian citizens and non-Jordanian nationals are eligible to register for a vaccine in Jordan.  https://web.archive.org/web/20210122011932/https://corona.moh.gov.jo/en"
"328","Kuwait","KWT",2021-02-02,"Middle_East_North_Africa","C1: School closing","3G","3G","""Public schools, universities, and colleges are planning for continued virtual learning.""    https://web.archive.org/web/*/https://kw.usembassy.gov/covid-19-information/"
"329","Kuwait","KWT",2021-02-07,"Middle_East_North_Africa","C1: School closing","3G","3G","""Public schools, universities, and colleges are planning for continued virtual learning.""    https://web.archive.org/web/*/https://kw.usembassy.gov/covid-19-information/"
"330","Kuwait","KWT",2021-02-02,"Middle_East_North_Africa","C2: Workplace closing","1G","1G","""Government offices and private businesses, banking, financial, and construction sectors, retail stores, shopping malls, public parks, restaurant takeout and dine-in services, hotels, and tailors are open with physical distancing measures. ""    https://web.archive.org/web/*/https://kw.usembassy.gov/covid-19-information/"
"331","Kuwait","KWT",2021-02-07,"Middle_East_North_Africa","C2: Workplace closing","2G","1G","""Government offices and private businesses, banking, financial, and construction sectors, retail stores, shopping malls, public parks, restaurant takeout and dine-in services, hotels, and tailors are open with physical distancing measures. Beginning February 7 for a one-month period, all commercial businesses, including restaurants, are closed from 8 PM to 5 AM daily, with the exception of pharmacies, co-ops, and grocery stores. Takeout orders and delivery is not restricted.  Beginning February 7 for a one-month period, health clubs, salons, barber shops, and spas are closed."""
"332","Kuwait","KWT",2021-02-02,"Middle_East_North_Africa","C3: Cancel public events","2G","2G","""Many types of social gatherings, including weddings, receptions, desert camping, and public and private diwaniyas, are banned.""    https://web.archive.org/web/*/https://kw.usembassy.gov/covid-19-information/"
"333","Kuwait","KWT",2021-02-02,"Middle_East_North_Africa","C4: Restrictions on gatherings","2G","2G","No change    https://web.archive.org/web/*/https://kw.usembassy.gov/covid-19-information/"
"334","Kuwait","KWT",2021-02-02,"Middle_East_North_Africa","C5: Close public transport","1G","1G","""Is public transportation operating? Yes.  Taxis are operating and buses have implemented social distancing measures.""    https://web.archive.org/web/*/https://kw.usembassy.gov/covid-19-information/"
"335","Kuwait","KWT",2021-02-02,"Middle_East_North_Africa","C6: Stay at home requirements","1G","1G","""Is a curfew in place? No.""    https://web.archive.org/web/*/https://kw.usembassy.gov/covid-19-information/"
"336","Kuwait","KWT",2021-02-02,"Middle_East_North_Africa","C7: Restrictions on internal movement","1G","1G","""Are there restrictions on intercity or interstate travel? No.""    https://web.archive.org/web/*/https://kw.usembassy.gov/covid-19-information/"
"337","Kuwait","KWT",2021-02-02,"Middle_East_North_Africa","C8: International travel controls","4","3","""For a two-week period starting on February 7, non-Kuwaiti citizens are not permitted to enter Kuwait. There may be exceptions available for first-degree relatives of Kuwaiti citizens, domestic employees traveling with them, governmental medical staff, and private sector medical staff as approved by the Ministry of Health. Details can be found at corona.e.gov.kw/en. U.S. citizens are permitted to enter Kuwait only if in possession of a valid visa or residency. ""    https://web.archive.org/web/*/https://kw.usembassy.gov/covid-19-information/"
"338","Kuwait","KWT",2021-02-02,"Middle_East_North_Africa","H1: Public information campaigns","2G","2G","No update    https://web.archive.org/web/20210105000242/https://corona.e.gov.kw/en/Home/BreakingNews"
"339","Kuwait","KWT",2021-02-02,"Middle_East_North_Africa","H2: Testing policy","3","3","""PCR tests are widely and readily available. There are no antigen tests available. Labs will generally return PCR test results in 24 hours or less, though some may take up to 48 hours. The tests range from approximately 25-40 KD (82-132 USD). Method of result notification varies by laboratory, but is generally via text message or email.""    https://web.archive.org/web/*/https://kw.usembassy.gov/covid-19-information/"
"340","Kuwait","KWT",2021-02-02,"Middle_East_North_Africa","H3: Contact tracing","2","2","No update:    https://web.archive.org/web/*/https://kw.usembassy.gov/covid-19-information/"
"341","Kuwait","KWT",2021-02-02,"Middle_East_North_Africa","H6: Facial Coverings","3G","3G","""The use of face masks is mandatory in all public spaces. Individuals who are found in violation of the law will be imprisoned for up to three months and/or fined up to 5,000 KD.""    https://web.archive.org/web/*/https://kw.usembassy.gov/covid-19-information/"
"342","Kuwait","KWT",2021-02-02,"Middle_East_North_Africa","H7: Vaccination policy","3G","3G","No updates:    https://web.archive.org/web/20210105002053if_/https://gulfnews.com/world/gulf/kuwait/kuwait-all-citizens-to-get-covid-19-vaccine-for-free-1.75488993  https://web.archive.org/web/20210105002646/https://gulfnews.com/world/gulf/kuwait/covid-19-more-than-1000-people-vaccinated-on-1st-day-in-kuwait-1.76123900"
"343","Lebanon","LBN",2021-01-26,"Middle_East_North_Africa","C1: School closing","3G","3G","No change in policy.    Source:  https://web.archive.org/web/20210201160228/https://www.gov.il/en/departments/guides/ramzor-cites-guidelines?chapterIndex=4  https://web.archive.org/web/20210125214746/https://www.france24.com/en/middle-east/20210122-lebanon-extends-lockdown-by-two-weeks-as-covid-19-deaths-soar"
"344","Lebanon","LBN",2021-02-02,"Middle_East_North_Africa","C1: School closing","3G","3G","""Closure of all administrations, public institutions, independent interests, universities, public and private schools, various kindergartens, public parks, docks, public and private sports stadiums, both internal and external, and the Casino du Liban, with some specific exceptions.""    Source: https://web.archive.org/web/20210208151252/http://drm.pcm.gov.lb/Media/News/Daily-situation-report-25-Jan,-2021_English-Versio.pdf    NB: ""The Presidency of the Council of Ministers issued Resolution No. 46 / PM on 21/2/2021 based on the recommendation of the Ministerial Committee in charge of following up on the issue of preventive measures and procedures for the Coronavirus in its meeting on January 21/2021, where the President of the Republic and the Prime Minister decided to give an exceptional approval to extend the full closure decision No. 26 / PM on 11/1/2021 until 5  a.m. on Monday corresponding to 8/2/2021. """
"345","Lebanon","LBN",2021-02-09,"Middle_East_North_Africa","C1: School closing","3G","3G","On  February 8, the Lebanese government announced a limited easing of the restrictions on movement and public services to combat the spread of COVID-19 in Lebanon. A 24-hour curfew remains in force until 5:00 a.m. Monday, March 8.  Most public institutions and facilities, and private businesses and enterprises will remain closed, with exceptions for entities that provide for security, public safety, and health, and food production and distribution.  Grocery stores will be allowed to reopen for limited shopping and restaurants will allow pick-up.  Pharmacies will observe reduced hours. In addition to grocery stores, restaurants and pharmacies, other private business will be allowed to resume operations under the lockdown.  Those who wish to request a brief exception to the curfew should visit this site.  Rafic Hariri International Airport remains open, operating at a reduced capacity; all air travelers arriving in Beirut will be required to undergo PCR testing.  Additional COVID mitigation measures will apply to passengers arriving from Baghdad, Istanbul, Adana, Cairo, and Addis Ababa. Details of the lockdown, including the limited exceptions for travel during the lockdown, may be found here.  https://archive.vn/wip/W7EtA  https://archive.vn/RnP8Q"
"346","Lebanon","LBN",2021-01-26,"Middle_East_North_Africa","C2: Workplace closing","2G","2G","No change in policy.    Source:  https://web.archive.org/web/20210201160228/https://www.gov.il/en/departments/guides/ramzor-cites-guidelines?chapterIndex=4  https://web.archive.org/web/20210125214746/https://www.france24.com/en/middle-east/20210122-lebanon-extends-lockdown-by-two-weeks-as-covid-19-deaths-soar"
