"","CountryName","CountryCode","Date","region","PolicyType","PolicyCode","previous_PolicyCode","Notes"
"1","Albania","ALB",2022-04-19,"Europe_Central_Asia","C1: School closing","1G","1G","No policy change.    https://web.archive.org/web/20220504205256/https://al.usembassy.gov/updates_covid19/"
"2","Albania","ALB",2022-05-01,"Europe_Central_Asia","C1: School closing","1G","1G","No policy change.    https://web.archive.org/web/20220504205256/https://al.usembassy.gov/updates_covid19/"
"3","Albania","ALB",2022-04-19,"Europe_Central_Asia","C2: Workplace closing","1G","1G","No policy change. Info from the Ministry of Europe and Foreign Affairs indicates that mask wearing is still mandatory indoors:    Wearing the mask indoors as well as on public transport is mandatory. It is recommended to wear the mask wherever social distance can not be maintained, as well as for those who have not yet done the two doses of the vaccine.    https://web.archive.org/web/20220305213504/https://punetejashtme.gov.al/informacion-mbi-levizjen-e-shtetasve-te-huaj-ne-shqiperi/"
"4","Albania","ALB",2022-05-01,"Europe_Central_Asia","C2: Workplace closing","1G","1G","No policy change. Info from the Ministry of Europe and Foreign Affairs indicates that mask wearing is still mandatory indoors:    Wearing the mask indoors as well as on public transport is mandatory. It is recommended to wear the mask wherever social distance can not be maintained, as well as for those who have not yet done the two doses of the vaccine.    https://web.archive.org/web/20220504211639/https://punetejashtme.gov.al/informacion-mbi-levizjen-e-shtetasve-te-huaj-ne-shqiperi/"
"5","Albania","ALB",2022-04-19,"Europe_Central_Asia","C3: Cancel public events","1G","1G","No policy change.  Sports championships, theater activities, artistic and cultural performances, conferences with the presence of fans with reduced capacities up to 30% are allowed according to the IPH protocol.    https://web.archive.org/web/20220305213504/https://punetejashtme.gov.al/informacion-mbi-levizjen-e-shtetasve-te-huaj-ne-shqiperi/"
"6","Albania","ALB",2022-05-01,"Europe_Central_Asia","C3: Cancel public events","0","1G","Restrictions from previous order have since been removed from the most recent order in effect from May 1.    https://web.archive.org/web/20220504211639/https://punetejashtme.gov.al/informacion-mbi-levizjen-e-shtetasve-te-huaj-ne-shqiperi/"
"7","Albania","ALB",2022-04-19,"Europe_Central_Asia","C4: Restrictions on gatherings","3G","3G","No policy change.  Outdoor gatherings are allowed up to 50 people, applying the rules according to the protocols of the Institute of Public Health: http://www.ishp.gov.al/    https://web.archive.org/web/20220305213504/https://punetejashtme.gov.al/informacion-mbi-levizjen-e-shtetasve-te-huaj-ne-shqiperi/"
"8","Albania","ALB",2022-05-01,"Europe_Central_Asia","C4: Restrictions on gatherings","0","3G","Restrictions from previous order have since been removed from the most recent order in effect from May 1.    https://web.archive.org/web/20220504211639/https://punetejashtme.gov.al/informacion-mbi-levizjen-e-shtetasve-te-huaj-ne-shqiperi/"
"9","Albania","ALB",2022-04-19,"Europe_Central_Asia","C5: Close public transport","0","0","Wearing the mask indoors as well as on public transport is mandatory. It is recommended to wear the mask wherever social distance can not be maintained, as well as for those who have not yet done the two doses of the vaccine.    https://web.archive.org/web/20220305213504/https://punetejashtme.gov.al/informacion-mbi-levizjen-e-shtetasve-te-huaj-ne-shqiperi/"
"10","Albania","ALB",2022-05-01,"Europe_Central_Asia","C5: Close public transport","0","0","No policy change.    https://web.archive.org/web/20220504211639/https://punetejashtme.gov.al/informacion-mbi-levizjen-e-shtetasve-te-huaj-ne-shqiperi/"
"11","Albania","ALB",2022-04-19,"Europe_Central_Asia","C6: Stay at home requirements","0","0","No evidence found of stay at home requirements."
"12","Albania","ALB",2022-05-01,"Europe_Central_Asia","C6: Stay at home requirements","0","0","No evidence of stay at home requirements.    https://web.archive.org/web/20220504211639/https://punetejashtme.gov.al/informacion-mbi-levizjen-e-shtetasve-te-huaj-ne-shqiperi/"
"13","Albania","ALB",2022-04-19,"Europe_Central_Asia","C7: Restrictions on internal movement","2G","2G","No policy change.  Restriction of movement throughout the territory of the Republic of Albania, from 23:00 to 06:00. Movement is allowed only for health or emergency reasons. Use the E-Albania application for specific permissions.    https://web.archive.org/web/20220305213504/https://punetejashtme.gov.al/informacion-mbi-levizjen-e-shtetasve-te-huaj-ne-shqiperi/"
"14","Albania","ALB",2022-05-01,"Europe_Central_Asia","C7: Restrictions on internal movement","0","2G","Restrictions from previous order have since been removed from the most recent order in effect from May 1.    https://web.archive.org/web/20220504211639/https://punetejashtme.gov.al/informacion-mbi-levizjen-e-shtetasve-te-huaj-ne-shqiperi/"
"15","Albania","ALB",2022-04-19,"Europe_Central_Asia","C8: International travel controls","1","1","Data From 06 September 2021, to enter the Republic of Albania, whether by land, sea or air, you must be equipped with:    • Vaccination passport, where at least two weeks have passed from the date of full vaccination; or    • PCR test performed within 72 hours; or    • Rapid antigen test performed within 48 hours OR    • Document / proof proving that you have passed or recovered from Covid-19 valid up to 6 months after recovery;    • These criteria also apply to those travelers who transit through Albania;    • Children up to the age of 6 are exempt from these criteria.    https://web.archive.org/web/20220305213504/https://punetejashtme.gov.al/informacion-mbi-levizjen-e-shtetasve-te-huaj-ne-shqiperi/"
"16","Albania","ALB",2022-05-01,"Europe_Central_Asia","C8: International travel controls","0","1","Restrictions from previous order have since been removed from the most recent order in effect from May 1.    Starting from May 1, 2022, for all trips to Albania, whether by sea, land or air, no specific document is required under the terms of Covid-19.    https://web.archive.org/web/20220504211639/https://punetejashtme.gov.al/informacion-mbi-levizjen-e-shtetasve-te-huaj-ne-shqiperi/"
"17","Albania","ALB",2022-04-19,"Europe_Central_Asia","E1: Income support","0","0","No evidence of income support."
"18","Albania","ALB",2022-04-19,"Europe_Central_Asia","E2: Debt/contract relief","0","0","No evidence of debt/contract relief."
"19","Albania","ALB",2022-04-19,"Europe_Central_Asia","H1: Public information campaigns","2G","2G","Ministry of Health continues to post daily Covid updates.    https://web.archive.org/web/20220504213754/https://shendetesia.gov.al/covid19-ministria-e-shendetesise-502-testime-14-qytetare-te-infektuar-asnje-humbje-jete-dhe-33-te-sheruar-ne-24-oret-e-fundit/"
"20","Albania","ALB",2022-04-19,"Europe_Central_Asia","H2: Testing policy","3","3","Are PCR and/or antigen tests available for U.S. citizens in Albania? Yes  If so, are test results reliably available within one calendar day? Yes  Airport Covid-19 PCR test:  Tirana International Airport offers a Covid-19 PCR test for travelers. For more information, visit their website.  Public Health Labs:  Currently, to be tested for COVID-19 by the Albanian public health authority one must have symptoms and a recommendation from the public health authority’s family doctor.  However, private testing labs will perform a test for a fee, and no symptoms or a doctor’s recommendation is required (see details below).  If you have an Albanian social security number, you also have an assigned public health family doctor.  To learn who your public health family doctor is, call the help line at 0-800-4040 to find out.  Tests are free of charge if done by the Albanian Institute of Public Health (IPH).  Private Labs:  Individuals can also arrange private testing by going to a private testing lab. No symptoms or doctor’s order is required to arrange a private test, and no advance appointment is necessary.  According to the Albanian Ministry of Health and Social Protection, there are several private labs authorized to perform SARS-CoV-2 testing for administrative issues. For a full list, please see the Ministry of Health list here.    https://web.archive.org/web/20220504205256/https://al.usembassy.gov/updates_covid19/"
"21","Albania","ALB",2022-04-19,"Europe_Central_Asia","H3: Contact tracing","0","0","No evidence of contact tracing."
"22","Albania","ALB",2022-04-19,"Europe_Central_Asia","H6: Facial Coverings","2G","2G","Wearing the mask indoors as well as on public transport is mandatory. It is recommended to wear the mask wherever social distance can not be maintained, as well as for those who have not yet done the two doses of the vaccine.    https://web.archive.org/web/20220504211639/https://punetejashtme.gov.al/informacion-mbi-levizjen-e-shtetasve-te-huaj-ne-shqiperi/"
"23","Albania","ALB",2022-04-19,"Europe_Central_Asia","H7: Vaccination policy","5G","5G","The Ministry of Health appeals to citizens to be vaccinated as soon as possible, to protect themselves and the health of others. AntiCOVID vaccines reduce the chance of infection and greatly avoid hospitalizations and fatalities.  Every citizen over 12 years old can be vaccinated in health centers.    https://web.archive.org/web/20220504213754/https://shendetesia.gov.al/covid19-ministria-e-shendetesise-502-testime-14-qytetare-te-infektuar-asnje-humbje-jete-dhe-33-te-sheruar-ne-24-oret-e-fundit/"
"24","Albania","ALB",2022-04-19,"Europe_Central_Asia","H8: Protection of elderly people","1G","1G","All passengers who are allowed to enter the territory of the Republic of Albania, in addition to respecting the protocols of international standards that airlines apply anywhere in the world, must also apply these rules:    • Only traveling passengers will enter the airport building, avoiding being escorted by their family members;    • Passengers must respect the social distance of 1.5 meters throughout their stay at the airport;    • Priority is given to the elderly, people in need and families with minor children;    https://web.archive.org/web/20220504211639/https://punetejashtme.gov.al/informacion-mbi-levizjen-e-shtetasve-te-huaj-ne-shqiperi/"
"25","Albania","ALB",2022-04-19,"Europe_Central_Asia","V2: Vaccine Availability","31812","25460","Update from 16 years of age to 12 years of age. This happened sometime in March or April, however, the website does not show updated orders before 27/04/22.    From the website:  Every citizen over 12 years old can be vaccinated in health centers.    https://web.archive.org/web/20220504213754/https://shendetesia.gov.al/covid19-ministria-e-shendetesise-502-testime-14-qytetare-te-infektuar-asnje-humbje-jete-dhe-33-te-sheruar-ne-24-oret-e-fundit/"
"26","Albania","ALB",2022-04-19,"Europe_Central_Asia","V3: Vaccine Financial Support","31812","25460","The Ministry of Health appeals to citizens to be vaccinated as soon as possible, to protect themselves and the health of others. AntiCOVID vaccines reduce the chance of infection and greatly avoid hospitalizations and fatalities.  Every citizen over 12 years old can be vaccinated in health centers.    https://web.archive.org/web/20220504213754/https://shendetesia.gov.al/covid19-ministria-e-shendetesise-502-testime-14-qytetare-te-infektuar-asnje-humbje-jete-dhe-33-te-sheruar-ne-24-oret-e-fundit/"
"27","Albania","ALB",2022-04-19,"Europe_Central_Asia","V4: Mandatory Vaccination","31812","25460","Starting September 1, 2021, vaccination will be mandatory for groups at-risk, including medical staff, teachers, and students, by September 30, 2021.    https://web.archive.org/web/20220504205256/https://al.usembassy.gov/updates_covid19/"
"28","Andorra","AND",2022-04-12,"Europe_Central_Asia","C1: School closing","0","0","none posted: https://web.archive.org/web/20220501104830/https://www.educacio.ad/"
"29","Andorra","AND",2022-04-12,"Europe_Central_Asia","C2: Workplace closing","0","0","none listed: https://web.archive.org/web/20220429210919/https://www.govern.ad/coronavirus"
"30","Andorra","AND",2022-04-12,"Europe_Central_Asia","C3: Cancel public events","0","0","nothing mentioned via portal, citizen or traveler announcements: https://web.archive.org/web/20220429210919/https://www.govern.ad/coronavirus  https://web.archive.org/web/20220502134537/https://www.govern.ad/images/stories/Coronavirus/PDFs/Evitar_propagacio_Covid19.pdf  https://web.archive.org/web/20220429014912/https://visitandorra.com/ca/covid-19-a-andorra/preguntes-frequeents-faq-si-vens-a-passar-uns-dies-a-andorra/"
"31","Andorra","AND",2022-04-12,"Europe_Central_Asia","C4: Restrictions on gatherings","0","0","nothing mentioned via portal, citizen or traveler announcements: https://web.archive.org/web/20220429210919/https://www.govern.ad/coronavirus  https://web.archive.org/web/20220502134537/https://www.govern.ad/images/stories/Coronavirus/PDFs/Evitar_propagacio_Covid19.pdf  https://web.archive.org/web/20220429014912/https://visitandorra.com/ca/covid-19-a-andorra/preguntes-frequeents-faq-si-vens-a-passar-uns-dies-a-andorra/"
"32","Andorra","AND",2022-04-12,"Europe_Central_Asia","C5: Close public transport","0","0","At present, the capacity of the internal buses is 50% of its capacity. All are running. https://web.archive.org/web/20210427100251/https://visitandorra.com/ca/covid-19-a-andorra/preguntes-frequeents-faq-com-arribar-i-moure-s-per-andorra/"
"33","Andorra","AND",2022-04-12,"Europe_Central_Asia","C6: Stay at home requirements","0","0","while they use the covid certificate, it doesn't state any difference in treatment: https://web.archive.org/web/20220429210919/https://www.govern.ad/coronavirus  https://web.archive.org/web/20220502135053/https://visitandorra.com/ca/covid-19-a-andorra/  https://web.archive.org/web/20220502134537/https://www.govern.ad/images/stories/Coronavirus/PDFs/Evitar_propagacio_Covid19.pdf"
"34","Andorra","AND",2022-04-12,"Europe_Central_Asia","C7: Restrictions on internal movement","0","0","while they use the covid certificate, it doesn't state any difference in treatment: https://web.archive.org/web/20220429210919/https://www.govern.ad/coronavirus  https://web.archive.org/web/20220502135053/https://visitandorra.com/ca/covid-19-a-andorra/  https://web.archive.org/web/20220502134537/https://www.govern.ad/images/stories/Coronavirus/PDFs/Evitar_propagacio_Covid19.pdf"
"35","Andorra","AND",2022-04-12,"Europe_Central_Asia","C8: International travel controls","0","0","all transportation are noted as open: https://web.archive.org/web/20210427100251/https://visitandorra.com/ca/covid-19-a-andorra/preguntes-frequeents-faq-com-arribar-i-moure-s-per-andorra/"
"36","Andorra","AND",2022-04-12,"Europe_Central_Asia","E1: Income support","0","0","nothing mentioned: https://web.archive.org/web/20220429210919/https://www.govern.ad/coronavirus"
"37","Andorra","AND",2022-04-12,"Europe_Central_Asia","E2: Debt/contract relief","0","0","nothing mentioned: https://web.archive.org/web/20220429210919/https://www.govern.ad/coronavirus"
"38","Andorra","AND",2022-04-12,"Europe_Central_Asia","H1: Public information campaigns","2T","2T","there is a public dashboard and tourism info site: https://web.archive.org/web/20220429210919/https://www.govern.ad/coronavirus  https://web.archive.org/web/20210427100251/https://visitandorra.com/ca/covid-19-a-andorra/preguntes-frequeents-faq-com-arribar-i-moure-s-per-andorra/  https://web.archive.org/web/20220502134537/https://www.govern.ad/images/stories/Coronavirus/PDFs/Evitar_propagacio_Covid19.pdf"
"39","Andorra","AND",2022-04-12,"Europe_Central_Asia","H2: Testing policy","3","3","testing is evident and part of portals:  https://web.archive.org/web/20220429210919/https://www.govern.ad/coronavirus"
"40","Andorra","AND",2022-04-12,"Europe_Central_Asia","H3: Contact tracing","2","2","it is reliant on the individual to notify, but there is a comprehensive platform for them to do it & protocols: https://web.archive.org/web/20220502142237/https://www.salut.ad/contactescovid/pas1"
"41","Andorra","AND",2022-04-12,"Europe_Central_Asia","H6: Facial Coverings","2G","2G","[Facial masks] will only continue to be mandatory for access to hospitals, health centers and social and health centers (surgical masks and FFP2).  https://web.archive.org/web/20220502143003/https://visitandorra.com/ca/covid-19-a-andorra/preguntes-frequeents-faq-si-vens-a-passar-uns-dies-a-andorra/"
"42","Andorra","AND",2022-04-12,"Europe_Central_Asia","H7: Vaccination policy","5G","5G","main vaccine site: https://web.archive.org/web/20220502145335/https://www.govern.ad/info-vacunacio  widely available including for 5 - 11, with parent approval: https://web.archive.org/web/20220502143315/https://www.govern.ad/vacunacio/questionari-infantil/Questionari_previ_vacunacio_5_11_anys.pdf"
"43","Andorra","AND",2022-04-12,"Europe_Central_Asia","H8: Protection of elderly people","1G","1T","La recomanació de dur mascareta en interiors per a les persones vulnerables i en vigilància passiva amb símptomes  https://web.archive.org/web/20220502134537/https://www.govern.ad/images/stories/Coronavirus/PDFs/Evitar_propagacio_Covid19.pdf"
"44","Austria","AUT",2022-04-04,"Europe_Central_Asia","C1: School closing","2T","2T","How are the current, far-reaching easing of restrictions affecting university and college operations?  Not directly. Because the universities and colleges remain exempt from the general health law requirements and thus also from the current Corona Basic Measures Ordinance . However, they offer an important orientation for the individual and independent definition of those corona measures that the universities and colleges take independently and independently within the framework of their autonomy. These vary from university to university and from college to college.    This is also the reason why universities and colleges currently have different forms of access regulations (2.5G, 3G regulation or none at all) depending on their situation-specific requirements and why the handling of a mask requirement is quite different. In view of the general lifting of most restrictions, universities and colleges are also considering whether they should relax their corona measures even further, while also monitoring the epidemiological situation. In any case, the recommendation to wear an FFP2 mask in closed rooms remains.    Therefore, please find out from your respective university or college which corona measures must be observed at their locations.    Sources:   https://archive.ph/j9rGq [Coronavirus (COVID-19): Frequently asked questions and answers (FAQ) in the university and college sector]  https://archive.ph/FKBQD [5-point plan for getting back to normal at universities and colleges]"
"45","Austria","AUT",2022-04-16,"Europe_Central_Asia","C1: School closing","2T","2T","Educational field    Tests or evidence of a low epidemiological risk  Schools are open to anyone who needs them. If students are in the school building, they must carry out antigen or PCR tests at least twice a week (once a week from April 19). If the test intervals are observed, the test result is also valid on the sixth and seventh day after the first test.    Mask requirement  •	In the generally accessible areas of the school building or in homes (e.g. corridors), teachers and administrative staff as well as external persons are still required to wear FFP2 masks.  •	The FFP2 mask requirement in classrooms and group rooms and teachers' and conference rooms for teachers and administrative staff as well as for external persons with proof of a low epidemiological risk (vaccinated, recovered or tested) is no longer applicable.  •	Outside the classrooms and group rooms, students up to the 8th grade wear an MNS and students from the 9th grade wear an FFP2 mask.  •	A mask does not have to be worn in physical education classes, in movement-oriented classes in the classroom or in dormitories.    For further binding regulations see  COVID-19 School Ordinance 2021/22  and its amendment as well as  COVID-19 Higher Education Act.    Sources:  https://archive.ph/WGqni [Coronavirus: Aktuelle Maßnahmen]  https://archive.ph/LEl7E [Nationwide measures]"
"46","Austria","AUT",2022-04-04,"Europe_Central_Asia","C2: Workplace closing","2G","2G","At work  The FFP2 mask obligation applies when entering work places in closed rooms,  •	unless physical contact with people from outside the household is excluded, or  •	the risk of infection can be minimized by other suitable protective measures (in particular technical protective measures such as the installation of partitions or plexiglass walls).  •	The FFP2 mask requirement also applies to entering external workplaces, with the exception of those in your own private living area.  •	In justified cases, stricter regulations that go beyond the legal requirements can be made to prevent the further spread of COVID-19.    **Health and social sector**  Mobile care and support services  •	Mobile care and support service providers may only enter external workplaces if they can show proof of a low epidemiological risk (vaccinated, recovered or tested) and wear an FFP2 mask when in contact with customers.    Hospitals and health resorts and other places where health services are provided  The FFP2 mask requirement generally applies to patients, accompanying persons, visitors, operators, employees and service providers. unless the risk of infection can be minimized by other suitable protective measures.    The following also applies to employees:   •	Operators may only let employees in if they present proof of 3G (vaccinated, recovered or tested).  •	This also applies to external service providers, residents' representatives, patient, disabled and nursing advocates, nursing supervisory bodies or members of established commissions.  In principle, the planned measures must not be disproportionate or lead to unreasonable hardship.    Retirement and nursing homes as well as inpatient residential facilities for the disabled  In general, the FFP2 mask requirement applies to visitors, accompanying persons, employees, external service providers and residents (in places that do not belong to their own living area).  The following also applies to employees:   •	Operators may only let employees in if they present proof of 3G (vaccinated, recovered or tested).  •	This also applies to external service providers, residents' representatives, patient, disabled and nursing advocates, nursing supervisory bodies or members of established commissions.  In principle, the planned measures must not be disproportionate or lead to unreasonable hardship.    **COVID-19 officer and COVID-19 prevention concept**  Operators and owners of the following areas must appoint a COVID-19 officer and develop and implement a COVID-19 prevention concept:  •	cable cars and cog railways,  •	Coaches and excursion boats in occasional traffic,  •	Business premises with customer areas,  •	non-public sports facilities and leisure facilities,  •	workplaces with more than 51 employees,  •	Retirement and nursing homes as well as residential facilities for the disabled and  •	hospitals or sanatoriums    The COVID-19 prevention concept is a state-of-the-art concept for minimizing the risk of infection with SARS-CoV-2. A data protection-compliant system for the traceability of contacts, such as a system for recording the presence on a voluntary basis of visitors or accompanying persons and external service providers, can also be included for old people's and nursing homes as well as inpatient residential facilities for the disabled as well as for hospitals and spa facilities.    Sources:  https://archive.ph/nVGXS [Nationwide measures]  https://archive.ph/94mKv [Coronavirus: current measures]"
"47","Austria","AUT",2022-04-16,"Europe_Central_Asia","C2: Workplace closing","2G","2G","At work  The FFP2 mask obligation applies when entering workplaces in closed rooms,  •	unless physical contact with people from outside the household is excluded, or  •	the risk of infection can be minimized by other suitable protective measures (in particular technical protective measures such as the installation of partitions or plexiglass walls).  •	The FFP2 mask requirement also applies to entering external workplaces, with the exception of those in your own private living area.  •	In justified cases, stricter regulations that go beyond the legal requirements can be made to prevent the further spread of COVID-19.    Customer areas  The FFP2 mask requirement applies when entering customer areas in all retail establishments and when using services.    3 G rule:  3-G proof only has to be provided by visitors, employees and service providers in hospitals, old people’s and nursing homes and comparable settings.    Hospitals and nursing homes in Vienna  •	Visitors are still required to carry out a PCR test and wear an FFP2 mask.  •	3 visitors are allowed in hospitals per day and patient.  •	For support services, one additional person is allowed for patients in need of support.  •	There are no visitor restrictions in the nursing homes.  •	2G is no longer required in both the hospitals and the nursing homes.  •	Employees in hospitals and nursing homes still need 2.5 G (vaccinated, recovered or PCR test), in addition there is a PCR screening twice a week.    Sources:  https://archive.ph/WGqni [Coronavirus: Aktuelle Maßnahmen]  https://archive.ph/LEl7E [Nationwide measures]  https://archive.ph/V1rio [Vienna]"
