"","CountryName","CountryCode","Date","region","PolicyType","PolicyCode","previous_PolicyCode","Notes"
"1","Australia","AUS",2021-12-07,"East_Asia_Pacific","C1: School closing","0","3T","From 14 Dec lockout and lockdowns have ended. School and childcare centres can provide onsite learning to all students  https://web.archive.org/web/20211214173520/https://www.healthdirect.gov.au/covid19-restriction-checker/education-and-childcare/nt"
"2","Australia","AUS",2021-12-15,"East_Asia_Pacific","C1: School closing","0","0","No new policy. Continuing from 14 Dec lockout and lockdowns have ended. School and childcare centres can provide onsite learning to all students. https://archive.vn/Nut9s"
"3","Australia","AUS",2021-12-07,"East_Asia_Pacific","C2: Workplace closing","1T","3T","From 14 Dec lockdown and lockouts have ended but some areas have restrictions on workers who are unvaccinated. In NSW if you're not fully vaccinated, your employer must require you to work from home unless it's not reasonably practicable. Also many workers in the Northern Territory are required to be vaccinated with a first dose of COVID-19 vaccine in order to keep working. Workers need to be fully vaccinated by 24 December 2021.    https://web.archive.org/web/20211214173212/https://www.healthdirect.gov.au/covid19-restriction-checker/gatherings-and-work/nt    https://web.archive.org/web/20211214171839/https://www.healthdirect.gov.au/covid19-restriction-checker/gatherings-and-work/nsw"
"4","Australia","AUS",2021-12-07,"East_Asia_Pacific","C3: Cancel public events","2T","2T","From 14 Dec NSW is no longer under lockdown. However, different rules apply to people who are fully vaccinated and those who aren’t fully vaccinated. If you are not fully vaccinated, you cannot visit a recreation or entertainment facility or attend an outdoor event. If you're not fully vaccinated, you can only gather with 1 other person or with your household outdoors.    Also Music festivals are still prohibited for all vaccinated and unvaccinated like.   COVID-19 Safety Plans are required if more than 1000 people attend an outdoor gathering.     https://web.archive.org/web/20211115210410/https://www.healthdirect.gov.au/covid19-restriction-checker/entertainment-and-amusement-venues/nsw"
"5","Australia","AUS",2021-12-07,"East_Asia_Pacific","C4: Restrictions on gatherings","4T","4T","From 14 December in the NT region restrictions have eased for people who are fully vaccinated, have a medical exemption, or are under 16 years. If all members of your household who are aged 16 years and over are fully vaccinated, there is no limit to the number of fully vaccinated visitors you can have to your home. However, in NT you can't have a person aged over 16 years who's not fully vaccinated visit your place of residence, except in limited circumstances.    http://web.archive.org/web/20211105145855/https://www.healthdirect.gov.au/covid19-restriction-checker/gatherings-and-work/nsw"
"6","Australia","AUS",2021-12-07,"East_Asia_Pacific","C5: Close public transport","1T","1T","No new policy. Continuing policy is in place where from Monday 1 November, COVIDSafe capacity on all modes in NSW will increase from 50 per cent to around 75 per cent with an increase in service capacities. More green physical distancing dots will be rolled out across the network, allowing you to choose the best places to sit and stand on all modes. Other regions (ex. Victoria) have returned to full capacity after passing 80% of vaccinated 29 Oct.     https://web.archive.org/web/20211102095556/https://transportnsw.info/covid-19/covid-19-safer-travel-guidance  https://web.archive.org/web/20211214171205/https://transportsafety.vic.gov.au/bus-safety/newsroom/bus-industry-covid"
"7","Australia","AUS",2021-12-07,"East_Asia_Pacific","C6: Stay at home requirements","0","2T","From 14 Dec lockouts and lockdowns in NT have ended.     https://web.archive.org/web/20211214155411/https://transportnsw.info/covid-19/covid-19-safer-travel-guidance  https://web.archive.org/web/20211214155551/https://www.qld.gov.au/health/conditions/health-alerts/coronavirus-covid-19/current-status/public-health-directions/travelling-to-queensland  https://web.archive.org/web/20211214163831/https://au.usembassy.gov/covid-19-information/"
"8","Australia","AUS",2021-12-07,"East_Asia_Pacific","C7: Restrictions on internal movement","2T","2T","From 14 Dec lockouts and lockdowns in NT have ended. Continuing policy in limited regions has canceled public transit routes or limited travel for essential work and essential purposes ex. within the Queensland/New South Wales border zone. The Queensland Government declared parts of NSW a hotspot. Anyone who has been to a hotspot in the last 14 days will not be allowed to enter Queensland, unless they are a Queensland resident or have an exemption.     https://web.archive.org/web/20211214155411/https://transportnsw.info/covid-19/covid-19-safer-travel-guidance  https://web.archive.org/web/20211214155551/https://www.qld.gov.au/health/conditions/health-alerts/coronavirus-covid-19/current-status/public-health-directions/travelling-to-queensland  https://web.archive.org/web/20211214163831/https://au.usembassy.gov/covid-19-information/"
"9","Australia","AUS",2021-12-07,"East_Asia_Pacific","C8: International travel controls","3","3","Continuing from 27 November anyone who is not a citizen or permanent resident of Australia, or their immediate family including parents of citizens, and who have been in African countries where the Omicron variant has been detected and spread – within the past 14 days – will not be able to enter Australia.  The countries are: South Africa, Namibia, Zimbabwe, Botswana, Lesotho, Eswatini, Seychelles, Malawi and Mozambique.      https://web.archive.org/web/20211206202731/https://au.usembassy.gov/covid-19-information  https://web.archive.org/web/20211206204246/https://www.health.gov.au/ministers/the-hon-greg-hunt-mp/media/additional-border-security-measures-to-protect-australians-from-the-new-omicron-covid-19-variant    Note for future: On 15 December AUS plans to reopen the borders for students and skilled labour on 15 December.  https://web.archive.org/web/20211214154554/https://www.health.gov.au/ministers/the-hon-greg-hunt-mp/media/melbourne-press-conference-on-13-december-2021-on-international-border-reopening-telehealth-and-omicron-variant"
"10","Australia","AUS",2021-12-07,"East_Asia_Pacific","E1: Income support","0","0","https://web.archive.org/web/20211214153520/https://www.servicesaustralia.gov.au/covid-19-disaster-payment"
"11","Australia","AUS",2021-12-07,"East_Asia_Pacific","E2: Debt/contract relief","0","0","https://web.archive.org/web/20211214153520/https://www.servicesaustralia.gov.au/covid-19-disaster-payment"
"12","Australia","AUS",2021-12-07,"East_Asia_Pacific","H1: Public information campaigns","2G","2G","No new policy. Central websites remain updated and informative on best practices and current rules.   https://web.archive.org/web/20211105151607/https://www.health.gov.au/news/health-alerts/novel-coronavirus-2019-ncov-health-aler  https://web.archive.org/web/20211007134226/https://www.health.gov.au/news/health-alerts/novel-coronavirus-2019-ncov-health-alert/coronavirus-covid-19-case-numbers-and-statistics"
"13","Australia","AUS",2021-12-15,"East_Asia_Pacific","H1: Public information campaigns","2G","2G","No new policy. Central websites remain updated and informative on best practices and current rules.   https://web.archive.org/web/20211105151607/https://www.health.gov.au/news/health-alerts/novel-coronavirus-2019-ncov-health-aler  https://web.archive.org/web/20211007134226/https://www.health.gov.au/news/health-alerts/novel-coronavirus-2019-ncov-health-alert/coronavirus-covid-19-case-numbers-and-statistics"
"14","Australia","AUS",2021-12-07,"East_Asia_Pacific","H2: Testing policy","2","2","No new policy. Anyone with even mild symptoms is encouraged to get tested.   https://web.archive.org/web/20211105151738/https://www.health.gov.au/news/health-alerts/novel-coronavirus-2019-ncov-health-alert/ongoing-support-during-coronavirus-covid-19/what-you-need-to-know-about-coronavirus-covid-19"
"15","Australia","AUS",2021-12-15,"East_Asia_Pacific","H2: Testing policy","2","2","No new policy. Anyone with even mild symptoms is encouraged to get tested.   https://web.archive.org/web/20211105151738/https://www.health.gov.au/news/health-alerts/novel-coronavirus-2019-ncov-health-alert/ongoing-support-during-coronavirus-covid-19/what-you-need-to-know-about-coronavirus-covid-19"
"16","Australia","AUS",2021-12-07,"East_Asia_Pacific","H3: Contact tracing","2","2","No new policy. Continuing from 26 April 2020 government contact tracers and regular citizens enter data into an integrated app COVIDSafe.   https://web.archive.org/web/20210921075506/https://www.covidsafe.gov.au/technology.html  https://web.archive.org/web/20210924162834/https://www.health.gov.au/news/health-alerts/novel-coronavirus-2019-ncov-health-alert/coronavirus-covid-19-case-numbers-and-statistics"
"17","Australia","AUS",2021-12-15,"East_Asia_Pacific","H3: Contact tracing","2","2","No new policy. Continuing from 26 April 2020 government contact tracers and regular citizens enter data into an integrated app COVIDSafe.   https://web.archive.org/web/20210921075506/https://www.covidsafe.gov.au/technology.html  https://web.archive.org/web/20210924162834/https://www.health.gov.au/news/health-alerts/novel-coronavirus-2019-ncov-health-alert/coronavirus-covid-19-case-numbers-and-statistics"
"18","Australia","AUS",2021-12-07,"East_Asia_Pacific","H6: Facial Coverings","3T","4T","Lockouts and lockdowns have ended (from 21 November) but many in the NT require everyone to wear a mask outside of their home. Note by 17 December this rule will be lifted for eleven NT communities.     https://web.archive.org/web/20211214165907/https://www.healthdirect.gov.au/covid19-restriction-checker/face-masks/nt"
"19","Australia","AUS",2021-12-07,"East_Asia_Pacific","H7: Vaccination policy","5G","5G","No new policies. Continuing from 13 September everyone in Australia aged 12 years and over is eligible for a free COVID-19 vaccination.   https://web.archive.org/web/20211004191741/https://www.health.gov.au/initiatives-and-programs/covid-19-vaccines/who-can-get-vaccinated"
"20","Australia","AUS",2021-12-15,"East_Asia_Pacific","H7: Vaccination policy","5G","5G","No new policies. Continuing from 13 September everyone in Australia aged 12 years and over is eligible for a free COVID-19 vaccination.   https://web.archive.org/web/20211004191741/https://www.health.gov.au/initiatives-and-programs/covid-19-vaccines/who-can-get-vaccinated"
"21","Australia","AUS",2021-12-07,"East_Asia_Pacific","H8: Protection of elderly people","1G","1G","No new policies. National policy outlines recommended guidelines to protect the elderly along a three tiered system. The visitation restrictions and guidelines for residential aged care facilities follow social distancing, vaccination and COVID screening norms.    https://web.archive.org/web/20210415104420/https://www.health.gov.au/sites/default/files/documents/2020/11/coronavirus-covid-19-national-aged-care-guidance-escalation-tiers-and-aged-care-provider-responses.pdf    https://web.archive.org/web/20211021011733/https://www.health.gov.au/node/18602/coronavirus-covid-19-advice-for-people-in-residential-aged-care-facilities-and-visitors"
"22","Australia","AUS",2021-12-15,"East_Asia_Pacific","H8: Protection of elderly people","1G","1G","No new policies. National policy outlines recommended guidelines to protect the elderly along a three tiered system. The visitation restrictions and guidelines for residential aged care facilities follow social distancing, vaccination and COVID screening norms.    https://web.archive.org/web/20210415104420/https://www.health.gov.au/sites/default/files/documents/2020/11/coronavirus-covid-19-national-aged-care-guidance-escalation-tiers-and-aged-care-provider-responses.pdf    https://web.archive.org/web/20211021011733/https://www.health.gov.au/node/18602/coronavirus-covid-19-advice-for-people-in-residential-aged-care-facilities-and-visitors"
"23","Australia","AUS",2021-12-15,"East_Asia_Pacific","V1: Vaccine Prioritisation","-3","-3","No new policy. Continued from 13 September 2021, everyone in Australia aged 12 years and over is eligible for a free COVID-19 vaccination.     It appears that starting on the 8th of November people over 18 will be eligible for a booster shot (6 months after their completion of the second dosis).    https://web.archive.org/web/20211201170746/https://www.health.gov.au/initiatives-and-programs/covid-19-vaccines/getting-your-vaccination/booster-doses    https://web.archive.org/web/20210916120513/https://www.health.gov.au/initiatives-and-programs/covid-19-vaccines/getting-vaccinated-for-covid-19/when-will-i-get-a-covid-19-vaccine    https://web.archive.org/web/20211004191741/https://www.health.gov.au/initiatives-and-programs/covid-19-vaccines/who-can-get-vaccinated"
"24","Australia","AUS",2021-12-07,"East_Asia_Pacific","V2: Vaccine Availability","13831","12725","No new policy. Continuing from 13 September 2021, everyone in Australia aged 12 years and over is eligible for a free COVID-19 vaccination.     It appears that starting on the 8th of November people over 18 will be eligible for a booster shot (6 months after their completion of the second dosis).    https://web.archive.org/web/20211201170746/https://www.health.gov.au/initiatives-and-programs/covid-19-vaccines/getting-your-vaccination/booster-doses    https://web.archive.org/web/20210916120513/https://www.health.gov.au/initiatives-and-programs/covid-19-vaccines/getting-vaccinated-for-covid-19/when-will-i-get-a-covid-19-vaccine    https://web.archive.org/web/20211004191741/https://www.health.gov.au/initiatives-and-programs/covid-19-vaccines/who-can-get-vaccinated"
"25","Australia","AUS",2021-12-15,"East_Asia_Pacific","V2: Vaccine Availability","15634","13831","No new policy. Continuing from 13 September 2021, everyone in Australia aged 12 years and over is eligible for a free COVID-19 vaccination.     It appears that starting on the 8th of November people over 18 will be eligible for a booster shot (6 months after their completion of the second dosis).    https://web.archive.org/web/20211201170746/https://www.health.gov.au/initiatives-and-programs/covid-19-vaccines/getting-your-vaccination/booster-doses    https://web.archive.org/web/20210916120513/https://www.health.gov.au/initiatives-and-programs/covid-19-vaccines/getting-vaccinated-for-covid-19/when-will-i-get-a-covid-19-vaccine    https://web.archive.org/web/20211004191741/https://www.health.gov.au/initiatives-and-programs/covid-19-vaccines/who-can-get-vaccinated"
"26","Australia","AUS",2021-12-07,"East_Asia_Pacific","V3: Vaccine Financial Support","13831","12725","No new policy. Continuing the COVID-19 vaccine is free for everyone in Australia. Vaccination providers cannot charge you for the COVID-19 vaccine or your appointments to receive the vaccine.    If your vaccination provider charges for any costs associated with the administration of the COVID-19 vaccination (including booking fees), you should:    contact us by emailing provider.benefits.integrity@health.gov.au,  or call the Provider Benefits Integrity Hotline on 1800 314 808 (9am to 5pm AEST weekdays).    https://web.archive.org/web/20210423124712/https://www.health.gov.au/initiatives-and-programs/covid-19-vaccines/getting-vaccinated-for-covid-19"
"27","Australia","AUS",2021-12-15,"East_Asia_Pacific","V3: Vaccine Financial Support","15634","13831","No new policy. Continuing the COVID-19 vaccine is free for everyone in Australia. Vaccination providers cannot charge you for the COVID-19 vaccine or your appointments to receive the vaccine.    If your vaccination provider charges for any costs associated with the administration of the COVID-19 vaccination (including booking fees), you should:    contact us by emailing provider.benefits.integrity@health.gov.au,  or call the Provider Benefits Integrity Hotline on 1800 314 808 (9am to 5pm AEST weekdays).    https://web.archive.org/web/20210423124712/https://www.health.gov.au/initiatives-and-programs/covid-19-vaccines/getting-vaccinated-for-covid-19"
"28","Brunei","BRN",2021-12-07,"East_Asia_Pacific","C1: School closing","3G","3G","In-person learning will restart on January 3, 2022 for students under the Ministry of Education and Ministry of Religious Affairs.    https://archive.vn/uA4rP#selection-1681.0-1681.129"
"29","Brunei","BRN",2021-12-14,"East_Asia_Pacific","C1: School closing","3G","3G","No changes. In-person learning will restart on January 3, 2022 for Bruneian students.    On 07 August, Brunei detected its first local Covid-19 cases in over a year, all of which were unlinked to previously-known imported cases. Hence, Brunei has decided to tighten Covid measures, including instituting the closure of schools.    Per the press release of 07 Aug by the Ministry of Health,    ""With the consent of His Majesty the Sultan and Yang Di-Pertuan of Brunei Darussalam, it is hereby announced that the following control measures are reinstated for two weeks with immediate effect:    ...    3. Online learning will commenced for schools, other educational institutions, tuition classes, music classes and special needs classes.""    Although it is initially unclear whether this directive applies to universities, Universiti Brunei Darussalam, the country's largest university, instituted Covid-19 shutdown measures on 9th August.    See the Ministry of Health's press release, archived at https://archive.vn/C5fBL  See Universiti Brunei Darussalam (UBD)'s Covid-19 update page, archived at https://archive.vn/MKajg  See the Scoop's report, archived at https://archive.vn/uA4rP#selection-1681.0-1681.129"
"30","Brunei","BRN",2021-12-20,"East_Asia_Pacific","C1: School closing","3G","3G","No changes. In-person learning will restart on January 3, 2022 for Bruneian students.    On 07 August, Brunei detected its first local Covid-19 cases in over a year, all of which were unlinked to previously-known imported cases. Hence, Brunei has decided to tighten Covid measures, including instituting the closure of schools.    Per the press release of 07 Aug by the Ministry of Health,    ""With the consent of His Majesty the Sultan and Yang Di-Pertuan of Brunei Darussalam, it is hereby announced that the following control measures are reinstated for two weeks with immediate effect:    ...    3. Online learning will commenced for schools, other educational institutions, tuition classes, music classes and special needs classes.""    Although it is initially unclear whether this directive applies to universities, Universiti Brunei Darussalam, the country's largest university, instituted Covid-19 shutdown measures on 9th August.    See the Ministry of Health's press release, archived at https://archive.vn/C5fBL  See Universiti Brunei Darussalam (UBD)'s Covid-19 update page, archived at https://archive.vn/MKajg  See the Scoop's report, archived at https://archive.vn/uA4rP#selection-1681.0-1681.129"
"31","Brunei","BRN",2021-12-07,"East_Asia_Pacific","C2: Workplace closing","1G","3G","Business premises, including workplaces and dine-in services, may open at 50-percent capacity up to a maximum of 200 people until Dec 14. The capacity will be increased to 75-percent up to a maximum of 300 people starting Dec 15.    https://web.archive.org/web/20211211031242/https:/www.garda.com/crisis24/news-alerts/550471/brunei-authorities-extend-ongoing-covid-19-restrictions-and-curfew-measures-through-dec-14-update-34  https://archive.vn/uA4rP"
"32","Brunei","BRN",2021-12-14,"East_Asia_Pacific","C2: Workplace closing","1G","1G","Business premises, including workplaces and dine-in services, may open at 50-percent capacity up to a maximum of 200 people until Dec 14. The capacity will be increased to 75-percent up to a maximum of 300 people starting Dec 15.    https://web.archive.org/web/20211211031242/https:/www.garda.com/crisis24/news-alerts/550471/brunei-authorities-extend-ongoing-covid-19-restrictions-and-curfew-measures-through-dec-14-update-34  https://archive.vn/uA4rP"
"33","Brunei","BRN",2021-12-15,"East_Asia_Pacific","C2: Workplace closing","1G","1G","Business premises can operate to 75 percent or 300-people capacity, whichever is smaller, from 15 December.    ""From Wednesday, all people, regardless of vaccination status, will be allowed to enter public premises or attend public events.  However, unvaccinated individuals are required to undergo ART testing at accredited ART Centres. Each test result is valid for two days.  Children under 18 who are unvaccinated or partially vaccinated will be allowed to enter premises without the need for ART testing, provided that they are accompanied by a fully vaccinated adult.  Business and public premises will be allowed to hold 75 percent of their capacity, but not more than 300 people. The rule applies to:         Restaurants, cafés, food courts, markets and food stalls, cinemas, arcades, indoor playgrounds, beauty establishments, and music schools.      All indoor and outdoor sports, fitness and recreational facilities. (Only training is allowed, no sports competitions.)        Museums, galleries, libraries and senior citizens centres. (Opening hours are restricted to 8am-2pm.)       Government offices and service counters. ""    Additionally, the civil service will return to normal in-person working and standard working hours.  ""In the early endemic phase, civil servants will fully return to the office and normal working hours will be reinstated from 7.45am to 12.15pm and from 1.30pm to 4.30pm.""    The Scoop's report, archived at https://archive.vn/uA4rP#selection-1561.0-1627.41"
"34","Brunei","BRN",2021-12-20,"East_Asia_Pacific","C2: Workplace closing","1G","1G","No change.    Business premises can operate to 75 percent or 300-people capacity, whichever is smaller, from 15 December.    ""From Wednesday, all people, regardless of vaccination status, will be allowed to enter public premises or attend public events.  However, unvaccinated individuals are required to undergo ART testing at accredited ART Centres. Each test result is valid for two days.  Children under 18 who are unvaccinated or partially vaccinated will be allowed to enter premises without the need for ART testing, provided that they are accompanied by a fully vaccinated adult.  Business and public premises will be allowed to hold 75 percent of their capacity, but not more than 300 people. The rule applies to:         Restaurants, cafés, food courts, markets and food stalls, cinemas, arcades, indoor playgrounds, beauty establishments, and music schools.      All indoor and outdoor sports, fitness and recreational facilities. (Only training is allowed, no sports competitions.)        Museums, galleries, libraries and senior citizens centres. (Opening hours are restricted to 8am-2pm.)       Government offices and service counters. ""    Additionally, the civil service will return to normal in-person working and standard working hours.  ""In the early endemic phase, civil servants will fully return to the office and normal working hours will be reinstated from 7.45am to 12.15pm and from 1.30pm to 4.30pm.""    The Scoop's report, archived at https://archive.vn/uA4rP#selection-1561.0-1627.41"
"35","Brunei","BRN",2021-12-07,"East_Asia_Pacific","C3: Cancel public events","2G","2G","Indoor gatherings are restricted to 30 people. Public events are cancelled.    https://web.archive.org/web/20211211031242/https:/www.garda.com/crisis24/news-alerts/550471/brunei-authorities-extend-ongoing-covid-19-restrictions-and-curfew-measures-through-dec-14-update-34"
"36","Brunei","BRN",2021-12-14,"East_Asia_Pacific","C3: Cancel public events","2G","2G","Indoor gatherings are restricted to 30 people. Public events are cancelled.    https://web.archive.org/web/20211211031242/https:/www.garda.com/crisis24/news-alerts/550471/brunei-authorities-extend-ongoing-covid-19-restrictions-and-curfew-measures-through-dec-14-update-34"
