"","CountryName","CountryCode","Date","region","PolicyType","PolicyCode","previous_PolicyCode","Notes"
"1","Burkina Faso","BFA",2022-05-10,"sub_Saharan_Africa","C1: School closing","0","0","Schools are fully open  https://web.archive.org/web/20220606203053/https://en.unesco.org/covid19/educationresponse"
"2","Burkina Faso","BFA",2022-05-10,"sub_Saharan_Africa","C2: Workplace closing","0","0","No workplace closures mentioned  https://web.archive.org/web/20220606203451/https://bf.usembassy.gov/u-s-citizen-services/covid-19-information/  https://web.archive.org/web/20220606204913/https://www.gov.uk/foreign-travel-advice/burkina-faso/coronavirus"
"3","Burkina Faso","BFA",2022-05-10,"sub_Saharan_Africa","C3: Cancel public events","0","0","No restrictions on public events mentioned  https://web.archive.org/web/20220606203451/https://bf.usembassy.gov/u-s-citizen-services/covid-19-information/  https://web.archive.org/web/20220606204913/https://www.gov.uk/foreign-travel-advice/burkina-faso/coronavirus"
"4","Burkina Faso","BFA",2022-05-10,"sub_Saharan_Africa","C4: Restrictions on gatherings","0","0","No restrictions on gatherings mentioned  https://web.archive.org/web/20220606203451/https://bf.usembassy.gov/u-s-citizen-services/covid-19-information/  https://web.archive.org/web/20220606204913/https://www.gov.uk/foreign-travel-advice/burkina-faso/coronavirus"
"5","Burkina Faso","BFA",2022-05-10,"sub_Saharan_Africa","C5: Close public transport","0","0","Public transport is operating as usual  https://web.archive.org/web/20220606203451/https://bf.usembassy.gov/u-s-citizen-services/covid-19-information/"
"6","Burkina Faso","BFA",2022-05-10,"sub_Saharan_Africa","C6: Stay at home requirements","0","0","There is no curfew in place  https://web.archive.org/web/20220606203451/https://bf.usembassy.gov/u-s-citizen-services/covid-19-information/"
"7","Burkina Faso","BFA",2022-05-10,"sub_Saharan_Africa","C7: Restrictions on internal movement","0","0","There is no curfew in place  https://web.archive.org/web/20220606203451/https://bf.usembassy.gov/u-s-citizen-services/covid-19-information/"
"8","Burkina Faso","BFA",2022-05-10,"sub_Saharan_Africa","C8: International travel controls","1","1","A negative test is required for everyone regardless of vaccination status  https://web.archive.org/web/20220606203451/https://bf.usembassy.gov/u-s-citizen-services/covid-19-information/"
"9","Burkina Faso","BFA",2022-05-10,"sub_Saharan_Africa","E1: Income support","0","0","https://web.archive.org/web/20220606210036/https://www.imf.org/en/Topics/imf-and-covid19/Policy-Responses-to-COVID-19    no updated financial policy"
"10","Burkina Faso","BFA",2022-05-10,"sub_Saharan_Africa","E2: Debt/contract relief","0","0","https://web.archive.org/web/20220606210036/https://www.imf.org/en/Topics/imf-and-covid19/Policy-Responses-to-COVID-19    no updated financial policy"
"11","Burkina Faso","BFA",2022-05-10,"sub_Saharan_Africa","H1: Public information campaigns","2G","2G","There is a coordinated public health campaign  https://archive.ph/RXlBQ"
"12","Burkina Faso","BFA",2022-05-10,"sub_Saharan_Africa","H2: Testing policy","3","3","Testing is generally available to all  https://web.archive.org/web/20220606203451/https://bf.usembassy.gov/u-s-citizen-services/covid-19-information/"
"13","Burkina Faso","BFA",2022-05-10,"sub_Saharan_Africa","H3: Contact tracing","0","0","No mention of contact tracing  https://archive.ph/RXlBQ"
"14","Burkina Faso","BFA",2022-05-10,"sub_Saharan_Africa","H6: Facial Coverings","3G","3G","Face masks are mandatory in public  https://web.archive.org/web/20220606204913/https://www.gov.uk/foreign-travel-advice/burkina-faso/coronavirus"
"15","Burkina Faso","BFA",2022-05-10,"sub_Saharan_Africa","H7: Vaccination policy","5G","5G","Vaccination is available generally to all  https://web.archive.org/web/20220606203451/https://bf.usembassy.gov/u-s-citizen-services/covid-19-information/"
"16","Burkina Faso","BFA",2022-05-10,"sub_Saharan_Africa","H8: Protection of elderly people","0","0","No discussion of special protections for elderly people  https://archive.ph/RXlBQ"
"17","Botswana","BWA",2022-05-10,"sub_Saharan_Africa","C1: School closing","0","0","31 May 2022    Schools are fully open.  https://web.archive.org/web/20220531052933/https://en.unesco.org/covid19/educationresponse"
"18","Botswana","BWA",2022-05-10,"sub_Saharan_Africa","C2: Workplace closing","0","0","31 May 2022    -Gatherings included funerals, weddings, business meetings, and workshops, are permitted with continued safety protocols:  wearing of masks, social distancing, and the use of hand sanitizers when regular hand-washing is impossible.  -Restaurants have resumed operates at full capacity as permitted by their trading licenses.  https://web.archive.org/web/20220531060532/https://bw.usembassy.gov/covid-19-information/"
"19","Botswana","BWA",2022-05-10,"sub_Saharan_Africa","C3: Cancel public events","0","0","31 May 2022    -Gatherings included funerals, weddings, business meetings, and workshops, are permitted with continued safety protocols:  wearing of masks, social distancing, and the use of hand sanitizers when regular hand-washing is impossible.  -Restaurants have resumed operates at full capacity as permitted by their trading licenses.  https://web.archive.org/web/20220531060532/https://bw.usembassy.gov/covid-19-information/"
"20","Botswana","BWA",2022-05-10,"sub_Saharan_Africa","C4: Restrictions on gatherings","0","0","31 May 2022    -Gatherings included funerals, weddings, business meetings, and workshops, are permitted with continued safety protocols:  wearing of masks, social distancing, and the use of hand sanitizers when regular hand-washing is impossible.  -Restaurants have resumed operates at full capacity as permitted by their trading licenses.  https://web.archive.org/web/20220531060532/https://bw.usembassy.gov/covid-19-information/"
"21","Botswana","BWA",2022-05-10,"sub_Saharan_Africa","C5: Close public transport","0","0","31 May 2022    Transportation Options  -Are commercial flights operating??? Yes.  -Is public transportation operating??? Yes.  https://web.archive.org/web/20220531060532/https://bw.usembassy.gov/covid-19-information/"
"22","Botswana","BWA",2022-05-10,"sub_Saharan_Africa","C6: Stay at home requirements","0","0","31 May 2022    Movement Restrictions  Is a curfew in place?  No.  https://web.archive.org/web/20220531060532/https://bw.usembassy.gov/covid-19-information/"
"23","Botswana","BWA",2022-05-10,"sub_Saharan_Africa","C7: Restrictions on internal movement","0","0","31 May 2022    Movement Restrictions  -Are there restrictions on intercity or interstate travel?? No.  https://web.archive.org/web/20220531060532/https://bw.usembassy.gov/covid-19-information/"
"24","Botswana","BWA",2022-05-10,"sub_Saharan_Africa","C8: International travel controls","1","1","31 May 2022    Entry and Exit Requirements  -Is a negative COVID-19 test (PCR and/or serology) required for entry? Fully vaccinated travelers are not required to provide proof of a negative COVID-19 test.  Others are required to show proof of a negative PCR COVID-19 test within 72 hours of travel.  -Are health screening procedures in place at airports and other ports of entry?? Yes.  -Travelers are granted visa-free entry for 60 days at the Port of Entry.  https://web.archive.org/web/20220531060532/https://bw.usembassy.gov/covid-19-information/    If you’re fully vaccinated:  -If you are fully vaccinated, you do not need to take a coronavirus test to travel to Botswana. You will need to present your vaccination certification during travel and on arrival.    Proof of vaccination status  -Botswana accepts both the UK’s proof of COVID-19 vaccination record and proof of COVID-19 vaccination issued in the Crown Dependencies. Your final vaccine dose must have been administered at least 14 days prior to travel. Your NHS appointment card from vaccination centres is not designed to be used as proof of vaccination and should not be used to demonstrate your vaccine status    If you’re not fully vaccinated:  -Unvaccinated people must present proof of a negative COVID-19 PCR test, which was obtained not more than 72 hours before the date of travel. You may also be asked to undertake an additional PCR test at the port of entry at your own cost. If the test is positive, you will be permitted to isolate within the district of the port of entry at your own cost.  -People who refuse to be subject to the above provisions are liable to a fine, imprisonment or both.  https://web.archive.org/web/20220531060617/https://www.gov.uk/foreign-travel-advice/botswana/coronavirus"
"25","Botswana","BWA",2022-05-10,"sub_Saharan_Africa","E1: Income support","0","0","31 May 2022    No policy found.  https://web.archive.org/web/20220531055455/https://www.imf.org/en/Topics/imf-and-covid19/Policy-Responses-to-COVID-19"
"26","Botswana","BWA",2022-05-10,"sub_Saharan_Africa","E2: Debt/contract relief","0","0","31 May 2022    No policy found.  https://web.archive.org/web/20220531055455/https://www.imf.org/en/Topics/imf-and-covid19/Policy-Responses-to-COVID-19"
"27","Botswana","BWA",2022-05-10,"sub_Saharan_Africa","H1: Public information campaigns","2G","2G","31 May 2022    Botswana maintains a government website and includes COVID-19 updates.  https://web.archive.org/web/20220531060108/https://cms1.gov.bw/"
"28","Botswana","BWA",2022-05-10,"sub_Saharan_Africa","H2: Testing policy","3","3","31 May 2022    COVID-19 Testing  -Are test results reliably available within one calendar day? Yes.  Same-day test results are widely available through private clinics such as Diagnofirm.  Cost for testing at Diagnofirm is 750 BWP (~65 USD).  The costs are borne by the individual being tested; payment can be made by cash or credit card.   -Test results are normally provided by email, text message, and hardcopy.  https://web.archive.org/web/20220531060532/https://bw.usembassy.gov/covid-19-information/"
"29","Botswana","BWA",2022-05-10,"sub_Saharan_Africa","H3: Contact tracing","0","0","31 May 2022    No policies found.  https://web.archive.org/web/20220531060108/https://cms1.gov.bw/"
"30","Botswana","BWA",2022-05-10,"sub_Saharan_Africa","H6: Facial Coverings","2G","2G","31 May 2022    -Gatherings included funerals, weddings, business meetings, and workshops, are permitted with continued safety protocols:  wearing of masks, social distancing, and the use of hand sanitizers when regular hand-washing is impossible.  https://web.archive.org/web/20220531060532/https://bw.usembassy.gov/covid-19-information/    Public spaces and services  -The majority of shops, banks and restaurants continue to operate, with precautionary measures in place including the compulsory wearing of face coverings.  https://web.archive.org/web/20220531060617/https://www.gov.uk/foreign-travel-advice/botswana/coronavirus"
"31","Botswana","BWA",2022-05-10,"sub_Saharan_Africa","H7: Vaccination policy","5G","5G","31 May 2022    COVID-19 vaccines if you live in Botswana  -The Botswana national vaccination programme started in March 2021 and is using the AstraZeneca, Covaxin, Jansen (Johnson & Johnson), Moderna, Pfizer-BioNTech and Sinovac vaccines. British nationals resident in Botswana are eligible for vaccination if they choose to join the programme. The Government of Botswana is delivering a categorised roll out of COVID-19 vaccines and boosters. Citizens and residents are advised to self-register using the Republic of Botswana’s COVID-19 vaccination Self-Registration website. For further information on the vaccines used in Botswana, and their regulatory status, you should keep in touch with your local medical provider and see the website of the Botswana Medicines Regulatory Authority.  https://web.archive.org/web/20220531060617/https://www.gov.uk/foreign-travel-advice/botswana/coronavirus    COVID-19 Vaccine Information:  -Has the government of Botswana approved a COVID-19 vaccine for use???Yes, multiple vaccines are available for citizens and non-citizens alike.  -Which vaccines are available in Botswana?   Both FDA-approved and WHO Emergency Use-listed vaccines are available.  https://web.archive.org/web/20220531060532/https://bw.usembassy.gov/covid-19-information/"
"32","Botswana","BWA",2022-05-10,"sub_Saharan_Africa","H8: Protection of elderly people","0","0","31 May 2022    No new policies found.  https://web.archive.org/web/20220531060108/https://cms1.gov.bw/"
"33","Cote d'Ivoire","CIV",2022-05-07,"sub_Saharan_Africa","C1: School closing","0","0","17 May 2022  Primary and secondary schools, as well as universities, are open.  https://web.archive.org/web/20220517041829/https://ci.usembassy.gov/covid-19-information/"
"34","Cameroon","CMR",2022-05-18,"sub_Saharan_Africa","C1: School closing","0","0","Most schools are open and maintain normal hours    Archived webpage: https://web.archive.org/web/20220517032128/https://cm.usembassy.gov/covid-19-information/"
"35","Cameroon","CMR",2022-05-18,"sub_Saharan_Africa","C2: Workplace closing","0","0","Businesses, churches, government offices, and most schools are open and maintain normal hours.    Archived webpage: https://web.archive.org/web/20220517032128/https://cm.usembassy.gov/covid-19-information/"
"36","Cameroon","CMR",2022-05-18,"sub_Saharan_Africa","C3: Cancel public events","1G","1G","Restriction on the number of people that can gather will affect public events.    https://web.archive.org/web/20220517041836/https://www.gov.uk/foreign-travel-advice/cameroon/coronavirus"
"37","Cameroon","CMR",2022-05-18,"sub_Saharan_Africa","C4: Restrictions on gatherings","3G","3G","Gatherings of over 50 people are prohibited.    https://web.archive.org/web/20220517041836/https://www.gov.uk/foreign-travel-advice/cameroon/coronavirus"
"38","Cameroon","CMR",2022-05-18,"sub_Saharan_Africa","C5: Close public transport","0","0","Public transportation is operating.    Archived webpage: https://web.archive.org/web/20220517032128/https://cm.usembassy.gov/covid-19-information/"
"39","Cameroon","CMR",2022-05-18,"sub_Saharan_Africa","C6: Stay at home requirements","0","0","There is no curfew in place.    Archived webpage: https://web.archive.org/web/20220517032128/https://cm.usembassy.gov/covid-19-information/"
"40","Cameroon","CMR",2022-05-18,"sub_Saharan_Africa","C7: Restrictions on internal movement","0","0","There is no restiction on interstate or intercity travel    Archived webpage: https://web.archive.org/web/20220517032128/https://cm.usembassy.gov/covid-19-information/"
"41","Cameroon","CMR",2022-05-18,"sub_Saharan_Africa","C8: International travel controls","1","1","Sampling and screening at Points of Entry (PoE)  Travelers, whether arriving or departing from Cameroonian territory, are subject to the requirements for presenting results or screening for COVID-19. The results are presented at the various entry points in one of the official languages ??of Cameroon, namely French or English.    Case of travelers entering Cameroonian territory    All incoming travellers, aged 5 and over, are systematically tested at the Border Health Posts (PSF). Screening at the borders responds to the screening strategies defined by the country. Screening is done using a validated rapid diagnostic test:    if the RDT is positive, the case is considered positive and a second sample will be taken for genomic sequencing (genomic surveillance)  If the RDT is negative, but the case is symptomatic (therefore a suspected case); the patient is taken again for a PCR test.  All confirmed cases must be registered in a linear list and transferred to approved treatment centers. All travelers who test negative are allowed to continue their itinerary.    Case of travelers leaving Cameroonian territory    The latter must present a negative COVID-19 PCR test less than 3 days old or a negative RDT, depending on the requirements of the country of arrival or transit.    Archived webpage: https://web.archive.org/web/20220517042349/https://www.ccousp.cm/urgences-sanitaires/covid-19/condition-dentree-et-sortie-au-cameroun/"
"42","Cameroon","CMR",2022-05-18,"sub_Saharan_Africa","E1: Income support","0","0","No new policy update"
"43","Cameroon","CMR",2022-05-18,"sub_Saharan_Africa","E2: Debt/contract relief","0","0","No new policy update"
"44","Cameroon","CMR",2022-05-18,"sub_Saharan_Africa","H1: Public information campaigns","2G","2G","There is coordinated campaign through various media including websites, social media handles and toll free numbers.    Archived website: https://web.archive.org/web/20220517043408/https://www.facebook.com/photo/?fbid=358956042931408&set=pcb.358956099598069"
"45","Cameroon","CMR",2022-05-18,"sub_Saharan_Africa","H2: Testing policy","2","2","PCR and/or antigen tests are available with results ready in 24 hours.    Archived webpage: https://web.archive.org/web/20220517032128/https://cm.usembassy.gov/covid-19-information/"
"46","Cameroon","CMR",2022-05-18,"sub_Saharan_Africa","H3: Contact tracing","2","2","Investigation and listing of positive or suspected symptomatic cases at PoE  All passengers who test positive and those taken for PCR should be investigated. The investigation of each case must make it possible to:    collect individual case information;  retrace his itinerary during the last 14 (fourteen) days in search of exposure factors;  list the contacts through a mapping (community pathways, from the appearance of the signs, starting with the family, the different places, the people visited or who visited the patient, seeking care, worship, public transport, restaurant , co-workers, ceremonies, in the means of transport and at the point of entry).    Archived webpage: https://web.archive.org/web/20220517042349/https://www.ccousp.cm/urgences-sanitaires/covid-19/condition-dentree-et-sortie-au-cameroun/"
"47","Cameroon","CMR",2022-05-18,"sub_Saharan_Africa","H6: Facial Coverings","3G","3G","Mask wearing is mandatory on all public transportation. Anyone not wearing a mask in public can potentially be fined 6,000 CFA (about $11).    Archived webpage: https://web.archive.org/web/20220517032128/https://cm.usembassy.gov/covid-19-information/"
"48","Cameroon","CMR",2022-05-18,"sub_Saharan_Africa","H7: Vaccination policy","5G","5G","The Cameroon national vaccination programme started in April 2021 and is using the AstraZeneca, Johnson & Johnson, Pfizer BioNTech and Sinopharm vaccines. The Government of Cameroon has stated that British nationals resident in Cameroon are eligible for vaccination.    https://web.archive.org/web/20220517041836/https://www.gov.uk/foreign-travel-advice/cameroon/coronavirus"
"49","Cameroon","CMR",2022-05-18,"sub_Saharan_Africa","H8: Protection of elderly people","0","0","No new policy"
"50","Democratic Republic of Congo","COD",2022-05-10,"sub_Saharan_Africa","C8: International travel controls","2","1","Unvaccinated travelers must quarantine until receiving test results on arrival.  Fully vaccinated travelers are exempted from Quarantine.  https://archive.vn/m9iDe"
"51","Congo","COG",2022-05-09,"sub_Saharan_Africa","C1: School closing","0","0","Businesses, schools, airports, and ports are open.    Archived link: https://web.archive.org/web/20220425181735/https://cd.usembassy.gov/covid-19-information/"
"52","Congo","COG",2022-05-09,"sub_Saharan_Africa","C2: Workplace closing","1G","1G","Nightclubs and other closed and recreational spaces can now re-open. Customers must show proof of vaccination. Sports and mass activities can resume, in strict compliance with regulations.  https://web.archive.org/web/20220411212907/https://www.gov.uk/foreign-travel-advice/congo/coronavirus"
"53","Congo","COG",2022-05-09,"sub_Saharan_Africa","C3: Cancel public events","1G","1G","Sports and mass activities can resume, in strict compliance with regulations. Public gathering should not exceed 50% capacity of the venue.    Archived links: https://web.archive.org/web/20220425182720/https://www.gov.uk/foreign-travel-advice/congo/coronavirus  https://web.archive.org/web/20220425181735/https://cd.usembassy.gov/covid-19-information/"
"54","Congo","COG",2022-05-09,"sub_Saharan_Africa","C4: Restrictions on gatherings","2G","2G","The National Coordination also propose the need to present proof of vaccination attesting to the Covid-19 vaccination status in the event of a gathering of more than 100 people (vigil, worship, masses, sporting event, seminar, congress, symposium, meeting, etc.) at the end of its 35th meeting on April 5, 2022.    https://web.archive.org/web/20220411220510/https://gouvernement.cg/communique-de-la-coordination-nationale-de-gestion-de-la-pandemie-de-coronavirus-covid-19-suite-a-sa-reunion-du-mardi-05-avril-2022/"
"55","Congo","COG",2022-05-09,"sub_Saharan_Africa","C5: Close public transport","0","0","Transportation Options:  Are commercial flights operating? Yes  Is public transportation operating? Yes  Masks are required in public, including on public transportation and at all airports.    Archived link: https://web.archive.org/web/20220425181735/https://cd.usembassy.gov/covid-19-information/"
"56","Congo","COG",2022-05-09,"sub_Saharan_Africa","C6: Stay at home requirements","0","0","Movement Restrictions:  Is a curfew in place? No  Are there restrictions on intercity or interstate travel? No.    Archived link: https://web.archive.org/web/20220425181735/https://cd.usembassy.gov/covid-19-information/"
"57","Congo","COG",2022-05-09,"sub_Saharan_Africa","C7: Restrictions on internal movement","0","0","Movement Restrictions:  Is a curfew in place? No  Are there restrictions on intercity or interstate travel? No.    Archived link: https://web.archive.org/web/20220425181735/https://cd.usembassy.gov/covid-19-information/"
"58","Congo","COG",2022-05-09,"sub_Saharan_Africa","C8: International travel controls","1","1","At the end of the 35th meeting of the National Coordination for the management of the Covid -19 coronavirus pandemic on Tuesday, April 05, 2022, the need for presentation, at the border, of a negative RT-PCR test of less than 72 hours for all passengers entering Congo, with the exception of children under ten (10) years old was re-emphasised.    https://web.archive.org/web/20220411220510/https://gouvernement.cg/communique-de-la-coordination-nationale-de-gestion-de-la-pandemie-de-coronavirus-covid-19-suite-a-sa-reunion-du-mardi-05-avril-2022/"
"59","Congo","COG",2022-05-09,"sub_Saharan_Africa","E1: Income support","0","0","Although the government planned to ""strengthen the social protection system for the benefit of vulnerable populations by respecting the monthly floor of social expenditure of 30 billion FCFA (about US$50 million), prescribed in the IMF program,"" it is however not clear how this is to be achieved.    Archived websites:   https://web.archive.org/web/20220328003439/https://gouvernement.cg/communique-de-la-coordination-nationale-de-gestion-de-la-pandemie-de-coronavirus-covid-19-suite-a-sa-reunion-du-lundi-28-fevrier-2022/"
"60","Congo","COG",2022-05-09,"sub_Saharan_Africa","E2: Debt/contract relief","0","0","Although the government proposed to ""effectively mobilize in 2022 the planned envelope of 6 billion FCFA (about US$10 million), with a view to supplying the business support fund,"" the mode of implementation is however not clear.    Archived website: https://web.archive.org/web/20220328003439/https://gouvernement.cg/communique-de-la-coordination-nationale-de-gestion-de-la-pandemie-de-coronavirus-covid-19-suite-a-sa-reunion-du-lundi-28-fevrier-2022/"
"61","Congo","COG",2022-05-09,"sub_Saharan_Africa","H1: Public information campaigns","2G","2G","Information campaign is ongoing. There is a website dedicated to the dissemination of Corona related information.    Archived link: https://web.archive.org/web/20220425201355/https://www.stopcoronavirusrdc.info/"
"62","Congo","COG",2022-05-09,"sub_Saharan_Africa","H2: Testing policy","3","3","COVID-19 Testing  Are PCR tests available for U.S. citizens in DRC? Yes  If so, are test results reliably available one calendar day? Yes  COVID-19 testing is available in DRC at the traveler’s expense.    Archived link: https://web.archive.org/web/20220425181735/https://cd.usembassy.gov/covid-19-information/"
"63","Congo","COG",2022-05-09,"sub_Saharan_Africa","H3: Contact tracing","0","0","No information on contact tracing in Democratic Republic of Congo"
"64","Congo","COG",2022-05-09,"sub_Saharan_Africa","H6: Facial Coverings","3G","3G","Masks are required in public indoor and outdoor spaces.  There is a fine of 10,000 Congolese Franc for not wearing a mask.    Archived link: https://web.archive.org/web/20220425181735/https://cd.usembassy.gov/covid-19-information/"
"65","Congo","COG",2022-05-09,"sub_Saharan_Africa","H7: Vaccination policy","5G","5G","The Republic of the Congo national vaccination programme started in March 2021 and is using the Sputnik V, Sinopharm, and Janssen (Johnson and Johnson) vaccines. British nationals resident in the Republic of the Congo are eligible for vaccination, depending on available stocks, if they choose to join the programme. Further information on the vaccination programme can be found at the emergency Public Health Operations Centre of the Ministry of Health and Population, or at the vaccination centre at the Ministry of Foreign Affairs.    Archived link: https://web.archive.org/web/20220425182720/https://www.gov.uk/foreign-travel-advice/congo/coronavirus"
