"","CountryName","CountryCode","Date","region","PolicyType","PolicyCode","previous_PolicyCode","Notes"
"1","Bermuda","BMU",2022-01-20,"North_America","C6: Stay at home requirements","1G","2G","s  The current restrictions relating to Curfew will expire as of 5:00 am on 20 January 2022.  https://archive.fo/QXSeK  Household mixing is strongly discouraged. However, if you must attend a household other than your own, we continue to strongly urge persons to take an antigen test before they visit another home or welcoming someone into their home"
"2","Bermuda","BMU",2022-01-20,"North_America","C8: International travel controls","3","1","All visitors arriving by air or sea to Bermuda must be fully vaccinated as defined here except for persons younger than 18 years and working crew.  Residents do not have a vaccination requirement.    Upon arrival to Bermuda, vaccinated travellers are required to get an arrival PCR test and a Day 4 antigen test (arrival day=Day 0).Vaccinated residents with a valid pre-arrival test must quarantine on arrival until their arrival negative test result is received. Vaccinated residents without a valid pre-arrival test must quarantine on arrival until their day 4 negative test result is received.    Unvaccinated travellers are required to get an arrival PCR test and a Day 10 antigen test (arrival day=Day 0) and must quarantine on arrival until their day 10 negative test result is received    https://archive.fo/cWIkK"
"3","Canada","CAN",2022-01-08,"North_America","C1: School closing","3T","3T","No change from 07Jan."
"4","Canada","CAN",2022-01-14,"North_America","C1: School closing","3T","3T","On 14 January 2022 in Canada at the elementary and secondary level: “Only schools in British Columbia, Alberta and Saskatchewan have opened their doors to in-person learning. Students in other provinces are learning online.” In Quebec: “The higher education ministry … sent a communication … to its establishments to confirm the return to in-person class, in accordance with public health recommendations, will take place as of January 17th, 2022,” ministry spokesperson … added that schools would be permitted a “transition period” and could delay their in-class returns to Jan. 31 at the latest.’ This provincial government order applies to all Quebec post-secondary institutions in contrast to most other jurisdictions, where vaccination/testing mandates or decisions to offer most classes online are policies set by individual post-secondary institutions rather than dictated by governments. See University Affairs Canada, University of New Brunswick, Global News and Globe and Mail newspaper websites archived:  https://web.archive.org/web/20220111214106/https://www.theglobeandmail.com/canada/article-schools-in-alberta-saskatchewan-facing-staff-shortages-due-to-rising/  https://web.archive.org/web/20220111215017/https://globalnews.ca/news/8496876/quebec-cegeps-universities-bring-back-in-person-learning/  https://web.archive.org/web/20211213193256/https://www.universityaffairs.ca/news/news-article/covid-19-updates-for-canadas-universities/  https://web.archive.org/web/20220113210148/https://www.unb.ca/coronavirus/community-updates/jan-13-22.html"
"5","Canada","CAN",2022-01-24,"North_America","C1: School closing","3T","3T","On 24 January 2022, schools are closed (but open for online learning) at all levels – elementary, secondary and post-secondary – in the provinces of New Brunswick (NB) and Newfoundland and Labrador (NL) by provincial government order (elementary and secondary) and influenced by provincial government public health guidance (post-secondary). Elementary and secondary schools are open for in-class learning almost everywhere else in the rest of Canada. Many post-secondary institutions throughout Canada are offering most classes online. However, in most cases, these decisions are set by individual post-secondary institutions rather than dictated or guided by governments. E.g., “Universities in Ontario have been told by the Ministry of Colleges and Universities that there are no restrictions on in-person instruction”. See governments of NB, NL and UNB, Memorial University and Globe and Mail newspaper websites archived:  https://web.archive.org/web/20220121134059/https://www.theglobeandmail.com/canada/article-universities-to-stick-to-online-classes-for-now-to-slow-spread-of/  https://web.archive.org/web/20220120204024/https://www.gov.nl.ca/releases/2022/education/0120n05/  https://web.archive.org/web/20220105110515/https://gazette.mun.ca/campus-and-community/winter-2022-update/  https://web.archive.org/web/20220113203046/https://www2.gnb.ca/content/gnb/en/corporate/promo/covid-19/news/news_release.2022.01.0019.html  https://web.archive.org/web/20220113210148/https://www.unb.ca/coronavirus/community-updates/jan-13-22.html"
"6","Canada","CAN",2022-01-28,"North_America","C1: School closing","3T","3T","On 28 January 2022, schools are closed (but open for online learning) at all levels – elementary, secondary and post-secondary – for all students, teachers and staff in the province of New Brunswick (NB) by provincial government order (elementary and secondary) and influenced by provincial government public health guidance (post-secondary). Elementary and secondary schools are open for in-class learning almost everywhere else in the rest of Canada. Many post-secondary institutions throughout Canada are offering most classes online. However, in most cases, these decisions are set by individual post-secondary institutions rather than dictated or guided by governments. E.g., “Universities in Ontario have been told by the Ministry of Colleges and Universities that there are no restrictions on in-person instruction”. See governments of NB, University of NB and Globe and Mail newspaper websites archived:  https://web.archive.org/web/20220121134059/https://www.theglobeandmail.com/canada/article-universities-to-stick-to-online-classes-for-now-to-slow-spread-of/  https://web.archive.org/web/20220113203046/https://www2.gnb.ca/content/gnb/en/corporate/promo/covid-19/news/news_release.2022.01.0019.html  https://web.archive.org/web/20220113210148/https://www.unb.ca/coronavirus/community-updates/jan-13-22.html"
"7","Canada","CAN",2022-01-31,"North_America","C1: School closing","3T","3T","On 31 January 2022, elementary and secondary schools in the province of New Brunswick (NB) move from online to in-class learning. Elementary and secondary schools are open for in-class learning throughout Canada EXCEPT Igloolik, Nunavut Territory where all levels are closed including the Igloolik Community Learning Centre campus of Nunavut Arctic College. No jurisdiction has implemented a vaccine or testing mandate for students. Many post-secondary institutions throughout Canada are offering most classes online. In most cases, these decisions are set by individual post-secondary institutions rather than dictated or guided by governments. E.g., “Universities in Ontario have been told by the Ministry of Colleges and Universities that there are no restrictions on in-person instruction”. However, at the University of NB: “Following the guidance of Public Health and to assist our province in managing the impacts of the current outbreak … Only courses that must be delivered in-person to meet course outcomes will resume in-person classes on Monday, Jan. 24. All other courses will continue to be offered remotely and will transition to in-person instruction on Monday, Feb. 7.” In other words, post-secondary instruction in NB is online “following” provincial government public health guidance. See governments of NB, University of NB and Globe and Mail newspaper websites archived:  https://web.archive.org/web/20220131170000/https://www.gov.nu.ca/health/information/nunavuts-path  https://web.archive.org/web/20220121134059/https://www.theglobeandmail.com/canada/article-universities-to-stick-to-online-classes-for-now-to-slow-spread-of/  https://web.archive.org/web/20220113203046/https://www2.gnb.ca/content/gnb/en/corporate/promo/covid-19/news/news_release.2022.01.0019.html  https://web.archive.org/web/20220113210148/https://www.unb.ca/coronavirus/community-updates/jan-13-22.html"
"8","Canada","CAN",2022-02-07,"North_America","C1: School closing","3T","3T","On 7 February 2022, elementary and secondary schools are open for in-class learning throughout Canada EXCEPT in Igloolik, Nunavut Territory where all levels are closed including the Igloolik Community Learning Centre campus of Nunavut Arctic College. . No jurisdiction has implemented a vaccine or testing mandate for students. Many post-secondary institutions throughout Canada are offering most classes online or have implemented vaccine mandates for students and staff to enter campus. In most cases, these decisions are set by individual post-secondary institutions rather than dictated or guided by governments. E.g., “Universities in Ontario have been told by the Ministry of Colleges and Universities that there are no restrictions on in-person instruction”. However, at Memorial University of Newfoundland (MUN), Newfoundland and Labrador’s (NL’s) only university and largest post-secondary institution: “We have been working very closely with Public Health since the beginning of the pandemic and all major decisions have been informed by its input and general guidance…layered protection … approach Memorial has taken with the vaccine mandate, mandatory three-ply masks, asymptomatic rapid testing, wastewater testing, density requirements, cleaning and hygiene and ventilation standards for classrooms and labs.” The post-secondary vaccine mandate is a decision made by MUN “working very closely with Public Health …informed by its input and general guidance”. See government of Nunavut, MUN and Globe and Mail newspaper websites, archived:  https://web.archive.org/web/20220211144521/https://www.gov.nu.ca/health/information/nunavuts-path  https://web.archive.org/web/20220121134059/https://www.theglobeandmail.com/canada/article-universities-to-stick-to-online-classes-for-now-to-slow-spread-of/  https://web.archive.org/web/20220129121757/https://gazette.mun.ca/campus-and-community/return-to-campus-update/"
"9","Canada","CAN",2022-02-11,"North_America","C1: School closing","3T","3T","On 11 February 2022, elementary and secondary schools are open for in-class learning throughout Canada EXCEPT in Igloolik, Nunavut Territory where all levels are closed including the Igloolik Community Learning Centre campus of Nunavut Arctic College.  No jurisdiction has implemented a vaccine or testing mandate for students. Many post-secondary institutions throughout Canada are offering most classes online or have implemented vaccine mandates for students and staff to enter campus. In most cases, these decisions are set by individual post-secondary institutions rather than dictated or guided by governments. E.g., “Universities in Ontario have been told by the Ministry of Colleges and Universities that there are no restrictions on in-person instruction”. See government of Nunavut and Globe and Mail newspaper websites, archived:  https://web.archive.org/web/20220211144521/https://www.gov.nu.ca/health/information/nunavuts-path  https://web.archive.org/web/20220121134059/https://www.theglobeandmail.com/canada/article-universities-to-stick-to-online-classes-for-now-to-slow-spread-of/"
"10","Canada","CAN",2022-01-08,"North_America","C2: Workplace closing","3T","3T","No change from 07Jan."
"11","Canada","CAN",2022-01-14,"North_America","C2: Workplace closing","3T","3T","On 14 January 2022, non-essential businesses remain closed in Nunavut Territory. “Nunavut’s Minister of Health, John Main, has extended the territory’s public health emergency until January 20, 2022. All existing measures under the public health emergency order remain in effect.” In the rest of Canada, businesses are open with varying levels of restrictions. Many jurisdictions restrict access to some non-essential businesses to fully vaccinated customers (or require proof of a recent negative test). See Nunavut News, Globe and Mail newspaper and government of Nunavut websites, archived (and to be updated in future rounds when archive.org delays solved):  https://web.archive.org/web/20220113210434/https://www.nunavutnews.com/news/nunavut-ending-lockdown-jan-17/  https://web.archive.org/web/20220107141016/https://www.gov.nu.ca/health/news/nunavut-extends-public-health-emergency-33  https://web.archive.org/web/20211225214240/https://gov.nu.ca/health/news/new-covid-cases-lead-nunavut-wide-restrictions  https://web.archive.org/web/20220111210218/https://www.theglobeandmail.com/canada/article-mandatory-vaccination-canada-province-territory-policies-guide/"
"12","Canada","CAN",2022-01-17,"North_America","C2: Workplace closing","2T","3T","On 17 January 2022, “non-essential businesses may open” in Nunavut Territory. Throughout Canada, businesses are open with different levels of restrictions in different provinces and territories. Many jurisdictions restrict access to some non-essential businesses to fully vaccinated customers (or require proof of a recent negative test). The Province of Alberta follows that approach, but allows an opt-out for businesses that do not wish to apply a vaccination/test mandate if they accept lower capacity limits. See Nunavut News and Globe and Mail newspaper and governments of Nunavut and Alberta websites, archived:  https://web.archive.org/web/20220120120728/https://www.gov.nu.ca/executive-and-intergovernmental-affairs/news/covid-19-gn-update-january-13-2022  https://web.archive.org/web/20220120121614/https://www.alberta.ca/covid-19-public-health-actions.aspx  https://web.archive.org/web/20220113210434/https://www.nunavutnews.com/news/nunavut-ending-lockdown-jan-17/  https://web.archive.org/web/20220120121142/https://www.theglobeandmail.com/canada/article-mandatory-vaccination-canada-province-territory-policies-guide/"
"13","Canada","CAN",2022-01-19,"North_America","C2: Workplace closing","3T","2T","Effective 19 Jan. 2022: “Quebec’s Nunavik region moved into lockdown … Nunavik Regional Board of Health and Social Services …, which spans the northern third of the province … all non-essential public places are closed.” In the rest of Canada, businesses are open with different levels of restrictions in different provinces and territories. Many jurisdictions restrict access to some non-essential businesses to fully vaccinated customers (or require proof of a recent negative test). See Globe and Mail newspaper website, archived:  https://web.archive.org/web/20220120121142/https://www.theglobeandmail.com/canada/article-mandatory-vaccination-canada-province-territory-policies-guide/  https://web.archive.org/web/20220121135800/https://www.theglobeandmail.com/canada/article-quebec-reports-88-more-covid-19-deaths-as-hospitalizations-rise-by/"
"14","Canada","CAN",2022-01-24,"North_America","C2: Workplace closing","3T","3T","On 24 January 2022 in Quebec’s Nunavik region, the northern third of the province, lockdown measures remain in place: “all non-essential activities are suspended: … retail business with the exception of groceries, restaurant except for the sale of take-out, bar, gym”. In the rest of Canada, businesses are open with different levels of restrictions in different provinces and territories. Many jurisdictions restrict access to some non-essential businesses to fully vaccinated customers (or require proof of a recent negative test). See Globe and Mail newspaper and Nunavik Regional Board of Health and Social Services website, archived:  https://web.archive.org/web/20220121183438/http://nrbhss.ca/sites/default/files/covid19/Ordinance_2022-7_Red_Alert_Level_2022-01-19.pdf  https://web.archive.org/web/20220120121142/https://www.theglobeandmail.com/canada/article-mandatory-vaccination-canada-province-territory-policies-guide/"
"15","Canada","CAN",2022-01-28,"North_America","C2: Workplace closing","3T","3T","On 28 January 2022 in Quebec’s Nunavik region, the northern third of the province, lockdown measures remain in place for all residents: “non-essential activities are suspended: … retail business with the exception of groceries, restaurant except for the sale of take-out, bar, gym”. Non-essential businesses are closed in Igloolik, Nunavut Territory since 25 Jan. In the rest of Canada, businesses are open with different levels of restrictions in different provinces and territories. Many jurisdictions restrict access to some non-essential businesses to fully vaccinated customers (or require proof of a recent negative test). See Globe and Mail newspaper and Nunavik Regional Board of Health and Social Services website, archived:  https://web.archive.org/web/20220128015926/http://nrbhss.ca/sites/default/files/covid19/Ordinance_2022-7_Red_Alert_Level_2022-01-19.pdf  https://web.archive.org/web/20220127124214/https://www.theglobeandmail.com/canada/article-mandatory-vaccination-canada-province-territory-policies-guide/  https://web.archive.org/web/20220131170000/https://www.gov.nu.ca/health/information/nunavuts-path"
"16","Canada","CAN",2022-02-07,"North_America","C2: Workplace closing","3T","3T","On 7 february 2022, non-essential businesses and services remain closed in Igloolik, Nunavut Territory since 25 Jan. In the rest of Canada, businesses are open with different levels of restrictions in different provinces and territories. Many jurisdictions restrict access to some non-essential businesses to fully vaccinated customers (or require proof of a recent negative test). See Globe and Mail newspaper and government of Nunavvut website, archived:  https://web.archive.org/web/20220206121540/https://www.theglobeandmail.com/canada/article-mandatory-vaccination-canada-province-territory-policies-guide/  https://web.archive.org/web/20220131170000/https://www.gov.nu.ca/health/information/nunavuts-path"
"17","Canada","CAN",2022-02-11,"North_America","C2: Workplace closing","3T","3T","On 11 february 2022, non-essential businesses and services are closed regardless of vaccination status in Igloolik, Nunavut Territory since 25 Jan. In the rest of Canada, businesses are open with different levels of restrictions in different provinces and territories. Some jurisdictions restrict access to some non-essential businesses to fully vaccinated customers (or require proof of a recent negative test). See Globe and Mail newspaper and government of Nunavvut website, archived:  https://web.archive.org/web/20220206121540/https://www.theglobeandmail.com/canada/article-mandatory-vaccination-canada-province-territory-policies-guide/  https://web.archive.org/web/20220211144521/https://www.gov.nu.ca/health/information/nunavuts-path"
"18","Canada","CAN",2022-01-08,"North_America","C3: Cancel public events","2T","2T","No change from 07Jan."
"19","Canada","CAN",2022-01-14,"North_America","C3: Cancel public events","2T","2T","On 14 January 2022, in most of Canada organized public events such as concerts and sports matches are either banned, restricted to no spectators or only to those who show proof of vaccination. The Province of Alberta provides an opt-out: “Indoor facilities that do not implement the Restrictions Exemption Program [vaccination/test mandate] must follow these restrictions: Limit capacity to 1/3 fire code occupancy. Require attendees to be with household members only, or 2 close contacts if they live alone.” See Globe and Mail newspaper and Alberta government websites, archived :  https://web.archive.org/web/20220111210218/https://www.theglobeandmail.com/canada/article-mandatory-vaccination-canada-province-territory-policies-guide/  https://web.archive.org/web/20220113170043/https://www.alberta.ca/covid-19-public-health-actions.aspx"
"20","Canada","CAN",2022-01-24,"North_America","C3: Cancel public events","2T","2T","On 24 January 2022, in most of Canada organized public events such as concerts and sports matches are either banned, restricted to no spectators or only to those who show proof of vaccination. The Province of Alberta provides an opt-out: “Indoor facilities that do not implement the Restrictions Exemption Program [vaccination/test mandate] must follow these restrictions: Limit capacity to 1/3 fire code occupancy. Require attendees to be with household members only, or 2 close contacts if they live alone.” See Globe and Mail newspaper and Alberta government websites, archived:  https://web.archive.org/web/20220120121614/https://www.alberta.ca/covid-19-public-health-actions.aspx  https://web.archive.org/web/20220120121142/https://www.theglobeandmail.com/canada/article-mandatory-vaccination-canada-province-territory-policies-guide/"
"21","Canada","CAN",2022-01-28,"North_America","C3: Cancel public events","2T","2T","On 28 January 2022, in most of Canada organized public events such as concerts and sports matches are either banned, restricted to no spectators or only to those who show proof of vaccination. The Province of Alberta provides an opt-out: “Indoor facilities that do not implement the Restrictions Exemption Program [vaccination/test mandate] must follow these restrictions: Limit capacity to 1/3 fire code occupancy. Require attendees to be with household members only, or 2 close contacts if they live alone.” In sum, 2T fits both vaccinated and unvaccinated. In some jurisdictions – e.g., Newfoundland and Labrador, events are banned for all persons, regardless of vaccination status. However, in other jurisdictions events are permitted with capacity restrictions. Unvaccinated persons are banned from events in most jurisdictions except events hosted at Alberta facilities that accept tighter capacity restrictions in order to opt out of the vaccine mandate. Canadians See Globe and Mail newspaper and Alberta and Newfoundland government websites, archived:  https://web.archive.org/web/20220127124214/https://www.theglobeandmail.com/canada/article-mandatory-vaccination-canada-province-territory-policies-guide/  https://web.archive.org/web/20220127141511/https://www.alberta.ca/covid-19-public-health-actions.aspx  https://web.archive.org/web/20220117121246/https://www.gov.nl.ca/covid-19/life-during-covid-19/vaccination-record/citizens/  https://web.archive.org/web/20220124144956/https://www.gov.nl.ca/covid-19/alert-levels/alert-level-4/"
"22","Canada","CAN",2022-02-07,"North_America","C3: Cancel public events","2T","2T","On 7 February 2022, in most of Canada organized public events such as concerts and sports matches are restricted to limited capacity for vaccinated persons. However, the Province of Alberta provides an opt-out: “Indoor facilities that do not implement the Restrictions Exemption Program [vaccination/test mandate] must follow these restrictions: Limit capacity to 1/3 fire code occupancy. Require attendees to be with household members only, or 2 close contacts if they live alone.” In Igloolik, Nunavut Territory, non-emergency events are banned for all persons, regardless of vaccination status. “Indoor gatherings, halls, conference spaces, government and Inuit organization facilities Maximum amount of people 0 (+5 for emergencies)”. In sum, 2T fits both vaccinated and unvaccinated. See Globe and Mail newspaper and Alberta and Nunavut government websites, archived:  https://web.archive.org/web/20220131170000/https://www.gov.nu.ca/health/information/nunavuts-path  https://web.archive.org/web/20220206121540/https://www.theglobeandmail.com/canada/article-mandatory-vaccination-canada-province-territory-policies-guide/  https://web.archive.org/web/20220207011529/https://www.alberta.ca/covid-19-public-health-actions.aspx"
"23","Canada","CAN",2022-02-11,"North_America","C3: Cancel public events","2T","2T","On 11 February 2022, in most of Canada organized public events such as concerts and sports matches are restricted to vaccinated persons, and even then with limited capacity in some jurisdictions. However, “Alberta Premier … said his province would eliminate its [vaccine] passport program at midnight on Tuesday [8 Feb.) … [and] said ‘Now is the time to begin learning to live with COVID-19…None of that has to do anything with a few trucks parked at the Coutts border crossing.’ Alberta recorded 1,623 people with COVID-19 in hospital as of Feb. 7, compared to 1,570 on Jan. 27, when [Premier] said the government would back off restrictions when hospital admissions were on a sustained downward trend.” In Igloolik, Nunavut Territory, non-emergency events are banned for all persons, regardless of vaccination status. “Indoor gatherings, halls, conference spaces, government and Inuit organization facilities Maximum amount of people 0 (+5 for emergencies)”. In sum, 2T fits both vaccinated and unvaccinated. See Globe and Mail newspaper and Nunavut government websites, archived:  https://web.archive.org/web/20220211144521/https://www.gov.nu.ca/health/information/nunavuts-path  https://web.archive.org/web/20220210154614/https://www.theglobeandmail.com/canada/article-saskatchewan-premier-scott-moe-brings-provinces-vaccine-passport-mask/  https://web.archive.org/web/20220206121540/https://www.theglobeandmail.com/canada/article-mandatory-vaccination-canada-province-territory-policies-guide/"
"24","Canada","CAN",2022-01-08,"North_America","C4: Restrictions on gatherings","4T","4T","No change from 07Jan."
