countryname,countrycode,region,startdate,enddate,policytype,policyvalue,flag,new_level,prev_level,initialnote
India,IND,South_Asia,20200618,,C2: Workplace closing,2,0,2T,1T,Lock down with closures back in few cities like chennai  http://archive.fo/FwLr8
India,IND,South_Asia,20200618,,C3: Cancel public events,2,0,2T,2G,http://archive.fo/FwLr8
India,IND,South_Asia,20200618,,C4: Restrictions on gatherings,4,0,4T,4G,http://archive.fo/FwLr8
Pakistan,PAK,South_Asia,20200622,,C6: Stay at home requirements,2,0,2T,1G,"The Balochistan authorities have implemented a smart lockdown, in which hotspot areas of the virus are required to stay inside. Only one person is allowed to leave for essential groceries.    https://web.archive.org/web/20200622213857/https://www.samaa.tv/news/pakistan/2020/06/balochistan-to-implement-lockdown-in-hotspot-virus-areas/"
,,,,,,,,,,
Note: Data from 29 Jun 2020. Individual countries may be several days older.,,,,,,,,,,
Source: Oxford COVID-19 Government Response Tracker. More at: github.com/OxCGRT/covid-policy-tracker or bsg.ox.ac.uk/covidtracker,,,,,,,,,,
