"","CountryName","CountryCode","Date","region","PolicyType","PolicyCode","previous_PolicyCode","Notes"
"224","Denmark","DNK",2022-05-17,"Europe_Central_Asia","H1: Public information campaigns","2G","2G","A dedicated government website is available for regular updates on the coronavirus pandemic as well as regulations and guidelines set up by the government to prevent the spread of the virus    From 1 February 2022, there are no longer any restrictions in the social and elderly areas. Thus there is no longer a requirement for a corona passport for visitors etc. and requirements for the use of a face mask or shield for visitors, etc., and employees on social services, etc.     If possible it is urged to continue arrangements for the display of corona passports and for the use of face masks/shields in nursing homes and social services with vulnerable residents/users. It is also urged with a continued focus on the test effort in relation to employees in the elderly care and on social services as well as visitors to nursing homes and social services.    Archived: https://web.archive.org/web/20220528133517/https://en.coronasmitte.dk/rules-and-regulations"
"225","Denmark","DNK",2022-05-31,"Europe_Central_Asia","H1: Public information campaigns","2G","2G","A dedicated government website is available for regular updates on the coronavirus pandemic as well as regulations and guidelines set up by the government to prevent the spread of the virus    From 1 February 2022, there are no longer any restrictions in the social and elderly areas. Thus there is no longer a requirement for a corona passport for visitors etc. and requirements for the use of a face mask or shield for visitors, etc., and employees on social services, etc.     If possible it is urged to continue arrangements for the display of corona passports and for the use of face masks/shields in nursing homes and social services with vulnerable residents/users. It is also urged with a continued focus on the test effort in relation to employees in the elderly care and on social services as well as visitors to nursing homes and social services.    Archived: https://web.archive.org/web/20220604124509/https://en.coronasmitte.dk/rules-and-regulations"
"226","Denmark","DNK",2022-05-17,"Europe_Central_Asia","H2: Testing policy","3","3","PCR testing is generally available. However, testing is only recommended if you are at increased risk for severe disease.    Archived: https://web.archive.org/web/20220528134139/https://en.coronasmitte.dk/general-information/test-for-covid-19"
"227","Denmark","DNK",2022-05-31,"Europe_Central_Asia","H2: Testing policy","3","3","PCR testing is generally available. However, testing is only recommended if you are at increased risk for severe disease.    Archived: https://web.archive.org/web/20220528134139/https://en.coronasmitte.dk/general-information/test-for-covid-19"
"228","Denmark","DNK",2022-05-17,"Europe_Central_Asia","H3: Contact tracing","2","2","A mobile app, SmitteStop is currently in use to help with contact tracing and it helps by notifying users who have been in contact with infected users for more than 15 minutes at a distance of 1 meter.     Archived: https://web.archive.org/web/20210820134054/https://dig.watch/updates/denmark-launches-national-contact-tracing-app"
"229","Denmark","DNK",2022-05-31,"Europe_Central_Asia","H3: Contact tracing","2","2","A mobile app, SmitteStop is currently in use to help with contact tracing and it helps by notifying users who have been in contact with infected users for more than 15 minutes at a distance of 1 meter.     Archived: https://web.archive.org/web/20210820134054/https://dig.watch/updates/denmark-launches-national-contact-tracing-app"
"230","Denmark","DNK",2022-05-17,"Europe_Central_Asia","H6: Facial Coverings","0","0","Citizens of Denmark are no longer required to wear face masks or present COVID-19 health passes indicating proof of vaccination, recovery, or a recent negative test result. It is recommended that hospitals and nursing homes if it is possible continue to require visitors to use facemask/shields to protect the elderly and vulnerable    Archived:  https://web.archive.org/web/20220210053955/https://www.dw.com/en/covid-digest-denmark-lifts-almost-all-restrictions/a-60618361  https://web.archive.org/web/20220528133517/https://en.coronasmitte.dk/rules-and-regulations"
"231","Denmark","DNK",2022-05-31,"Europe_Central_Asia","H6: Facial Coverings","0","0","Citizens of Denmark are no longer required to wear face masks or present COVID-19 health passes indicating proof of vaccination, recovery, or a recent negative test result. It is recommended that hospitals and nursing homes if it is possible continue to require visitors to use facemask/shields to protect the elderly and vulnerable    Archived:  https://web.archive.org/web/20220210053955/https://www.dw.com/en/covid-digest-denmark-lifts-almost-all-restrictions/a-60618361  Archived: https://web.archive.org/web/20220604124509/https://en.coronasmitte.dk/rules-and-regulations"
"232","Denmark","DNK",2022-05-17,"Europe_Central_Asia","H7: Vaccination policy","5G","5G","Due to the high adherence to vaccination in Denmark, the widespread societal infection with the omicron variant, and the change from winter to summer, the Danish Health Authority rounded the season's vaccination program on May 15, 2022. Vaccination remains voluntary and free of charge.    Archived: https://web.archive.org/web/20220528134515/https://en.coronasmitte.dk/general-information/vaccination"
"233","Denmark","DNK",2022-05-31,"Europe_Central_Asia","H7: Vaccination policy","5G","5G","Due to the high adherence to vaccination in Denmark, the widespread societal infection with the omicron variant, and the change from winter to summer, the Danish Health Authority rounded the season's vaccination program on May 15, 2022. Vaccination remains voluntary and free of charge.    Archived: https://web.archive.org/web/20220604124509/https://en.coronasmitte.dk/rules-and-regulations"
"234","Denmark","DNK",2022-05-17,"Europe_Central_Asia","H8: Protection of elderly people","2G","0","From 1 February 2022, there are no longer any restrictions in the social and elderly areas. Thus there is no longer a requirement for a corona passport for visitors etc. and requirements for the use of a face mask or shield for visitors, etc., and employees on social services, etc.     If possible it is urged to continue arrangements for the display of corona passports and for the use of face masks/shields in nursing homes and social services with vulnerable residents/users. It is also urged with a continued focus on the test effort in relation to employees in the elderly care and on social services as well as visitors to nursing homes and social services.    Archived: https://web.archive.org/web/20220210053301/https://en.coronasmitte.dk/rules-and-regulations"
"235","Denmark","DNK",2022-05-31,"Europe_Central_Asia","H8: Protection of elderly people","2G","2G","From 1 February 2022, there are no longer any restrictions in the social and elderly areas. Thus there is no longer a requirement for a corona passport for visitors etc. and requirements for the use of a face mask or shield for visitors, etc., and employees on social services, etc.     If possible it is urged to continue arrangements for the display of corona passports and for the use of face masks/shields in nursing homes and social services with vulnerable residents/users. It is also urged with a continued focus on the test effort in relation to employees in the elderly care and on social services as well as visitors to nursing homes and social services.    Archived: https://web.archive.org/web/20220604124509/https://en.coronasmitte.dk/rules-and-regulations"
"236","Spain","ESP",2022-05-26,"Europe_Central_Asia","C1: School closing","0","0","No mandate for the wearing of masks in schools from 19th April 2022    Royal Decree 286/2022, of April 19, which modifies the mandatory use of masks during the health crisis situation caused by COVID-19.    This royal decree establishes the areas where the mask will continue to be mandatory. However, it is recommended for all people with a greater vulnerability to COVID-19 infection to maintain the use of a mask in any situation in which there is prolonged contact with people at a distance of less than 1.5 meters.    For this reason, responsible use of the mask is recommended in closed spaces for public use in which people transit or spend a long time. Likewise, the responsible use of the mask in crowded events is recommended. In the family environment and in private gatherings or celebrations, responsible use is recommended based on the vulnerability of the participants.    In the work environment, in general, the use of masks will not be mandatory. However, those responsible for occupational risk prevention, in accordance with the corresponding risk assessment of the job, may determine the appropriate preventive measures that must be implemented in the workplace or in certain areas of the work centers, including the possible use of masks, if this is derived from the aforementioned evaluation.    Consequently, the mandatory use of a mask is maintained, first of all, in health centers, services and establishments, since these are areas where there may be a greater concentration of vulnerable people in whom the risk of serious illness is greater and, on the other hand, where the probability of transmission is higher, since they are places where there may be a greater number of people with communicable respiratory infections, in addition to COVID-19.    https://web.archive.org/web/20220503180420/https://www.boe.es/diario_boe/txt.php?id=BOE-A-2022-6449"
"237","Spain","ESP",2022-05-26,"Europe_Central_Asia","C2: Workplace closing","2T","2T","Businesses such as hotels, bars, shops & restaurant's in some area's have restrictions based on status.  However most business are open and operating according to Social Distancing guidelines for COVID.  Additionally other events may require the COVID Passport as well.      - https://web.archive.org/web/20211218130910/https://www.gov.uk/foreign-travel-advice/spain/coronavirus  - https://web.archive.org/web/20211221021728/https://es.usembassy.gov/covid-19-information/  - https://web.archive.org/web/20211221010259/https://www.spth.gob.es/faq"
"238","Spain","ESP",2022-05-26,"Europe_Central_Asia","C3: Cancel public events","1T","1T","Due to the Alert Level still being at 2 for Gran Canaria and Tenerife, which restricts gatherings over 12 people closures would be recommended.    Gran Canaria and Tenerife remain at Level 2    Gatherings:  Limited to 12 people on levels 1, 2 and 3; and reduced to 8 people at level 4.    Restoration:  level 1, 2 and 3, terraces and interiors at 100%, tables of 12 and closing at 4:00; and level 4 terraces at 75%, interiors at 50%, tables of 8 and closing at 3:00.    Nightlife:  levels 1, 2, and 3, 100% capacity outdoors and 75% indoors, with tables for up to 12 people and closing at 4:00. At level 4, the outdoor capacity is reduced to 75% and, indoors, to 50%, with tables for up to eight people. In addition, the closing is advanced to 3:00.     https://web.archive.org/web/20220323135614/https://www.rtve.es/noticias/20220323/mapa-confinamientos-espana-coronavirus-restricciones/2041269.shtml#restricciones-coronavirus-comunidades-autonomas      https://web.archive.org/web/20220409175658/https://www.gobiernodecanarias.org/principal/coronavirus/semaforo/  https://web.archive.org/web/20220506012433/https://www.gobiernodecanarias.org/principal/coronavirus/semaforo/"
"239","Spain","ESP",2022-05-26,"Europe_Central_Asia","C4: Restrictions on gatherings","3T","3T","Gran Canaria and Tenerife remain at Level 2    Gatherings:  Limited to 12 people on levels 1, 2 and 3; and reduced to 8 people at level 4.    Restoration:  level 1, 2 and 3, terraces and interiors at 100%, tables of 12 and closing at 4:00; and level 4 terraces at 75%, interiors at 50%, tables of 8 and closing at 3:00.    Nightlife:  levels 1, 2, and 3, 100% capacity outdoors and 75% indoors, with tables for up to 12 people and closing at 4:00. At level 4, the outdoor capacity is reduced to 75% and, indoors, to 50%, with tables for up to eight people. In addition, the closing is advanced to 3:00.     https://web.archive.org/web/20220323135614/https://www.rtve.es/noticias/20220323/mapa-confinamientos-espana-coronavirus-restricciones/2041269.shtml#restricciones-coronavirus-comunidades-autonomas      https://web.archive.org/web/20220409175658/https://www.gobiernodecanarias.org/principal/coronavirus/semaforo/  https://web.archive.org/web/20220506012433/https://www.gobiernodecanarias.org/principal/coronavirus/semaforo/"
"240","Spain","ESP",2022-05-26,"Europe_Central_Asia","C5: Close public transport","0","0","Masks must be worn on public transport    https://web.archive.org/web/20220315234253/https://www.spth.gob.es/faq?tab=2  https://web.archive.org/web/20220525075246/https://www.sanidad.gob.es/"
"241","Spain","ESP",2022-05-26,"Europe_Central_Asia","C6: Stay at home requirements","0","0","No stay at home requirements in place.  https://web.archive.org/web/20220315234253/https://www.spth.gob.es/faq?tab=2"
"242","Spain","ESP",2022-05-26,"Europe_Central_Asia","C7: Restrictions on internal movement","0","0","No restrictions on internal movement.  https://web.archive.org/web/20220315234253/https://www.spth.gob.es/faq?tab=2"
"243","Spain","ESP",2022-05-17,"Europe_Central_Asia","C8: International travel controls","1","1","ALL passengers arriving in Spain by air (except those under 12 years of age and those in international transit), regardless of the country of origin of the trip, including Spaniards returning home, must have a mandatory one of these documents:    An EU DIGITAL COVID CERTIFICATE OR EU EQUIVALENT  of vaccination against COVID-19 or a negative certificate of a diagnostic test for active infection or a certificate of recovery after having passed this disease. You can check if your certificate is valid on the website  https://spth.gob.es  or on the Spain Travel Health –SpTH– application (Android, iOS, Huawei). It will open in a new window.    Upon arrival at the airport, follow the indications that indicate the  VÍA ORANJA .    QRSpTH . If you DO NOT have the EU Digital COVID Certificate or EU equivalent, you must complete the  SpTH Health Control Form  through the website  https://spth.gob.es It will open in a new window. or the Spain Travel Health –SpTH– application (Android, iOS , Huawei), by manually entering the data from your vaccination certificate, recovery or diagnostic test. At the end of the completion of the FCS, the system will send you a QR code that you will have to present both at the time of boarding and upon arrival in Spain. In the health control you may be required to present this document certifying vaccination, diagnostic test or recovery.    At the present time, there are no countries that require additional measures to those already mentioned. In the event that the epidemiological situation in a country/territory or area worsens in a worrying way, exceptional health control measures may be applied to passengers coming from said countries/areas.    https://web.archive.org/web/20220525070337/https://www.sanidad.gob.es/profesionales/saludPublica/ccayes/alertasActual/nCov/spth.htm"
"244","Spain","ESP",2022-05-26,"Europe_Central_Asia","C8: International travel controls","1","1","ALL passengers arriving in Spain by air (except those under 12 years of age and those in international transit), regardless of the country of origin of the trip, including Spaniards returning home, must have a mandatory one of these documents:    An EU DIGITAL COVID CERTIFICATE OR EU EQUIVALENT  of vaccination against COVID-19 or a negative certificate of a diagnostic test for active infection or a certificate of recovery after having passed this disease. You can check if your certificate is valid on the website  https://spth.gob.es  or on the Spain Travel Health –SpTH– application (Android, iOS, Huawei). It will open in a new window.    Upon arrival at the airport, follow the indications that indicate the  VÍA ORANJA .    QRSpTH . If you DO NOT have the EU Digital COVID Certificate or EU equivalent, you must complete the  SpTH Health Control Form  through the website  https://spth.gob.es It will open in a new window. or the Spain Travel Health –SpTH– application (Android, iOS , Huawei), by manually entering the data from your vaccination certificate, recovery or diagnostic test. At the end of the completion of the FCS, the system will send you a QR code that you will have to present both at the time of boarding and upon arrival in Spain. In the health control you may be required to present this document certifying vaccination, diagnostic test or recovery.    At the present time, there are no countries that require additional measures to those already mentioned. In the event that the epidemiological situation in a country/territory or area worsens in a worrying way, exceptional health control measures may be applied to passengers coming from said countries/areas.    https://web.archive.org/web/20220520103330/https://www.sanidad.gob.es/profesionales/saludPublica/ccayes/alertasActual/nCov/spth.htm"
"245","Spain","ESP",2022-05-26,"Europe_Central_Asia","E1: Income support","2T","2T","Similar to Switzerland there is an extension for the tourism industry until the end of June    The Spanish government has finally backed down and agreed to extend the furlough scheme which was introduced at the start of the Covid-19 pandemic, but only until 31 March and not until June as some sectors had requested. The furloughs resulting from the volcanic eruption on La Palma, in the Canary Islands, will however continue until June and possibly beyond.    However, the conditions for this short-term extension of the pandemic furlough scheme will not be exactly the same, as 20 per cent fewer companies will benefit from the exemptions from Social Security contributions. For furloughed workers, though, nothing will change. Nearly 105,000 people are in this situation, either from the pandemic or the volcanic eruption.    There will also be a special protection mechanism for travel agencies, as this sector has been worst-hit by the pandemic and will need considerable time to recover. Nearly 10,800 workers in this industry are furloughed at present, and that is almost one in three. Next month the government will approve a scheme specifically for these workers. Companies will be able to activate this mechanism for up to one year, and can then extend it twice for six months at a time if necessary.    The CC OO union has welcomed the agreement and asked the government to also extend the Me Cuida Plan until 30 June, which it has agreed to do.    https://web.archive.org/web/20220316000226/https://www.surinenglish.com/spain/government-extends-furlough-20220222113506-nt.html"
"246","Spain","ESP",2022-05-26,"Europe_Central_Asia","E2: Debt/contract relief","0","0","Policy ceased on 31st March 2022"
"247","Spain","ESP",2022-05-26,"Europe_Central_Asia","H1: Public information campaigns","2G","2G","Strong government information through various websites which are regularly updated    https://web.archive.org/web/20220511152355mp_/https://www.sanidad.gob.es/ciudadanos/portada/home.htm"
"248","Spain","ESP",2022-05-26,"Europe_Central_Asia","H2: Testing policy","2","2","you can get a COVID test in the Public Health System for free if you are a resident in Spain registered with the Spanish Social Security or have a European Health Insurance Card. However you will only be entitled to a free COVID test from the Public Health System if you have COVID symptoms, not for travel purposes. You also have no say over what type of test you have.    https://web.archive.org/web/20220407120810/https://www.sanidad.gob.es/en/profesionales/saludPublica/ccayes/alertasActual/nCov/documentos/Estrategia_estatal_segunda_ola.pdf  https://web.archive.org/web/20220525113327/https://www.barcelona-tourist-guide.com/en/covid/covid-test-in-barcelona.html"
"249","Spain","ESP",2022-05-26,"Europe_Central_Asia","H3: Contact tracing","1","1","What should I do if I have health problems during my stay in Spain?  If during your stay in Spain you develop symptoms of acute respiratory infection (fever, cough or difficulty in breathing) or other symptoms compatible with COVID-19 such as reduced sense of smell and taste, chills, sore throat, muscle aches, headache, general weakness, diarrhea or vomiting, you must commit to:    Self-isolating: staying at home or place of accommodation and self-isolating in a room. Preferably in a room for individual use, which is well ventilated and with an individual bathroom. If this is not possible, the safety distance of 1.5 metres should be guaranteed and a surgical mask should be worn when in contact with other people living with the patient. Be very careful with hygiene.  Contact the health service: contact the competent health authorities of the Autonomous Communities by telephone. If you feeling that the illness is serious, you have shortness of breath or chest pain, call 112.  What should I do if I had had close contact with a diagnosed case of COVID-19 during my stay in Spain?  If you have had close contact with a COVID-19 case and you are not vaccinated with a complete vaccination regimen, you should quarantine: if you have had close contact with a patient with COVID-19 or someone suspected of having it without adequate protective measures, from 48 hours before the onset of symptoms, you should quarantine for 7 days staying in your home or place of accommodation, preferably in a room on your own. During the following 10 days after the last contact, protection measures should be stepped up (use of masks, limiting the number of social contacts, etc).    For more information you can consult the website of the Ministry of Health of the Government of Spain, dedicated to the health emergency due to COVID-19, in different languages, on this link.    https://web.archive.org/web/20220315234253/https://www.spth.gob.es/faq?tab=2  https://web.archive.org/web/20220518025808/https://www.spth.gob.es/faq?tab=2"
"250","Spain","ESP",2022-05-26,"Europe_Central_Asia","H6: Facial Coverings","2G","2G","The use of face coverings is mandatory for anyone over the age of 6 years if you are in the following situations:    on any form of public transport in Spain  visiting a hospital or medical centre (including other healthcare settings such as dentists, opticians, pharmacies etc.)  visiting a care or nursing home  Face masks must cover the nose and mouth.    In addition to the mandatory use of face masks in the above situations, the Spanish government recommends you use them responsibly in the following circumstances:    enclosed public spaces such as shops, cinemas, bars and restaurants  at large events (e.g. concerts, sporting events) • when in the company of people considered clinically vulnerable or high-risk and social distancing of 1.5m cannot be observed • at family gatherings • in any other enclosed communal spaces open to the public  Those with respiratory problems or those unable to wear a mask due to other health conditions or disabilities are exempt. More details are available from the Ministry for Health (in Spanish).    https://web.archive.org/web/20220525090656/https://www.gov.uk/foreign-travel-advice/spain/coronavirus  https://archive.ph/PgKSH  Enter new data here for Spain. Click this bar for further information/instructions.  Date from (inclusive)  05/26/2022  Date to (inclusive)"
"251","Spain","ESP",2022-05-26,"Europe_Central_Asia","H7: Vaccination policy","5G","5G","All groups from 5 years up are able to be vaccinated    https://web.archive.org/web/20220425095936/https://www.sanidad.gob.es/profesionales/saludPublica/ccayes/alertasActual/nCov/pbiVacunacion.htm"
"252","Spain","ESP",2022-05-26,"Europe_Central_Asia","H8: Protection of elderly people","3T","3T","The use of face coverings is mandatory for anyone over the age of 6 years if you are in the following situations:    on any form of public transport in Spain  visiting a hospital or medical centre (including other healthcare settings such as dentists, opticians, pharmacies etc.)  visiting a care or nursing home  Face masks must cover the nose and mouth.      Municipality information: Bars, restaurants and nightlife venues with capacity and closing hours according to license. Consumption is allowed at the bar from a distance and on dance floors with a mask and without the possibility of eating or drinking. Mandatory COVID passport to enter residences for the elderly.    https://web.archive.org/web/20220525091255/https://www.rtve.es/noticias/20220524/mapa-confinamientos-espana-coronavirus-restricciones/2041269.shtml"
"253","Estonia","EST",2022-05-17,"Europe_Central_Asia","C1: School closing","1G","1G","Educational activities take place in the regular manner. It is still important to follow the dispersion and disinfection rules. It is recommended to wear a mask in a crowded spaces.   https://web.archive.org/web/20220526224519/https://www.kriis.ee/en/covid-crisis-management-qa/crisis-management/current-restrictions"
"254","Estonia","EST",2022-05-17,"Europe_Central_Asia","C2: Workplace closing","1G","1G","NO CHANGE  https://web.archive.org/web/20220526224519/https://www.kriis.ee/en/covid-crisis-management-qa/crisis-management/current-restrictions"
