"","CountryName","CountryCode","Date","region","PolicyType","PolicyCode","previous_PolicyCode","Notes"
"1","Bahrain","BHR",2022-01-19,"Middle_East_North_Africa","C1: School closing","1G","0","Bahrain has announced the precautionary adoption of the coronavirus Yellow Alert Level starting Dec. 19 until Jan. 31 of 2022. During this period, some activities are allowed for both, vaccinated and non-vaccinated individuals, this includes providing the option for both to attend education and training institutions.    https://web.archive.org/web/20220131205552/https://www.arabnews.com/node/1987216/middle-east  https://web.archive.org/web/20211206153449/https://healthalert.gov.bh/uploads/luyotccz_ikf.pdf"
"2","Bahrain","BHR",2022-01-12,"Middle_East_North_Africa","C2: Workplace closing","1G","1G","No change,   government website still recommends ""avoid mixing with people or attending public councils"".   Workplaces that are open are required to have sanitation and hygiene measures in place as per traffic light protocol.   https://archive.ph/xEZu5"
"3","Bahrain","BHR",2022-01-19,"Middle_East_North_Africa","C2: Workplace closing","2G","1G","Bahrain has announced the precautionary adoption of the coronavirus Yellow Alert Level starting Dec. 19 until Jan. 31 of 2022. During this period, the government adopts a 30% work-from-home policy across all government entities.    https://web.archive.org/web/20220131205552/https://www.arabnews.com/node/1987216/middle-east  https://web.archive.org/web/20211206153449/https://healthalert.gov.bh/uploads/luyotccz_ikf.pdf"
"4","Bahrain","BHR",2022-01-12,"Middle_East_North_Africa","C3: Cancel public events","1G","1G","No change, government website still recommends ""avoid mixing with people or attending public councils.""  https://archive.ph/xEZu5"
"5","Bahrain","BHR",2022-01-19,"Middle_East_North_Africa","C3: Cancel public events","2G","1G","Bahrain has announced the precautionary adoption of the coronavirus Yellow Alert Level starting Dec. 19 until Jan. 31 of 2022.     During this period, vaccinated individuals (green shield holders), those recovered from COVID-19, and children under the age of 12 who must be accompanied by a vaccinated or a recovered person are allowed to attend events, conferences, and sporting events, while non-vaccinated individuals aren't allowed to attend them.    https://web.archive.org/web/20220131205552/https://www.arabnews.com/node/1987216/middle-east  https://web.archive.org/web/20211206153449/https://healthalert.gov.bh/uploads/luyotccz_ikf.pdf"
"6","Bahrain","BHR",2022-01-19,"Middle_East_North_Africa","C4: Restrictions on gatherings","3G","0","Bahrain has announced the precautionary adoption of the coronavirus Yellow Alert Level starting Dec. 19 until Jan. 31 of 2022.    During this period, some activities are allowed for both, vaccinated and non-vaccinated individuals, this includes holding private events at home, with no more than 30 attendees. Vaccinated individuals can attend cinemas with up to 30% of the facility’s capacity, Indoor gyms, sports halls, swimming pools, and indoor events and conferences.    https://web.archive.org/web/20220131205552/https://www.arabnews.com/node/1987216/middle-east  https://web.archive.org/web/20211206153449/https://healthalert.gov.bh/uploads/luyotccz_ikf.pdf"
"7","Bahrain","BHR",2022-01-19,"Middle_East_North_Africa","C5: Close public transport","0","0","Is public transportation operating? Yes. Both vaccinated and non-vaccinated individuals are allowed to use it subject to mask-wearing.    https://web.archive.org/web/20220131220003/https://bh.usembassy.gov/covid-19-information/"
"8","Bahrain","BHR",2022-01-12,"Middle_East_North_Africa","C6: Stay at home requirements","1G","1G","No change, government still recommends to ""avoid mixing with people or attending public councils"".   https://archive.ph/xEZu5"
"9","Bahrain","BHR",2022-01-19,"Middle_East_North_Africa","C6: Stay at home requirements","1G","1G","Is a curfew in place? No, but the government advises citizens to refrain from interacting with people or attending social gatherings.    https://web.archive.org/web/20211122081303/https://healthalert.gov.bh/en/category/what-we-advise  https://web.archive.org/web/20220131220003/https://bh.usembassy.gov/covid-19-information/"
"10","Bahrain","BHR",2022-01-19,"Middle_East_North_Africa","C7: Restrictions on internal movement","0","0","Are there restrictions on intercity or interstate travel? No    https://web.archive.org/web/20220131220003/https://bh.usembassy.gov/covid-19-information/"
"11","Bahrain","BHR",2022-01-12,"Middle_East_North_Africa","C8: International travel controls","3","3","No change, passengers from several countries remain banned from international entry due to the recent Omicron variant. The Red List includes the Republic of South Africa, the Republic of Namibia, the Republic of Botswana, the Republic of Zimbabwe, the Kingdom of Lesotho, the Kingdom of Eswatini, the Republic of Malawi, the Republic of Mozambique, the Republic of Angola, the Republic of Zambia, and the Federal Republic of Nigeria. Screening with PCR testing and possibly precautionary quarantine applies for most other passengers.   https://archive.ph/JnsKS  https://archive.ph/rtYim"
"12","Bahrain","BHR",2022-01-19,"Middle_East_North_Africa","C8: International travel controls","2","3","- All unvaccinated arrivals aged 12 years and above, must quarantine for 10 days.     -All vaccination certificates issued from GCC countries, or issued by countries which Bahrain has signed a mutual vaccination recognition agreement, or issued by countries whose citizens are eligible for a visa on arrival will be accepted upon entry, or containing a QR code for vaccines approved by the World Health Organization, or the Kingdom of Bahrain, will be accepted upon entry will be accepted.    - Fully vaccinated: completed 14 days after the second dose in a two-dose vaccination series (e.g. Pfizer, Moderna, AstraZeneca, etc.) or completed 14 days after administration of a single dose for single-dose vaccination series (e.g. Johnson & Johnson).    - All passengers and airline staff are screened at all entry points of the airport and at travel gates.  - All travelers arriving in the Kingdom of Bahrain aged 6 years and above are required to:  1. Present a verified PCR test certificate bearing a QR code, administered no more than 72 hours before boarding the inbound flight.   2. Take a PCR test upon arrival.  3. Recently recovered passengers (age 6 years and above) are not required to present a negative PCR test before departure. In lieu of a negative PCR test, passengers who have recently recovered from a COVID-19 infection can present documentary proof in the form of a recovery certificate or a positive PCR test taken no later than 14 days prior to departure and no earlier than 30 days prior to departure. Passengers are still required to undergo a PCR test on arrival in Bahrain.    https://web.archive.org/web/20220130141228/https://www.bahrainairport.bh/covid-19-travel-information"
"13","Bahrain","BHR",2022-01-12,"Middle_East_North_Africa","H1: Public information campaigns","2G","2G","Regularly updated government website with information about pandemic.   https://archive.ph/bOhER"
"14","Bahrain","BHR",2022-01-19,"Middle_East_North_Africa","H1: Public information campaigns","2G","2G","Coordinated public information is available and regularly updated.    https://web.archive.org/web/20211122081303/https://healthalert.gov.bh/en/category/what-we-advise"
"15","Bahrain","BHR",2022-01-12,"Middle_East_North_Africa","H2: Testing policy","3","3","PCR testing is widely available to the public.   https://archive.ph/iWFsZ"
"16","Bahrain","BHR",2022-01-19,"Middle_East_North_Africa","H2: Testing policy","3","3","COVID-19 tests through the 444 hotline are free for citizens and residents of Bahrain.    https://web.archive.org/web/20220131220003/https://bh.usembassy.gov/covid-19-information/"
"17","Bahrain","BHR",2022-01-12,"Middle_East_North_Africa","H3: Contact tracing","2","2","Comprehensive contact tracing is occurring, not via app however.   https://archive.ph/wWttZ"
"18","Bahrain","BHR",2022-01-19,"Middle_East_North_Africa","H3: Contact tracing","2","2","All arrivals to Bahrain must activate the 'BeAware Bahrain' application.    https://web.archive.org/web/20220130141228/https://www.bahrainairport.bh/covid-19-travel-information"
"19","Bahrain","BHR",2022-01-12,"Middle_East_North_Africa","H6: Facial Coverings","2G","2G","It is required to wear a mask indoors at all times at current green alert level. Mask wearing is mandatory outdoors during Yellow, Orange, and Red levels.  https://archive.ph/sZBD8"
"20","Bahrain","BHR",2022-01-19,"Middle_East_North_Africa","H6: Facial Coverings","4G","2G","The current COVID Alert level is yellow. It is required to wear a mask indoors at all times. Mask wearing is mandatory outdoors during Yellow, Orange, and Red levels.    https://web.archive.org/web/20220131220003/https://bh.usembassy.gov/covid-19-information/"
"21","Bahrain","BHR",2022-01-12,"Middle_East_North_Africa","H7: Vaccination policy","5G","5G","Government has called for all to receive vaccine at no cost to the individual.   https://archive.ph/U4axz"
"22","Bahrain","BHR",2022-01-19,"Middle_East_North_Africa","H7: Vaccination policy","5G","5G","Citizens and residents of Bahrain can now register for the Pfizer-BioNTech, Sinopharm, AstraZeneca, or Sputnik V COVID-19 vaccines on the Ministry of Health’s website.    https://web.archive.org/web/20220131220003/https://bh.usembassy.gov/covid-19-information/"
"23","Bahrain","BHR",2022-01-12,"Middle_East_North_Africa","H8: Protection of elderly people","2G","2G","Mobile vaccination units exist to serve elderly in special circumstances.   https://archive.ph/71jxS"
"24","Bahrain","BHR",2022-01-19,"Middle_East_North_Africa","H8: Protection of elderly people","2G","2G","Bahrain has launched mobile units providing home vaccinations against COVID-19 for the elderly and people with special needs. Bahrain’s official news agency BNA said that the service is the first of its kind in the region and is offered by medical teams who make home visits to the people who cannot make it to the vaccination centres and give them the jabs.    https://web.archive.org/web/20210406052034/https://gulfnews.com/world/gulf/bahrain/bahrain-launches-mobile-covid-19-vaccination-service-1.76481985"
"25","Bahrain","BHR",2022-01-19,"Middle_East_North_Africa","V2: Vaccine Availability","19389","19387","Bahrain has approved the Sinopharm COVID-19 vaccine for children aged between 3 and 11 years from October 27, the state media office said on Tuesday.    https://web.archive.org/web/20211216011401/https://english.alarabiya.net/coronavirus/2021/10/26/Bahrain-approves-Sinopharm-COVID-19-vaccine-for-children-ages-3-11-"
"26","Bahrain","BHR",2022-01-19,"Middle_East_North_Africa","V3: Vaccine Financial Support","19389","19387","Vaccines are government-funded.    https://web.archive.org/web/20211216011401/https://english.alarabiya.net/coronavirus/2021/10/26/Bahrain-approves-Sinopharm-COVID-19-vaccine-for-children-ages-3-11-"
"27","Algeria","DZA",2022-01-11,"Middle_East_North_Africa","C1: School closing","1G","0","05/02/22    Schools are fully opened.  https://web.archive.org/web/20220205211636/https://en.unesco.org/covid19/educationresponse"
"28","Algeria","DZA",2022-01-11,"Middle_East_North_Africa","C2: Workplace closing","1G","2T","05/02/22    There is no specific information on workplace but other places are open and therefore it implies that workplaces are open.  Recreational areas, beaches, cultural centres, sports facilities, restaurants, fast food outlets, cafes and most markets are open. Weddings, funerals and other large gatherings are allowed within certain rules.    https://web.archive.org/web/20220205214551/https://www.gov.uk/foreign-travel-advice/algeria/coronavirus  https://web.archive.org/web/20220205214630/https://www.atlys.com/covid/algeria?from=united-states"
"29","Algeria","DZA",2022-01-11,"Middle_East_North_Africa","C3: Cancel public events","2G","2G","05/02/22    Recreational areas, beaches, cultural centres, sports facilities, restaurants, fast food outlets, cafes and most markets are open. Weddings, funerals and other large gatherings are allowed within certain rules.    https://web.archive.org/web/20220205214551/https://www.gov.uk/foreign-travel-advice/algeria/coronavirus"
"30","Algeria","DZA",2022-01-11,"Middle_East_North_Africa","C4: Restrictions on gatherings","4G","4G","05/02/22    Additionally, the “vaccination pass” is required to access public spaces and buildings to include:     Stadiums and locations for sporting events  Sports halls, gyms, and swimming pools  Meetings, seminars, and conferences  Cinemas, theaters, museums, and entertainment venues  National and local festivities and events  Lounges and exhibition fairs  Party halls  Hammams    https://web.archive.org/web/20220205220623/https://dz.usembassy.gov/covid-19-information/"
"31","Algeria","DZA",2022-01-11,"Middle_East_North_Africa","C5: Close public transport","1G","1T","05/01/22    According to atlys travel guide website, public transportations are operational but there are certain restrictions in place.  https://web.archive.org/web/20220205214630/https://www.atlys.com/covid/algeria?from=united-states    ""Travel between provinces is now permitted though public transport options remain limited.""  https://web.archive.org/web/20220205214551/https://www.gov.uk/foreign-travel-advice/algeria/coronavirus"
"32","Algeria","DZA",2022-01-11,"Middle_East_North_Africa","C6: Stay at home requirements","0","0","05/01/22    There is no indication of people having to stay at home.  https://web.archive.org/web/20220205214630/https://www.atlys.com/covid/algeria?from=united-states"
"33","Algeria","DZA",2022-01-11,"Middle_East_North_Africa","C7: Restrictions on internal movement","0","0","05/01/22  ""Travel between provinces is now permitted though public transport options remain limited.""  https://web.archive.org/web/20220205214551/https://www.gov.uk/foreign-travel-advice/algeria/coronavirus"
"34","Algeria","DZA",2022-01-11,"Middle_East_North_Africa","C8: International travel controls","3","1","05/01/22    From 1 June 2021, Algeria’s borders have been partially open. However, there remain limitations on routes into and out of Algeria. See Entry requirements for further information on rules for entry to Algeria.  A limited commercial flight schedule is operating. Demand for flights remains high, which you should take into account when making travel arrangements.  Airlines can be contacted via their websites or call centres for more information.  https://web.archive.org/web/20220205214551/https://www.gov.uk/foreign-travel-advice/algeria/coronavirus    *** Effective January 5, 2022, the Algerian government is requiring all travelers over the age of 18 entering or exiting Algeria to present a “vaccination pass” that proves complete COVID-19 vaccination. *  https://web.archive.org/web/20220205220623/https://dz.usembassy.gov/covid-19-information/"
"35","Algeria","DZA",2022-01-11,"Middle_East_North_Africa","E1: Income support","1G","1G","05/02/22    Algeria has been hit by two shocks in 2020—the spread of COVID-19 and the sharp decline in oil prices. Government policy is responding to both shocks.    The first case of COVID-19 in Algeria was reported on February 25, 2020. The authorities responded to the pandemic by implementing containment measures since early February 2020 (e.g., cancelling flights, and imposing quarantines to repatriated Algerians). Confinement measures included closure of schools, universities, restaurants, and shops; cancellation of public and private events; shut down of transportation services (internal and external); putting on mandatory leave half of civil servants and private workers with full compensation. Demonstrations and religious activities were cancelled, a lockdown of affected areas was ordered and a curfew was put in place in several cities including Algiers.    A gradual easing of containment measured started in early June 2020. The authorities have continued to monitor and adapt the lockdown measures as needed, including during the second wave of the pandemic in Algeria in late 2020. International borders partially reopened in June 2021. The number of daily new cases, which had fallen sharply through late March 2021 following a peak during the second wave, is ticking up again. Algeria started the vaccination campaign in late-January 2021 and has since received additional doses through the COVAX Facility and other sources for a total of 2.7 million doses as at end-May 2021. Domestic production of the Sputnik V vaccine is expected to start in September, according to an official government announcement.      Key Policy Responses as of June 28, 2021    FISCAL  In terms of tax measures, in response to the economic impact on households and enterprises of the lockdown measures in 2020, the authorities postponed the declaration and payments of income taxes for individuals and enterprises. Further contractual deadlines were relaxed and penalties for companies that experience delays in completing public contracts were suspended. Imports of pharmaceutical products and medical equipment used in the fight against Covid-19 were temporarily exonerated from VAT and custom duties.    The 2021 budget law introduced a permanent tax holiday for foreign-currency-generating export activities and suspended VAT and custom duties for imported or domestically purchased inputs used in the production of goods. It also extended the repayment period of overdue tax claims to 60 months from 36 months previously,    In terms of spending measures, a supplementary finance law (SFL) enacted on June 4, 2020 included provisions amounting to DZD 70 bn dinars to mitigate the health and economic impacts of the COVID-19 crisis. For the health sector, this included DZD 3.7 bn for medical supplies, DZD 16.5 bn for bonus payments to health workers, and DZD 8.9 bn for the health sector's development. For the economic impact, the law included DZD 20 bn for allowances to the unemployed and DZD 11.5 bn for transfers to poor households. Overall, in order to adjust to the new low oil price environment, the SFL envisaged a reduction in current and capital spending by 5.7 percent (representing 2.2 percent of 2019 GDP) compared to the initial 2020 budget law.    The government estimates the total budget cost of spending measures taken in response to the pandemic at DZD 238 bn for 2020 and the first four months of 2021. Of this amount, DZD 99.1bn were in exceptional bonuses to civil servants contributing to the fight against the pandemic, mostly health workers, DZD73bn were in social support measures to low-income households and DZD 22.5bn for vaccine procurement.    In terms of economic reforms, a national socio-economic recovery plan was discussed at a conference in August 2020. The authorities published a 2020-2024 Economic Revival plan in June 2021. Among other things the plan aims at diversifying the economy, fostering high value-added sectors and international trade and promoting a favorable business climate and FDI.    MONETARY AND MACRO-FINANCIAL   On March 15, the Bank of Algeria lowered the reserve requirement ratio from 10 percent to 8 percent, and its main policy rate by 25 basis points to 3.25 percent.    On April 6, the Bank of Algeria announced that it was easing solvency, liquidity and NPLs ratios for banks. Banks are also allowed to extend payments of some loans without a need to provision against them.    On April 30, the Bank of Algeria announced that it was cutting its main policy rate from 3.25 to 3.00 percent, that it was lowering its reserve requirement ratio from 8 percent to 6 percent, and that it was lowering haircuts on government securities used in refinancing operations.    On September 14, the Bank of Algeria announced a reduction in the reserve requirement ratio from 6 percent to 3 percent and the activation of 1-month open market operations.    On October 14, 2020, the Bank of Algeria announced that the easing of prudential requirements for banks, announced in April 2020, would be extended through the end of the year.    On January 6, 2021, the Bank of Algeria announced that the easing of prudential requirements for banks, first announced in April 2020, would be extended through March 31, 2021. On February 8 2021, the Bank of Algeria announced a reduction in the reserve requirement ratio from 3 percent to 2 percent effective February 15, 2021.    On April 1, 2021, the Bank of Algeria announced that the easing of prudential requirements for banks, first announced in April 2020, would be extended through June 30, 2021.    EXCHANGE RATE AND BALANCE OF PAYMENTS  The authorities announced several measures to cut the import bill by at least USD 10 bn (6 percent of GDP). Authorities banned exports of several products, including food, medical and hygiene items.    https://web.archive.org/web/20220205223224/https://www.imf.org/en/Topics/imf-and-covid19/Policy-Responses-to-COVID-19"
