"","CountryName","CountryCode","Date","region","PolicyType","PolicyCode","previous_PolicyCode","Notes"
"1","Andorra","AND",2022-02-11,"Europe_Central_Asia","C1: School closing","1G","1G","Masks indoors. https://archive.vn/CA2nB"
"2","Andorra","AND",2022-02-11,"Europe_Central_Asia","C2: Workplace closing","1G","1G","Covid certificate required and masks indoors. Removal of a swathe of restrictions related to capacity. https://archive.vn/CA2nB"
"3","Andorra","AND",2022-02-15,"Europe_Central_Asia","C2: Workplace closing","1G","1G","No changes. Masks still required indoors and COVID certificate required (same mask requirement for vaccinated as unvaccinated so 1 coded for both). https://archive.vn/Ko7N2"
"4","Andorra","AND",2022-02-11,"Europe_Central_Asia","C3: Cancel public events","1G","1G","Events with over 300 people require masks. https://archive.vn/CA2nB"
"5","Andorra","AND",2022-02-11,"Europe_Central_Asia","C4: Restrictions on gatherings","2G","2G","Removal of a swathe of restrictions related to capacity. Over 300 people, masks required. https://archive.vn/CA2nB"
"6","Andorra","AND",2022-02-11,"Europe_Central_Asia","C5: Close public transport","0","0","No changes. https://archive.vn/CA2nB"
"7","Andorra","AND",2022-02-15,"Europe_Central_Asia","C5: Close public transport","0","0","No changes. https://archive.vn/Ko7N2"
"8","Andorra","AND",2022-02-11,"Europe_Central_Asia","C6: Stay at home requirements","0","0","No changes. https://archive.vn/CA2nB"
"9","Andorra","AND",2022-02-15,"Europe_Central_Asia","C6: Stay at home requirements","0","0","No changes. https://archive.vn/Ko7N2"
"10","Andorra","AND",2022-02-11,"Europe_Central_Asia","C7: Restrictions on internal movement","0","0","No changes. https://archive.vn/CA2nB"
"11","Andorra","AND",2022-02-15,"Europe_Central_Asia","C7: Restrictions on internal movement","0","0","No changes. https://archive.vn/Ko7N2"
"12","Andorra","AND",2022-02-15,"Europe_Central_Asia","C8: International travel controls","2","2","No changes on previous week. https://archive.vn/3Gtcx"
"13","Andorra","AND",2022-02-15,"Europe_Central_Asia","E1: Income support","2G","2G","Only in the event of taking care of a child under 14 years old ill with COVID-19 or a child with disabilities are parents able to claim back income from government. https://archive.vn/0Eu69"
"14","Andorra","AND",2022-02-11,"Europe_Central_Asia","H1: Public information campaigns","2G","2G","No changes. https://archive.vn/CA2nB"
"15","Andorra","AND",2022-02-15,"Europe_Central_Asia","H1: Public information campaigns","2G","2G","No changes. https://archive.vn/Ko7N2"
"16","Andorra","AND",2022-02-11,"Europe_Central_Asia","H2: Testing policy","3","3","No changes. https://archive.vn/CA2nB"
"17","Andorra","AND",2022-02-15,"Europe_Central_Asia","H2: Testing policy","3","3","No changes. https://archive.vn/3HbJW"
"18","Andorra","AND",2022-02-11,"Europe_Central_Asia","H3: Contact tracing","2","2","No changes. https://archive.vn/CA2nB"
"19","Andorra","AND",2022-02-15,"Europe_Central_Asia","H3: Contact tracing","2","2","No changes. https://archive.vn/3HbJW"
"20","Andorra","AND",2022-02-11,"Europe_Central_Asia","H6: Facial Coverings","2G","2G","Masks required indoors. Mandate scaled-down. https://archive.vn/CA2nB"
"21","Andorra","AND",2022-02-15,"Europe_Central_Asia","H6: Facial Coverings","2G","2G","Masks still required indoors (exclusion of schools). https://archive.vn/Ko7N2"
"22","Andorra","AND",2022-02-11,"Europe_Central_Asia","H7: Vaccination policy","5G","5G","No changes. https://archive.vn/CA2nB"
"23","Andorra","AND",2022-02-15,"Europe_Central_Asia","H7: Vaccination policy","5G","5G","No changes, now 85% of those over 16 have received one dose of vaccine. https://archive.vn/3HbJW"
"24","Austria","AUT",2022-01-31,"Europe_Central_Asia","C1: School closing","2T","2T","Schools are open to anyone who needs them. Masks are compulsory throughout the school building, as well as in classrooms and group rooms. If students are in the school building and do not have proof of 2G, antigen or PCR tests must be carried out at least twice a week. However, these must be carried out so often that valid proof must be submitted for each day of the teaching week. If the test intervals are observed, this also applies to the sixth and seventh day after the first test    Source: https://archive.vn/hh6W3 .[Nationwide measures]"
"25","Austria","AUT",2022-02-04,"Europe_Central_Asia","C1: School closing","2T","2T","""Schools are open to anyone who needs them. Masks are compulsory throughout the school building, as well as in classrooms and group rooms. If students are in the school building and do not have proof of 2G, antigen or PCR tests must be carried out at least twice a week. However, these must be carried out so often that valid proof must be submitted for each day of the teaching week. If the test intervals are observed, this also applies to the sixth and seventh day after the first test.""    ""Since week 38/2021, the Corona Commission has been determining the epidemiological risk for the educational institutions in each federal state. On the basis of this classification, the education department determines the risk level for the federal state in agreement with the central office by ordinance. The responsible education department then informs the schools. Defined framework conditions also enable flexible measures to be taken at the school location. ""    Source: https://web.archive.org/web/20220204182451/https://corona-ampel.gv.at/aktuelle-massnahmen/bundesweite-massnahmen/"
"26","Austria","AUT",2022-02-10,"Europe_Central_Asia","C1: School closing","2T","2T","On February 10, 2022, the Corona Commission classified all of Austria and all federal states as very high risk. There is still a safety phase in schools with risk level III measures.    Source: https://archive.vn/t4cJm#selection-541.0-549.69 [Corona traffic light map]"
"27","Austria","AUT",2022-02-11,"Europe_Central_Asia","C1: School closing","2T","2T","Schools are open to anyone who needs them. Masks are compulsory throughout the school building, as well as in classrooms and group rooms. If students are in the school building and do not have proof of 2G, antigen or PCR tests must be carried out at least twice a week. However, these must be carried out so often that valid proof must be submitted for each day of the teaching week. If the test intervals are observed, this also applies to the sixth and seventh day after the first test.    Since week 38/2021, the Corona Commission has been determining the epidemiological risk for the educational institutions in each federal state. On the basis of this classification, the education department determines the risk level for the federal state in agreement with the central office by ordinance. The responsible education department then informs the schools. Defined framework conditions also enable flexible measures to be taken at the school location.     The rules of the meetings apply to extracurricular youth education, youth work and supervised holiday camps. In addition, the following applies:  •	Persons are allowed to participate with a 2.5G proof  •	A maximum of eight supervisors per group of 50 participants are allowed.  •	If it can be credibly demonstrated that a negative PCR test cannot be presented for reasons of lack of availability, an untimely evaluation or due to the unpredictability of the official activity to be performed, operators may exceptionally admit persons even if they have 3G proof submit. This also applies to operators.    Employees in elementary educational institutions, facilities for extracurricular childcare and childminders are obliged to provide evidence of a negative PCR test twice a week. The test may not have been carried out more than 72 hours ago.     Source: https://web.archive.org/web/20220211185204/https://corona-ampel.gv.at/aktuelle-massnahmen/bundesweite-massnahmen/"
"28","Austria","AUT",2022-02-12,"Europe_Central_Asia","C1: School closing","2T","2T","Schools are open to anyone who needs them. Masks are compulsory throughout the school building, as well as in classrooms and group rooms. If students are in the school building and do not have proof of 2G, antigen or PCR tests must be carried out at least twice a week. However, these must be carried out so often that valid proof must be submitted for each day of the teaching week. If the test intervals are observed, this also applies to the sixth and seventh day after the first test.    *Targetted*  Since week 38/2021, the Corona Commission has been determining the epidemiological risk for the educational institutions in each federal state. On the basis of this classification, the education department determines the risk level for the federal state in agreement with the central office by ordinance. The responsible education department then informs the schools. Defined framework conditions also enable flexible measures to be taken at the school location.     *Youth work*  The rules for gatherings apply to gatherings of people in the context of extracurricular youth education and youth work or in the context of supervised holiday camps. In addition, the following applies:  •	The responsible person may only admit participants with a 2.5G proof.    *Requirement for testing for employees*  Employees in elementary educational institutions, facilities for extracurricular childcare and childminders are obliged to provide evidence of a negative PCR test twice a week. The test may not have been carried out more than 72 hours ago.     Source: https://web.archive.org/web/20220218132709/https://corona-ampel.gv.at/aktuelle-massnahmen/bundesweite-massnahmen/"
"29","Austria","AUT",2022-02-19,"Europe_Central_Asia","C1: School closing","2T","2T","Educational field  Since week 38/2021, the Corona Commission has been determining the epidemiological risk for the educational institutions in each federal state. On the basis of this classification, the education department determines the risk level for the federal state in agreement with the central office by ordinance. The responsible education department then informs the schools. Defined framework conditions also enable flexible measures to be taken at the school location. Further information can be found on the website of the  Federal Ministry of Education, Science and Research (BMBWF) .    Tests or G-proofs  Schools are open to anyone who needs them. If students are in the school building and do not have 2G proof, they must carry out antigen or PCR tests at least twice a week. These tests are to be carried out so often that valid evidence can be presented for each day of the teaching week. If the test intervals are observed, the test result is also valid on the sixth and seventh day after the first test.    Mask requirement  •	FFP2 mask requirement for everyone in the school or home, except students.  •	Pupils up to and including the 8th grade can wear an MNS, from the 9th grade onwards an FFP2 mask must be worn if they are not in their seat.  •	Physical education, movement-oriented classes in the classroom and in dormitories do not require a mask to be worn.    Extracurricular youth education, youth work and supervised holiday camps  •	Meeting rules apply  •	The responsible person may admit participants with a 3G proof.  •	Employees in elementary educational institutions, facilities for extracurricular childcare and childminders are obliged to provide evidence of a negative PCR test (sample collection max. 72 hours) twice a week.    For further binding regulations see  COVID-19 School Ordinance 2021/22 and its amendment as well as  COVID-19 Higher Education Act.    Sources:  https://archive.vn/5egKM [Nationwide measures]  https://web.archive.org/web/20220221202947/https://www.sozialministerium.at/Informationen-zum-Coronavirus/Coronavirus---Aktuelle-Ma%C3%9Fnahmen.html [Coronavirus: current measures]  https://archive.vn/DibEY [5th amendment to the 4th COVID-19 Measures Ordinance]"
"30","Austria","AUT",2022-01-31,"Europe_Central_Asia","C2: Workplace closing","3G","3G","At work  •	The professional activity should preferably take place outside the workplace, if this is possible and both employer and employee agree.  •	Employees, owners and operators may only enter workplaces where physical contact with other people cannot be ruled out with a 3G ID. (A maximum of two physical contacts per day, outdoors and lasting no longer than 15 minutes each, are not considered contacts).  •	An FFP2 mask should be worn if physical contact with people cannot be ruled out or the risk of infection can be minimized by other suitable protective measures.  •	Owners of a place of work with more than 51 employees must appoint a COVID-19 officer and develop and implement a COVID-19 prevention concept.  •	With regard to the wearing of a mask and the submission of proof of a low epidemiological risk, stricter regulations that go beyond this Ordinance can be provided for in justified cases.  •	If it can be credibly demonstrated that a negative PCR test cannot be presented for reasons of lack of availability, an untimely evaluation or due to the unpredictability of the official activity to be performed, operators may exceptionally admit persons even if they have 3G proof submit. This also applies to operators.    **Customer Areas**  •	 Commercial premises and (body-related) services may only be entered with a valid 2G ID. Operators must check the 2G proof of customers in customer areas - for the purpose of purchasing goods or using services - if possible upon entry, at the latest when purchasing goods or using the service.  •	Exceptions to the 2G obligation are establishments providing basic services, such as: public pharmacies, grocery stores and farmers' direct sellers, drugstores and drugstores, banks, petrol stations  •	The FFP2 mask requirement applies in closed rooms in the customer area of business premises as well as the connecting structures of structurally connected business premises (e.g. shopping centers, market halls).  •	Operators must appoint a COVID-19 officer and develop and implement a COVID-19 prevention concept.  •	Business premises may only be open between 5:00 a.m. and 10:00 p.m.    **Gastronomy and Accommodation**  Gastronomy  •	The gastronomy is open to customers with a valid 2G card.  •	Customers must be assigned a seat. The business premises may only be entered between 5:00 a.m. and 10:00 p.m.  •	Food and beverages may not be consumed in the immediate vicinity of the dispensing point and only while seated at the administration points. Outdoors, food and catering stands at administration points may also be consumed while standing.  •	The FFP2 mask requirement applies in closed rooms, but not while staying at the administration site.  •	Operators must appoint a COVID-19 officer and develop and implement a COVID-19 prevention concept.  •	Self-service is permitted provided that the risk of infection can be minimized through special hygienic precautions.  •	The collection of food and non-alcoholic beverages as well as alcoholic beverages in commercially sealed containers is permitted for everyone with an FFP2 mask, regardless of 2G proof. The food and drinks may not be consumed within a radius of 50 meters from the business premises.    Accommodation  •	Accommodation establishments (including campsites and shelters) may only be entered with a 2G ID.  •	When entering, the FFP2 mask requirement applies.  •	An exception to the 2G proof obligation can be made for the absolutely necessary period if a 3G proof is provided and if:  	o	Persons who were already being accommodated at the time this provision came into force, for the duration of the accommodation agreed in advance with the accommodation provider,  	o	for the purpose of caring for and providing assistance to people in need of support, professional reasons that cannot be postponed, satisfaction of an urgent need for housing, spa guests or patients in a spa or rehabilitation facility.  •	Exceptions apply to pupils for the purpose of attending school and students for study purposes.  •	Operators must appoint a COVID-19 officer and develop and implement a COVID-19 prevention concept.    **Leisure, sports and culture**  Leisure  Access to leisure facilities (such as leisure and amusement parks, swimming pools, dance schools, facilities for practicing prostitution, animal parks, etc.) is only permitted for people with a 2G card.  •	The FFP2 mask requirement applies in closed rooms  •	Opening hours are only allowed between 5:00 a.m. and 10:00 p.m.  •	Operators of leisure facilities must appoint a COVID-19 officer and develop and implement a COVID-19 prevention concept.    Arts and Culture  Access to art and cultural institutions (museums, art galleries, cultural exhibition halls, libraries, libraries, archives, theatres, cinemas, variety shows, cabarets, concert halls and arenas) is only permitted with a 2G ID.  •	The FFP2 mask requirement applies in closed rooms  •	Opening hours are only allowed between 5:00 a.m. and 10:00 p.m.  •	Operators of leisure facilities must appoint a COVID-19 officer and develop and implement a COVID-19 prevention concept.    Sports  •	Entering sports facilities for the purpose of practicing sports is only permitted under certain conditions:  	o	There is a 2G proof for non-public sports facilities and an FFP2 mask requirement in closed rooms.  	o	 The opening hours of sports facilities are only permitted between 5:00 a.m. and 10:00 p.m.  	o	Without 2G proof, sports may only be practiced outdoors in public sports facilities. Closed premises may only be entered with an FFP2 mask if this is necessary to practice the sport outdoors. Staying in the sports facility is limited to the duration of the exercise.  •	Outdoor sports facilities are open to everyone regardless of 2G proof.  •	Operators of non-public sports facilities must appoint a COVID-19 officer and develop and implement a COVID-19 prevention concept.  •	elite sport:  	o	When sports are practiced by top athletes, a responsible doctor must draw up a COVID-19 prevention concept and compliance with it must be monitored on an ongoing basis.  	o	Top athletes, as well as their supervisors and trainers, must show proof of 3G for training and competitions if physical contact with other people cannot be ruled out.   	o	If a SARS-CoV-2 infection becomes known in an athlete, supervisor or trainer, all athletes, supervisors and trainers are to be in the following 14 days after the infection became known before each competition undergo a PCR test or an antigen test for the presence of SARS-CoV-2 infection.    VIENNA  Work  •	The 3G rule applies in the workplace, whereby the acceptance of the negative PCR test must not be older than 48 hours.  •	This also applies to external jobs (3G proof) and mobile care and support service providers ( 2.5G proof).    Sources:   https://archive.vn/hh6W3 .[Nationwide measures]  https://archive.vn/4E6Wl [Coronavirus: current measures]  https://web.archive.org/web/20220201224111/https://www.ris.bka.gv.at/Dokumente/BgblAuth/BGBLA_2022_II_34/BGBLA_2022_II_34.html [4th COVID-19 Measures Ordinance and amendment of the 4th COVID-19 Measures Ordinance (1st amendment to the 4th COVID-19-MV]  https://archive.vn/b1gXo [Measures for the entire federal state of Vienna]"
