"","CountryName","CountryCode","Date","region","PolicyType","PolicyCode","previous_PolicyCode","Notes"
"152","Bosnia and Herzegovina","BIH",2022-04-05,"Europe_Central_Asia","C8: International travel controls","1","1","Are U.S. citizens permitted to enter? Yes  U.S. citizens wishing to enter BiH must have one of the following: a negative COVID-19 test (PCR or antigen) not older than 48 hours if coming from Europe and not older than 72 hours if arriving from other countries (including the United States); or a COVID-19 vaccination certificate showing full vaccination completed 10 days prior to arrival; or a doctor’s certificate of COVID-19 recovery in the period 10 to 180 days prior to arrival.  Children until the age of seven, accompanied by a parent who meets the above conditions may enter without a COVID-19 test or certificate.  Foreign nationals who are permanently or temporarily resident in BiH may enter without a COVID-19 test or certificate if returning from Croatia, Montenegro or Serbia with stays in those countries for less than 48 hours.  Citizens of Croatia, Montenegro or Serbia may enter without a COVID-19 test or certificate when coming directly from those countries.  The BiH Border Police website has detailed information on entry and exit requirements and exceptions. For the most up-to-date information, visit their website or contact them directly by calling their Operations Center at +387 33 755 300.  Requirements and restrictions may change without advance notice.  Is a negative COVID-19 test (PCR and/or serology) required for entry? No.  See above.  Are health screening procedures in place at airports and other ports of entry? No  Nations bordering BiH also maintain border restrictions. For questions regarding those, please visit the following websites:    https://web.archive.org/web/20220501113228/https://ba.usembassy.gov/covid-19-information/"
"153","Bosnia and Herzegovina","BIH",2022-04-05,"Europe_Central_Asia","E1: Income support","0","0","No income support."
"154","Bosnia and Herzegovina","BIH",2022-04-05,"Europe_Central_Asia","E2: Debt/contract relief","0","0","No debt/contract relief."
"155","Bosnia and Herzegovina","BIH",2022-04-05,"Europe_Central_Asia","H1: Public information campaigns","2G","2G","Ministry of Health continues to post Covid-19 updates on its website and Facebook account.    https://web.archive.org/web/20220501114502/https://covid19.fmoh.gov.ba/novosti    (Facebook page won't record on Wayback but here is the web address for further evidence):  https://www.facebook.com/KrizniStabStozerFederalnogMinistarstvaZdravstva/"
"156","Bosnia and Herzegovina","BIH",2022-04-05,"Europe_Central_Asia","H2: Testing policy","2","2","Are PCR and/or antigen tests available for U.S. citizens in BiH? Yes  If so, are test results reliably available within 72 hours? Yes  Private and public clinics throughout BiH perform PCR and serological COVID-19 tests. Payment is due in full at the time of the test and current prices are roughly 100 convertible marks (km) for PCR and 40km for antigen.  Turnaround of results and availability of testing appointments vary based on the city yet clinics in most large cities have testing options daily and return results within 24 hours.  A list of clinics known to provide COVID-19 testing in BiH can be found on our website here  Public Health Centers (Dom Zdravlja) test symptomatic individuals regardless of nationality, free of charge. To arrange a test, contact your canton’s health center for additional guidance.    https://web.archive.org/web/20220501113228/https://ba.usembassy.gov/covid-19-information/"
"157","Bosnia and Herzegovina","BIH",2022-04-05,"Europe_Central_Asia","H3: Contact tracing","0","0","No evidence of contact tracing."
"158","Bosnia and Herzegovina","BIH",2022-04-05,"Europe_Central_Asia","H6: Facial Coverings","2G","2G","The new Order , which is in force since February 24, 2022. year, it is still mandatory to wear a mask indoors (with a distance of at least 2 meters) in all health care institutions, institutions that care for the elderly, institutions that care for and accommodate people with disabilities and people with mental disorders, criminal correctional and other social protection institutions, as well as means of public transport.    https://web.archive.org/web/20220228132129/https://covid19.fmoh.gov.ba/novost/867/na-snazi-nove-naredbe-kriznog-staba-federalnog-ministarstva-zdravstva    According to the recommendations of the FMZ Crisis Staff, it is recommended to wear protective masks indoors and outdoors if it is not possible to maintain a physical distance of two meters.     https://web.archive.org/web/20220228132129/https://covid19.fmoh.gov.ba/novost/867/na-snazi-nove-naredbe-kriznog-staba-federalnog-ministarstva-zdravstva"
"159","Bosnia and Herzegovina","BIH",2022-04-05,"Europe_Central_Asia","H7: Vaccination policy","5G","5G","Has the government of BiH approved a COVID-19 vaccine for use? Yes  Are vaccines available in BiH for U.S. citizens to receive? No  Eligible individuals (residents and/or persons with local health insurance) can sign up following instructions from their locality.  Which vaccines are available in BiH? Pfizer, AstraZeneca, Sputnik V, Sinopharm, Moderna  Follow official local sources (also see Local Resources, below) for announcements about vaccines in your area.  Visit the FDA’s website to learn more about FDA-approved vaccines in the United States.  The United States Government does not plan to provide COVID-19 vaccinations to private U.S. citizens overseas. Please follow host country developments and guidelines for COVID-19 vaccination.    https://web.archive.org/web/20220501113228/https://ba.usembassy.gov/covid-19-information/"
"160","Bosnia and Herzegovina","BIH",2022-04-05,"Europe_Central_Asia","H8: Protection of elderly people","2G","2G","The language in the latest report on 24/02/2022 specifies protections for elderly that have not previously been detected in earlier reports.    VII. ORDERS FOR INSTITUTIONS WHICH CARE FOR AND ACCOMMODATION OF ELDERLY PERSONS, INSTITUTIONS FOR CARE FOR ACCOMMODATION PERSONS WITH DEVELOPMENTAL DISABILITIES AND PERSONS WITH MENTAL DISABILITIES    1. Visits and outings to persons accommodated in social care institutions that care for and accommodate the elderly are allowed, provided that the institution must have an internal plan for visits to the institution, as well as a crisis plan in case of contagious COVID-19 disease.    https://web.archive.org/web/20220226222346/https://fbihvlada.gov.ba/uploads/documents/naredbe-2422022-prilog1_1645708827.pdf    The new Order , which is in force since February 24, 2022. year, it is still mandatory to wear a mask indoors (with a distance of at least 2 meters) in all health care institutions, institutions that care for the elderly, institutions that care for and accommodate people with disabilities and people with mental disorders, criminal correctional and other social protection institutions, as well as means of public transport.    https://web.archive.org/web/20220228132129/https://covid19.fmoh.gov.ba/novost/867/na-snazi-nove-naredbe-kriznog-staba-federalnog-ministarstva-zdravstva"
"161","Belarus","BLR",2022-04-16,"Europe_Central_Asia","C1: School closing","0","0","No policy found  https://web.archive.org/web/20220502085026/https://by.usembassy.gov/covid-19-information/  https://archive.ph/xSLyt"
"162","Belarus","BLR",2022-04-16,"Europe_Central_Asia","C2: Workplace closing","0","0","No policy found  https://web.archive.org/web/20220502085026/https://by.usembassy.gov/covid-19-information/  https://archive.ph/xSLyt"
"163","Belarus","BLR",2022-04-16,"Europe_Central_Asia","C3: Cancel public events","0","0","No policy found  https://web.archive.org/web/20220502085026/https://by.usembassy.gov/covid-19-information/  https://archive.ph/xSLyt"
"164","Belarus","BLR",2022-04-16,"Europe_Central_Asia","C4: Restrictions on gatherings","0","0","No policy found  https://web.archive.org/web/20220502085026/https://by.usembassy.gov/covid-19-information/  https://archive.ph/xSLyt"
"165","Belarus","BLR",2022-04-16,"Europe_Central_Asia","C5: Close public transport","0","0","No policy found  https://web.archive.org/web/20220502085026/https://by.usembassy.gov/covid-19-information/  https://archive.ph/xSLyt"
"166","Belarus","BLR",2022-04-16,"Europe_Central_Asia","C6: Stay at home requirements","0","0","No policy found  https://web.archive.org/web/20220502085026/https://by.usembassy.gov/covid-19-information/  https://archive.ph/xSLyt"
"167","Belarus","BLR",2022-04-16,"Europe_Central_Asia","C7: Restrictions on internal movement","0","0","No policy found  https://web.archive.org/web/20220502085026/https://by.usembassy.gov/covid-19-information/  https://archive.ph/xSLyt"
"168","Belarus","BLR",2022-04-16,"Europe_Central_Asia","C8: International travel controls","2","2","There are no restrictions on entry to Belarus for citizens of Belarus, foreign citizens and stateless persons. Foreigners and stateless persons, with the exception of certain categories , also require a PCR test or vaccination certificate upon entry.  Persons who are not vaccinated require to quarantine.    https://web.archive.org/web/20220502085026/https://by.usembassy.gov/covid-19-information/  https://web.archive.org/web/20220502085659/https://gpk.gov.by/covid-19/"
"169","Belarus","BLR",2022-04-16,"Europe_Central_Asia","E1: Income support","0","0","No policy found.  https://web.archive.org/web/20220502085026/https://by.usembassy.gov/covid-19-information/  https://archive.ph/xSLyt"
"170","Belarus","BLR",2022-04-16,"Europe_Central_Asia","E2: Debt/contract relief","0","0","No policy found.  https://web.archive.org/web/20220502085026/https://by.usembassy.gov/covid-19-information/  https://archive.ph/xSLyt"
"171","Belarus","BLR",2022-04-16,"Europe_Central_Asia","H1: Public information campaigns","2G","2G","Most information in russia.  https://archive.ph/xSLyt"
"172","Belarus","BLR",2022-04-16,"Europe_Central_Asia","H2: Testing policy","3","3","Tests can be obtained at the airport or health clinics in several cities.  It can take several days to weeks to schedule a test, and payment must be made at the time of the test, by the recipient.  Depending on the location, test results can be in either Russian, English, or both.  Test results will typically be a paper copy.  https://web.archive.org/web/20220502085026/https://by.usembassy.gov/covid-19-information/"
"173","Belarus","BLR",2022-04-16,"Europe_Central_Asia","H3: Contact tracing","0","0","No change in policy found.  https://archive.ph/xSLyt"
"174","Belarus","BLR",2022-04-16,"Europe_Central_Asia","H6: Facial Coverings","1G","1G","No change in policy found  https://web.archive.org/web/20220502085026/https://by.usembassy.gov/covid-19-information/  https://archive.ph/xSLyt"
"175","Belarus","BLR",2022-04-16,"Europe_Central_Asia","H7: Vaccination policy","5G","5G","Vaccines are generally available.    https://web.archive.org/web/20220502085026/https://by.usembassy.gov/covid-19-information/  https://archive.ph/xSLyt"
"176","Belarus","BLR",2022-04-16,"Europe_Central_Asia","H8: Protection of elderly people","0","0","No policy found  https://web.archive.org/web/20220502085026/https://by.usembassy.gov/covid-19-information/  https://archive.ph/xSLyt"
"177","Switzerland","CHE",2022-04-01,"Europe_Central_Asia","C1: School closing","0","0","As of April 1, all remaining covid-19 restrictions have been lifted    https://web.archive.org/web/20220418174730/https://www.swissinfo.ch/eng/covid-19_coronavirus--the-situation-in-switzerland/45592192    31/3/22  No change from previous coding. Restrictions are fully lifted from 1/4/22    No change until 31st March when all restrictions will go    There is no government mandate to wear a mask in a school since 17/2/22    In Switzerland masks must still be worn on public transport and in hospitals, clinics, retirement and care homes. But the following recommendation also applies: wear a mask in any situation where you want to protect yourself and others. The mask should always cover your nose and mouth.    https://web.archive.org/web/20220311100556/https://www.bag.admin.ch/bag/en/home/krankheiten/ausbrueche-epidemien-pandemien/aktuelle-ausbrueche-epidemien/novel-cov/masken.html#-655746524"
"178","Switzerland","CHE",2022-04-01,"Europe_Central_Asia","C2: Workplace closing","0","1G","As of April 1, all remaining covid-19 restrictions have been lifted    https://web.archive.org/web/20220418174730/https://www.swissinfo.ch/eng/covid-19_coronavirus--the-situation-in-switzerland/45592192    31/3/22  No change until rules expire after 31st March    Chapter 4a90 Measures to protect Employees at High Risk  90 Inserted by No I of the O of 13 Jan. 2021 (Employees at High Risk) (AS 2021 5). Amended by No I of the O of 17 Dec. 2021, in force from 1 Jan. 2022 until 31 March 2022 (AS 2021 881; Art. 29 para. 7).    Art. 27a  1 Employers shall enable their employees at high risk to carry out their working duties from home. They shall take the appropriate organisational and technical measures to achieve this.91    2 Where it is not possible for employees to carry out their regular working duties from home, employers shall, in derogation from the contract of employment and for the same pay, assign the employees concerned equivalent alternative work that can be performed from home.    3 Where for operational reasons the presence of employees at high risk in the workplace is essential at all or at certain times, they may carry out their regular activities in the workplace provided the following requirements are met:    a.  The workplace is organised so as to prevent any close contact with other persons, in particular by providing the employee concerned with his or her own room or a clearly separate working area.  b.  In cases where close contact cannot be avoided at all times, appropriate protective measures shall be taken in accordance with the STOP principle (substitution, technical measures, organisational measures, personal protective equipment).  4 If it is not possible for the employees concerned to work in accordance with paragraphs 1–3, the employer shall in derogation from the contract of employment assign them equivalent alternative work in their normal workplace for the same pay in conditions which meet the requirements of paragraph 3 letters a and b.    5 Before the employer takes any measures, he or she shall consult the employees concerned. The employer shall record the measures decided in writing and notify the employees of the same in a suitable manner.    6 The employee concerned may decline to carry out work assigned to him or her if the employer fails to meet the requirements of paragraphs 1–4 or if the employee regards his or her personal risk of infection with the coronavirus for specific reasons as being too high despite the employer taking measures in accordance with paragraphs 3 and 4. The employer may request a medical certificate.    7 If it is not possible for the employee concerned to work in accordance with paragraphs 1–4, or if the employee declines the work assigned in terms of paragraph 6, the employer shall furlough the employee while continuing to pay his or her salary.    8 Employees shall give notice that they are at high risk by making a personal declaration. The employer may request a medical certificate.    9 Article 2 paragraph 3quater of the COVID-19 Loss of Earnings Ordinance of 20 March 202092 governs claims for compensation for loss of earnings related to the corona pandemic.    10 The following persons are regarded as being at high risk:    a.  pregnant women;  b.  persons with the diseases or genetic anomalies listed in Annex 7 who cannot be vaccinated on medical grounds.  11 The following persons are not regarded as being at high risk:    a.  pregnant women who have been vaccinated against COVID-19, for 270 days from the date on which the vaccination is administered in full;  b.  persons specified in paragraph 10 who have been infected with Sars-CoV-2 and have recovered:1.  when based on a molecular-biological analysis for Sars-CoV-2: for 270 days from the eleventh day after confirmation of infection,  2.93  when based on an analysis for Sars-CoV-2 antibodies: for the period of validity of the related certificate (Art. 34a para. 1 let. c of the COVID-19 Ordinance on Certificates of 4 June 202194).95  12 The diseases and genetic anomalies referred to in paragraph 10 are defined in Annex 7 on the basis of medical criteria. The list of these criteria is not exhaustive. A clinical assessment of the risk in specific cases remains reserved and may lead to persons being classed as being at high risk under paragraph 10bis.    13 The FDHA shall continually update Annex 7 based on the state of science.    14 …96    https://web.archive.org/web/2/https://www.fedlex.admin.ch/eli/cc/2020/438/en  Enter new data here for Switzerland. Click this bar for further information/instructions.  Date from (inclusive)  01/04/2022  Date to (inclusive)  18/04/2022  Closure/Containment"
"179","Switzerland","CHE",2022-04-01,"Europe_Central_Asia","C3: Cancel public events","0","0","As of April 1, all remaining covid-19 restrictions have been lifted    https://web.archive.org/web/20220418174730/https://www.swissinfo.ch/eng/covid-19_coronavirus--the-situation-in-switzerland/45592192    31/3/22  No change until rules expire after 31st March    From 17 February: Almost all measures lifted  From Thursday, 17 February, the following protective measures will be lifted throughout Switzerland:  - mask requirement in shops, restaurants, as well as in other public settings (facilities, venues and events)  - mask requirement in the workplace  - access restrictions regulated by COVID certificate (3G, 2G and 2G+-rule) to facilities and venues such as cinemas, theatres and restaurants, as well as events  - permit requirement for large-scale events  - restrictions on private gatherings    In agreement with the Federal Council, voluntary capacity restrictions in the retail sector and in cablecars and gondolas will be lifted.    https://web.archive.org/web/2/https://www.admin.ch/gov/en/start/documentation/media-releases/media-releases-federal-council.msg-id-87216.html"
"180","Switzerland","CHE",2022-04-01,"Europe_Central_Asia","C4: Restrictions on gatherings","0","0","As of April 1, all remaining covid-19 restrictions have been lifted  https://web.archive.org/web/20220418174730/https://www.swissinfo.ch/eng/covid-19_coronavirus--the-situation-in-switzerland/45592192    31/3/22  No change until rules expire after 31st March    From 17 February: Almost all measures lifted  From Thursday, 17 February, the following protective measures will be lifted throughout Switzerland:  - mask requirement in shops, restaurants, as well as in other public settings (facilities, venues and events)  - mask requirement in the workplace  - access restrictions regulated by COVID certificate (3G, 2G and 2G+-rule) to facilities and venues such as cinemas, theatres and restaurants, as well as events  - permit requirement for large-scale events  - restrictions on private gatherings    In agreement with the Federal Council, voluntary capacity restrictions in the retail sector and in cablecars and gondolas will be lifted.    https://web.archive.org/web/2/https://www.admin.ch/gov/en/start/documentation/media-releases/media-releases-federal-council.msg-id-87216.html"
"181","Switzerland","CHE",2022-04-01,"Europe_Central_Asia","C5: Close public transport","0","0","As of April 1, all remaining covid-19 restrictions have been lifted. The lifted restrictions include mask wearing on public transport    https://web.archive.org/web/20220418174730/https://www.swissinfo.ch/eng/covid-19_coronavirus--the-situation-in-switzerland/45592192    31/3/22    Public transport is operating but masks must be worn.    https://archive.fo/ECS2a"
"182","Switzerland","CHE",2022-04-01,"Europe_Central_Asia","C6: Stay at home requirements","0","0","As of April 1, all remaining covid-19 restrictions have been lifted  https://web.archive.org/web/20220418174730/https://www.swissinfo.ch/eng/covid-19_coronavirus--the-situation-in-switzerland/45592192    31/3/22  No change until rules expire after 31st March    From 17 February: Almost all measures lifted  From Thursday, 17 February, the following protective measures will be lifted throughout Switzerland:  - mask requirement in shops, restaurants, as well as in other public settings (facilities, venues and events)  - mask requirement in the workplace  - access restrictions regulated by COVID certificate (3G, 2G and 2G+-rule) to facilities and venues such as cinemas, theatres and restaurants, as well as events  - permit requirement for large-scale events  - restrictions on private gatherings    In agreement with the Federal Council, voluntary capacity restrictions in the retail sector and in cablecars and gondolas will be lifted.    https://web.archive.org/web/2/https://www.admin.ch/gov/en/start/documentation/media-releases/media-releases-federal-council.msg-id-87216.html"
"183","Switzerland","CHE",2022-04-01,"Europe_Central_Asia","C7: Restrictions on internal movement","0","0","As of April 1, all remaining covid-19 restrictions have been lifted  https://web.archive.org/web/20220418174730/https://www.swissinfo.ch/eng/covid-19_coronavirus--the-situation-in-switzerland/45592192    31/3/22  No change until rules expire after 31st March    From 17 February: Almost all measures lifted  From Thursday, 17 February, the following protective measures will be lifted throughout Switzerland:  - mask requirement in shops, restaurants, as well as in other public settings (facilities, venues and events)  - mask requirement in the workplace  - access restrictions regulated by COVID certificate (3G, 2G and 2G+-rule) to facilities and venues such as cinemas, theatres and restaurants, as well as events  - permit requirement for large-scale events  - restrictions on private gatherings    In agreement with the Federal Council, voluntary capacity restrictions in the retail sector and in cablecars and gondolas will be lifted.    https://web.archive.org/web/2/https://www.admin.ch/gov/en/start/documentation/media-releases/media-releases-federal-council.msg-id-87216.html"
"184","Switzerland","CHE",2022-04-01,"Europe_Central_Asia","C8: International travel controls","3","3","No change to policy    31/3/22  Foreign Nationals    Art. 47 Border crossings and controls  1 The following persons shall be refused entry for a period of stay of up to three months that does not require a permit and does not involve gainful employment (Art. 10 of the Foreign Nationals and Integration Act of 16 December 20058 (FNIA):    foreign nationals who wish to enter Switzerland from a high-risk country or from a high-risk region and who do not fall within the scope of the Agreement of 21 June 19999 between the European Community and its Member States, of the one part, and the Swiss Confederation, of the other part, on the Free Movement of Persons (AFMP) or of the Convention of 4 January 196010 establishing the European Free Trade Association (EFTA Convention);  b. and c.11  ... .12  2 The following persons are exempt from this ban on entry:    a.13 persons who prove that they have been vaccinated against Sars-CoV-2; the persons who are regarded as having been vaccinated, the period for which the vaccination is valid, and the accepted forms of proof are regulated in Annex 1a number 1;  abis.14  persons who prove that they have been infected with Sars-CoV-2 and have recovered; the period for which exemption is valid and the accepted forms of proof are regulated in Annex 1a number 2;  b.  persons who provide credible evidence that they are in a situation of special necessity;  c.15  persons under the age of 18.16  2bis ...17    2ter The exemptions under paragraph 2 letters a, abis and c do not apply to persons who wish to enter Switzerland from a country or region listed in Annex 1 number 2.18    2quater The State Secretariat for Migration (SEM) shall issue the required directives on exceptions to the ban on entry.19    3 Decisions taken by the competent authorities may be enforced immediately. Article 65 of the FNIA applies mutatis mutandis. An appeal may be filed against the SEM decision within 30 days of notification. The appeal does not have suspensive effect.    4 The criminal provisions of Article 115 FNIA apply mutatis mutandis. In the event of any violation of the provision on entry, a ban on entry may also be imposed.    https://web.archive.org/web/20220311183954/https://www.fedlex.admin.ch/eli/cc/2020/438/en"
"185","Switzerland","CHE",2022-04-01,"Europe_Central_Asia","E1: Income support","2G","2G","No change - April 1    31/3/22  No change  Loss of earnings payments to continue for certain groups of people  Once measures are lifted, there will no longer be a need for most economic support measures. Therefore, claims for loss of earnings as a result of business closures, event bans, reduced working hours and a shortfall in outside care will no longer be possible from 17 February.      An exception applies until 30 June for persons working in the events sector whose employment is significantly restricted due to measures to combat the COVID-19 epidemic. An exception also applies until the end of March for persons who have to interrupt work due to their need to protect themselves. Overall, the rapid lifting of measures should result in a reduction in expenditure of several hundred million Swiss francs  compared to the budgeted amounts.    https://web.archive.org/web/20220218091949/https://www.admin.ch/gov/en/start/documentation/media-releases/media-releases-federal-council.msg-id-87216.html"
"186","Switzerland","CHE",2022-04-01,"Europe_Central_Asia","H1: Public information campaigns","2G","2G","April 1  No changes. Great public information.    https://archive.fo/ECS2a"
