countryname,countrycode,region,date,policytype,policyvalue,flag,new_level,prev_level,notes
Malaysia,MYS,East_Asia_Pacific,20200803,C7: Restrictions on internal movement,2,0,2T,0,"Four sub-districts in the Malaysian state of Kedah have been put under the ""targeted enhanced move control order (MCO)"" following the growing number of Covid-19 cases linked to the Sivagangga cluster in the state.  It is learnt that the targeted enhanced MCO would affect the movement of people living within 1km radius of a restaurant in Kubang Pasu, in which the owner is said to have tested positive for Covid-19.  https://web.archive.org/web/20200804131004/http://www.straitstimes.com/asia/se-asia/4-areas-in-malaysias-kedah-under-lockdown-5-schools-ordered-to-close-amid-rise-in-covid"
Malaysia,MYS,East_Asia_Pacific,20200806,C2: Workplace closing,2,1,2G,2G,"""Malaysia has a ‘Recovery Movement Control Order’ (RMCO) in place until 31 August 2020. The RMCO will allow the majority of business, religious and social activities to operate under strict hygiene and social distancing practices. Activities which pose a higher risk of COVID--19 transmission remain prohibited including nightclubs, pubs, amusement parks, reflexology and massage centres, open houses, mass social gatherings and mass religious gatherings.""  https://web.archive.org/web/20200818011432/https://www.smartraveller.gov.au/destinations/asia/malaysia"
Malaysia,MYS,East_Asia_Pacific,20200806,C3: Cancel public events,2,1,2G,2G,"""Activities which pose a higher risk of COVID--19 transmission remain prohibited including ... mass social gatherings and mass religious gatherings.""  https://web.archive.org/web/20200818011432/https://www.smartraveller.gov.au/destinations/asia/malaysia"
Malaysia,MYS,East_Asia_Pacific,20200806,C7: Restrictions on internal movement,2,0,2T,2T,"""Domestic travel within Malaysia is permitted, except to Enhanced Movement Control Order areas.""  https://web.archive.org/web/20200818011432/https://www.smartraveller.gov.au/destinations/asia/malaysia"
Malaysia,MYS,East_Asia_Pacific,20200806,C8: International travel controls,3,.,3.,3.,"""Tourists are not permitted to enter Malaysia. All foreigners who are given permission to enter Malaysia are subject to 14 days quarantine on arrival.""  https://web.archive.org/web/20200818011432/https://www.smartraveller.gov.au/destinations/asia/malaysia"
Malaysia,MYS,East_Asia_Pacific,20200806,E1: Income support,1,1,1A,1A,"Wage Subsidy Program continues, as planned and documented above, with cut off for applications 30th Sept."
New Zealand,NZL,East_Asia_Pacific,20200812,C1: School closing,2,0,2T,0,"Wednesday 12 August- Schools to close     Prime Minister Jacinda Ardern has announced Auckland will go into Level 3 lockdown and the rest of the country will go into Level 2 as of Midday Wednesday 12 August, following a family in Auckland confirmed as having COVID-19.    “Auckland region will move to Alert Level 3 at 12 noon on Wednesday 12 August 2020.  It will remain at Alert Level 3 for at least 3 days. This will give us time to assess the situation and gather information, including contact tracing, so we can find out more about how the case arose. If you are in Auckland, this is what you should do while we minimise the risk of transmission”     “""After 102 days, we have our first cases of Covid-19 outside of managed isolation or quarantine facilities... we have all worked incredibly hard to prevent this scenario,""    Media Article 1: https://web.archive.org/web/20200811140238/https://www.nzherald.co.nz/nz/news/article.cfm?c_id=1&objectid=12355759    Media Article 2: https://web.archive.org/web/20200811141448/https://news.sky.com/story/coronavirus-breaks-out-again-in-new-zealand-after-102-days-12047011    Government Unite Against Covid Website https://web.archive.org/web/20200811140440/https://covid19.govt.nz/updates-and-resources/latest-updates/new-zealands-alert-levels-are-changing-at-12-noon-on-wednesday-12-august/    Government Unite Against Covid Website with Level 3 restrictions for Auckland: https://web.archive.org/web/20200811140651/https://covid19.govt.nz/covid-19/restrictions/auckland/    Jacinda Ardern Press Conference: https://web.archive.org/web/20200811141724/https://www.youtube.com/watch?v=Yhr-GB5kcPg  "
New Zealand,NZL,East_Asia_Pacific,20200812,C2: Workplace closing,3,0,3T,0,"All but essential services to close in Auckland.  Wednesday 12 August    Prime Minister Jacinda Ardern has announced Auckland will go into Level 3 lockdown and the rest of the country will go into Level 2 as of Midday Wednesday 12 August, following a family in Auckland confirmed as having COVID-19.    “Auckland region will move to Alert Level 3 at 12 noon on Wednesday 12 August 2020.  It will remain at Alert Level 3 for at least 3 days. This will give us time to assess the situation and gather information, including contact tracing, so we can find out more about how the case arose. If you are in Auckland, this is what you should do while we minimise the risk of transmission”     “""After 102 days, we have our first cases of Covid-19 outside of managed isolation or quarantine facilities... we have all worked incredibly hard to prevent this scenario,""    Media Article 1: https://web.archive.org/web/20200811140238/https://www.nzherald.co.nz/nz/news/article.cfm?c_id=1&objectid=12355759    Media Article 2: https://web.archive.org/web/20200811141448/https://news.sky.com/story/coronavirus-breaks-out-again-in-new-zealand-after-102-days-12047011    Government Unite Against Covid Website https://web.archive.org/web/20200811140440/https://covid19.govt.nz/updates-and-resources/latest-updates/new-zealands-alert-levels-are-changing-at-12-noon-on-wednesday-12-august/    Government Unite Against Covid Website with Level 3 restrictions for Auckland: https://web.archive.org/web/20200811140651/https://covid19.govt.nz/covid-19/restrictions/auckland/    Jacinda Ardern Press Conference: https://web.archive.org/web/20200811141724/https://www.youtube.com/watch?v=Yhr-GB5kcPg"
New Zealand,NZL,East_Asia_Pacific,20200812,C3: Cancel public events,2,0,2T,0,"Wednesday 12 August   Gatherings of up to 10 people can continue, but only for wedding services, funerals and tangihanga.  Prime Minister Jacinda Ardern has announced Auckland will go into Level 3 lockdown and the rest of the country will go into Level 2 as of Midday Wednesday 12 August, following a family in Auckland confirmed as having COVID-19.    “Auckland region will move to Alert Level 3 at 12 noon on Wednesday 12 August 2020.  It will remain at Alert Level 3 for at least 3 days. This will give us time to assess the situation and gather information, including contact tracing, so we can find out more about how the case arose. If you are in Auckland, this is what you should do while we minimise the risk of transmission”     “""After 102 days, we have our first cases of Covid-19 outside of managed isolation or quarantine facilities... we have all worked incredibly hard to prevent this scenario,""    Media Article 1: https://web.archive.org/web/20200811140238/https://www.nzherald.co.nz/nz/news/article.cfm?c_id=1&objectid=12355759    Media Article 2: https://web.archive.org/web/20200811141448/https://news.sky.com/story/coronavirus-breaks-out-again-in-new-zealand-after-102-days-12047011    Government Unite Against Covid Website https://web.archive.org/web/20200811140440/https://covid19.govt.nz/updates-and-resources/latest-updates/new-zealands-alert-levels-are-changing-at-12-noon-on-wednesday-12-august/    Government Unite Against Covid Website with Level 3 restrictions for Auckland: https://web.archive.org/web/20200811140651/https://covid19.govt.nz/covid-19/restrictions/auckland/    Jacinda Ardern Press Conference: https://web.archive.org/web/20200811141724/https://www.youtube.com/watch?v=Yhr-GB5kcPg"
New Zealand,NZL,East_Asia_Pacific,20200812,C4: Restrictions on gatherings,4,0,4T,0,"Wednesday 12 August   Gatherings of up to 10 people can continue, but only for wedding services, funerals and tangihanga.  Prime Minister Jacinda Ardern has announced Auckland will go into Level 3 lockdown and the rest of the country will go into Level 2 as of Midday Wednesday 12 August, following a family in Auckland confirmed as having COVID-19.    “Auckland region will move to Alert Level 3 at 12 noon on Wednesday 12 August 2020.  It will remain at Alert Level 3 for at least 3 days. This will give us time to assess the situation and gather information, including contact tracing, so we can find out more about how the case arose. If you are in Auckland, this is what you should do while we minimise the risk of transmission”     “""After 102 days, we have our first cases of Covid-19 outside of managed isolation or quarantine facilities... we have all worked incredibly hard to prevent this scenario,""    Media Article 1: https://web.archive.org/web/20200811140238/https://www.nzherald.co.nz/nz/news/article.cfm?c_id=1&objectid=12355759    Media Article 2: https://web.archive.org/web/20200811141448/https://news.sky.com/story/coronavirus-breaks-out-again-in-new-zealand-after-102-days-12047011    Government Unite Against Covid Website https://web.archive.org/web/20200811140440/https://covid19.govt.nz/updates-and-resources/latest-updates/new-zealands-alert-levels-are-changing-at-12-noon-on-wednesday-12-august/    Government Unite Against Covid Website with Level 3 restrictions for Auckland: https://web.archive.org/web/20200811140651/https://covid19.govt.nz/covid-19/restrictions/auckland/    Jacinda Ardern Press Conference: https://web.archive.org/web/20200811141724/https://www.youtube.com/watch?v=Yhr-GB5kcPg"
New Zealand,NZL,East_Asia_Pacific,20200812,C6: Stay at home requirements,2,0,2T,0,"“We’re asking people in Auckland to stay home to stop the spread, and only leave home  for essential movement.    Wednesday 12 August    Prime Minister Jacinda Ardern has announced Auckland will go into Level 3 lockdown and the rest of the country will go into Level 2 as of Midday Wednesday 12 August, following a family in Auckland confirmed as having COVID-19.    “Auckland region will move to Alert Level 3 at 12 noon on Wednesday 12 August 2020.  It will remain at Alert Level 3 for at least 3 days. This will give us time to assess the situation and gather information, including contact tracing, so we can find out more about how the case arose. If you are in Auckland, this is what you should do while we minimise the risk of transmission”     “""After 102 days, we have our first cases of Covid-19 outside of managed isolation or quarantine facilities... we have all worked incredibly hard to prevent this scenario,""    Media Article 1: https://web.archive.org/web/20200811140238/https://www.nzherald.co.nz/nz/news/article.cfm?c_id=1&objectid=12355759    Media Article 2: https://web.archive.org/web/20200811141448/https://news.sky.com/story/coronavirus-breaks-out-again-in-new-zealand-after-102-days-12047011    Government Unite Against Covid Website https://web.archive.org/web/20200811140440/https://covid19.govt.nz/updates-and-resources/latest-updates/new-zealands-alert-levels-are-changing-at-12-noon-on-wednesday-12-august/    Government Unite Against Covid Website with Level 3 restrictions for Auckland: https://web.archive.org/web/20200811140651/https://covid19.govt.nz/covid-19/restrictions/auckland/    Jacinda Ardern Press Conference: https://web.archive.org/web/20200811141724/https://www.youtube.com/watch?v=Yhr-GB5kcPg  "
New Zealand,NZL,East_Asia_Pacific,20200812,C7: Restrictions on internal movement,2,0,2T,0,"Travel into and out of Auckland will be restricted to those returning home to the city, or those leaving who live elsewhere. Police are due to issue further information on the use of roadblocks around Auckland on Wednesday.    Wednesday 12 August    Prime Minister Jacinda Ardern has announced Auckland will go into Level 3 lockdown and the rest of the country will go into Level 2 as of Midday Wednesday 12 August, following a family in Auckland confirmed as having COVID-19.    “Auckland region will move to Alert Level 3 at 12 noon on Wednesday 12 August 2020.  It will remain at Alert Level 3 for at least 3 days. This will give us time to assess the situation and gather information, including contact tracing, so we can find out more about how the case arose. If you are in Auckland, this is what you should do while we minimise the risk of transmission”     “""After 102 days, we have our first cases of Covid-19 outside of managed isolation or quarantine facilities... we have all worked incredibly hard to prevent this scenario,""    Media Article 1: https://web.archive.org/web/20200811140238/https://www.nzherald.co.nz/nz/news/article.cfm?c_id=1&objectid=12355759    Media Article 2: https://web.archive.org/web/20200811141448/https://news.sky.com/story/coronavirus-breaks-out-again-in-new-zealand-after-102-days-12047011    Government Unite Against Covid Website https://web.archive.org/web/20200811140440/https://covid19.govt.nz/updates-and-resources/latest-updates/new-zealands-alert-levels-are-changing-at-12-noon-on-wednesday-12-august/    Government Unite Against Covid Website with Level 3 restrictions for Auckland: https://web.archive.org/web/20200811140651/https://covid19.govt.nz/covid-19/restrictions/auckland/    Jacinda Ardern Press Conference: https://web.archive.org/web/20200811141724/https://www.youtube.com/watch?v=Yhr-GB5kcPg"
Philippines,PHL,East_Asia_Pacific,20200803,C5: Close public transport,2,0,2T,1G,No public transport allowed because of the imposition of the MECQ in Manila  https://web.archive.org/web/20200803211839/https://mb.com.ph/2020/08/03/no-public-transport-allowed-under-mecq-dotr/
Philippines,PHL,East_Asia_Pacific,20200804,C6: Stay at home requirements,2,0,2T,2T,"Following the declaration made by President Duterte on August 2nd, a Memorandum from the Executive Secretary announced that up until 11:59pm on 18 August, the National Capital Region and the provinces of Laguna, Cavite, Rizal and Bulacan will be put under modified enhanced community quarantine (MECQ) from 4 August.     See the memorandum here, archived: http://archive.vn/fX50v"
Philippines,PHL,East_Asia_Pacific,20200806,C2: Workplace closing,2,1,2G,2G,"As of August 6th, financial service providers are allowed to operate at full operational capacity and employees of such providers are allowed full mobility in performance of their functions.    See the updated resolution, archived: http://archive.vn/AkVX3"
Philippines,PHL,East_Asia_Pacific,20200810,H3: Contact tracing,2,.,2.,2.,"On 10 August, President Duterte announced in a public address that he wants the Philippine National Police (PNP) to assist in the government’s contact tracing efforts to stop the spread of the virus as they have the necessary resources to help local officials.     See the news release, archived: http://archive.vn/K0NGN"
Philippines,PHL,East_Asia_Pacific,20200812,C1: School closing,3,1,3G,3G,"Despite calls for postponement, it still appears that 2020/21 school year will commence on August 24th as per the decision made by the Department of Education in mid-May (http://archive.vn/pn97H). However, what is notable is that the current enrolment rate is only around 83.1 percent the of last year’s figure of 27.7 million, which an education official states could result in the number of out-of-school-youth increasing to four million as a result of the pandemic.     See the article here on CNN Philippines, archived: http://archive.vn/yi8SR    However, it is noted in an article from the Philippine News Agency that the Department of Education has noted that only schools considered “low risk” the Inter-Agency Task Force for the Management of Emerging Infectious Diseases (IATF-EID) will have limited face-to-face classes, and that other “blended learning” will be incorporated. It has been announced by Malacañang (the Presidential Palace) that at least 50% of public schools in National Capital Region (NCR) will be converted into isolation centres for those infected with COVID-19.    See the article on the Philippine News Agency website, archived: http://archive.vn/RsxUd"
Papua New Guinea,PNG,East_Asia_Pacific,20200804,C2: Workplace closing,2,1,2G,1G,"The PNG government asks that, from 4 August,  1. Venues which ""provide night club activities and services"", and/or ""only serve alcohol without food"" to close until further notice;  2. ""Venues or parts of venues that operate for the purpose of the sale and consumption of alcohol"" and licensed bookmakers to operate subject to certain measures;  3. Boroko Market to close until further notice; and  4. All restaurants in the National Capital District to submit certain information to the government.    http://archive.vn/E6IxU"
Papua New Guinea,PNG,East_Asia_Pacific,20200804,C3: Cancel public events,1,0,1T,2G,"The PNG government asks that, from 4 August,   1. Clubs and sporting matches not to allow spectators;  2. Local religious activities to operate following certain restrictions; and  3. Religious gatherings, including but not limited to, church gatherings and crusades not to occur.    http://archive.vn/E6IxU"
Papua New Guinea,PNG,East_Asia_Pacific,20200804,C4: Restrictions on gatherings,3,1,3G,3G,No gathering of over 50 persons can occur from 4 August.    http://archive.vn/E6IxU
Papua New Guinea,PNG,East_Asia_Pacific,20200804,C6: Stay at home requirements,3,0,3T,0,"The PNG government asks that, from 4 August, all people in the National Capital District to stay home between 10pm and 5pm unless from essential purpose.    http://archive.vn/E6IxU"
Papua New Guinea,PNG,East_Asia_Pacific,20200804,C7: Restrictions on internal movement,0,.,0,0,"Domestic flights and travel by foot, vehicle and vessel between Provinces are not restricted but should follow certain measures from 4 August, as required by the government.     http://web.archive.org/web/20200806161019/https://covid19.info.gov.pg/files/National%20Pandemic%20Measures/New%20Measures%2004082020/Measure%20No.3-Domestic%20Travel-04.08.20.pdf"
Papua New Guinea,PNG,East_Asia_Pacific,20200804,C8: International travel controls,3,.,3.,2.,"From 4 August, 'no person, including PNG citizens and permanent residents are allowed to enter PNG, except by aircraft'.  Only flights departing from Cairns Airport and Brisbane Airport in Australia, and airports exempted in writing by the Controller, can enter PNG. All passengers are to be quarantined.    http://web.archive.org/web/20200806160928/https://covid19.info.gov.pg/files/National%20Pandemic%20Measures/New%20Measures%2004082020/Measure%20No.2-International%20Travel-04.08.20.pdf"
Papua New Guinea,PNG,East_Asia_Pacific,20200807,C1: School closing,3,0,3T,0,"""Since 28 July, Port Moresby (capital) has been placed in a 14-day lockdown  with only essential businesses to operate, schools closed, and public  transport services stopped.""    Source: https://web.archive.org/web/20200815212756/https://covid19.info.gov.pg/files/Situation%20Report/PNG%20COVID-19%20Health%20Situation%20Report%2033%20%282020-08-09%29_FINAL.pdf"
Papua New Guinea,PNG,East_Asia_Pacific,20200807,C2: Workplace closing,3,0,3T,2G,"""Since 28 July, Port Moresby (capital) has been placed in a 14-day lockdown  with only essential businesses to operate, schools closed, and public  transport services stopped.""    Source: https://web.archive.org/web/20200815212756/https://covid19.info.gov.pg/files/Situation%20Report/PNG%20COVID-19%20Health%20Situation%20Report%2033%20%282020-08-09%29_FINAL.pdf"
Papua New Guinea,PNG,East_Asia_Pacific,20200807,C3: Cancel public events,1,1,1G,1T,"“COVID-19 is here and it will be with us for some time into the future. We have to learn to live with it. Education, business, government services, churches and religious services as well as cultural and sporting events must be able to continue under the new normal or “niupela pasin” going forward,” said the Prime Minister.    Source: http://web.archive.org/web/20200816100149/https://covid19.info.gov.pg/index.php/2020/08/13/controller-manning-issues-11-new-measures/"
Papua New Guinea,PNG,East_Asia_Pacific,20200807,C5: Close public transport,2,0,2T,1G,"""Since 28 July, Port Moresby (capital) has been placed in a 14-day lockdown  with only essential businesses to operate, schools closed, and public  transport services stopped.""    Source: https://web.archive.org/web/20200815212756/https://covid19.info.gov.pg/files/Situation%20Report/PNG%20COVID-19%20Health%20Situation%20Report%2033%20%282020-08-09%29_FINAL.pdf"
Papua New Guinea,PNG,East_Asia_Pacific,20200807,C7: Restrictions on internal movement,2,1,2G,0,"On 07 August, Measure 3 (Domestic Travel Measures) issued on 04 August was revoked. From this date, no person is allowed to travel by aircraft from one province to another province in PNG, unless provided an exemption in writing by the Controller or his delegate. Cargo flights with no passengers and medivac flights are exempted.     Source: https://web.archive.org/web/20200815212756/https://covid19.info.gov.pg/files/Situation%20Report/PNG%20COVID-19%20Health%20Situation%20Report%2033%20%282020-08-09%29_FINAL.pdf"
Papua New Guinea,PNG,East_Asia_Pacific,20200807,H2: Testing policy,1,.,1.,2.,"“Testing in all provinces remains critically low, therefore ongoing transmission in other parts of the country is a possibility as population mobility continues,”-said Papua New Guinea’s prime minister James Marape.    Source: https://web.archive.org/web/20200812011714/https://www.independent.co.uk/news/world/australasia/coronavirus-new-cases-papua-new-guinea-lockdown-a9664211.html"
Papua New Guinea,PNG,East_Asia_Pacific,20200807,H3: Contact tracing,2,.,2.,1.,"Contact tracing is ongoing for the cases confirmed in the last week. However, additional resources are required to improve monitoring of persons in quarantine, facility assessments and in instituting home quarantine.    Source: https://web.archive.org/web/20200815212756/https://covid19.info.gov.pg/files/Situation%20Report/PNG%20COVID-19%20Health%20Situation%20Report%2033%20%282020-08-09%29_FINAL.pdf"
Papua New Guinea,PNG,East_Asia_Pacific,20200812,C2: Workplace closing,2,1,2G,3T,"""The closure of venues or part of venues that serve alcohol without food; licensed premises that sell takeaway alcohol shall not sell alcohol on Fridays, Saturdays and Sundays; no audience allowed for any clubs or sporting matches; reporting by PNG Sports Foundation is no longer in the measures; immediate closure of Boroko Market; the removal of SOP development by the Council of Churches; The PNG Business Council to develop COVID-19 business continuity plans in NCD; all restaurants to submit information about physical size of restaurant seating areas and seating plans to the PNG Business Council; and no chewing of buai in NCD except in private dwellings. ""    Source: https://web.archive.org/web/20200815212756/https://covid19.info.gov.pg/files/Situation%20Report/PNG%20COVID-19%20Health%20Situation%20Report%2033%20%282020-08-09%29_FINAL.pdf"
Papua New Guinea,PNG,East_Asia_Pacific,20200812,C3: Cancel public events,1,1,1G,1G,"The following measures must be adopted in the new normal (""Niupela Pasin"") situation:  “- Mandatory wearing of mask in all public places;  - Markets, sports and community events must be conducted in COVID-19  safe manner;  - Measuring of temperature and washing of hands upon request must be  complied with;  - Bars and clubs will remain shut and beer drinking in public places  and settlements will cease, but served only in license restaurants and  hotels in a COVID-19 sensitive setting;  - No shaking hands and keep away from another person by 2 meters if  you are without mask; and  - Churches will open for services but in a COVID-19 sensitive manner.”    Source:  Press Release from the Department of the Prime Minister and NEC https://www.facebook.com/SirManasupeHaus/photos/a.836303540053943/1228705554147071/?type=3&theater= (requires log-in)"
Papua New Guinea,PNG,East_Asia_Pacific,20200812,C4: Restrictions on gatherings,0,.,0,3G,"  The following measures must be adopted in the new normal (""Niupela Pasin"") situation:  “- Mandatory wearing of mask in all public places;  - Markets, sports and community events must be conducted in COVID-19  safe manner;  - Measuring of temperature and washing of hands upon request must be  complied with;  - Bars and clubs will remain shut and beer drinking in public places  and settlements will cease, but served only in license restaurants and  hotels in a COVID-19 sensitive setting;  - No shaking hands and keep away from another person by 2 meters if  you are without mask; and  - Churches will open for services but in a COVID-19 sensitive manner.”    Source:  Press Release from the Department of the Prime Minister and NEC https://www.facebook.com/SirManasupeHaus/photos/a.836303540053943/1228705554147071/?type=3&theater= (requires log-in)"
Papua New Guinea,PNG,East_Asia_Pacific,20200812,C5: Close public transport,0,.,0,2T,"Even though public transport is now operating the ""stringent requirements like wearing mask, only 15 passengers in PMVs, early check-ins for airline travelers and monitored sea travelling"" will be required.    Source:  Press Release from the Department of the Prime Minister and NEC https://www.facebook.com/SirManasupeHaus/photos/a.836303540053943/1228705554147071/?type=3&theater= (requires log-in)"
Papua New Guinea,PNG,East_Asia_Pacific,20200812,C6: Stay at home requirements,0,.,0,3T,"The two-week lockdown in the capital of Port Moresby was lifted on Wednesday, August 12, despite the country’s reported cases of Covid-19 doubling during the past week.    Source: https://web.archive.org/web/20200812011714/https://www.independent.co.uk/news/world/australasia/coronavirus-new-cases-papua-new-guinea-lockdown-a9664211.html"
