"","CountryName","CountryCode","Date","region","PolicyType","PolicyCode","previous_PolicyCode","Notes"
"55","Canada","CAN",2021-01-25,"North_America","C8: International travel controls","4","4","As of 25 January 2021, the government of Canada’s rules remain in place restricting non-Canadians from entering Canada except to perform “essential” work or to visit a family member who is a Canadian citizen. See Government of Canada website, archived:  https://web.archive.org/web/20210114193357/https://www.canada.ca/en/immigration-refugees-citizenship/services/coronavirus-covid19/travel-restrictions-exemptions.html"
"56","Canada","CAN",2021-01-28,"North_America","C8: International travel controls","4","4","In a 28 January 2021 Canadian Press news service report, more coverage of whether border controls are strict enough to encourage enough Canadians to heed public health advice to limit international travel to essential trips. See Globe and Mail newspaper website, archived:  https://web.archive.org/web/20210128135746/https://www.theglobeandmail.com/canada/article-holiday-season-vacations-coincide-with-rise-in-covid-19-travel-related-2/"
"57","Canada","CAN",2021-01-29,"North_America","C8: International travel controls","4","4","On 29 January 2021, Prime Minister Justin Trudeau announced an agreement with Canadian airlines to suspend flights to Mexican and Carribean destinations effective 31 January through 30 April. ‘In the coming weeks the federal government will also introduce mandatory COVID-19 testing upon arrival at airports, and this will be on top of the pre-boarding requirement for a negative COVID-19 test, Mr. Trudeau said. Following the second test, travellers will have to wait three days at a designated hotel for their test result. Mr. Trudeau said the hotel stays will cost travellers more than $2,000. If the traveller’s second test is negative, they will be able to complete their 14-day quarantine at home “under significantly increased surveillance and enforcement.”’ These measures are intended to encourage Canadians to heed public health advice against non-essential international travel. See Globe and Mail newspaper website, archived:  https://web.archive.org/web/20210129180239/https://www.theglobeandmail.com/politics/article-federal-government-airlines-agree-to-halt-flights-to-caribbean-mexico/"
"58","Canada","CAN",2021-01-25,"North_America","E1: Income support","2G","2G","E1 = 2A  As of 25 January 2021, the government of Canada continues to pay the Canada Recovery Benefit to self-employed Canadians who have lost income. In addition, Employment Insurance benefits and eligibility rules for formerly employed Canadians have been enhanced in many circumstances. See government of Canada websites, archived:  https://web.archive.org/web/20210125223626/https://www.canada.ca/en/revenue-agency/services/benefits/recovery-benefit.html  https://web.archive.org/web/20201124235654/https://www.canada.ca/en/revenue-agency/services/benefits/recovery-benefit/crb-statistics.html  https://web.archive.org/web/20210125224852/https://www.canada.ca/en/services/benefits/ei/notice-covid-19.html"
"59","Canada","CAN",2021-01-29,"North_America","E1: Income support","2G","2G","E1 = 2A  As of 29 January 2021, the government of Canada continues to pay the Canada Recovery Benefit to self-employed Canadians who have lost income. In addition, Employment Insurance benefits and eligibility rules for formerly employed Canadians have been enhanced in many circumstances. See government of Canada website, archived:  https://web.archive.org/web/20210126183447/https://www.canada.ca/en/department-finance/economic-response-plan.html"
"60","Canada","CAN",2020-12-29,"North_America","E2: Debt/contract relief","1","1","On 29 December, the Globe and Mail newspaper reported on slow implementation of the federal government’s new Highly Affected Sectors Credit Availability Program to help businesses in tourism, hospitality, air travel and entertainment with fully government-guaranteed financing. See article in Globe and Mail newspaper website, archived:  https://web.archive.org/web/20210102225155/https://www.theglobeandmail.com/politics/article-struggling-sectors-still-waiting-for-promised-relief-from-federal/?cu_id=A6KwM2NPqY9Tjy01oPJvjyThBi3rn%2FLU"
"61","Canada","CAN",2021-01-14,"North_America","E2: Debt/contract relief","1","1","Limited evidence of household level debt and contract relief.    For instance, Ontario has temporarily banned evictions during lockdown:   https://web.archive.org/web/20210130120222/https://globalnews.ca/news/7575951/ontario-pauses-enforcement-residential-evictions-coronavirus/    Mortgage deferrals information from national government:   http://web.archive.org/web/20201216153510/https://www.cmhc-schl.gc.ca/en/finance-and-investing/mortgage-loan-insurance/the-resource/covid19-understanding-mortgage-payment-deferral    ***recoded as past coding, while still at a 1, used measures for businesses not households/individuals as evidence"
"62","Canada","CAN",2021-01-25,"North_America","H1: Public information campaigns","2G","2G","As of 25 January 2021, the government of Canada continues to provide online information resources on covid-19.  https://web.archive.org/web/20210125231259/https://www.canada.ca/en/public-health/services/diseases/2019-novel-coronavirus-infection/digital-resources.html"
"63","Canada","CAN",2021-01-29,"North_America","H1: Public information campaigns","2G","2G","As of 29 January 2021, the government of Canada continues to provide: “Digital tools to help Canadians access services and get information on COVID-19”. See Government of Canada website, archived:  https://web.archive.org/web/20210129202310/https://www.canada.ca/en/government/system/digital-government/digital-government-response-to-covid-19.html"
"64","Canada","CAN",2021-01-25,"North_America","H2: Testing policy","2","2","As of 25 January 2021, the government of Canada’s “Pan-Canadian COVID-19 Testing and Screening Guidance: Technical guidance and implementation plan”   continues to apply. See Government of Canada website, archived:  https://web.archive.org/web/20210125231908/https://www.canada.ca/en/health-canada/services/drugs-health-products/covid19-industry/medical-devices/testing/pan-canadian-guidance.html"
"65","Canada","CAN",2021-01-29,"North_America","H2: Testing policy","2","2","H2 = 2G  As of 29 January 2021, the government of Canada continues to recommend: “Contact your local health authority for advice about testing if you think you may have COVID-19 (and/or) have been in contact with someone who has COVID-19.” Provincial, territorial and local public health approaches are similar. See Government of Canada website, archived:  https://web.archive.org/web/20210118232215/https://www.canada.ca/en/public-health/services/diseases/2019-novel-coronavirus-infection/symptoms/testing.html"
"66","Canada","CAN",2021-01-04,"North_America","H3: Contact tracing","1","1","On 4 January, Quebec Minister of Health Christian Dubé tweeted “To bring down cases, we need your co-operation for the tracing done by public health” indicating that contact tracing may not be as timely and comprehensive in practice as earlier in the crisis. See Global news website, archived:  https://web.archive.org/web/20210107191838/https://globalnews.ca/news/7553481/quebec-coronavirus-covid-19-jan-4-2021/"
"67","Canada","CAN",2021-01-05,"North_America","H3: Contact tracing","1","1","On 5 January, Alberta Health reported employing 1,250 contact tracers at the end of 2020, short of their announced target of 1,600. Local CTV news reporters speculate that the shortfall in hiring of tracers has contributed to the fact that “59% of the province’s COVID-19 cases come from unknown origins”. See CTV news website, archived:  https://web.archive.org/web/20210107192656/https://calgary.ctvnews.ca/yardsticks-always-being-moved-alberta-fails-to-meet-its-2020-target-for-contact-tracers-1.5255966"
"68","Canada","CAN",2021-01-08,"North_America","H3: Contact tracing","1","1","In the 8 January Globe and Mail print edition, western Canadian affairs columnist Gary Mason concludes that “in the worst-hit provinces in this country, such as Quebec, Ontario and Alberta, contact tracers have been overwhelmed by the sheer number of cases”. Mason’s conclusion is impressionistic without much in the way of data, but is consistent with other recent reports about contact tracing backlogs. See article on Globe and Mail newspaper website, archived:  https://web.archive.org/web/20210108135121/https://www.theglobeandmail.com/opinion/article-canadas-overwhelmed-contact-tracing-efforts-have-been-a-gross-failure/"
"69","Canada","CAN",2021-01-25,"North_America","H3: Contact tracing","1","1","On 25 January 2021, the Canadian Medical Association (CMA) called for “redoubling our efforts in effective … contact tracing”. This indicates that previously reported problems keeping contact tracing on pace with higher case numbers remain an issue. See CMA newswire, archived:  https://web.archive.org/web/20210125233051/https://www.newswire.ca/news-releases/one-year-since-first-canadian-covid-19-case-the-cma-calls-for-a-clear-and-focused-plan-ahead-876909120.html"
"70","Canada","CAN",2021-01-27,"North_America","H3: Contact tracing","1","1","In a 27 January 2021 report, the Globe and Mail, Canada’s only newspaper with a national readership, reported on recent contact tracing problems in a region in the province of Ontario north of Toronto with an outbreak of cases attributed to the “British variant”. The regional public health officer “reached out to other public-health units in Ontario for assistance with contact tracing. Three have stepped up … sending a total of nine staff to help with contact tracing...Without help from the other regions, Dr. Gardner said his health unit did not have the resources to reach contacts within 24 hours.” However, redeployment of contact tracers from low-case to high-case regions is a positive initiative. See Globe and Mail newspaper website, archived:  https://web.archive.org/web/20210128135316/https://www.theglobeandmail.com/canada/article-covid-19-cases-keep-climbing-after-ontario-long-term-care-home-struck/"
"71","Canada","CAN",2021-01-23,"North_America","H6: Facial Coverings","3T","3T","On 23 January 2021, the Chief Public Health Officer of Canada  repeated advice about “wearing a face mask as appropriate (including in shared indoor spaces with people from outside your immediate household)”. Most provinces have imposed such a requirement. See Government of Canada website, archived:  https://web.archive.org/web/20210125231259/https://www.canada.ca/en/public-health/services/diseases/2019-novel-coronavirus-infection/digital-resources.html"
"72","Canada","CAN",2021-01-29,"North_America","H6: Facial Coverings","3T","3T","As of 29 January 2021, the government of Canada continues to recommend that Canadians “wear a non-medical mask or face covering when you're in public and you might come into close contact with others; you're in shared indoor spaces with people from outside your immediate household; advised by your local public health authority”. 3T pending review of whether all provinces and territories require masks in outdoor public spaces. See Government of Canada website, archived: https://www.canada.ca/en/public-health/services/diseases/2019-novel-coronavirus-infection/prevention-risks/about-non-medical-masks-face-coverings.html  ***Review note: confirmed via subnational data that some provinces (e.g. BC) coded as 2G for masks, meaning 3T at national level still accurate"
"73","Canada","CAN",2020-12-29,"North_America","H7: Vaccination policy","2G","2G","On 29 December, Canadian Press news service reported on plans in several provinces to accelerate vaccinations. See article in Globe and Mail newspaper website, archived:  https://web.archive.org/web/20210102222357/https://www.theglobeandmail.com/canada/article-ontario-reports-nearly-4500-new-covid-19-cases-over-two-days/"
"74","Canada","CAN",2020-12-30,"North_America","H7: Vaccination policy","2G","2G","A, C:    On 30 December, vaccinations began in remote indigenous communities in British Columbia (BC). Members of three groups -- long-term care residents, frontline workers, remote indigenous community residents -- have now been vaccinated somewhere in Canada. Vaccinations are expected to start soon in indigenous communities in other provinces. However, to my knowledge, there is no province that has vaccinated members of more than 2 groups at this time. See article in Globe and Mail newspaper website and Province of BC website, archived:  https://web.archive.org/web/20210103010814/https://www.theglobeandmail.com/canada/article-vaccine-rollout-picks-up-speed-in-first-nations-across-canada/  https://web.archive.org/web/20210104162416/http://www.bccdc.ca/health-info/diseases-conditions/covid-19/covid-19-vaccine/bcs-plan-for-vaccine-distribution"
"75","Canada","CAN",2021-01-04,"North_America","H7: Vaccination policy","2G","2G","As of 4 January 2021, 11:18AM EST, according to the Canadian Television (CTV) News covid-19 vaccine tracker, 121,295 Canadians or 0.3% of the national population have received vaccinations. See CTV News website, archived:  https://web.archive.org/web/20210104165037/https://www.ctvnews.ca/health/coronavirus/covid-19-vaccine-tracker-how-many-people-in-canada-have-received-shots-1.5247509"
"76","Canada","CAN",2021-01-08,"North_America","H7: Vaccination policy","2G","2G","A, C:    As of 8 January 10:30AM EST, according to the CTV News covid-19 vaccine tracker, 231,807 Canadians have received a covid-19 vaccination or 0.6% of the national population. See CTV News website, archived:  https://web.archive.org/web/20210106182429/https://www.ctvnews.ca/health/coronavirus/coronavirus-vaccine-tracker-how-many-people-in-canada-have-received-shots-1.5247509"
"77","Canada","CAN",2021-01-11,"North_America","H7: Vaccination policy","2G","2G","A, C:    As of 11 January 10:21AM EST, according to an unofficial vaccine tracker website, 328,797 Canadians have received a covid-19 vaccination or just under 0.9% of the national population. (Another unofficial vaccine tracker website shows a slightly smaller national count. It is possible that vaccine tracker websites are not reporting up-to-date information in all provinces.) See covid19tracker.ca and CTV News websites, archived:  https://web.archive.org/web/20210111152357/https://covid19tracker.ca/vaccinationtracker.html  https://web.archive.org/web/20210111145425/https://www.ctvnews.ca/health/coronavirus/coronavirus-vaccine-tracker-how-many-people-in-canada-have-received-shots-1.5247509"
"78","Canada","CAN",2021-01-14,"North_America","H7: Vaccination policy","2G","2G","On 14 January 2021, the Government of Quebec announced that, if vaccine supply is insufficient, the second vaccination dose will be delayed for up to 90 days in order to maximize first doses to members of high-risk groups. The Government of Canada’s Deputy Chief Public Health Officer “noted … that there is no data to support extending the interval past 42 days. However, he … suggested the ethical issues raised by a surge in cases and a resulting spike in hospitalizations and deaths could present an exceptional enough circumstance to justify it.”  https://web.archive.org/web/20210115140139/https://www.theglobeandmail.com/canada/article-quebec-further-delaying-second-dose-of-covid-19-vaccines/"
"79","Canada","CAN",2021-01-15,"North_America","H7: Vaccination policy","2G","2G","As of 15 January 10:21AM EST, according to an unofficial vaccine tracker website, “more than 450,242 Canadians (almost 1.2% of the national population) have received at least one dose of an approved COVID-19 vaccine. At least 24,939 Canadians (0.07%) are fully vaccinated, having received both required doses.” See covid19tracker.ca, archived:  https://web.archive.org/web/20210115153920/https://covid19tracker.ca/vaccinationtracker.html"
"80","Canada","CAN",2021-01-18,"North_America","H7: Vaccination policy","2G","2G","As of 18 January 11:06AM CST, according to an unofficial vaccine tracker website, “more than 557,237 Canadians [almost 1.5% of the national population] have received at least one dose of an approved COVID-19 vaccine. At least 31,199 [0.08%] Canadians are fully vaccinated, having received both required doses.” See covid19tracker.ca, archived:  https://web.archive.org/web/20210118183916/https://covid19tracker.ca/vaccinationtracker.html"
"81","Canada","CAN",2021-01-19,"North_America","H7: Vaccination policy","2G","2G","A.C: On 19 January 2021, the Globe and Mail newspaper updated its “EXPLAINER: The federal and provincial rollout plans so far” which contains a clear explanation illustrated with charts on how the federal and provincial governments are working together and sharing responsibility to vaccinate Canadians. See Globe and Mail newspaper website, archived:  https://web.archive.org/web/20210126030320/https://www.theglobeandmail.com/canada/article-covid-19-vaccine-rollout-in-canada-by-province-explainer/"
"82","Canada","CAN",2021-01-20,"North_America","H7: Vaccination policy","3G","2G","On 20 January 2021, Indigenous Services Canada announced: “The rollout of the vaccines to many First Nations, Inuit, and Métis communities has started. Vaccine administration continues within communities, thanks to the commitment of Indigenous leadership and health experts, and federal, provincial, Indigenous collaboration, including on logistics and data sharing. To date vaccination has begun in 169 communities for First Nations or Inuit in all provinces and territories except Nova Scotia and PEI.” Covid vaccinations (Pfizer and Moderna) in Canada are being administered to 3 groups -- A. key workers (front-line health sector), B. clinically vulnerable groups (remote indigenous communities and federal prisoners at risk due to age or other health problems), C. elderly groups (residents of long-term care facilities and retirement homes). See Government of Canada and Globe and Mail newspaper websites, archived:  https://web.archive.org/web/20210126020941/https://www.canada.ca/en/indigenous-services-canada/news/2021/01/government-of-canada-covid-19-update-for-indigenous-peoples-and-communities1.html  https://web.archive.org/web/20210126024649/https://www.theglobeandmail.com/politics/article-older-at-risk-federal-inmates-to-receive-shot-sparking-criticism-from/"
"83","Canada","CAN",2021-01-25,"North_America","H7: Vaccination policy","3G","3G","As of 25 January 1:05 pm EST, according to an unofficial vaccine tracker website, “more than 733,500 Canadians [1.9% of the national population] have received at least one dose of an approved COVID-19 vaccine. At least 96,537 [0.25%] of Canadians are fully vaccinated, having received both required doses.” See covid19tracker.ca, archived:  https://web.archive.org/web/20210124221629/https://covid19tracker.ca/vaccinationtracker.html"
"84","Canada","CAN",2021-01-29,"North_America","H7: Vaccination policy","3G","3G","As of 29 January 10:25 pm EST, according to an unofficial vaccine tracker website, “doses of COVID-19 vaccines (including both Moderna and Pfizer-BioNTech) have been delivered to the provinces for administration. As of today, 82.5% of doses delivered to the provinces have been administered...As of today, more than 829,385 Canadians [almost 2.2% of the national population] have received at least one dose of an approved COVID-19 vaccine. 96,857 Canadians [0.25%] are fully vaccinated against COVID-19, having received both required doses.” Note that previous estimates of the number of Canadians fully vaccinated were incorrect due to a data reporting error by one of the provinces. Delays in vaccine delivery to Canada have resulted in first-does vaccinations being halted in the province of Alberta. In most other provinces and territories, vaccine supply is sufficient for the time being to continue with first doses to three priority groups: A. key workers (front-line health sector), B. clinically vulnerable groups (remote indigenous communities and federal prisoners at risk due to age or health problems), C. elderly groups (residents of long-term care facilities and retirement homes).See covid19tracker.ca and CBC news websites, archived:  https://web.archive.org/web/20210129155032/https://covid19tracker.ca/vaccinationtracker.html  https://web.archive.org/web/20210129163115/https://www.cbc.ca/news/canada/edmonton/covid-update-deena-hinshaw-alberta-1.5891450"
"85","United States","USA",2021-01-11,"North_America","C1: School closing","3T","3T","Schools in District of Columbia and Puerto Rico still have full closure in effect.  http://web.archive.org/web/20210111233346/https://www.edweek.org/leadership/map-where-are-schools-closed/2020/07"
"86","United States","USA",2021-01-15,"North_America","C1: School closing","3T","3T","Policy remains as 3T because states including District of Columbia, Puerto Rico etc still have full closure in effect.   http://web.archive.org/web/20210117222645/https://www.edweek.org/leadership/map-where-are-schools-closed/2020/07"
"87","United States","USA",2021-01-25,"North_America","C1: School closing","3T","3T","Policy remains as 3T because states including District of Columbia, Puerto Rico etc still have full closure in effect.   http://web.archive.org/web/20210126004425/https://www.edweek.org/leadership/map-where-are-schools-closed/2020/07"
"88","United States","USA",2021-02-01,"North_America","C1: School closing","3T","3T","Some states like District of Columbia still have full closure in effect.  http://web.archive.org/web/20210202004334/https://www.edweek.org/leadership/map-where-are-schools-closed/2020/07"
"89","United States","USA",2021-01-04,"North_America","C2: Workplace closing","2T","2T","Nightclubs, Casinos, theaters, indoor museums are still closed in some states such as Michigan and Illinois.  list of state restrictions - https://archive.vn/SC0Pg   Illinois - https://archive.vn/0PO7b   Michigan - https://archive.vn/4o01f"
"90","United States","USA",2021-01-11,"North_America","C2: Workplace closing","2T","2T","Nightclubs, Casinos, theaters, indoor museums, private clubs are still closed in some states such as Michigan and Illinois.  State by State restrictions - https://archive.vn/V7TbP   Illinois - https://archive.vn/WJlkx   Michigan - https://archive.vn/1DVjE   California - In any region that triggers a Regional Stay Home Order Museums, zoos, and aquariums, bars, movie theaters etc are closed . See full list - https://archive.vn/AkIhN"
"91","United States","USA",2021-01-18,"North_America","C2: Workplace closing","2T","2T","Nightclubs, Casinos, theaters, indoor museums, private clubs etc. are still closed in some states such as Michigan and Illinois.  State by state -  http://web.archive.org/web/20210118182002/https://www.aarp.org/politics-society/government-elections/info-2020/coronavirus-state-restrictions.html   Michigan - http://web.archive.org/web/20210118180151/https://www.michigan.gov/coronavirus/   California - http://web.archive.org/web/20210118175742/https://covid19.ca.gov/stay-home-except-for-essential-needs/"
"92","United States","USA",2021-01-25,"North_America","C2: Workplace closing","2T","2T","Business such as Nightclubs etc. are still closed in states such as michigan/    State by State restrictions - http://web.archive.org/web/20210126005148/https://www.aarp.org/politics-society/government-elections/info-2020/coronavirus-state-restrictions.html    Michigan - http://web.archive.org/web/20210126005230/https://www.michigan.gov/coronavirus/"
"93","United States","USA",2021-02-01,"North_America","C2: Workplace closing","2T","2T","Some sectors are still closed in states such as Michigan where nightclubs and waterparks are closed.  State by State Restrictions - http://web.archive.org/web/20210202004853/https://www.aarp.org/politics-society/government-elections/info-2020/coronavirus-state-restrictions.html    Michigan - http://web.archive.org/web/20210202004446/https://www.michigan.gov/coronavirus/"
"94","United States","USA",2021-01-04,"North_America","C3: Cancel public events","2T","2T","No Policy Change"
"95","United States","USA",2021-01-11,"North_America","C3: Cancel public events","2T","2T","In states like Illinois, meeting rooms, banquet centers, private party rooms, private clubs and country clubs may not host gatherings  State by State restrictions - https://archive.vn/V7TbP   Illinois - https://archive.vn/WJlkx"
"96","United States","USA",2021-02-01,"North_America","C3: Cancel public events","2T","2T","State by State Restrictions - http://web.archive.org/web/20210202004853/https://www.aarp.org/politics-society/government-elections/info-2020/coronavirus-state-restrictions.html"
"97","United States","USA",2021-01-04,"North_America","C4: Restrictions on gatherings","4T","4T","Some states still limit gatherings to 10persons or less such as illinois  Sources:  https://archive.vn/Yoe5f  Illinois - https://archive.vn/0PO7b"
"98","United States","USA",2021-01-11,"North_America","C4: Restrictions on gatherings","4T","4T","Some states such as District of Columbia, Idaho, Illinois etc. still limit indoor gatherings to 10 people or less.  State by State Restrictions - https://archive.vn/V7TbP  District of Columbia – https://archive.vn/hN0dt   Idaho – Currently at stage Two  - http://web.archive.org/web/20201231093542/https://rebound.idaho.gov/wp-content/uploads/stage-2-modified-order_r.pdf   Illinois - https://archive.vn/WJlkx"
